,Produto,Preço Base,Preço Final
1400,Refresco em Pó Tornado Uva 20G,0.79,0.79
1401,Refresco em Pó Tornado Uva Embalagem 20G,0.79,0.79
1402,Cerveja Heineken Garrafa 330Ml,5.98,5.98
1403,Cerveja Nacional Antarctica Original 300Ml Retornável,3.49,3.49
1404,Cerveja Heineken 350Ml,4.59,4.59
1405,Cerveja Brahma 300Ml,2.19,2.19
1406,Cerveja Pilsen Litrinho Skol 300Ml,2.19,2.19
1407,Cerveja Puro Malte Bohemia 310Ml com 6Un,15.9,15.9
1408,Cerveja Brahma 300Ml Retornável,2.19,2.19
1409,Cerveja Skol 300Ml Retornável,2.19,2.19
1410,Cerveja Heineken Keg 5L,89.98,89.98
1411,Cerveja Amstel Puro Malte Lata 473Ml,4.19,4.19
1412,Cerveja Albanos Puro Malte Pilsen 600Ml,7.98,7.98
1413,Cerveja Heineken Lata 473Ml,5.79,5.79
1414,Cerveja Lager Budweiser 310Ml com 6Un,20.1,14.94
1415,Cerveja Brahma Duplo Malte 310Ml com 6Un,17.7,17.7
1416,Cerveja Pilsen Duplo Malte Brahma 473Ml,4.29,4.29
1417,Cerveja Antártica 473Ml,3.79,3.79
1418,Cerveja Heineken Garrafa 600Ml,10.98,10.98
1419,"Cerveja Corona Extra, Pilsen, 330Ml, Long Neck 1 Garrafa de Plástico Será Reciclada",6.19,6.19
1420,Cerveja Puro Malte Petra Origem Lata 350Ml,2.78,2.78
1421,Cerveja Pilsen Puro Malte Eisenbahn Lata 473Ml,4.49,4.49
1422,Cerveja Budweiser 473Ml,4.49,4.49
1423,Cerveja Nacional Império Pilsen Lata 473Ml,3.49,3.49
1424,Cerveja Heineken Zero Lata 350Ml,4.78,4.78
1425,Cerveja Itaipava Lata 473Ml,3.09,2.79
1426,Cerveja Puro Malte Bohemia 473Ml,3.99,3.99
1427,Cerveja Tiger Puro Malte Lata 350Ml,2.48,1.99
1428,Cerveja Premium Sol Long Neck 330Ml,4.98,3.99
1429,Cerveja Heineken Zero Garrafa 330Ml,5.98,5.98
1430,Cerveja Pilsen Kaiser Lata 473Ml,3.19,3.19
1431,Cerveja Eisenbahn Pilsen Puro Malte Long Neck 355Ml,3.99,3.99
1432,Cerveja Original Antarctica 473Ml,4.49,4.49
1433,Cerveja Original 300Ml,3.49,3.49
1434,Cerveja Spaten Puro Malte Garrafa 600Ml,7.99,7.99
1435,Cerveja Zero Brahma 350Ml,3.98,3.98
1436,Cerveja Budweiser 330Ml,5.19,5.19
1437,Cerveja Gold Lager Long Neck Therezópolis 355Ml,4.49,4.49
1438,Cerveja Pilsen Skol 473Ml,3.89,3.89
1439,Cerveja Puro Malte Petra Origem Lata 473Ml,3.79,3.79
1440,Cerveja Pilsen Brahma 473Ml,3.99,3.99
1441,Cerveja Stella Artois Long Neck 330Ml,5.49,5.49
1442,Cerveja Eisenbahn American Ipa Puro Malte Long Neck 355Ml,4.99,4.99
1443,Cerveja Lager Puro Malte Crystal Tiger 473Ml,4.98,2.79
1444,Cerveja Imperio Long Neck Gold 210Ml,4.58,4.58
1445,Cerveja Stella Artois 473Ml,4.69,4.69
1446,Cerveja Premium Puro Malte Gold Black Princess Lata 350Ml,4.98,4.98
1447,Cerveja Escura Caracu 350Ml,4.49,4.49
1448,Cerveja Puro Malte Skol 473Ml,3.49,3.49
1449,Cerveja Estrella Galicia Zero Álcool Lata 330Ml,5.98,5.98
1450,Cerveja Spaten Puro Malte Lata 350Ml,3.4,3.4
1451,Cerveja Pilsen Puro Malte Unfiltered Eisenbahn 355Ml,3.99,3.99
1452,Cerveja Malzbier Brahma 355Ml,4.98,4.98
1453,Cerveja Albanos Amber Lager 600Ml,9.98,9.98
1454,Cerv Albanos Session Ipa 600Ml,10.98,10.98
1455,Cerveja Laut Pilsen 600Ml,7.98,7.98
1456,Cerveja Brahma Zero Long Neck 355Ml,4.49,4.49
1457,Cerveja Pilsen Läut 473Ml,3.49,3.49
1458,Cerveja Sirius Pilsen 473Ml,2.38,2.38
1459,Cerveva Bruder Pilsen Puro Malte 600Ml,6.98,3.99
1460,Cerveja Pilsen Serrana 473Ml,3.19,3.19
1461,Cerveja Baixa Gastronomia Bruder 600Ml,7.98,7.98
1462,Cerveja Red Lager Puro Malte Back To The Red Black Princess Garrafa 600Ml,14.98,14.98
1463,Cerveja Laut The Dark Lager 600Ml,9.98,8.49
1464,Cerveja Laut Session Ipa Skalaut 600Ml,13.98,11.29
1465,Cerveja Alma Cevada Session Ipa Bruder 600Ml,9.98,9.98
1466,Cerveja Laut Session Ipa 600Ml,13.98,11.29
1467,Ice Syn Lemon 300Ml,3.99,3.99
1468,Conhaque Presidente 900Ml,16.98,16.98
1469,Whisky Escocês Finest Ballantines Garrafa 750Ml,79.8,79.8
1470,Conhaque Dreher Garrafa 900Ml,17.98,17.98
1471,Cachaça Pirassununga 21 Garrafa 900Ml,13.98,13.98
1472,Aguardente 51 965Ml,13.99,13.99
1473,Whisky Escocês Ballantine's Finest 750Ml,79.8,79.8
1474,Conhaque Presidente Embalagem 970Ml,16.98,16.98
1475,Cachaça Salinas Tradicional Garrafa 600Ml,34.98,34.98
1476,Gin Rocks Garrafa 1 Litro,41.98,41.98
1477,Aguardente Ypioca Ouro Garrafa 960Ml,26.98,26.98
1478,Aguardente Vila Velha Garrafa 600Ml,6.98,6.98
1479,Bebida Catuaba Selvagem Açaí 1L,18.59,18.59
1480,Gin Dry Orloff 1Litro,45.98,45.98
1481,Drink Pronto Schweppes Premium Drinks Gin Tônica 310Ml,6.98,6.98
1482,Raíz Amarga Paratudo Garrafa 900Ml,15.98,15.98
1483,Jurubeba Leão Do Norte Garrafa 600Ml,16.98,16.98
1484,Cachaça do Barril Garrafa 500Ml,4.98,4.98
1485,Bebida Gin Rosé Vanfall 750Ml,74.98,74.98
1486,Aguardente Pirassununga 21 Garrafa 965Ml,13.98,13.98
1487,Cachaça Ferreira Januaria Garrafa 600Ml,26.98,26.98
1488,Gin Vanfall 750Ml,74.98,74.98
1489,Cachaça Seleta Garrafa 600Ml,33.98,33.98
1490,Vodka Smirnoff 998Ml,51.98,51.98
1491,Cachaça Salinas Cristalina Garrafa 600Ml,34.98,34.98
1492,Cachaça Umburana Salinas 600Ml,34.98,34.98
1493,Cachaça 88 Old Cesar Garrafa 965Ml,16.98,16.98
1494,Vodka Kriskof Apple 900 Ml,12.98,12.98
1495,Cachaça Brasilizar Ouro Ypioca 965Ml,26.98,26.98
1496,Cachaça Atitude Mineira 470Ml,3.98,3.98
1497,Coquetel Porto Rico Coco 940Ml,11.98,11.98
1498,Aguardente Tradicional Salinas 600Ml,34.98,34.98
1499,Cachaça Atitude Ouro 470Ml,3.98,3.98
1500,Cachaça Seleta Garrafa 600Ml,33.98,33.98
1501,Smirnoff Ice Original Garrafa 275Ml,10.98,10.98
1502,Bebida Ice Syn Berry 300Ml,3.99,3.99
1503,Bebida Ice Syn Vodka Apple 300Ml,3.99,3.99
1504,Drink Pronto Beats Gt Sabor Gin&Tônica Long Neck Skol 269Ml,7.99,7.99
1505,Bebida Mista Senses Skol Beats 269Ml,6.99,6.99
1506,Drink Pronto Schweppes Premium Drinks Vodka & Citrus 310Ml,6.98,6.98
1507,Drink Pronto Beats Senses Skol Beats 269Ml,4.94,4.94
1508,Bebida Catuaba Comary Selvagem 1L,15.98,15.98
1509,Smirnoff Ice Original 275Ml,10.98,10.98
1510,Drink Pronto Beats Drinks Gt Sabor Gin&Tônica Skol 269Ml,5.83,5.83
1511,Drink Pronto Beats Drinks Mint Sabor Mojito Skol 269Ml,6.28,6.28
1512,Vinho Tinto Vilena Bordô Suave 750Ml,16.98,16.98
1513,Vinho Tinto Suave Nacional de Mesa Pérgola 1L,20.98,20.98
1514,Vinho Tinto Camernere San Clemente 750Ml,35.98,35.98
1515,Vinho Tinto Monte Carmo Seco 1 Litro,20.98,20.98
1516,"Vinho Tinto Seco Suave Monte Carmo 1,47L",19.98,19.98
1517,Vinho Tinto São Marcos Suave Garrafa 750Ml,15.98,15.98
1518,Vinho Tinto Cabernet San Clemente 750Ml,35.98,35.98
1519,Vinho Tinto Brasileiro Suave Dom Bosco 750Ml,17.98,17.98
1520,Vinho Rosé Suavinho Campo Largo 500Ml,8.98,8.98
1521,Vinho Tinto Casa Geraldo Bordô Garrafa 750Ml,32.98,32.98
1522,Vinho Branco Brasileiro Liebfraumilch Reserva Especial Fino Garrafa 750Ml,21.98,21.98
1523,Vinho Tinto Suave Cantina da Serra 880Ml,8.98,8.98
1524,Vinho Tinto Suave Campino 750Ml,16.98,16.98
1525,Vinho Tinto Campo Largo Seco Garrafa 750Ml,15.98,15.98
1526,Vinho Tinto Suave Canção 750Ml,17.98,17.98
1527,Vinho Tinto Santomé Suave Garrafa 1 Litro,21.98,21.98
1528,Vinho Santome 1Lt Bordo Suave,22.98,22.98
1529,Vinho Tinto San Tome Bordô Seco Garrafa 1 Litro,24.59,24.59
1530,Vinho Almadén Ugni Blanc Suave 750Ml,29.98,29.98
1531,Vinho Branco Seco Campo Largo 750Ml,15.98,15.98
1532,Vinho Tinto Brasileiro Chapinha Suave Garrafa 750Ml,14.98,14.98
1533,Vinho Tinto Bordô Suave San Tomé 1L,24.98,24.98
1534,Vinho Branco Dom Bosco Suave Garrafa 750Ml,15.98,15.98
1535,Vinho Branco Campo Largo Suave 750Ml,15.98,15.98
1536,Cooler Branco Pêssego Suavinho Campo Largo 500Ml,8.98,8.98
1537,Sidra Cereser Spritz 660Ml,17.98,17.98
1538,Vinho Santomé Bordô Suave 269Ml,8.98,8.98
1539,Vinho Branco Campo Largo Seco 750Ml,15.98,15.98
1540,Sidra Cereser Edição Limitada 660Ml,13.98,13.98
1541,Frisante Campino Soleo Suave Garrafa 660Ml,31.98,31.98
1542,Vinho Tinto Canção Garrafa 750Ml,17.98,17.98
1543,Vinho Tinto San Tome Frisante Suave 245Ml,5.98,5.98
1544,Sidra sem Álcool Cereser Maçã Edição Especial 660Ml,15.98,15.98
1545,Sidra Cereser sem Álcool Maçã 660Ml,15.98,15.98
1546,Vinho Vilena Niagara Suave Branco 750Ml,16.98,16.98
1547,Sidra Cereser Maça 660Ml,13.98,13.98
1548,Vinho Tinto Suavinho Campo Largo 500Ml,8.98,8.98
1549,Vinho Branco Cooler de Pêssego Vilena 750Ml,16.98,16.98
1550,Espumante Manosso Moscatel 750Ml,48.98,48.98
1551,Vinho Branco Cooler de Morango Vilena 750Ml,16.98,16.98
1552,Vinho Branco Suave Monte Carmo Garrafa 1Litro,20.98,20.98
1553,Vinho Dom Bosco Tinto Suave 750Ml,17.98,17.98
1554,Sidra Cereser sem Álcool Sabor Maçã 660Ml,15.98,15.98
1555,"Vinho Tinto Suave São Marcos 1,25L",21.98,21.98
1556,Vinho Monte Carmo Branco Seco 1L,20.98,20.98
1557,Toalhinhas Umedecidas 20X13cm Mili Love & Care 100Un,14.79,14.79
1558,Fralda Xg Babysec Jumbo Pacote 20Un,28.98,28.98
1559,Lenços Umedecidos Baby Use It 70Un,2.98,2.98
1560,Sabonete de Loção Hidratante Pom Pom 80G,2.98,2.98
1561,Sabonete Pom Pom Glicerinado 80G,2.98,2.98
1562,Sabonete Pom Pom Glicerinado Unidade 90G,2.98,2.98
1563,Lenço Umedecido Huggies Max Clean 48 Unidades,21.98,21.98
1564,Sabonte Pom Pom Hidratante Unidade 90G,2.98,2.98
1565,Sabonete Original Johnsons Baby 80G,6.59,6.59
1566,Fralda Personal Soft & Protect M 28Un,22.98,22.98
1567,Fralda Descartável Infantil Soft e Protect Xg Personal Embalagem com 20 Unidades,22.98,22.98
1568,Lenço Umedecido Isababy Recém Nascido Embalagem 50Un,10.98,10.98
1569,Fraldas Descartáveis Pampers Supersec Xg,33.98,33.98
1570,Fralda Calça Mamypoko Dia e Noite P 46Un,35.98,35.98
1571,Fralda Mamypoko Calça D&N Jumbo M com 34 Unidades,35.98,35.98
1572,Fralda Descartável Evolution Super Econômica Xxg Embalagem 54 Un,55.98,55.98
1573,Fralda Huggies Tripla Proteção G 28 Fraldas,34.98,34.98
1574,Sabonete Baby Hora do Sono Johnson's 80G,6.59,6.59
1575,Sabonete de Mel e Glicerina Johnsons Baby 80G,6.59,6.59
1576,Fraldas Mili Ultra Seca Jumbinho Xxg 16Un,22.98,22.98
1577,Fralda Descartável Infantil Baby Protect & Sec Tamanho G Personal 22Un,27.98,27.98
1578,Sabonete em Barra para Bebê Baby Delicate Care Protex 85G,4.29,4.29
1579,Fraldas Descartáveis Pampers Super Sec Xg Pacote 22 Un + 2 Fraldas Grátis,33.98,33.98
1580,Fralda Baby G Turma da Mônica 24Un,26.98,26.98
1581,Fralda Turma da Mônica Baby P Pacote 30Un,26.98,26.98
1582,Fralda Descartável Tamanho Rn Turma da Mônica Baby 36Un,26.98,26.98
1583,Fralda Descartável Infantil Baby Protect & Sec Tamanho Xg Personal 18Un,27.98,27.98
1584,Lenço Umedecido Huggies One & Done 48 Unidades,21.98,21.98
1585,Fraldas Descartáveis Evolution Super Econômico G Pacote 72 Un,55.98,55.98
1586,Fralda Huggies Tripla Proteção G 36 Fraldas,44.98,44.98
1587,Fralda G Babysec Ultra Sec Jumbo Pacote 24Un,28.98,28.98
1588,Sabonete Baby Dove Hidratação Balanceada 75G,4.29,4.29
1589,Fralda P Babysec Ultra Sec Pacote 30Un,28.98,28.98
1590,Fralda Descartavel Baby P 3 a 5Kg Turma da Mônica 62Un,45.98,39.98
1591,Fralda Huggies Tripla Proteção M 32 Fraldas,34.98,34.98
1592,Fralda Huggies Tripla Proteção Xxg 22 Fraldas,34.98,34.98
1593,Fralda Ultra Mega Tamanho M Babysec 38 Unidades,39.98,39.98
1594,Fralda Descartável Tamanho Xg Turma da Mônica Baby 42Un,45.98,39.98
1595,Condicionador Johnson's Baby Cabelos Cacheados 200Ml,21.98,21.98
1596,Sabonete Pom Pom Leite e Mel Unidade 80G,2.98,2.98
1597,Fralda Descartável Huggies Turma Monica Jumbo Xg 24Un,34.98,34.98
1598,Fraldas Descartáveis Isababy Premium Jumbinho M 18Un,22.98,22.98
1599,Fralda Xg Pampers Supersec Embalagem 24Un,33.98,33.98
1600,Fralda M Isababy Pemium Jumbo Embalagem 32Un,31.98,31.98
1601,Fralda Descartável Eg Isababy Premium Jumbo Embalagem 24Un,31.98,31.98
1602,Fralda P Pampers Supersec 34 Unidades,33.98,33.98
1603,Sabonete Johnsons Baby Óleo de Amêndoas Unidade 80G,6.59,6.59
1604,Fralda Huggies Tripla Proteção M 42 Fraldas,39.98,39.98
1605,Fralda Turma da Mônica Baby M Pacote 28Un,26.98,26.98
1606,Turma da Monica Baby Fralda Descartavel Xxg 14 a 18Kg,45.98,39.98
1607,Fralda Descartável P Babysec Ultrasec Pacote 46Un,39.98,39.98
1608,Fralda Descartável Baby Tamanho Xxg Turma da Mônica 16Un,26.98,26.98
1609,Fraldas Mili Ultra Seca Jumbinho G 20Un,22.98,22.98
1610,Fralda Calça Infantil Descartável Tamanho P Mamypoko 46Un,35.98,35.98
1611,Fralda Descartável Xg Pampers Supersec Pacote 22 Un,33.98,33.98
1612,Fralda Mili Ultra Seca Jumbinho Xg 18Un,22.98,22.98
1613,Fraldas Descartável Tamanho Xg Cremer com 36Un,49.8,49.8
1614,Fralda Calça Infantil Tamanho G Mamypoko 32Un,35.98,35.98
1615,Fraldas Descartáveis Pampers Supersec Xg Pacote 22Un,33.98,33.98
1616,Fraldas Mili Ultra Seca Jumbinho M 22Un,22.98,22.98
1617,Fralda Cremer Disney Mega Xxg 32Un,49.8,49.8
1618,Fraldas Descartáveis Mamypoko Fralda-Calça Regular P Super Seca Pacote 24 Un,24.98,24.98
1619,Fralda Infantil Descartável Tamanho G Turma da Mônica Baby 44Un,45.98,39.98
1620,Fralda Infantil Babysec Premium Mega Xg 26Un,39.98,39.98
1621,Fralda Descartável Mili Jumbinho Ultra Seca P 24Un,22.98,22.98
1622,Fralda Huggies Tripla Proteção Xg 24 Fraldas,34.98,34.98
1623,Fraldas Descartáveis Pampers Supersec Xg Pacote 12 Un,33.98,33.98
1624,Fralda Babysec Premium G 30 Unidades,38.98,38.98
1625,Fralda Huggies Natural Care P 36 Fraldas,34.98,27.98
1626,Fralda Descartável Evolution Mega Classic Tamanho P Pacote 52 Un,32.98,32.98
1627,Toalha Umedecida Isababy Zoo Refil 100Un,14.98,14.98
1628,Fralda Xxg Babysec Ultrasec Pacote 16Un,28.98,28.98
1629,Fralda Descartável Pampers Supersec Xg Pacote 24Un,33.98,33.98
1630,Fraldas Descartáveis Isababy Premium G Pacote 18Un,22.98,22.98
1631,Fralda Cremer Disney Mega P 54Un,49.8,49.8
1632,Fralda Infantil Babysec Premium Mega M Pacote 34 Unidades,39.98,39.98
1633,Fralda Descartável Turma da Mônica Baby Tamanho Xg Huggies 20Un,26.98,26.98
1634,Fralda Descartável Babysec Ultra Sec M Pacote 28Un,28.98,28.98
1635,Lenço Umedecido Ypê Multiuso Álcool Pacote com 18Un,8.98,6.98
1636,Fralda Personal Soft & Protect Tamanho P 30Un,24.98,24.98
1637,Monica Fralda Mega M C/50,45.98,39.98
1638,Fralda Calça Infantil P Mamypoko Embalagem 50 Un,32.98,32.98
1639,Fralda Mamypoko Dia e Noite M com 44 Unidades,32.98,32.98
1640,Fralda Dry Evolution Classic Mega P 52 Unidades,32.98,32.98
1641,Mamadeira Lisa Cbico Pvc 240Ml,6.98,6.98
1642,Mamadeira Pequena Super Higiênica Lisa New Baby 150Ml,7.98,7.98
1643,Lenço Umedecido Piquitucho 40Un,5.98,5.98
1644,Mamadeira Lisa 240Ml New Baby -Cores Sortidas- Un,8.98,8.98
1645,Fraldas Pampers Supersec Xg 22Un,33.98,33.98
1646,Super Poderosa Kit Shampoo e Condicionador Cachos Dos Sonhos 300Ml,8.98,8.98
1647,Kit Probelle Super Poderosa Shampoo 300 Ml e Condicionador 300Ml Água de Coco,8.98,8.98
1648,Kit Shampoo+Condicionador Super Poderosa Liso Mais Crescimento 600Ml,8.98,8.98
1649,Kit Shampoo e Condicionador Probelle Super Poderosa Volumex Babosa 600Ml Un,8.98,8.98
1650,Kit Shampoo 300Ml + Condicionador 300Ml Volumex Mel e Própolis Super Poderosa Probelle,8.98,8.98
1651,Kit Pantene Hidratação Shampoo 350 Ml + Condicionador 175 Ml,31.98,31.98
1652,Kit Shampoo 350Ml + Condicionador 175Ml Pantene Liso Extremo,31.98,31.98
1653,Kit Shampoo + Condicionador Niely Gold Nutrição Magica 175Ml,17.98,17.98
1654,Shampoo Darling Tília 350Ml,8.98,8.98
1655,Shampoo Joias da Natureza Purificação Detox 325Ml,11.59,11.59
1656,Shampoo Lisos Te Quero Monange 325Ml,8.98,8.98
1657,Kit Shampoo 300Ml e Condicionador 200Ml Liso Pleno Niely Gold,17.98,17.98
1658,Shampoo Palmolive Naturals Neutro 350Ml,11.59,11.59
1659,Gel Fixador Ny Looks 1 Fixação Média Incolor Embalagem 240G,8.59,8.59
1660,Escova de Cabelo Masculina Ricca Oval Ref 358 Embalagem 1 Un,3.98,3.98
1661,Shampoo Monange Hidrata com Poder 325Ml,8.98,8.98
1662,Shampoo Condicionador Darling 2 em 1 350Ml,9.59,9.59
1663,Shampoo Tresemmé Hidratação Profunda 400Ml,17.98,17.98
1664,Condicionador Infantil Moana Juntinhos Cachos Encantados Seda 300Ml,13.29,13.29
1665,Creme para Pentear Infantil Cachos Encantados Juntinhos Moana Seda 300Ml,12.98,12.98
1666,Kit Bioextratus Mel Shampoo e Condicionador 250Ml,44.98,44.98
1667,Kit Shampoo 275Ml + Condicionador Detox Limão Chá Verde Niely 175Ml,17.98,17.98
1668,Condicionador Infantil Frozen Juntinhos Brilho Encantado Seda 300Ml,12.98,12.98
1669,Condicionador Seda Ceramidas 325Ml,13.79,13.79
1670,Creme Kanechom Power Cachos 1Kg,8.98,8.98
1671,Shampoo Palmolive Naturals Neutro Embalagem 400Ml,11.59,11.59
1672,Chikas Acorda Cachos Masc 450G,20.59,20.59
1673,Gel Condicionador Fixador Ny Looks Fator 4 240G,8.59,8.59
1674,Kit Niely Gold Cachos do Seu Jeito Shampoo + Condicionador 175Ml,17.98,17.98
1675,Água Oxigenada Cremosa 40V Ideal 70Ml,2.98,2.98
1676,Máscara Capilar Bio Extratus Banho de Creme Anti Queda Embalagem 1Kg,46.98,46.98
1677,Creme para Pentear Seda Keraforce Embalagem 300Ml,12.98,12.98
1678,Condicionador Instance Frutas Vermelhas Eudora 300Ml,24.98,24.98
1679,Shampoo Instance Frutas Vermelhas Eudora 300Ml,23.98,23.98
1680,Acessorios Donna,2.98,2.98
1681,Creme de Hidratação Skala Óleo de Coco 1Kg,10.98,10.98
1682,Condicionador Seda Bambu e Biotina 325Ml,13.79,13.79
1683,Condicionador Liso Extremo Seda 325Ml,13.79,13.79
1684,Creme de Hidratação Skala Ceramidas G3 Plus 1Kg,10.98,10.98
1685,Shampoo Nutrição Extraordinária Palmolive 350Ml,11.59,11.59
1686,Touca Plástica para Banho Nedo Ref1104 1 Un,3.98,3.98
1687,Shampoo Infantil Juntinhos Frozen Brilho Encantado Seda 300Ml,11.59,11.59
1688,Amônia Farmax Embalagem 100Ml,2.99,2.99
1689,Gel Condicionador Fixador Ny Looks Fator 4 240G,8.59,8.59
1690,Condicionador Seda Hidratação Micelar 325Ml,13.79,13.79
1691,Condicionador Neutrox Clássico 300Ml,12.98,12.98
1692,Condicionador Seda Liso Extremo Embalagem 350Ml,13.79,13.79
1693,Creme Trat Kanec Lisos Super 1Kg,8.98,8.98
1694,Creme de Hidratação Skala Expert Bomba de Vitaminas 100% Vegano & 0% Origem Animal 1Kg,10.98,10.98
1695,Shampoo Instance Karité Eudora 300Ml,23.98,23.98
1696,Creme de Hidratação Skala Expert Amido de Milho 100% Vegano & 0% Origem Animal 1Kg,10.98,10.98
1697,Creme de Hidratação Skala Expert Condicionador Abacate 100% Vegano & 0% Origem Animal 1Kg,10.98,10.98
1698,Condicionador Elseve Reparação Total 5+ Cabelos Danificados Loréal Paris 200Ml,16.99,16.99
1699,Gel Condicionador Fixador Ny Looks 1 240G,8.59,8.59
1700,Máscara Capilar Bio Extratus Banho de Creme Ceramidas e Manteiga de Karité Embalagem 1Kg,46.98,46.98
1701,Pó Descolorante Bio Extratus Azul Embalagem 50G,12.98,12.98
1702,Creme para Pentear Seda Boom Transição 295Ml,11.98,11.98
1703,Reparador de Pontas Bicho da Seda Oil Siliconado Embalagem 30Ml,10.98,10.98
1704,Chikas Desmaia Cabelo Masc 450G,20.59,20.59
1705,Chikas Desliza Liso Shampoo 300Ml,14.98,14.98
1706,Condicionador Darling Tília 350Ml,11.98,11.98
1707,Creme de Tratamento Skala Expert Bomba de Vitaminas Banana 1Kg,10.98,10.98
1708,Shampoo Seda Pureza Refrescante Embalagem 350Ml,11.59,11.59
1709,Água Oxigenada Farmax Cremosa Volume 30,2.98,2.98
1710,Shampoo Chikas Acorda Cachos 300Ml,14.98,14.98
1711,Pó Descolorante Cless Liss Óleo de Argan Sachê 50G,12.59,12.59
1712,Chikas Desmaia Cabelo Shampoo 300Ml,14.98,14.98
1713,Kit Shampoo e Condicionador Super Poderosa Liso Brilho Espelhado 600Ml,8.98,8.98
1714,Pente com Cabo Nedo Embalagem 1 Un,2.79,2.79
1715,Óleo Amêndoas Farmax 100Ml,8.98,8.98
1716,Condicionador Seda Recarga Natural Força Anti-Quebra Embalagem 350Ml,13.79,13.79
1717,Gel Condicionador Fixador Ny Looks Fator 3 240G,8.98,8.98
1718,Creme para Pentear Liso Perfeito Seda 300Ml,12.98,12.98
1719,Amônia Avante Embalagem 100Ml,2.98,2.98
1720,Chikas Desmaia Cabelo Finalizador 300Ml,20.98,14.98
1721,Tintura para Cabelo Fleury 5.0 Castanho Claro Embalagem 1 Un,4.98,3.99
1722,Condicionador Bio Extratus Mais Brilho 250Ml,22.98,22.98
1723,Condicionador Tok Bothânico Ceramidas Embalagem 500Ml,6.98,6.98
1724,Solução À Base de Amônia Farmax 100Ml,2.99,2.99
1725,Condicionador Bio Extratos Blond Bioreflex Embalagem 250Ml,22.98,22.98
1726,Creme de Hidratação Coquetel de Frutas Skala 1Kg,10.98,10.98
1727,Descolorante em Pó Bela&Cor Óleo de Argan 50G,9.98,9.98
1728,Condicionador Seda Rita Pretos Luminosos Embalagem 325Ml,13.79,13.79
1729,Creme para Pentear Skala Abacate 250G,8.98,8.98
1730,Shampoo Cachos Livres Extrato de Coco Palmolive 350Ml,9.98,9.98
1731,Finalizador Bio Extratus Blond Bioreflex Desamarelador Embalagem 200G,29.98,29.98
1732,Condicionador Seda Pretos Luminosos Secagem Rápida 325Ml,13.79,13.79
1733,Creme para Tratamento Skala Coquetel Brasil 1Kg,10.98,10.98
1734,Creme de Argam Kanechom 1Kg,8.98,8.98
1735,Creme de Tratamento Biohair Cachos Definidos Embalagem 1Kg,18.98,18.98
1736,Condicionador Darling Ceramidas 350Ml,10.98,10.98
1737,Condicionador Kolene Original 500Ml,14.98,14.98
1738,Condicionador Bio Extratus Umectante com Óleo de Coco Embalagem 250Ml,21.98,21.98
1739,Condicionador Monange Cachos Que Tal 325Ml,9.98,9.98
1740,Shampoo Bio Extratus Umectante com Óleo de Coco Embalagem 250Ml,26.98,26.98
1741,Tintura de Cabelo Cor Castanho Claro Luxuoso 5.0 Biocolor,13.98,13.98
1742,Condicionador Seda Recarga Natural Bomba Coco 325Ml,13.79,13.79
1743,Condicionador Naturals Ceramidas Force Palmolive 350Ml,12.98,12.98
1744,Condicionador Pantene Pro-V Micelar Purifica & Hidrata 175Ml,16.98,16.98
1745,Condicionador Seda Recarga Natural Mel Anti-Quebra 325Ml,13.79,13.79
1746,Shampoo Pêra sem Sal Tok Bothânico 400Ml,6.59,6.59
1747,Tintura de Cabelo Biocolor Louro Escuro Clássico 6.0,11.98,11.98
1748,Condicionador Bomba de Nutrição Seda 325Ml,13.79,13.79
1749,Shampoo Seda Bomba Argan 325Ml,11.59,11.59
1750,Gel Fixador Ny Looks Verde Fator 3 Extra Forte Embalagem 240G,8.98,8.98
1751,Creme Kanechom Óleo de Coco 1Kg,8.98,8.98
1752,Condicionador Palmolive Naturals Neutro 350Ml,12.98,12.98
1753,Creme para Tratamento Capilar Skala Café Verde Ucuuba 1Kg,10.98,10.98
1754,Shampoo Bio Extratus Homem 3 em 1 Embalagem 250Ml,24.98,24.98
1755,Condicionador Bio Extratus Antiqueda Jaborandi Embalagem 250Ml,26.98,26.98
1756,Condicionador Seda Óleo Hidratação 325Ml,13.79,13.79
1757,Gel Fix Kanechom Azul 230G,6.79,6.79
1758,Creme para Pentear Infantil Tiana Juntinhos Crespos Encantados Seda 300Ml,12.98,12.98
1759,Ampola Unidas Pelos Cachos Pantene 45Ml,15.98,9.99
1760,Solução de Amonia Ideal 100Ml,2.98,2.98
1761,Creme de Tratamento Verão Tropical Kanechom 1Kg,8.98,8.98
1762,Shampoo Palmolive Naturals Neutro Embalagem 350Ml,11.59,11.59
1763,Tintura para Cabelo Niasi Biocolor Coloração Creme 6.7 Marrom Natural,14.99,14.99
1764,Condicionador Seda Sos Ceramidas Embalagem 350Ml,13.79,13.79
1765,Chikas Cresce e Aparece Mascara 450G,20.59,20.59
1766,Água Oxigenada Cremosa Ideal 20V Embalagem 90Ml,2.98,1.29
1767,Tintura para Cabelo 4.0 Castanho Médio Cor e Ton 125G,14.98,14.98
1768,Kit Biohair Óleo de Argan Shampoo 350Ml e Condicionador 350Ml,19.98,19.98
1769,Creme para Pentear Yamasterol Queratina Embalagem 320Ml,9.98,9.98
1770,Chikas Acorda Cachos Cond 300Ml,14.98,14.98
1771,Condicionador Skala Bomba de Abacate Embalagem 325Ml,8.98,8.98
1772,Água Oxigenada Ideal 20V 70Ml,2.98,1.29
1773,Água Oxigenada Ideal Volume 20 70Ml,2.98,1.29
1774,Creme de Tratamento Biohair Óleo de Argan Embalagem 1Kg,18.98,18.98
1775,Água Oxigenada Farmax 30V Embalagem 90Ml,2.98,2.98
1776,Tintura para Cabelo Niasi Biocolor Coloração Creme Castanho Claro 5.0,13.98,13.98
1777,Chikas Desliza Liso Cond 300Ml,14.98,14.98
1778,Tintura para Cabelo Niasi Biocolor Coloração Creme 6.0 Louro Escuro,11.98,11.98
1779,Descolorante Po B&C Camomila 50G,9.98,9.98
1780,Chikas Desmaia Cabelo Cond 300Ml,14.98,14.98
1781,Tratamento de Choque Desmaia Cabelo Fiovit 30G,7.29,7.29
1782,Condicionador Seda Óleo Hidratação Embalagem 350Ml,13.79,13.79
1783,Condicionador Matiza Louro Chikas 500Ml,21.98,21.98
1784,Chikas Cresce e Aparece Condicionador 300Ml,14.98,14.98
1785,Mascara Chikas Desliza Liso 450G,20.59,20.59
1786,Óleo Capilar Farmax Semente de Uva Embalagem 100Ml,8.98,8.98
1787,Condicionador Bio Extratos Proteínas do Leite Embalagem 250Ml,22.98,22.98
1788,Banho de Creme Nutritivo Mel Bio Extratus 1Kg,46.98,46.98
1789,Água Oxigenada Ideal 20 Volumes Embalagem 90Ml,2.98,1.29
1790,Condicionador Bio Extratus Pós Química Abacate e Jojoba Embalagem 250Ml,26.98,26.98
1791,Água Oxigenada Cremosa 30Vol Farmax Embalagem 90Ml,2.98,2.98
1792,Pente Nedo para Caspa Embalagem 1 Un,2.98,2.98
1793,Condicionador Palmolive Cachos Livres Extrato de Coco 350Ml,12.98,12.98
1794,Shampoo Suave Mel e Óleo de Amêndoas 325Ml,8.98,8.98
1795,Bio Ext Cachos e Crespos Banho de Creme 1Kg,46.98,46.98
1796,Condicionador Bio Extratos Tutano e Ceramidas Embalagem 250Ml,26.98,26.98
1797,Shampoo Bio Estratus Mais Brilho 250Ml,24.98,24.98
1798,Condicionador Palmolive Naturals Maciez Prolongada 350Ml,12.98,12.98
1799,Chikas Cresce e Aparece Shampoo 300Ml,14.98,14.98
1800,Shampoo Bio Extratus Homem Cabelos Grisalhos Embalagem 250Ml,24.98,24.98
1801,Condicionador Palmolive Naturals Cachos Control 350Ml,12.98,12.98
1802,Condicionador Tok Bothânico Jaborandi Embalagem 500Ml,6.98,6.98
1803,Finalizador Matiza Loiro Chikas 300Ml,25.98,25.98
1804,Alisante Salon Line Guanidina Óleo de Argan Embalagem 218G,25.98,25.98
1805,Condicionador Kanechom Coco Bom 1Kg,8.98,8.98
1806,Shampoo Bio Extratus Proteínas Do Leite Embalagem 250Ml,19.99,19.99
1807,Creme para Pentear Keraforce Original Seda 300Ml,12.98,12.98
1808,Pente de Cabelo Ricca Pequeno Embalagem 1 Un Ref 355,4.49,4.49
1809,Chikas Desliza Liso Finalizador 300Ml,20.98,14.98
1810,Condicionador Suave Óleo de Coco e Abacate 325Ml,10.98,10.98
1811,Chikas Cresce e Aparece Finalizador 300Ml,20.98,14.98
1812,Creme de Aloe Vera Kanechom 1Kg,8.98,8.98
1813,Máscara Capilar Bio Extratus Força com Pimenta Embalagem 250G,29.98,29.98
1814,Máscara Capilar Salon Line S.O.S Bomba de Vitaminas Explosão de Hidratação Pote 1Kg,36.98,36.98
1815,Condicionador Monange Química sem Drama 325Ml,9.98,9.98
1816,Gel Super Cola Stone Incolor 500G 1 Unidade,19.98,19.98
1817,Tratamento de Choque Babosa com Jaborandi Romanholi 30G,7.29,7.29
1818,Amônia Ideal 100Ml,2.98,2.98
1819,Oleo Capilar Semente de Uva Roma 60Ml,11.59,11.59
1820,Grampo para Cabelo Franjinha N°5 com 100 Unidades,6.98,6.98
