,Produto,Preço Base,Preço Final
3570,Leite Integral Dez Vitaminas Itambé 1L,7.98,7.98
3571,Leite Habitus Desnatado 1L,5.98,3.99
3572,Bala Erlan Sortida 600G,7.98,7.98
3573,Bala Dadinho Tradicional Pacote 90G,5.98,5.98
3574,Balas Chita Mole Sortida Cory 500G,8.98,8.98
3575,Marshmallow Fini Camping 80G,7.49,7.49
3576,Bala de Gelatinas Minhocas Fini 90G,6.98,6.98
3577,Bala de Gelatina Arcor Unicórnio 70G,3.98,3.98
3578,Bala Butter Toffees Chocolate 100G,4.98,4.98
3579,Bala de Gelatina Plutonita Urso Ácido 70G,2.98,2.98
3580,Bala de Goma Frutas Sortidas Dori Gomets 32G,0.98,0.98
3581,Bala Macia Sabor Abacaxi Original Chita 500G,8.98,8.98
3582,Bala 7Belo Sabor Framboesa Arcor 100G,3.98,3.98
3583,Bala Mastigável Mentos Rainbow,1.99,1.99
3584,Bala Fini Gelatina Dentaduras Embalagem 90G,6.98,6.98
3585,Bala de Gelatina Minhoca Citrica Fini 90G,6.98,6.98
3586,Trident Hortelã 8G com 5Un,2.49,2.49
3587,Marshmallow Fini Torção Pacote 80G,7.49,7.49
3588,Goma de Mascar Trident Tutti Frutti Embalagem 8G,2.49,2.49
3589,Bala Halls Extra Forte Embalagem 28G,1.59,1.59
3590,Bala de Gelatina Arcor Mordida 70G,2.99,2.99
3591,Bala Gelatinas Beijos Sabor Morango e Nata Fini 90G,6.98,6.98
3592,Pastilha de Menta Tic Tac 16G,2.99,2.99
3593,Bala Mastigável Fruittella Vita C Morango 40G,1.99,1.99
3594,Bala Fini Gelatina Ursinhos Embalagem 90G,6.98,6.98
3595,Bala Fini Tubes Morango Cítrico 80G,6.98,6.98
3596,Bala Erlan Sortida 500G,7.98,7.98
3597,Bala Halls Lyptus Menta 28G,1.59,1.59
3598,Pirulito Push Pop Minions Embalagem 15G,4.98,4.98
3599,Goma de Mascar Xfresh Intense Trident Envelope 8G,2.49,2.49
3600,Pastilha de Hortelã Garoto 17G,1.19,1.19
3601,Bala Fini Gelatinas Amoras Embalagem 90G,6.98,6.98
3602,Bala Halls Mentol 28G,1.59,1.59
3603,Bala Fini Tubes Sabores Sortidos Embalagem 80G,6.98,6.98
3604,"Goma de Mascar Mentos Pure Fresh Fruit Embalagem 8,5G",1.59,1.59
3605,Goma de Mascar Herbal Trident X Fresh 8G 5Un,2.49,2.49
3606,Tic Tac Pastilhas Sabor Menta 16G,2.99,2.99
3607,Bala de Goma Gomets Iogurte 32G,0.89,0.89
3608,"Goma Mentos Pure Fresh Spearmint Mentos 8,5G com 5Un",1.49,1.49
3609,Bala de Gelatina Tubes de Morango Fini 80G,6.98,6.98
3610,Goma de Mascar Menta sem Açúcar Trident 8G,2.49,2.49
3611,"Goma de Mascar Trident Menta 9,6G Embalagem Leve 6 Un Pague 5 Un",2.49,2.49
3612,Chiclete de Melância Fini 80G,7.49,7.49
3613,Goma Gelatina Boca Dori 85G,4.59,4.59
3614,Bala Mastigável Fruittella Morango Embalagem 40G,1.99,1.99
3615,Goma de Mascar Trident Morango Embalagem 8G,2.49,2.49
3616,Bala Halls Melancia Embalagem 28G,1.59,1.59
3617,"Goma de Mascar Trident Hortelã Embalagem 10,2G",2.49,2.49
3618,Bala Halls Morango Embalagem 28G,1.59,1.59
3619,Goma de Mascar Trident Fresh Intense 5 Unidades,2.49,2.49
3620,Bala Gelatinas Bananas Fini 90G,6.98,6.98
3621,Tic Tac Pastilhas Sabor Laranja 16G,2.99,2.99
3622,Goma de Mascar Trident Canela Embalagem 8G,2.49,2.49
3623,Bala Fine Tubes Azedinhos Tutti Frutti Embalagem 80G,6.98,6.98
3624,Goma Dori Gelatina Amora 85G,4.59,4.59
3625,Tic Tac Pastilhas Sabor Frutas Como Te Gusta 16G,2.99,2.99
3626,Goma de Mascar Trident Melancia Embalagem 8G,2.49,2.49
3627,Goma de Mascar Trident Cereja Ice Fresh Embalagem 8G,2.49,2.49
3628,Trident X Fresh Goma de Mascar Cereja Ice Trident 8G,2.49,2.49
3629,Bala Fini Super Gigante Tubes Regaliz Morango 27G,2.49,2.49
3630,Pastilha Sabor Hortelã Fini 14G,1.19,1.19
3631,"Goma de Mascar sem Açúcar Mentos 3 Camadas Pure Fruit 8,5G 5 Unidades",1.59,1.59
3632,Tic Tac Pastilhas Sabor Morango 16G,2.99,2.99
3633,Bala Gomets Creme e Frutas Embalagem 32G,0.99,0.99
3634,Drops Halls Menta Unitário 34G,1.59,1.59
3635,"Goma de Mascar Trident Menta Verde 8,5G 1Uni",2.49,2.49
3636,"Bala Tic Tac Laranja Embalagem 8,7G",2.99,2.99
3637,Goma de Mascar Trident Hortelã,2.49,2.49
3638,Bala Fini Tubes Ácido Uva Embalagem 80G,6.98,6.98
3639,Goma de Mascar Freegells Gum Melancia Embalagem 8G,1.29,1.29
3640,"Goma de Mascar Menta Blueberry sem Açúcar Trident Max 16,5G",3.98,3.98
3641,Goma de Mascar Fresh Blueberry Trident X 8G,2.49,2.49
3642,"Bala Halls Sabor Extra Forte 27,5G",1.59,1.59
3643,Bala Cereja Halls 28G,1.59,1.59
3644,"Goma de Mascar Trident Hortelã Embalagem 9,6G",2.49,2.49
3645,Pastilha Menta Fini 14Gr,1.19,1.19
3646,Bala Fini Frutiê Sabor Mix de Frutas Embalagem 70G,6.98,6.98
3647,Goma de Mascar Trident Morango 8G,2.49,2.49
3648,"Goma de Mascar sem Açúcar Mentos 3 Camadas Mint 8,5G 5Unidades",1.99,1.99
3649,Marshmallows Fini Alvorada Embalagem 80G,7.49,7.49
3650,Drops Halls Extra Forte Unitario,1.59,1.59
3651,Goma de Mascar Sabor Melancia Trident 8G,2.49,2.49
3652,Goma de Mascar Hortelã Fresca Zero Açúcar Trident Max 5Un,3.98,3.98
3653,Bala Tic Tac Morango Embalagem 16G,2.99,2.99
3654,Goma Gelatina Dori Banana Embalagem 85G,4.59,4.59
3655,"Goma de Mascar Trident Melancia Embalagem 9,6G",2.49,2.49
3656,Goma de Mascar Freegells Gum Tutti Frutti Embalagem 8G,1.29,1.29
3657,Bala Halls Cereja Pacote 34G,1.59,1.59
3658,Chiclete de Salada de Frutas Fini 14G,1.49,1.49
3659,"Goma de Mascar sem Açúcar Mentos 3 Camadas Strong Mint 8,5G 5 Unidades",1.99,1.99
3660,Marshmallows Alvorada Fini 250G,11.98,11.98
3661,Goma de Gelatina Dori Urso 85G,4.59,4.59
3662,Bala Fini Tubes Ácido Super Gigante Morango Embalagem 27G,2.49,2.49
3663,Pastilha Garoto Extra Forte 17G,1.29,1.29
3664,Chiclete Fini Ovos de Dinossauro Azedinhos Embalagem 80G,7.59,7.59
3665,Pastilha Tic Tac Sabor Coca Cola 16G,2.98,2.98
3666,Bala Halls Morango Pacote 34G,1.59,1.59
3667,Bala Fini Tubes Uva Embalagem 80G,6.98,6.98
3668,Bala Fini Tubes Super Gigante Iogurte de Morango Embalagem 27G,2.49,2.49
3669,Drops Fruittella Morango 40G,2.29,2.29
3670,Goma Dori Gomets Morango 32G,0.89,0.89
3671,Bala Tic Tac Laranja Embalagem 16G,2.99,2.99
3672,Pirulito Push Pop Duo 15G,4.98,4.98
3673,Bala Tic Tac Frutas Como Te Gusta Embalagem 16G,2.99,2.99
3674,"Goma de Mascar Mentos Freshmint 3 Camadas 8,5G",1.99,1.99
3675,Goma de Mascar Freegells Original Mint Embalagem 8G,1.29,1.29
3676,Bala Halls Cereja Pacote 37G,1.59,1.59
3677,Bala Fruittella Swirl Vita C Morango e Creme de Leite 41G,2.29,2.29
3678,Torre Push Pop Tradicional Sortidas 15G Unitario,4.98,4.98
3679,"Goma de Mascar Trident Melancia Embalagem 10,2G",2.49,2.49
3680,Ovo Pastilhas Minions 30G,8.98,8.98
3681,"Goma de Mascar Trident Hortelã Embalagem 9,6G Leve 6 Un Pague 5 Un",2.49,2.49
3682,Bala Halls Extra Forte Embalagem 34G,1.59,1.59
3683,Bala Erlan Mastigável Sortida Pacote 700G,7.98,7.98
3684,Goma de Mascar Trident Menta Embalagem 21Un,2.49,2.49
3685,Bala Gelatina Tubes Cítrico Tutti Frutti Muppets Fini Pacote 80G,6.98,6.98
3686,Bala Halls Melancia Pacote 37G,1.59,1.59
3687,Bala de Gengibre e Mel Santa Bárbara 37G,5.99,5.99
3688,"Bala Tic Tac Menta Embalagem 8,7G",2.99,2.99
3689,Tic Tac Árvore Mista T84x6 1344Grs,2.99,2.99
3690,"Trident Menta/Hortela Lv6 Pg5 10,2G",2.49,2.49
3691,Goma de Mascar Trident Melancia 8G,2.49,2.49
3692,Bala Tic Tac Incrível Dupla Morango Embalagem 16G,2.99,2.99
3693,Bala Dura Sabor Eucalipto Icekiss 500G,8.98,8.98
3694,Bala Halls Menta Lyptus Embalagem 1 Un,1.59,1.59
3695,Bala Halls Morango Embalagem 37G,1.59,1.59
3696,Bombom Especialidades Nestlé Caixa 251G,10.98,10.98
3697,Caixa de Bombom Favoritos Lacta 250G,13.98,13.98
3698,Chocolate Bis Laka 126G,7.49,7.49
3699,Bombom Garotices Sortidos Garoto 250G,12.29,12.29
3700,Chocolate Bis Laka Embalagem 126G,7.49,7.49
3701,Chocolate Ao Leite Hersheys Barra 94G,5.98,5.98
3702,Chocolate Lacta Amaro 40% Cacau Barra 135G,7.98,7.98
3703,Chocolate Lacta Laka Oreo 90G,7.98,7.98
3704,Chocolate Bombom Sonho de Valsa Lacta 1Un,1.49,1.49
3705,Chocolate em Pó Dr. Oetker 70% Cacau 200G,15.98,15.98
3706,Chocolate Barra Neugebauer Meio Amargo 40% Cacau Embalagem 90G,5.98,5.98
3707,Cacau em Pó Viver Bem Embalagem 150G,7.98,7.98
3708,Bombom Sonho Valsa Lacta 20G,1.49,1.49
3709,Cacau em Pó Solúvel 100% Dr.Oetker 150G,18.98,18.98
3710,Barra de Chocolate Preto e Branco Neugebauer 90G,5.98,5.98
3711,Bites Duo Trento 40G,2.79,2.79
3712,Chocolate Amaro Lacta 90G,7.98,7.98
3713,Chocolate em Pó Bretzke Solúvel Caixa 200G,8.98,8.98
3714,Chocolate em Pó Soluvel Dr Oetker 200G,15.98,15.98
3715,Barra B-Ready Wafer Recheado Nutella 22G,4.98,4.98
3716,Chocolate Trento Bites Dark 40G,2.79,2.79
3717,Barra de Chocolate Meio Amargo Garoto 90G,7.98,7.98
3718,Chocolate Neugebauer Cacau Meio Amargo 90G,5.98,5.98
3719,Bombom Sonho de Valsa 20G,1.49,1.49
3720,Chocolate Barra Lacta Amaro Embalagem 135G,7.98,7.98
3721,Chocolate Lacta Diamante Negro 90G,7.98,7.98
3722,Chocolate Bis Oreo 100G,6.98,6.98
3723,Chocolate Prestígio 33G,2.49,2.49
3724,Chocolate Lacta Diamante Negro Laka 90G,5.98,5.98
3725,Chocolate Garoto Meio Amargo 100G,7.98,7.98
3726,Chocolate Trento Bites Torta de Limão 40G,2.79,2.79
3727,Chocolate Barra Neugebauer Flocos Embalagem 90G,5.98,5.98
3728,Chocolate Barra Hersheys Ao Leite Embalagem 92G,5.98,5.98
3729,Chocolate Bis Xtra Barra 45G,2.98,2.98
3730,Chocolate Barra Neugebauer Amendoim Embalagem 90G,5.98,5.98
3731,Cacau em Pó Pink Embalagem 500G,28.98,28.98
3732,Barra de Chocolate Hershey's Ao Leite 92G,5.98,5.98
3733,Chocolate Barra Neugebauer Ao Leite Embalagem 90G,5.98,5.98
3734,Trento Bites Branco-Dark,2.79,2.79
3735,Bombom Ouro Branco 20G,1.29,1.29
3736,"Ferrero Rocher 3Un 37,5G",8.59,8.59
3737,Chocolate Trento Mini Embalagem 16G,1.29,1.29
3738,Mini Bites Sabor Mousse de Maracujá Trento 40Gg,2.79,2.79
3739,Chocolate Barra Lacta Laka Oreo Embalagem 90G,7.98,7.98
3740,Kinder Joy 20G,9.98,9.98
3741,"Tortuguita Chococrocante Arcor 15,5G",1.19,1.19
3742,Chocolate Trento Dark Pecci 32G,2.19,2.19
3743,Chocolate Nestlé Prestígio,7.59,7.59
3744,Chocolate Lacta Intense 60% Cacau Mix de Nuts 85G,8.98,8.98
3745,Chocolate Barra Neugebauer Branco com Cookies 90G,5.98,5.98
3746,Chocolate Tri Sabor Napolitano Tortuguita 19G,1.19,1.19
3747,Chocolate Trento Wafer Avelã 32G,2.19,2.19
3748,Chocolate Trento 32G,2.19,2.19
3749,Tablete Cajú e Passas Garoto 90G,7.98,7.98
3750,Chocolate Trento Branco Dark 32G,2.19,2.19
3751,Chocolate Lacta Oreo 90G,7.98,7.98
3752,Chocolate Hersheys Mais Cookies Hersheys 102G,5.49,5.49
3753,Bombom Ferrero Rocher Embalagem 3 Un,8.59,8.59
3754,Wafer Triplo Choco Hersheys 102G,5.49,5.49
3755,Chocolate Branco Trento Massimo com Cookies 30G,2.09,2.09
3756,Chocolate Original Twix 40G,3.29,3.29
3757,Chocolate Bis Xtra Black Lacta 45G,3.29,3.29
3758,Chocolate Crocante Garoto 90G,7.98,7.98
3759,Chocolate Trento Dark 32G,2.19,2.19
3760,Chocolate Tortuguita Branco com Recheio de Chocolate Arcor 18G,1.19,1.19
3761,Chocolate Barra Neugebauer Branco Embalagem 90G,5.98,5.98
3762,Chocolate Nestlé Classic Diplomata 90G,7.98,7.98
3763,Mini Chocolate Trento Dark Embalagem 16G,1.29,1.29
3764,Chocolate com Castanha de Caju Garoto 90G,7.98,7.98
3765,Chocolate Baton Ao Leite 16G,1.59,1.59
3766,Chocolate Lacta Diamante Negro Barra 25G,2.29,2.29
3767,Chocolate em Pó Dona Jura Caixa 200G,15.29,15.29
3768,Chocolate 5Star Lacta 40G,3.29,3.29
3769,Chocolate Garoto Ao Leite 90G,7.98,7.98
3770,Chocolate Trento Massimo Chocolate 30G,2.09,2.09
3771,Tablete Negresco Garoto 90G,7.98,7.98
3772,"Bombom Garoto Serenata de Amor 16,5G",0.98,0.98
3773,Chocolate Garoto Baton Recheada com Morango 16G,1.49,1.49
3774,Bibs Amendoim Embalagem 40G,3.19,3.19
3775,Chocolate Prestígio Branco 33G,2.29,2.29
3776,Chocolate Trento Cheesecake de Morango 32G,2.19,2.19
3777,Chocolate Baton Branco 16G,1.49,1.49
3778,Chocolate Trento Torta de Limão 32G,2.19,2.19
3779,Chocolate Neugebauer Bib's Branco Sticks 32G,1.98,1.98
3780,Chocolate Barra Neugebauer Ao Leite Embalagem 100G,5.98,5.98
3781,Chocolate Chokito 32G,2.49,2.49
3782,Chocolate Twix Triplo Chocolate Embalagem 40G,2.98,2.98
3783,Confeito Disqueti Ovinhos de Chocolate Dori Embalagem 90 G,9.98,9.98
3784,Chocolate Massimo Duo Trento 30G,2.09,2.09
3785,Chocolate Classic Prestígio 98G,7.59,7.59
3786,Chocolate Lacta Amaro 135G,7.98,7.98
3787,Chocolate Bibs Sticks Mousse de Limão 32G,1.98,1.98
3788,Chocolate Trento Massimo Dark 30G,2.09,2.09
3789,Chocolate Baton Garoto Recheado Extramilk 16G,1.49,1.49
3790,Chocolate Tribombom Dadinho Embalagem 30G,2.59,2.59
3791,Chocolate M&M's Ao Leite Pacote 52G,4.29,3.29
3792,Chocolate Trento Massimo Paçoca 30G,2.09,2.09
3793,Chocolate 5Star Barra 40G,3.29,3.29
3794,Confeito de Chocolate Ao Leite M&Ms 45G,4.29,3.29
3795,Trento Wafer Bites Ao Leite 40G,2.79,2.79
3796,Chocolate com Morango Trento 32G,2.19,2.19
3797,Chocolate Lacta Diamante Negro 20G,2.29,2.29
3798,Chocolate em Barra Laka Lacta 20G,2.29,2.29
3799,Chocolate Barra Tortuguita Ao Leite 100G,6.98,6.98
3800,Chocolate Laka Tablete 25G,2.29,2.29
3801,Chocolate Dadinho Roll Embalagem 32G,2.98,2.98
3802,Kinder Ovo Azul 1 Unidade 20G,9.59,9.59
3803,Chocolate Garoto Baton Creme Ao Leite 16G,1.39,1.39
3804,Confeito M&Ms Chocolate Crispy 35G,4.29,3.29
3805,Bombom Garoto Serenata de Amor Unidade 19G,0.98,0.98
3806,Ovo Chocolate Surpresa Patrulha Canina Embalagem 20G,10.98,10.98
3807,Chocolate Trento Bits Paçoca Embalagem 40G,2.79,2.79
3808,Chocolate Lacta Laka Oreo 20G,2.29,2.29
3809,Chocolate Bibs Sticks Ao Leite 32G,1.98,0.99
3810,Barra de Chocolate Lacta Shot 20G,2.59,2.59
3811,Chocolate Barra Ao Leite Aymoré 80G,4.98,4.98
3812,Chocolate Twix Recheio de Caramelo 40G,3.29,3.29
3813,Barra de Chocolate Lacta Ao Leite 20G,2.29,2.29
3814,Chocolate Trento Dark Branco 16G,1.29,1.29
3815,Chocolate Trento Bites Torta de Limão 40G,2.79,2.79
3816,Chocolate Barra Lacta Ao Leite Embalagem 20G,2.29,2.29
3817,Kinder Ovo Rosa 20G,9.59,9.59
3818,Chocolate Peccin Trento Mini Bites Branco Dark 12X40g,2.79,2.79
3819,Bombom Serenata de Amor Garoto Embalagem 20G,0.98,0.98
3820,Chocolate Barra Lacta Laka 20X20g,2.29,2.29
3821,Chocolate Mini M&M's Ao Leite 30G,4.29,4.29
3822,Chocolate Barra Lacta Oreo Embalagem 90G,7.98,7.98
3823,Chocolate Twix Barra 45G,3.29,3.29
3824,Chocolate Barra Neugebauer Branco com Cookies Embalagem 95G,5.98,5.98
3825,Chocolate Barra Lacta Amaro Embalagem 90G,7.98,7.98
3826,Chocolate Laka Embalagem 20G,2.29,2.29
3827,Chocolate com Wafer Torta de Maçã Trento 32G,2.19,2.19
3828,Confeito de Chocolate Ao Leite com Amendoim M&Ms 45G,4.29,3.29
3829,Chocolate Shot Barra 25G,2.59,2.59
3830,Chocolate Barra Branco com Cookies Aymoré 80G,4.98,4.98
3831,Ovo Chocolate Lol Surprise 20G,10.98,10.98
3832,Chocolate Trento Bites Paçoca 40G,2.79,2.79
3833,Chocolate Lacta Ao Leite Tablete 25G,2.29,2.29
3834,Chocolate Diamante Negro Embalagem 20G,2.29,2.29
3835,Chocolate Barra Garoto Meio Amargo Embalagem 100G,7.98,7.98
3836,Bombom Serenata de Amor Unidade,0.98,0.98
3837,Chocolate Barra Meio Amargo 40% Cacau Neugebauer Embalagem 90G,5.98,5.98
3838,Chocolate Sonho de Valsa Lacta 20G,1.49,1.49
3839,Chocolate Hersheys Ao Leite 92G,5.98,5.98
3840,Bombom Garoto Serenata Amor Branco 20G,0.98,0.98
3841,Chocolate Barra Hersheys Ao Leite Embalagem 115G,5.98,5.98
3842,Cacau em Pó Pink 500G,28.98,28.98
3843,Chocolate Lácta Diamante Negro Unidade 20G,2.29,2.29
3844,Chocolate Bis Xtra Embalagem 55G,2.98,2.98
3845,Chocolate Lácta Diamente Negro Embalagem 20G,2.29,2.29
3846,Bombom Serenata de Amor 20G,0.98,0.98
3847,Chocolate Barra Lacta Amaro Embalagem 135G,7.98,7.98
3848,Goiabada Predilecta 300G,3.98,3.98
3849,Goiabada Santa Amália Embalagem 400G,6.29,6.29
3850,Bananada Nutryllack Zero Açúcar 230G,9.98,9.98
3851,Doce de Leite Itambé Tradicional Lata 395G,13.98,13.98
3852,Goiabada Val 300G,3.49,3.49
3853,Goiabada Stella Doro 300G,3.98,3.98
3854,Goiabada Val Embalagem 500G,5.98,5.98
3855,Goiabada Fugini 300G,4.98,4.98
3856,Doce Amendoim Pé de Moleque São Dimas 500G,8.29,8.29
3857,Goiabada a Granel,14.98,14.98
3858,Goiabada Predilecta 500G,6.98,6.98
3859,Doce Noponto Leite com Coco 50G,2.09,2.09
3860,Paçoca Amor Sing's 18G 30Un,12.99,12.99
3861,Goiabada Predilecta Zero Acucar 300G,8.98,8.98
3862,Doce de Amendoim Dadinho 90G,5.98,5.98
3863,Bananinha Cremosa sem Açucar Famoso Embalagem 30G,1.89,1.89
3864,Goiabada Predilecta Prática 300G,3.98,3.98
3865,Moça Fiesta Beijinho Embalagem 385G,13.98,13.98
3866,Doce de Leite Noponto Pastoso com Chocolate Pote 400G,11.98,11.98
3867,Leite Coco Menina Embalagem 200Ml,3.49,3.49
3868,Doce Leite com Chocolate Mu Mu Neugebauer 350G,7.98,7.98
3869,Sobremesa Beijinho Moça 365G,13.98,13.98
3870,Doce de Leite Itambé 395G Tradicional Pastoso Lata,13.98,13.98
3871,Doce de Leite Noponto Pastoso com Ameixa Pote 400G,12.59,12.59
3872,Doce de Leite com Pé de Moleque Famoso Embalagem 150G,5.98,5.98
3873,Bananada Natural Nutrylack sem Açúcar Embalagem 280G,9.98,9.98
3874,Doce de Leite em Pedaços Delícias Famoso Embalagem 150G,5.98,5.98
3875,Doce de Leite Portão de Cambuí Tradicional 200G,11.98,11.98
3876,Doce de Leite com Amendoim Portão de Cambuí 200G,11.98,11.98
3877,Doce de Leite Portão Cambui com Coco Embalagem 200G,11.98,11.98
3878,Doce de Leite No Ponto Pastoso Puro Pacote 400G,11.59,11.59
3879,Doce de Leite Tradicional Itambé Lata 800G,26.98,26.98
3880,Bananada com Uvas Passas Nutryllack 230G,9.98,9.98
3881,Doce de Leite Noponto com Ameixa Barra 400G,11.98,11.98
3882,Doce Pé de Moleque Moído São Dimas 500G,8.29,8.29
3883,Marrom Glace Olé Lata 600G,15.99,15.99
3884,Doce de Leite Tradicional Portão de Cambuí 25G,1.98,1.98
3885,Doce de Leite Itambé com Chocolate Lata 800G,26.98,26.98
3886,Doce de Leite Cambui com Ameixa 200G,11.98,11.98
3887,Bananada com Uvas Passas sem Adição de Açúcar e sem Glúten Nutryllack 280G,9.98,9.98
3888,Doce de Leite com Amendoim Famoso Embalagem 150G,6.29,6.29
3889,Doce de Leite com Coco Cocada Famoso Embalagem 150G,5.98,5.98
3890,Goiabada Santa Amália Embalagem 1Kg,15.98,15.98
3891,Doce de Leite Tradicional Quadrado Noponto 50G,2.09,2.09
3892,Doce Bananinha Cremosa Famoso Embalagem 30G,1.29,1.29
3893,Doce de Leite com Amendoim Delícias Famoso Cajuzinho 150G,5.98,5.98
3894,Doce de Leite com Castanha do Pará Cambui Embalagem 25G,1.98,1.98
3895,Doce de Leite Noponto Tablete Embalagem 400G,11.98,11.98
3896,Doce de Leite Tozzi Alimentos 400G,16.98,16.98
3897,"Doce de Leite Noponto com Coco 1,001Kg",2.09,2.09
3898,Doce de Leite com Coco Delícias Famoso Beijinho 200G,5.98,5.98
3899,Doce Famoso Bananinha Cremosa Zero 30G,1.89,1.89
3900,Goiabada Cascão Diet Famoso Embalagem 30G,2.09,2.09
3901,Bananinha Famoso com Chocolate Amargo 21G,1.98,1.98
3902,Canudos para Recheio Soberano Embalagem 200 G,9.89,9.89
3903,Doce Banacaju Fazendinha 400G,9.98,9.98
3904,Banacaju Doces Fazendinha 400G,9.98,9.98
3905,Goiabada Cascão Famoso Embalagem 30G,1.29,1.29
3906,Pé de Moça Ricco Embalagem 55G,1.59,1.59
3907,Doce Leite com Coco Dalma Barra 380G,10.98,10.98
3908,Paçoquinha Yoki Unidade 22G,0.79,0.79
3909,Rapadura Sítio Sesmaria Embalagem 700G,8.29,8.29
3910,Doce Banagoiaba Fazendinha 400G,9.98,9.98
3911,Doce de Leite Noponto Tradicional 50G,2.09,2.09
3912,Goiabada Anchieta Embalagem 300G,4.98,4.98
3913,Bananinha Cremosa Doce Famoso 30G,1.29,1.29
3914,Doce de Leite Talhado Dalma 450G,11.98,11.98
3915,Doce de Leite Famoso com Ameixa Embalagem 150G,6.29,6.29
3916,Doces Leite Ameixa Famoso Embalagem 140G,6.29,6.29
3917,Pé de Moleque Moído São Dimas 500G,8.29,8.29
3918,Doce de Rapadura São Dimas 500G,8.29,8.29
3919,Bananada Mariola Lisa Fazendinha 450G,9.98,9.98
3920,Bananinha Cremosa Famoso Zero Açúcar Embalagem 350G,11.89,11.89
3921,Bananinha do Osmar 95Gr,3.49,3.49
3922,Goiabada Anchieta Embalagem 400G,4.98,4.98
3923,Goiabada Cascão Famoso Embalagem 400G,10.59,10.59
3924,Doce Leite Famoso Tablete Amei 400G,10.98,10.98
3925,Doce Nutryllack Bananada Natural com Uva Passas Pacote 280G,9.98,9.98
3926,Capa de Canudo para Doce Liz Funil 200G,9.59,9.59
3927,Doce de Bananinha Cremosa Famoso 30G com 24Un,1.29,1.29
3928,Figo em Calda Tozzi Lata 400G,14.98,14.98
3929,Cereja em Calda Cepêra 80G,10.98,10.98
3930,Figo em Calda Olé Lata 400G,24.98,24.98
3931,Leite Condensado Cemil Caixa 395G,7.98,7.98
3932,Leite Condensado Campos do Jordão Caixa 395G,5.98,5.98
3933,Leite Condensado Italac Semidesnatado 395G,5.49,5.49
3934,Leite Condensado Integral Moça 395G,11.29,11.29
3935,Leite Condensado Semidesnatado Piracanjuba 395G,8.59,8.59
3936,Leite Condensado Moça Semidesnatado 340G,6.98,6.98
3937,Leite Condensado Moça Integral Nestlé Lata 395G,11.29,11.29
3938,Creme de Leite Quatá Caixa 200G,4.49,4.49
3939,Leite Condensado Moça Nestlé Caixa 395G,6.49,6.49
3940,Chantilly Fleischmann 200Ml,6.99,6.99
3941,Coco Ralado Menina Úmido e Adoçado Pacote 100G,3.79,3.79
3942,Essência Alimentícia Dr Oetker Baunilha Embalagem 30Ml,9.98,9.98
3943,Chocolate Granulado Dori 150G,4.98,4.98
3944,Leite Condensado Semidesnatado Moça 395G,6.49,6.49
3945,Creme de Leite Cemil Caixa 200G,4.98,4.29
3946,Leite Condensado Camponesa 395G,7.89,7.89
3947,Creme de Leite Camponesa 17% 200G,4.29,4.29
3948,Coco Ralado Menina em Flocos Embalagem 100G,5.98,5.98
3949,Creme de Leite Ibiturama Caixa 200G,4.59,4.59
3950,Leite Condensado Cemil 395G,7.98,7.98
3951,Cobertura de Chocolate para Sorvete Wilson Will Embalagem 300G,8.98,8.98
3952,Mistura Láctea Condensada Moça Nestlé 395G,6.49,6.49
3953,Coco Ralado Menina Úmido e Adoçado Pacote 50G,2.19,2.19
3954,Coco Ralado La Preferida Adoçado Pacote 50G,2.09,2.09
3955,Leite Condensado Itambé Lata 395G,9.98,9.98
3956,Creme de Leite Piracanjuba Restritivo Zero Lactose 200G,4.98,4.98
3957,Coco Ralado Ducoco Úmido Adoçado Pacote 100G,4.59,4.59
3958,Coco Ralado Coco Show Adoçado Embalagem 100G,3.98,3.98
3959,Granulado Dori Colorido 150G,3.79,3.79
3960,Creme de Leite Itambé Caixa 200G,4.98,4.98
3961,Leite de Coco Menina 200Ml,3.98,3.98
3962,Coco Ducoco Floco Úmido e Adoçado Pacote 100G,6.59,6.59
3963,Leite Condensado Itambé,7.98,7.98
3964,Cobertura de Caramelo Kenko 250G,13.98,13.98
3965,Mistura Láctea Condensada de Soro de Leite e Leite Cristina 395Gr,6.29,6.29
3966,Leite Condensado Itambé Light Desnatado 395G,5.98,5.98
3967,Cobertura de Morango Kenko Embalagem 250G,13.98,13.98
3968,Creme Chantilly Cesibon Rich's 200Ml,4.98,4.98
3969,Leite de Coco Anchieta 200Ml,3.79,3.79
3970,Creme de Leite Itambé Nolac Uht Caixa 200G,5.59,5.59
3971,Leite Condensado Italac Zero Lactose Caixa 395G,6.98,6.98
3972,Mistura para Sorvete Yoki Morango Embalagem 150G,7.59,7.59
3973,Cobertura de Morango Cepêra Senninha Embalagem 200G,7.89,7.89
3974,Leite de Coco Ducoco 200Ml,5.98,5.98
3975,Pó para Sorvete Yoki Creme 150G,5.98,5.98
3976,Cobertura para Sorvetes de Caramelo Wilson Embalagem 300G,7.98,7.98
3977,Chocolate Granulado Colorido Dona Jura Embalagem 130G,2.99,2.99
3978,Leite de Coco Amo Embalagem 200Ml,3.99,3.99
3979,Leite de Coco Copra Pet 200Ml,3.98,3.98
3980,Coco Flocado Úmido Adoçado Amo 100G,5.98,5.98
3981,Creme Culinário Uht Richs 1Kg,18.98,18.98
3982,Coco Ralado Anchieta Úmido Adoçado 100G,5.29,5.29
3983,Granulado Macio Rosa Dona Jura 500G,2.99,2.99
3984,Creme Tipo Chantilly para Cobertura e Recheios Sabor Chocolate Plus Pastry Pride 907G,35.98,35.98
3985,Corante Alimenticio Romana 10Ml,6.98,6.98
3986,Choc. Flocos Cacau Foods Choc.Bra 500G,9.59,9.59
3987,Corante Romana Rosa 10Ml,6.59,6.59
3988,Coco Ralado Ducoco Queimado Pacote 100G,4.59,4.59
3989,Essência de Baunilha Romana 30Ml,8.98,8.98
3990,Coco Ralado Amo Úmido e Adoçado Embalagem 100G,4.59,4.59
3991,Big Cereal Crocante Cacau Foods Chocolate Decora 80G,4.98,3.99
3992,Confeito Dona Jura Cereal Mesclado 80G,3.59,3.59
3993,Gelatina Bretzke 24G sem Sabor,4.19,4.19
3994,Gelatina Oetker Morango 20G,1.59,1.59
3995,Gelatina Santa Amália Morango Embalagem 20G,1.49,1.49
3996,Gelatina de Framboesa Oetker 20G,1.59,1.59
3997,Gelatina Oetker Limão 20G,1.59,1.59
3998,Gelatina Oetker Tutti Frutti 20G,1.59,1.59
3999,Gelatina Oetker Maracujá 20G,1.59,1.59
4000,Gelatina em Pó Royal Maracujá Sachê 25G,1.49,1.49
4001,Gelatina Santa Amália Abacaxi Embalagem 20G,1.49,1.49
4002,Gelatina em Pó Dr Oetker Morango Caixa 30G,1.59,1.59
4003,Gelatina Apti Tutti Frutti 35G,1.49,1.49
4004,Pó para Gelatina Diet Morango Dr Oetker Embalagem 12G,4.29,4.29
4005,Gelatina Dr Oetker Abacaxi Caixa 30G,1.59,1.59
4006,Gelatina em Pó Santa Amália Maracujá Caixa 20G,1.49,1.49
4007,Gelatina em Pó Royal Framboesa Sachê 25G,1.49,1.49
4008,Gelatina Dr Oetker Tutti-Frutti Caixa 30G,1.59,1.59
4009,Gelatina em Pó Dr Oetker Tutti-Frutti Caixa 30G,1.59,1.59
4010,Gelatina em Pó Royal Morango 25G,1.49,1.49
4011,Gelatina em Pó Royal Uva Sachê 25G,1.49,1.49
4012,Gelatina Dr Oetker Morango Zero Caixa 12G,4.29,4.29
4013,Pó para Gelatina Dr Oetker Abacaxi Diet Caixa 12G,4.29,4.29
4014,Gelatina em Pó Dr Oetker Uva Caixa 20G,1.59,1.59
4015,Gelatina Santa Amália Uva Embalagem 20G,1.49,1.49
4016,Gelatina Dr Oetker Maracujá Caixa 20G,1.59,1.59
4017,Gelatina Dr Oetker Morango Caixa 30G,1.59,1.59
4018,Flan Dr Oetker Chocolate Embalagem 40G,3.59,3.59
4019,Gelatina Santa Amália Limão Embalagem 20G,1.49,1.49
4020,Gelatina em Pó Dr Oetker Diet Limão Caixa 12G,4.29,4.29
4021,Gelatina Royal Maracujá Sachê 25G,1.49,1.49
4022,Gelatina em Pó Royal Morango Sachê 25G,1.49,1.49
4023,Pó para Maria Mole Dr Oetker Coco Caixa 50G,4.59,4.59
4024,Gelatina Santa Amália Cereja Embalagem 20G,1.49,1.49
4025,Gelatina em Pó Royal Framboesa Sachê 35G,1.49,1.49
4026,Gelatina Dr. Oetker Diet Cereja Embalagem 12G,4.29,4.29
4027,Gelatina em Pó Dr Oetker Diet Framboesa Caixa 12G,4.29,4.29
4028,Gelatina em Pó Royal Cereja Sachê 25G,1.49,1.49
4029,Flan de Coco Dr Oetker Caixa 30G,3.59,3.59
4030,Gelatina Sabor Framboesa Royal 25G,1.49,1.49
4031,Gelatina Dr Oetker Uva Embalagem 25G,1.59,1.59
4032,Gelatina em Pó Dr Oetker Diet Abacaxi Caixa 12G,4.29,4.29
4033,Gelatina Cereja Royal 25G,1.49,1.49
4034,Gelatina Oetker 12G Diet Uva,4.29,4.29
4035,Gelatina em Pó Dr. Oetker Diet Cereja Caixa 12G,4.29,4.29
4036,Gelatina Santa Amália Tutti Frutti Embalagem 20G,1.49,1.49
4037,Gelatina Royal Cereja Sachê 25G,1.49,1.49
4038,Gelatina Santa Amália Maracujá Embalagem 20G,1.49,1.49
4039,Gelatina em Pó Dr Oetker Maracujá Caixa 30G,1.59,1.59
4040,Gelatina Lowçucar Sabor Morango 10G,3.79,3.79
