,Produto,Preço Base,Preço Final
0,Álcool 70% Asseptgel Start Embalagem 500Ml,6.29,6.29
1,Água Sanitária Suprema 5L,12.98,12.98
2,Água Sanitária Super Globo Embalagem 5 Litros,14.98,14.98
3,Álcool Mega 70° 1Lt,9.59,9.59
4,Água Sanitária Start Tuff Embalagem 5L,13.98,13.98
5,Álcool Líquido 70 Araucaria 1L,10.59,10.59
6,"Agua Sanitaria Super Globo Pague 1,8Ltr Leve 2Ltr",6.29,6.29
7,"Álcool Líquido Araucaria Uso Geral 46,2 Embalagem 1L",8.89,8.89
8,Desinfetante Marina Lavanda 2L,5.29,5.29
9,Água Sanitária Marina Embalagem 2L,5.19,5.19
10,Limpador Cif Cremoso Original Oferta Embalagem 500Ml,11.59,11.59
11,Água Sanitária Suprema 2L,5.89,5.89
12,Limpador Veja Perfumes Lavanda Oferta 500Ml,4.99,4.99
13,Desinfetante Vorel Lavanda Start 2L,5.59,5.59
14,Limpador Veja Perfumes Flores do Mediterrâneo 30% Grátis 500Ml,4.98,4.98
15,Álcool Líquido 70º Everest Embalagem 1L,9.98,9.98
16,Pedra Sanitária Sampa Clean 25G,2.49,2.49
17,Álcool Liquido Start 70% 5L,46.98,46.98
18,Desinfetante Batuta Oceano Ação Limpa Pisos Elimina Germes e Bactérias Embalagem 2L,7.98,7.98
19,Limpador Multiuso Cif Cremoso Original Oferta 450Ml,11.59,11.59
20,Água Sanitária Start Tuff 2L,6.29,6.29
21,Limpador Uau Cloro Ativo 2 Unidades de 500Ml Cada + Grátis Multiuso Lavanda 500Ml,17.98,17.98
22,Água Sanitária Ypê 2L,7.98,7.98
23,Kit Limpeza 2 Cloros de 500Ml + 1 Limpador Multiuso 500Ml Super Globo,9.98,9.98
24,Limpa Vidros Azulim Embalagem 500Ml,4.99,4.99
25,Água Sanitária Super Globo Embalagem 2 Litros,6.98,6.98
26,Desengordurante Uau Squeeze 500Ml,7.59,7.59
27,Limpador Cremoso Cif Original 450Ml,11.59,11.59
28,Soda Cáustica Escorpião 1Kg,34.98,34.98
29,Limp Alumínio Mix Embalagem 500Ml,2.98,2.98
30,Limpador Multiuso Uau Rosas Sedução 500Ml,4.59,4.59
31,Saponáceo Cremoso Multiuso Limão Bom Bril Sapólio Radium 250Ml,9.98,9.98
32,Limpador Uau Multiuso Desengordurante Limão Siciliano 500Ml,4.59,4.59
33,Limpador Perfumado Veja Lavanda 1L,9.98,9.98
34,"Limpador Perfumado Perfumes Flores Vermelhas e Sedução Uau Inglesa Leve 2L Pague 1,6L)",11.98,11.98
35,Limpador Agradable Casa e Perfume 1L,8.98,8.98
36,Lustra Móveis Poliflor Lavanda 200Ml,12.98,12.98
37,Detergente em Pó Casa e Roupa Urca 800G,4.98,4.98
38,Cloro Gel Vim Lavanda 700Ml,13.98,13.98
39,Limpador Uau Perfumes Flores Vermelhas Embalagem 1 Litro,6.98,6.98
40,Limpador Uau Multiuso Lavanda 500Ml,4.59,4.59
41,Limpador Multiuso Ação Clareadora Uau 500Ml,4.59,4.59
42,Cera Líquida Poliflor Pratic Incolor Oferta 750Ml,12.98,12.98
43,Bry Lustra Móveis de Lavanda Ingleza 200Ml,7.59,7.59
44,Limpador Multiuso Uau Cloro Ativo 500Ml,8.79,8.79
45,Limpador Multiuso Frescor do Campo Azulim 500Ml,3.29,3.29
46,Limpador Diluível Ajax Fresh Limão 500Ml,8.98,8.98
47,Limpador Uau Perfumes Lavanda e Conforto Embalagem L1p800ml,6.98,6.98
48,Limpador Limpeza Pesada Veja 500Ml,8.98,8.98
49,Multiuso Limpa e Desinfecta Ação Bactericida Azulim 550Ml,3.59,3.59
50,Kit Econômico Azulim Multiuso 4X1,13.98,13.98
51,Kit Limpador Uau Desengordurante Cozinha Limão 500Ml 2Un,12.98,12.98
52,"Álcool Araucaria 92,8 Embalagem 1 Litro",8.89,8.89
53,Desinfetante Vorel Citrus Embalagem 2L,5.59,5.59
54,Limpa Alumínio Polylar Limão 500Ml,3.19,3.19
55,Desinfetante Flores do Campo Suprema 2L,5.98,5.98
56,Limpador Multiuso Azulim Original Azul 500Ml,3.59,3.59
57,Lustra Móveis Lavanda Preço Especial Poliflor 500Ml,17.59,17.59
58,Lustra Móveis Poliflor Lavanda 500Ml,17.59,17.59
59,Sapólio Radium Po com Cloro 300G,6.29,6.29
60,Desengordurante Azulim Limpeza Pesada Limão Embalagem 500Ml,5.98,5.98
61,Limpador Multiuso Cif Gel 475G,13.98,13.98
62,Limpador Multiuso Brisa Suave Azulim 500Ml,3.29,3.29
63,Limpa Pisos Uau Eliminador de Odores Embalagem 750Ml,9.98,9.98
64,Água Sanitária Ypê 1L,4.69,4.69
65,Limpa Forno Uau 450Ml,17.98,17.98
66,Desinfetante Suprema Oceanic Embalagem 2 Litros,5.98,5.98
67,Limpador Uau Multiuso Flores e Folhas 500Ml,4.59,4.59
68,Limpador Multiuso Veja Floral Oferta 500Ml,4.89,4.89
69,Limpador Azulim Lavanda Embalagem 1L,7.98,7.98
70,Desinfetante Original Bruto Lysoform 1L,13.98,13.98
71,Cera Líquida Ingleza Maxx Incolor 750Ml,13.98,13.98
72,Lustra Móvel Poliflor Lavanda 200Ml,12.98,12.98
73,Limpador Amable Casa e Perfume 1L,8.98,8.98
74,Limpador Uau Requinte 500Ml,4.49,4.49
75,Desinfetante Pinho Sol Original 500Ml,6.58,6.58
76,Desinfetante Ypê Bak Lavanda 500Ml,3.98,3.98
77,Desinfetante Lavanda Pinho Sol 500Ml,6.58,6.58
78,Limpa Piso Uau Rosas e Sedução 750Ml,9.98,9.98
79,Limpador Multiuso Veja Campestre Oferta 10% de Desconto 500Ml,4.89,4.89
80,Desengordurante Super Globo Squeeze 500Ml,5.29,5.29
81,Limpador Multiuso Veja Floral 500Ml,4.89,4.89
82,Limpa Pisos Uau Ação Clareadora Embalagem 750Ml,9.98,9.98
83,Limpador Multiuso com Álcool Brilho Instantâneo Uau Frasco 500Ml,4.59,4.59
84,Saponáceo em Pó Multiuso Limão Bom Bril Sapólio Radium 300G,6.29,6.29
85,Cloro Aditivado Vim Original 700 Ml,14.98,14.98
86,Pedra Sanitária Santa Clara Lavanda Unidade 25G,2.39,2.39
87,Pulverizador Tropical Guarany Spray 500Ml,9.98,9.98
88,Água Sanitária Superglobo Embalagem 1L,3.98,3.98
89,Soda Cáustica Indaia Pote 1Kg,22.98,22.98
90,Desinfetante Batuta Floral Embalagem 2L,7.98,7.98
91,Soda Caustica Escorpião Embalagem 500G,19.98,19.98
92,Veja Uso Direto Original 900Ml,14.59,14.59
93,Lustra Móveis Poliflor Lavanda Embalagem 200Ml Grátis 20%,12.98,12.98
94,Limpador Uau Perfumes Cuidado e Carinho 500Ml,4.49,4.49
95,Limpador Uau Lavanda Conforto com 20% de Desconto 2L,11.98,11.98
96,Desinfetante Veja Perfumes da Natureza Floral Embalagem 500Ml,4.98,4.98
97,Desinfetante Pinho Trop 1L,7.29,7.29
98,Limpador Bela Flore Casa e Perfume 500Ml,5.29,5.29
99,Limpador Uau Flores e Sonhos 500Ml,4.49,4.49
100,Limpador Uau Limpa Pisos Madeira 750Ml,9.98,9.98
101,Limpador Uau Brisa Frescor 500Ml,4.49,4.49
102,Polidor para Metais Silvo 200Ml,29.98,29.98
103,Limpador Uau Perfumes Lavanda e Conforto Ingleza Embalagem 500Ml,4.49,4.49
104,Limpador Casa e Perfume Amable 500Ml,5.29,5.29
105,Tira Ferrugem Semorin Embalagem 50Ml,6.49,6.49
106,Pedra Sanitária Marine Oferta Pato,3.49,3.49
107,Limpador Banheiro Cif sem Cloro 500Ml,10.98,10.98
108,Limpador Perfumado Azulim Alegria Embalagem 1L,6.98,6.98
109,Desinfetante de Limão Pinho Bril 500Ml,4.49,4.49
110,Desinfetante Pinho Sol Lavanda Oferta 500Ml,6.58,6.58
111,Desinfetante Start Vorel Eucalipto Embalagem 2L,5.59,5.59
112,Limpador Multiuso Veja Gold Campestre 500Ml,4.89,4.89
113,Limpador Diluível Ajax Fresh Blue 500Ml,9.79,9.79
114,Limpador Removedor de Gordura Cozinha Cif Sch 450Ml Refil,9.98,9.98
115,Limpador Tira Limo com Cloro Cif 500Ml,11.98,11.98
116,Desengordurante Veja Limão Refil 400Ml,10.98,10.98
117,Limpador Perfumado Veja Aroma Sense Romance 500Ml,6.98,6.98
118,Limpador Start Azulim Multiuso Ação Clareadora Embalagem 500Ml,3.59,3.59
119,Desinfetante Pinho Sol Lavanda 1000Ml,13.98,13.98
120,Limpador Perfumado Ypê Amor de Verão 500Ml,4.29,4.29
121,Limpador Multiuso Floral Uau Embalagem 500Ml,4.59,4.59
122,Cera Auto Brilho Líquida Poliflor Brilho Prático Incolor 750Ml,14.98,14.98
123,Limpador Perfumado Veja Jasmin do Caribe - 1L,8.69,8.69
124,Lustra Móveis Bry Jasmim Embalagem 200Ml,6.29,6.29
125,Limpador Perfumado Azulim Alegria Embalagem 500Ml,4.59,4.59
126,Desinfetante Suprema Pinho Embalagem 2 Litros,5.98,5.98
127,Desinfetante Bak Turquesa Bak Squeeze Ypê 500Ml,3.98,3.98
128,Desinfetante Multisuperficies Antibacteriano Borrifador Ypê 500Ml,12.98,9.98
129,Desinfetante Pinho Bril Campos de Lavanda 1000Ml,7.99,7.99
130,Óleo de Peroba King Jasmim Embalagem 100Ml,8.98,8.98
131,Desinfetante Vorel Pinho Embalagem 2L,5.59,5.59
132,Desinfetante Pinho Bril Silvestre Oferta 500Ml,4.49,4.49
133,Limpador Banheiro Cif sem Cloro Refil 450Ml,12.98,12.98
134,Limpador para Cozinha Desengordura sem Esforço Limão Veja 500Ml,10.98,10.98
135,Limpa Alumínio Marina Verde Embalagem 500Ml,2.98,2.98
136,Limpador Mr. Músculo Banheiro Sachet Menor Preço 400Ml,11.79,11.79
137,Desinfetante Pinho Bril Citrus Embalagem Leve 500Ml Pague 400Ml,4.49,4.49
138,Limpador Perfumado Azulim Carinho Embalagem 1L,6.98,6.98
139,Limpador Perfumado Uau Flores e Sonhos 500Ml,4.49,4.49
140,Desinfetante Suave Odor Lysoform Bruto Bombril 1L,13.98,13.98
141,Veja Limpeza Pesada 2X1 500Ml Cloro Ativo,5.98,2.99
142,Limpador Multiuso Cereja Tropical Explosão de Perfume Veja 500Ml,4.89,4.89
143,Desinfetante Pinho Sol Limão 1L,13.98,13.98
144,Tira Ferrugem Azulim 50Ml,8.59,8.59
145,Limpador Perfumado Veja Aroma Sense Alegria 500Ml,6.98,6.98
146,Desinfetante Batuta Eucalipto Embalagem 2L,7.98,7.98
147,Sapólio Radium em Pó com Cloro Embalagem 300G,6.29,6.29
148,Limpador Multiuso Uau Flores e Frescor Ingleza 500Ml,4.59,4.59
149,Limpador Perfumado Veja Flores do Mediterrâneo Oferta 1L,8.98,8.98
150,Limpador Multiuso Azulim Citronela 500Ml,3.59,3.59
151,Multiuso Cuidado e Perfume Raio de Sol Azulim 500Ml,3.49,3.49
152,Limpador Gel Azulim Start Lavanda 500G,7.59,7.59
153,Desinfetante Pinho Sol Original Oferta 1000Ml,12.98,12.98
154,Pedra Sanitária Eucalipto Azulim 25G,2.59,2.59
155,Desinfetante Pinho Trop Pinho e Menta 500Ml,3.89,3.89
156,Limpador Concentrado Alternativa Ao Cloro Floral Ajax 1000Ml,14.98,14.98
157,Limpador Uau Desengordurante 500Ml,11.59,11.59
158,Pedra Sanitária Bosque de Pinho Oferta Glade 25G,4.59,4.59
159,Limpador Limpeza Pesada 4 em 1 Alta Performance Uau 500Ml,6.59,6.59
160,Cera Líquida Ingleza Maxx Amarela Embalagem 750Ml,13.98,13.98
161,Limpador Uau Harmonia 500Ml,4.49,4.49
162,Pedra Sanitária Harpic Pinho Campestre 25G,2.99,2.99
163,Desinfetante Pinho Flores de Limão Leve 500Ml Pague 450Ml,4.49,4.49
164,Cera em Pasta Ingleza Lavanda Incolor Lata 400G,34.98,34.98
165,Cera Líquida Ingleza Maxx Vermelha 750Ml,13.98,13.98
166,Desinfetante Pinho Sol Leve 500Ml Pague 450Ml,6.58,6.58
167,Limpa Forno Easy Off 250Ml,19.98,19.98
168,Limpador Uau Limpeza Pesada Alta Performance Embalagem 500Ml,6.48,6.48
169,Cera Líquida Brilhowax Vermelha 750Ml,9.98,9.98
170,Desinfetante Pinho Bril Silvestre Plus 500Ml,4.49,4.49
171,Cera Líquida Brilho Fácil Ardósia Embalagem 750Ml,12.98,12.98
172,Limpador Uau Multiuso Folhas Verdes Embalagem 500Ml,4.59,4.59
173,Pedra Sanitária Bouquet de Lavanda Glade 25G,4.59,4.59
174,Sapólio Radium Pedra Clássico 200G,3.98,3.98
175,Cera Líquida Brilhowax Incolor 750Ml,10.98,10.98
176,Limpa Forno Easy Off Embalagem 226Ml,19.98,19.98
177,Desinfetante Trop Pinho Lavanda Inglesa 500Ml,3.89,3.89
178,Limpador Uau Perfumes Brisa e Frescor Ingleza Frasco 1L 20% de Desconto,6.98,6.98
179,Cera em Pasta Ingleza Lavanda Vermelha Lata 400G,33.98,33.98
180,Limpador Uau Limpa Vidros Embalagem 500Ml,7.89,7.89
181,Desinfetante Creolina Pearson Embalagem 100Ml,16.98,16.98
182,Limpador Veja com Álcool Limpeza Pesada Original 500Ml,8.98,8.98
183,Desinfetante Perfumado Wave Azulim 1L,6.39,6.39
184,Desinfetante Pinho Sol Limão 500Ml,6.58,6.58
185,Desinfetante Pinho Sol Lavanda Embalagem 500Ml,6.58,6.58
186,Limpador Perfumado Veja Lavanda 500Ml,4.99,4.99
187,Desinfetante Pinho Bril Plus Original Leve 500Ml Pague 450Ml,4.49,4.49
188,Desinfetante Pinho Sol Lavanda Oferta 1000Ml,13.98,13.98
189,Limpador Concentrado Uau Eucalipto 130Ml,12.29,12.29
190,Limpador Perfumado Azulim Carinho 500Ml,4.59,4.59
191,Desinfetante de Eucalipto Kalipto 750Ml,6.98,6.98
192,Desengordurante Marina 500Ml,4.39,4.39
193,Limpador Perfumado Tulipa da Holanda Veja 1L,8.98,8.98
194,Graxa para Sapato em Pasta Preta Nugget Lata 36G,12.98,12.98
195,Água Sanitária Start Tuff 1L,3.59,3.59
196,Cera Líquida Nugget Calçado Marrom Unidade 60Ml,14.98,14.98
197,Limpeza Pesada Uau Rosas e Sedução 500Ml,6.29,6.29
198,Desinfetante Leitoso Kalipto Herbal Embalagem 750Ml,6.98,6.98
199,"Desinfetante Pinho Sol Original 1,75 Litro",14.98,14.98
200,Limpador para Limpeza Pesada Original Veja 1L,18.59,18.59
201,Óleo de Peroba Lavanda 100Ml,8.98,8.98
202,Cera Líquida Ingleza Ardosia Incolor Embalagem 850Ml,11.98,11.98
203,Pedra Sanitária Bosque de Pinho Glade 25G,4.59,4.59
204,Desinfetante Pinho Ypê Tradição 500Ml,5.79,5.79
205,Cera Líquida Ingleza Max Ardosia Verde Embalagem 750Ml,13.98,13.98
206,Desinfetante Lenço Brisa da Manhã Lysol 36Un,3.98,3.98
207,Desinfetante Líquido Pureza do Algodão Lysol 500Ml,6.99,6.99
208,Super Desengordurante Veja Power Gel Laranja 500Ml,6.99,3.99
209,Lenco Umed Lysol Desinf Pod/Citric 36Un,3.98,3.98
210,Desinfetante Uso Geral Ufe 750Ml,14.98,14.98
211,Desinfetante Pinho Trop Fresh 500Ml,3.89,3.89
212,Remediador Biológico Biol 2000 Sachê,19.98,19.98
213,Limpa Forno Microondas Azulim 500Ml,7.98,7.98
214,Limpador Ajax Fresh Lemon Limpeza Pesada 500Ml,8.98,8.98
215,Limpa Alumínio Polylar Verde Maçã 500Ml,2.98,2.98
216,Limpador Veja Limpeza Pesada Original Embalagem 500Ml,8.98,8.98
217,Desinfetante Start Azulim Lavics Embalagem 1L,6.39,6.39
218,Desinfetante Pinho Sol Original Embalagem 500Ml,6.58,6.58
219,Desinfetante Marina Erva Doce Embalagem 2 Litros,5.29,5.29
220,Limpador Perfumado Azulim Perfumes da Casa Paixão Embalagem 1L,6.98,6.98
221,Limpadores Veja Limpeza Pesada Original Leve 500Ml Pague 400Ml Embalagem 500Ml,8.98,8.98
222,Limpador Uau Cloro Ativo Refil 500Ml,14.98,14.98
223,Limpador Uau Banheiro 7Em1 Gatilho sem Cloro 500Ml,18.98,18.98
224,Cera Ingleza Ardosia Incolor Embalagem 750Ml,11.98,11.98
225,Desinfetante Pinho Trop Limão Embalagem 500Ml,3.89,3.89
226,Desinfetante Pearson Creolina Embalagem 50Ml,10.98,10.98
227,Limpa Parabrisa Kharis Embalagem 500Ml,9.59,9.59
228,Limpa Brilha Alum Brilhex Tradicional 500Ml,2.98,2.98
229,Desinfetante Veja Sensações Lavanda Bem Estar Embalagem 500Ml,4.99,4.99
230,Limpador Limpeza Pesada Original Veja 500Ml,8.98,8.98
231,Soda Cáustica Escorpião Pote 500G,19.98,19.98
232,Pedra Sanitária Santa Clara Floral Unidade 25G,2.39,2.39
233,Desinfetante Marina Erva Doce 2L,5.29,5.29
234,Pedra Sanitária de Eucalipto Marina 25G,2.29,2.29
235,"Álcool Everest 92,8º Embalagem 1 Litro",12.29,12.29
236,Limpa Cerâmica Marina 1L,5.39,5.39
237,Limpador Gel Brilhex Citronela 1Kg,8.98,8.98
238,Limpador Acido Muriatico Clarix 1L,7.29,7.29
239,Limpador Perfumado Casa e Perfume Amable Embalagem 500Ml,5.29,5.29
240,Limpador Perfumado Uau Brisa Frescor 500Ml,4.49,4.49
241,Limpador Multiuso Campestre Veja 500Ml,4.89,4.89
242,Pedra Sanitária Eucalipto Santa Clara Embalagem 25G,2.39,2.39
243,Ácido Muriático Mais Embalagem 1 Litro,6.98,6.98
244,Limpador Acido Muriatico Mais 1L,6.98,6.98
245,Limpador Perfumado Casa e Perfume Bela Fiore 500Ml,5.29,5.29
246,Limpa Vidros Ingleza Squeeze Uau 500Ml,7.89,7.89
247,Limpador Perfumado Uau Natureza Harmonia 500Ml,4.49,4.49
248,Limpador Uau Limpeza Pesada 500Ml,6.48,6.48
249,Cera Ingleza Vermelhão Embalagem 400G,33.98,33.98
250,Limpador Casa e Perfume Bela Flore Embalagem 500Ml,5.29,5.29
251,Limpador Multiuso Uau Flores e Frescor 500Ml,4.59,4.59
252,Pedra Sanitária Marina Floral Embalagem 25G,2.29,2.29
253,Pedra Sanitária Marina Lavanda Embalagem 25G,2.29,2.29
254,Desinfetante Marina Citronela 2 Litros,7.19,7.19
255,Desinfetante Marina Citronela 1 Litro,4.49,4.49
256,Álcool Uzu Clean 46º 1L,9.59,9.59
257,Pedra Sanitária Bouquet Lavanda Embalagem com 25% de Desconto Glade 25G,4.59,4.59
258,Evita Mofo Inspira Lavanda Pote 230G,11.99,11.99
259,Desodorizador e Aromatizante Glade Lavanda Aerosol 360Ml + Grátis 20%,13.98,13.98
260,Eliminador de Odores Multiuso Hortelã Uau 500Ml,4.59,4.59
261,Evita Mofo Inspira Sonho de Infância Embalagem 230G,11.99,11.99
262,Antimofo Limppano Inspira Lavanda Embalagem 100G,9.98,9.98
263,Evita Mofo Leve Brisa Pastilha 1 Unidades,3.98,3.98
264,Detergente Sanitário em Pedra Bosque de Pinho Harpic 25G,2.99,2.99
265,Aromatizador Air Wick Doces Dias de Lavanda Aparelho Elétrico + Refil 16Ml,14.98,14.98
266,Essência de Lavanda Marina 140Ml,6.98,6.98
267,Pedra Sanitária Leve Brisa Embalagem 25G,2.29,2.29
268,Desodorizador e Aromatizante de Lavanda Glade 360Ml,13.98,13.98
269,Pastilha Adesiva Sanitária Pinho Harpic Leve 5 Pague 4 Un,2.99,2.99
270,Purificador Toque de Frescor Lavanda Oferta Glade 24Ml,18.98,18.98
271,Pastilha Adesiva 2Em1 Acqua Marine Limpa e Perfuma Harpic 3Un,11.98,11.98
272,Odorizador Lembranças de Infância Oferta Glade 360Ml,13.98,13.98
273,Desodorizador Aerossol Lavanda Oferta Especial Glade 360Ml,13.98,13.98
274,Evita Mofo Limppano Inspira Embalagem 230G,11.59,11.59
275,Desodorizador Aerossol Frutas e Flores Vibrantes Glade 360Ml,13.98,13.98
276,Bom Ar Air Wick Campos de Lavanda 360Ml,14.59,14.59
277,Pedra Sanitária Sany Glade Pinho Embalagem 25G,4.59,4.59
278,Desodorizador e Aromatizante Glade Lembranças de Infância 360Ml,13.98,13.98
279,Desodorizador Glade Toque de Frescor Lavanda Embalagem Refil 12Ml 20% Grátis,12.98,12.98
280,Purificador de Ar Brisa Cítrica de Verão Glade 360Ml,14.59,14.59
281,Gel Adesivo Marina Lavanda 12G,4.98,4.98
282,Essência Marina Pinho 140Ml,5.98,5.98
283,Aromatizante Kharis Eucalipto 60Ml,12.98,12.98
284,Purificador Glade Aerosol Lavanda 360Ml,13.98,13.98
285,Essência Concentrada de Lavanda Marina 140Ml,6.98,6.98
286,Essencia Baunilha Romana Arcolor 30Ml,8.98,8.98
287,Pastilha Adesiva Azulim Lavanda Lv4 Pg3,6.98,6.98
288,Detergente Ypê Clear 500Ml,2.69,2.69
289,Detergente Ypê Neutro 500Ml,2.69,2.69
290,Detergente Coco Ypê 500Ml,2.69,2.69
291,Detergente Limpol Coco 500Ml,2.79,2.79
292,Detergente Ypê Limão 500Ml,2.69,2.69
293,Detergente Líquido Limpol Cristal Embalagem 500Ml,2.79,2.79
294,Detergente Liq.Limpol 500Ml Lavanda,2.79,2.79
295,Detergente Líquido Neutro Limpol 500Ml,2.79,2.79
296,Detergente Azulim Coco 500Ml,2.39,2.39
297,Detergente Líquido Suprema Coco Embalagem 500Ml,2.09,2.09
298,Detergente Limpol Maçã 500Ml,2.79,2.79
299,Detergente Limpol Limão 500Ml,2.79,2.79
300,Detergente Líquido Suprema Natural Clear Embalagem 500Ml,2.09,2.09
301,Detergente Líquido Azulim Neutro 500Ml,2.39,2.39
302,Detergente Líquido Azulim Citrus 500Ml,2.39,2.39
303,Detergente Líquido Maçã Ypê 500Ml,2.69,2.69
304,Detergente Líquido Suprema Neutro Embalagem 500Ml,2.09,2.09
305,Detergente Líquido Azulim Clear 500Ml,2.39,2.39
306,Detergente Líquido Spa Soft Neutro Embalagem 1 Litro,4.98,4.98
307,Detergente Líquido Limpol Jabuticaba 500Ml,2.79,2.79
308,Detergente Líquido Suprema Limão Embalagem 500Ml,2.09,2.09
309,Detergente Líquido Suprema Frutas Vermelhas Embalagem 500Ml,2.09,2.09
310,Limpa Alumínio em Pasta Alumil Start 500G,10.59,10.59
311,Pasta Multiuso Cristal Rosa 500G,5.98,5.98
312,Sabão em Pasta Dipol 500G,7.89,7.89
313,Detergente Liquido Maçã Smart 500Ml,2.39,2.39
314,Detergente Líquido Spa Soft Clear Embalagem 1 Litro,4.98,4.98
315,Detergente Líquido Start Spa Limão Embalagem 1 Litro,4.98,4.98
316,Detergente Líquido Start Spa Maçã Embalagem 1 Litro,4.98,4.98
317,Naftalina Dia a Dia Embalagem 24G,1.99,1.99
318,Repelente Elétrico Raid Líquido Oferta Refil 2Un,23.98,23.98
319,Inseticida Aerosol Ação Total Óleo de Eucalipto Baygon 360Ml,12.98,12.98
320,Inseticida Aerosol Ação Total Baygon 360Ml,12.98,12.98
321,"Inseticida Raid 30 Noites Elétrico Refil 21,9Ml",12.98,12.98
322,Inseticida Detefon Espiral 10Un,4.59,4.59
323,Inseticida Mata Baratas Baygon 360Ml,12.98,12.98
324,"Repelente Elétrico Raid Líquido Refil 32,9Ml",15.99,15.99
325,"Repelente Elétrico Liquido 45 Noites Refil Original Raid 32,9M",17.98,17.98
326,K-Othrine Sc 25 Bayer 30Ml,11.98,11.98
327,Inseticida Raid Protector Pastilha Elétrica Refil 12 Un,5.98,5.98
328,Inseticida Boa Noite Original Espiral 96G,4.49,4.49
329,Repelente Elétrico Raid Pastilha Oferta Refil 12Un,5.98,5.98
330,Sbp Repelente Elétrico Líquido 45 Noites 50% Grátis 2ª Unidade 35Ml,21.98,21.98
331,"Repelente Raid Elétrico Óleo de Eucalipto Líquido Refil 32,9Ml",15.99,15.99
332,Inseticida Aerossol Mata Baratas e Formigas Raid 285Ml,12.98,12.98
333,Refil Pastilha Eletrica Raid com 12Un,4.49,4.49
334,Aparelho Inseticida Raid Elétrico Pastilha 12 Horas + 4 Pastilhas Refil,24.99,24.99
335,Inseticida Líquido Baygon Ação Total Embalagem Leve 500Ml Pague 450Ml,12.98,12.98
336,Inseticida Líquido Detefon Ação Total 500Ml,18.98,18.98
337,Inseticida Vorel Aerosol 400Ml,14.98,14.98
338,Inseticida Detefon Ação Total Aerosol 300Ml,15.98,15.98
339,Raid Protector Refil 12 Un Pastilhas,5.98,5.98
340,Protector Refil Raid Pastilhas com 12Un,5.98,5.98
341,Inseticida Raid 12 Horas Refil Leve 12 Un Pague 10 Un,5.98,5.98
342,Inseticida Baygon Ação Total Embalagem Leve 450Ml Pague 300Ml,12.98,12.98
343,Raid Protector Refil 12 Pastilhas,5.98,5.98
344,Inseticida e Repelente Detefon Embalagem 500Ml,18.98,18.98
345,Inseticida Detefon Ação Total 300Ml,15.98,15.98
346,Inseticida Raid Pastilha Eucalipto 12Un,5.98,5.98
347,Sabão Omo 800G,14.49,14.49
348,"Lava Roupas Limpeza Total Brilhante 1,6Kg",17.99,17.99
349,"Amaciante Ypê Intenso Leve 2L Pague 1,8L",10.98,10.98
350,Amaciante Downy Brisa do Verão 500Ml,10.98,10.98
351,Lava Roupas em Pó Cuidado Total Brilhante Sachê 1.6Kg,19.99,19.99
352,"Amaciante Ypê Intenso Leve 2L Pague 1,6L",10.98,10.98
353,"Lava Roupas Sabão em Pó Limpeza Total Brilhante 2,4Kg",26.98,26.98
354,"Amaciante Ypê Aconchego Leve 5L Pague 4,5L",19.98,19.98
355,"Sabão em Pó Urca Casa & Roupa Pacote 1,6Kg",8.98,8.98
356,"Lava-Roupas Pó Omo Lavagem Perfeita Pacote 2,4Kg Tamanho Família",29.99,29.99
357,Amaciante Comfort Original Concentrado Oferta Embalagem 500Ml,10.98,10.98
358,"Amaciante Azul Aconchego Ypê Leve 2L Pague 1,6L",10.98,10.98
359,"Lava-Roupas Pó Omo Lavagem Perfeita Caixa 1,6Kg",23.98,23.98
360,"Lava-Roupas em Pó Concentrado Maciez Tixan Ypê Caixa Leve 1,6Kg Pague 1,52Kg",21.98,21.98
361,Sabão em Pó Baby Soft Embalagem 1Kg,9.98,9.98
362,Cloro Marina 5L,16.29,16.29
363,Lava Roupas em Pó para Roupas Brancas e Coloridas Limpeza Total Brilhante Sachê 800G,11.98,11.98
364,"Lava Roupas em Pó Concentrado Primavera Tixan Ypê Leve 1,6Kg Pague 1,52Kg",21.98,21.98
365,Lava Roupas em Pó Tixan Ypê Primavera 800G,11.98,11.98
366,"Lava Roupas em Pó para Roupas Brancas e Coloridas Limpeza Total Brilhante 1,6Kg Grátis 150G",19.98,19.98
367,Amaciante Concentrado Cuidado Essencial Comfort Refil 900Ml,18.59,18.59
368,"Amaciante Tradicional Puro Cuidado Comfort 1,8L",18.98,18.98
369,"Lava Roupa em Pó Brancas e Coloridas +150G Grátis Brilhante 1,6Kg",17.98,17.98
370,Tira Manchas em Pó Roupas Brancas Oxi Action Crystal White Vanish 120G,6.98,6.98
371,Amaciante Comfort Tradicional Explosão Azul 1.8L,18.98,18.98
372,"Lava-Roupas Pó Concentrado Maciez Tixan Ypê 1,6Kg",21.98,21.98
373,Amaciante Downy Lirios do Campo 500Ml,10.98,10.98
374,Sabão em Pó Urca Maxx 3Kg,19.98,19.98
375,"Lava-Roupas em Pó Concentrado Primavera Tixan Ypê 1,6Kg",21.98,21.98
376,Amaciante para Roupinhas de Bebê Vida Macia Camomila Embalagem 1L,10.98,10.98
377,Lava Roupas Líquido Azul Suprema 1L,7.98,7.98
378,"Tira Manchas Suprema Ultra Remoção Embalagem 1,5L",9.98,9.98
379,Cloro Santa Clara Super Forte Embalagem 1 Litro,4.59,4.59
380,"Tira Manchas Suprema Ultra Branqueador Embalagem 1,5L",9.59,9.59
381,Tira Manchas Gel Vanish Roupas Brancas 500Ml,11.98,11.98
382,Lava-Roupas Líquido Omo Puro Cuidado Galão 3L,43.98,43.98
383,Amaciante Baby Soft Toque de Carinho 5L,20.98,20.98
384,Lava Roupas Líquido Vida Macia Bebê Embalagem 500Ml,10.98,10.98
385,"Amaciante para Roupas Baby Soft Carinho 1,8L",7.98,7.98
386,Tira Manchas Gel Vanish Roupas Coloridas 500Ml,11.98,11.98
387,Amaciante para Roupinhas de Bebê Vida Macia Amêndoas Embalagem 1Lt,10.98,10.98
388,Tira Manchas Gel Multiuso Vanish 500Ml,11.98,11.98
389,Cloro Santa Clara Super Forte Unidade 2L,8.59,8.59
390,"Lava Roupas em Pó Limpeza Total para Roupas Brancas e Coloridas Brilhante Sachê 1,6Kg",21.99,21.99
391,Amaciante Suprema Toque de Amor Embalagem 5L,16.98,16.98
392,Sabão Líquido Suprema Coco Embalagem 3 Litros,21.98,21.98
393,Amaciante para Roupinhas de Bebê Vida Macia Camomila 500Ml,5.49,5.49
394,Amaciante Alegres Encantos Suprema 5L,16.59,16.59
395,Amac Mon Bijou 2L Azul,11.98,11.98
396,Amaciante Mon Bijou Baby 2L,11.98,11.98
397,Sabão em Barra Glicerinado Barra com 5 Unidades Pacote 1Kg,10.98,10.98
398,Tira Manchas Vanish Roupas Brancas 450G,28.98,28.98
399,Tira-Manchas em Pó Vanish Oxi Action Sachê 120G,5.98,5.98
400,Tira Manchas Pó Vanish Roupas Coloridas Refil 400G,19.98,19.98
401,"Sabão Líquido Puro Cuidado Omo Leve 3 Litros Pague 2,5 Litros",43.98,43.98
402,Amaciante Concentrado Downy Frescor da Primavera Embalagem 500Ml,10.98,10.98
403,Sabão em Barra Ufe Coco 5 Un Embalagem 1Kg,24.98,24.98
404,Tira Mancha Oxi Action Crystal White Multi Power Vanish 30G,1.79,1.79
405,Tira Manchas Vanish Pré-Lavagem Resolv Tradicional 450Ml,16.98,16.98
406,Amaciante Toque de Carinho Baby Soft 2L,8.98,8.98
407,Sabão Líquido Uau Active Embalagem 3L,25.98,25.98
408,Detergente em Pó Limão e Bicarbonato Surf 800G,10.59,10.59
409,"Lava Roupas em Pó 5 em 1 Cuidado do Coco Surf 2,4Kg",22.98,22.98
410,Tira Manchas Vanish Super Barra 75G,7.98,7.98
411,Amaciante Tradicional Ypê Aconchego 5L,25.99,25.99
412,Tira Manchas Gel Vanish Crystal White sem Cloro Refil 500Ml,11.98,11.98
413,Amaciante Baby Soft Toque Envolvente 2L,8.98,8.98
414,Detergente em Pó Rosas e Flor de Lis Surf 800G,10.59,10.59
415,Lava-Roupas Pó Omo Lavagem Perfeita Sanitiza & Higieniza Caixa 800G,13.98,13.98
416,Sabão em Pó Multicores Tuff 500G,5.98,5.98
417,Sabão Líquido Suprema Ultra Ação Embalagem 1L,8.98,8.98
418,Tira Manchas Vanish Super Barra Roupas Brancas 75G,7.98,7.98
419,Tira Manchas Vantage sem Cloro Refil 500Ml,8.98,8.98
420,Lava-Roupas em Pó Roupas Brancas e Coloridas Delicadeza Total Brilhante 800G,11.98,11.98
421,Lava-Roupas em Pó Concentrado Maciez Tixan Ypê 400G,7.78,7.78
422,Lava-Roupas em Pó Concentrado Primavera Tixan Ypê 400G,7.78,7.78
423,Amaciante Baby Soft Toque de Cuidado 2L,8.98,8.98
424,Amaciante Baby Soft Infinity Care 3 Litros,16.98,16.98
425,Sabão Líquido Uau Rosas e Sedução 3 Litros,26.98,26.98
