,Produto,Preço Base,Preço Final
1781,Biscoito Aymoré Salpet Tradicional 200G,2.79,2.79
1782,Biscoito Club Social Regular Original Multipack 144G,3.98,3.98
1783,Biscoito Marilan Cream Cracker Manteiga 350G,6.49,6.49
1784,Biscoito Marilan Cream Cracker 350G,6.49,6.49
1785,Biscoito Aymoré Cream Cracker 200G,2.59,2.59
1786,Biscoito Aymoré Salpet Tradicional 100G,1.59,1.59
1787,Biscoito Aymoré Água e Sal 375G,5.49,5.49
1788,Biscoito Salgado Levíssimo Água e Sal Bauducco 200G,2.89,2.89
1789,Biscoito Cream Cracker Marilan 200G,2.99,2.99
1790,Biscoito Club Social Presunto Embalagem 141G,3.98,3.98
1791,Biscoito Aymoré Água e Sal 200G,2.59,2.59
1792,Biscoito de Polvilho Vale do Prata Papa-Ovo Embalagem 90G,3.59,3.59
1793,Biscoito Água Sal Vilma Embalagem 200G,1.99,1.99
1794,Biscoito Salgado Salkim Tradicional Pacote 90G,1.19,1.19
1795,Biscoito Salgado Bauducco Levissimo Cracker Pacote 200G,2.89,2.89
1796,Biscoito Aymoré Cream Cracker 375G,5.49,5.49
1797,"Biscoito Salgado Petisco Deliciosos 1,8Kg",12.99,12.99
1798,Biscoito Original Pit Stop 162G,3.99,3.99
1799,Biscoito Aymoré Água 200G,3.79,3.79
1800,Biscoito Salgado Vilma Cream Cracker Embalagem 200G,1.99,1.99
1801,Biscoito de Polvilho Vale do Prata Tradicional 90G,2.99,2.99
1802,Biscoito Pit Stop Recheado Salsa e Cebola 105G,3.89,3.89
1803,Biscoito Salgado Salkim Bacon Embalagem 90G,1.19,1.19
1804,Biscoito Pit Stop Pão Na Chapa 162G,3.99,3.99
1805,Biscoito Pit Stop Recheado Misto Quente 105G,4.29,4.29
1806,Biscoito Pit Stop Pizza 162G,3.99,3.99
1807,Biscoito Integral Pit Stop Recheado Peito de Peru 105G,4.19,4.19
1808,Biscoito Salgado Salkim Sabor Churrasco Pacote 90G,1.19,1.19
1809,Biscoito Pit Stop Presunto 162G,3.99,3.99
1810,Biscoito Pit Stop Queijo 162G,3.99,3.99
1811,Biscoito de Polvilho Vale do Prata Papa Ovo Embalagem 170G,6.29,6.29
1812,Biscoito Aymoré Cracker Manteiga 200G,3.69,3.69
1813,Biscoito Marilan Cream Cracker Integral 420G,7.99,7.99
1814,Biscoito Salgado Salkim Sabor Pizza Pacote 90G,1.19,1.19
1815,"Biscoito Club Social Queijo Embalagem 23,5G",3.98,3.98
1816,Biscoito Marilan Pit Stop Integral 162G,4.29,4.29
1817,Biscoito Aymoré Cracker Manteiga 375G,6.49,6.49
1818,Biscoito de Polvilho Vale do Prata Queijo Embalagem 200G,6.29,6.29
1819,Biscoito Polvilho Santa Luzia Sabor Queijo 250G,6.49,6.49
1820,Biscoito de Polvilho Garotinho Sabor Queijo Embalagem 100G,3.99,3.99
1821,Biscoito Polvilho Santa Luzia Sabor Parmesão 100G,4.39,4.39
1822,Biscoito Polvilho Santa Luzia 150G,4.99,4.99
1823,Biscoito Quebra Quebra Duda Gomes 320G,7.99,7.99
1824,Biscoito Broinha de Queijo Duda Gomes 320G,7.99,7.99
1825,Salgadinho Fandangos Presunto 37G,2.29,2.29
1826,Salgadinho Cheetos Onda Requeijão Elma Chips 37G,2.39,2.39
1827,Salgadinho de Batata Original Pringles 114G,9.99,9.99
1828,Batata Palha Anchieta 300G,9.99,9.99
1829,Salgadinho Batata Ruffles Sal 37G,3.39,3.39
1830,Pururuca Guigui Pele Suína Original Embalagem 60G,5.49,5.49
1831,Salgadinho Baconzitos 30G,2.49,2.49
1832,Salgadinho Doritos Queijo Nacho 48G,4.49,4.49
1833,Salgadinho Costelinha com Limão Torcida Jr. Pacote 45G,1.99,1.99
1834,Salgadinho Pele Mega Chips 40G - Bacon,2.5,2.5
1835,Batata de Creme e Cebola Pringles 120G,9.99,9.99
1836,Pururuca Pacha Listrada Embalagem 400G,5.99,5.99
1837,Salgadinho Gulão Sabor Churrasco Embalagem 120G,3.5,3.5
1838,Pururuca Pacha Queijo Embalagem 400G,5.99,5.99
1839,Salgadinho de Milho Onda Requeijão Elma Chips Cheetos 140G,9.99,9.99
1840,Batata Palha Super Crock 100G,3.99,3.99
1841,Batata Palha Super Crok 300G,9.99,9.99
1842,Doritos Queijo 84Gr,8.79,8.79
1843,Salgadinho de Milho Onda Requeijão Elma Chips Cheetos 75G,5.49,5.49
1844,Salgadinho de Milho Presunto Elmachips Fandangos 140G,9.99,9.99
1845,Batata Pringles Churrasco 120G,9.99,9.99
1846,Salgadinho Doritos Queijo Nacho 300G,19.99,19.99
1847,Salgadinho de Milho Queijo Nacho Doritos 300G,19.99,19.99
1848,Salgadinho de Milho Fandangos Sabor Presunto 80G,4.99,4.99
1849,Salgadinho de Milho Cebola Elma Chips Cebolitos 110G,9.99,9.99
1850,Cheetos Lua 37G,2.39,2.39
1851,Batata Palha Anchieta Tradicional 100G,3.69,3.69
1852,Salgadinho Cebolitos 31G,2.25,2.25
1853,Batata Frita Lisa Peito de Peru Elma Chips 45G,5.99,5.99
1854,Salgadinho Gulão Cebola e Salsa Embalagem 120G,3.5,3.5
1855,Torresmo Frito de Minas 180G,12.99,12.99
1856,Batata Frita Frango Grelhado Sensações Elma Chips 45G,5.99,5.99
1857,Batata Palha Mega Chips Extra Fina Embalagem 100G,5.49,5.49
1858,Batata Ruffles Original 145G,13.99,13.99
1859,Salgadinho Gulão Requeijão Embalagem 120G,3.5,3.5
1860,Batata Ruffles Cebola e Salsa 92G,8.89,8.89
1861,Batata Frita Ruffles Churrasco 92G,8.89,8.89
1862,Batata Ruffles Elma Chips Original 92G,8.89,8.89
1863,Salgadinhos Gulão Presunto Embalagem 120G,3.5,3.5
1864,Batata Palha Mega Chipas Tradicional 120G,5.49,5.49
1865,Salgadinho Doritos Sweet Chilli 48G,4.49,4.49
1866,Batata Chips Max Chips 40Gr Lisa,1.99,1.99
1867,Batata Palha Batatex Tradicional 120G,3.99,3.99
1868,Pipoca Doce Aritana Embalagem 100G,2.8,2.8
1869,Batata Palha Anchieta Extra Fina 100G,3.69,3.69
1870,Pipoca Doce Aritana Embalagem 40G,0.99,0.99
1871,Batata Palha Anchieta Extra Fina 300G,9.99,9.99
1872,Salgadinho Batata Lisa Max Chips Embalagem 80 G,3.59,3.59
1873,Banana Frita Aritana 50G,3.99,3.99
1874,Apresuntado Pif Paf Fatiado Pacote 180G,5.99,5.99
1875,Salame Fatiado Aurora 100G,10.49,10.49
1876,Mortadela Ouro Tradicionalmente Defumada Fatiada Perdigão 200G,6.99,6.99
1877,Mortadela Tradicional Fatiada Perdigão 200G,5.99,5.99
1878,Mortadela Defumada em Fatias Soltíssimo Sadia 200G,5.99,5.99
1879,Mortadela de Frango Pif Paf Embalagem 400G,4.99,4.99
1880,Mortadela Tipo Bologna Fatiada Aurora 200G,5.99,5.99
1881,Mortadela Perdigão Ouro Fatiada Embalagem 200G,6.99,6.99
1882,Mortadela Tubular Aurora 400G,5.49,5.49
1883,Mortadela Defumada Aurora Fatiada Embalagem 200G,7.49,7.49
1884,Mortadela Pif Paf Tradição 400G,4.99,4.99
1885,Margarina Cremosa com Sal Qmix Qualy 500G,8.99,8.99
1886,Margarina Delícia com Sal 500G,6.49,6.49
1887,Margarina sem Sal Qualy 500G,8.99,8.99
1888,Margarina Cremosa com Sal Doriana 500G,7.49,7.49
1889,Margarina com Sal Claybom 500G,5.99,5.99
1890,Margarina com Sal Qualy 1Kg,17.99,17.99
1891,Requeijão Nestlé Tradicional 200G,8.49,8.49
1892,Manteiga com Sal Itambé Primeira Qualidade Pote 500G,17.99,17.99
1893,Manteiga de Primeira Qualidade com Sal Itambé 200G,9.99,9.99
1894,Requeijão Poços de Caldas Tradicional Copo 200G,8.59,8.59
1895,Margarina Delícia com Sal 1Kg,13.99,13.99
1896,Requeijão Cremoso Itambé Copo 220G,8.99,8.99
1897,Margarina com Sal Qualy 250G,4.99,4.99
1898,Manteiga Cotochés com Sal 500G,22.99,22.99
1899,Margarina com Sal Delícia 250G,3.99,3.99
1900,Margarina Delícia Supreme com Sal 500G,7.99,7.99
1901,Banha Refinada Aurora 1Kg Aproximadamente,15.99,15.99
1902,Requeijão Cremoso Itambé Tradicional Pote 420G,14.99,14.99
1903,Requeijão Itambé Nolac Cremoso Light Zero Lactose Copo 220G,10.99,10.99
1904,Margarina Qualy Aéra com Sal 500G,8.99,8.99
1905,Manteiga Serra Morena com Sal 500G,17.99,17.99
1906,Requeijão Cotoches Tradicional Copo 200G,7.99,7.99
1907,Margarina com Sal Claybom 250G,3.29,3.29
1908,Requeijão Trevinho Light 200G,7.39,7.39
1909,Requeijão Cremoso Light Itambé 220G,10.79,10.79
1910,Requeijão Trevinho Tradicional 200G,9.29,9.29
1911,Requeijão Cremoso Itambé Ervas Finas Copo 250G,9.99,9.99
1912,Margarina Qualy Aéra com Sal 250G,4.99,4.99
1913,Manteiga Serra Morena 200G,7.99,7.99
1914,Manteiga Saldanha Embalagem 200G,8.59,8.59
1915,Massa para Pastel Joselito Grande Embalagem 500G,6.99,6.99
1916,Massa para Pastel Joselito Média Embalagem 500G,6.99,6.99
1917,Massa Fresca para Pastel Joselito Pequena Embalagem 500G,6.99,6.99
1918,Massa Fresca para Lasanha Joselito Embalagem 500G,7.69,7.69
1919,Massa Pastel Italianinho Rolo 1Kg,11.99,11.99
1920,Massa Fresca para Pastel Joselito Rolo 500G,6.99,6.99
1921,Massa Pastel Italianinho Média 500G,5.99,5.99
1922,Massa para Lasanha Italianinho 500G,6.49,6.49
1923,Massa Pastel Italianinho Pequena 500G,5.99,5.99
1924,Massa Pastel Italianinho Grande 500G,5.99,5.99
1925,Queijo Ralado Santa Amália Pacote 50G,4.99,4.99
1926,Queijo Prato Itambé Fatiado 150G,6.99,6.99
1927,Queijo Canastra Minas Artesanal,34.99,34.99
1928,Queijo Ralado Santa Amália 100G,8.89,8.89
1929,Queijo Parmesão Ralado Itambé 50G,4.59,4.59
1930,Queijo Ralado Grosso Sta Amália 50G,4.99,4.99
1931,Queijo Parmesão Ralado Pachá 50G,4.99,4.99
1932,Queijo Minas Padrao Serra Morena,49.99,49.99
1933,Sardinha Coqueiro com Óleo 125G,5.49,5.49
1934,Sardinhas com Óleo Gomes da Costa 125G,4.89,4.89
1935,Atum Sólido em Óleo Coqueiro 120G,10.99,10.99
1936,Atum Ralado em Óleo Gomes da Costa 170G,6.79,6.79
1937,Sardinha Coqueiro com Molho de Tomate Lata 125G,4.99,4.99
1938,Atum Sólido Natural Coqueiro Embalagem 130G,10.49,10.49
1939,Atum Coqueiro Ralado Ao Natural 120G,7.89,7.89
1940,Sardinha Coqueiro com Tomate Embalagem 125G,5.49,5.49
1941,Atum Ralado em Óleo Coqueiro Embalagem 120G,7.89,7.89
1942,Sardinhas com Molho de Tomate Gomes da Costa 125G,4.89,4.89
1943,Sardinhas com Limão Gomes da Costa 125G,4.89,4.89
1944,Sardinha Coqueiro Ao Óleo e Limão Lata 125G,5.49,5.49
1945,Atum Ralado Ao Molho de Tomate Gomes da Costa 170G,6.89,6.89
1946,Sardinhas com Molho de Tomate Picante Gomes da Costa 125G,4.89,4.89
1947,Sardinhas com Molho de Tomate Gomes da Costa 250G,8.99,8.99
1948,Milho Knorr 170G,2.99,2.99
1949,Milho Verde Predilecta 170G,2.89,2.89
1950,Milho Verde em Conserva Predilecta 170G,2.69,2.69
1951,Milho Verde Fugini Ao Vapor 170G,2.89,2.89
1952,Milho Verde Minas Mais 170G,2.59,2.59
1953,Milho Verde Minas Mais 170G,2.49,2.49
1954,Ervilha Predilecta 170G,2.69,2.69
1955,Palmito Picado Anchieta 300G,8.99,8.99
1956,Dueto Milho e Ervilha Predilecta 170G,2.79,2.79
1957,Azeitonas Verdes com Caroço Tozzi Embalagem 70G,2.29,2.29
1958,Azeitona Verde S/Caroco Violetera 160G,6.39,6.39
1959,Ervilha Predilecta Lata 200G,2.09,2.09
1960,Azeitona Verde La Violetera Fatiada Sachê 160G,5.99,5.99
1961,Milho Verde Olé Vidro 170G,3.99,3.99
1962,Cogumelo em Conserva Tozzi Fatiado Embalagem 100G,8.29,8.29
1963,Salsicha Anglo Lata 180G,4.49,4.49
1964,Ervilha Predilecta Sachê 170G,1.49,1.49
1965,Azeitona Verde Anchieta com Caroço 800G,13.99,13.99
1966,Azeitona Verde Saborosas Embalagem 500G,11.99,11.99
1967,Azeitonas Verdes Anchieta com Caroço Vidro 200G,7.99,7.99
1968,Azeitonas Verdes Amo Recheada Sachê 150G,4.49,4.49
1969,Azeitona Verde Anchieta 80G,2.49,2.49
1970,Azeitona Verde Anchieta Embalagem 100G,5.29,5.29
1971,Azeitona sem Caroço Amo 150G,4.49,4.49
1972,Azeitonas Amo Fatiada Sachê 150G,4.49,4.49
1973,Pimenta Malagueta Sayonara Embalagem 40G,5.79,5.79
1974,Pimenta Mexicana Chacon 150Ml,6.99,6.99
1975,Azeitonas Verdes Amo com Caroço Sachê 150G,3.49,3.49
1976,Maionese Tradicional Hellmann's 500G,6.99,6.99
1977,Mostarda Amália 180G,3.89,3.89
1978,Maionese Tradicional Hellmann's 250G,5.29,5.29
1979,Maionese Hellmann's Original 700G,9.99,9.99
1980,Mostarda Predilecta 180G,3.49,3.49
1981,Ketchup Hellmann's Tradicional 380G,8.49,8.49
1982,Maionese Hellmann's Tradicional 200G,4.49,4.49
1983,Ketchup Predilecta 400G,4.49,4.49
1984,Maionese Quero Sachê 200G,1.79,1.79
1985,Ketchup Tradicional Heinz 397G,10.99,10.99
1986,Catchup Colonial Tradicional Embalagem 400G,4.69,4.69
1987,Catchup Santa Amália Tradicional Embalagem 400G,4.79,4.79
1988,Maionese Liza Pote 500G,4.69,4.69
1989,Maionese Quero 495G,3.99,3.99
1990,Maionese Light Hellmann's 250G,5.49,5.49
1991,Molho Barbecue Predilecta Sachê 240G,2.99,2.99
1992,Catchup Picante Colonial 400G,4.89,4.89
1993,Molho Verde Billy & Jack Embalagem 200G / 190Ml,5.49,5.49
1994,Maionese Heinz 390G,11.99,11.99
1995,Maionese D'ajuda Sachê 200G,1.79,1.79
1996,Maionese Predilecta 200G,2.99,2.99
1997,Molho Madeira Predilecta 340G,3.29,3.29
1998,Molho Billy & Jack Original 200G / 190Ml,5.49,5.49
1999,Maionese Tradicional Gourmet Embalagem 500G,6.79,6.79
2000,Molho Branco Predilecta 240G,4.49,4.49
2001,Maionese Arisco Tradicional 500G,3.99,3.99
2002,Maionese Limão Hellmann's 500G,7.99,7.99
2003,Maionese Heinz 215G,8.99,8.99
2004,Molho Billy & Jack Chipotle Kisabor 200G,5.99,5.99
2005,Maionese Aioli Hellmann's 500G,8.99,8.99
2006,Maionese Soya Sachê 200G,1.49,1.49
2007,Ketchup Heinz Bacon & Cebola Caramelizada 397G,11.99,11.99
2008,"Maionese Predilecta Embalagem 1,02Kg",8.99,8.99
2009,Maionese Sabor Bacon Kisabor 200G,4.29,4.29
2010,Molho Anchieta 3Em1 350Ml,7.99,7.99
2011,Molho Shoyu Tradicional Sayonara 500Ml,10.99,10.99
2012,Molho Inglês Chacón 900Ml,6.99,6.99
2013,Molho Salada Chacon 150Ml,3.39,3.39
2014,Molho Churrasco Chacon 500Ml,8.29,8.29
2015,Molho de Alho Chacon com Especiarias 500Ml,7.49,7.49
2016,Molho de Inglês Sayonara Embalagem 500Ml,5.99,5.99
2017,Molho para Carne Chacon 900Ml,10.99,10.99
2018,Molho de Pimenta Chacon Ultra Forte Embalagem 150Ml,3.99,3.99
2019,Catchup Tradicional Chapadão Embalagem 370G,2.59,2.59
2020,Molho de Alho Chacon com Especiarias 140Ml,5.99,5.99
2021,Molho de Alho com Pimenta Sayonara Embalagem 500Ml,5.99,5.99
2022,Molho Sayonara Pimenta Extra Fort 150Ml,3.39,3.39
2023,Molho para Carnes Sayonara Embalagem 150Ml,2.99,2.99
2024,Molho de Soja Sayonara Shoyu 150Ml,3.99,3.99
2025,Molho de Alho Chacon com Especiarias 150Ml,3.99,3.99
2026,Molho de Alho Chacon 150Ml,3.69,3.69
2027,Molho de Pimenta Defumada Chacon Embalagem 150 Ml,3.99,3.99
2028,Molho de Alho Cremoso Sayonara 210G,4.99,4.99
2029,Molho Sayonara Alho Tradicional Plus 150Ml,2.99,2.99
2030,Molho para Carnes Sayonara Embalagem 500Ml,6.99,6.99
2031,Molho de Pimenta Chacon Suave Embalagem 150Ml,3.99,3.99
2032,Molho Ingles Chacon 150Ml,2.99,2.99
2033,Molho Shoyu Chacon 150Ml,3.29,3.29
2034,Molho Carne Chacon 500Ml,7.99,7.99
2035,Molho Inglês Sayonara Embalagem 500Ml,4.99,4.99
2036,Molho de Alho com Pimenta 900Ml - Sayonara,8.49,8.49
2037,Molho Inglês Sayonara 900Ml,6.99,6.99
2038,Molho de Pimenta Tradicional Sayonara 900Ml,9.99,9.99
2039,Molho de Carne Chacon 150Ml,3.39,3.39
2040,Molho de Alho com Pimenta Sayonara Embalagem 150Ml,2.59,2.59
2041,Molho de Pimenta Sayonara 150Ml,2.99,2.99
2042,Molho Barbecue Cremoso Sayonara 225G,7.49,7.49
2043,Molho Inglês Sayonara 150Ml,2.79,2.79
2044,Molho Tomate Tradicional Pramesa Sache 340G,1.39,1.39
2045,Molho de Tomate Minas Mais Tradicional Sachê 340G,1.59,1.59
2046,Extrato de Tomate Tradicional Elefante 340G,5.49,5.49
2047,Molho de Tomate Predilecta Tradicional 340G,1.49,1.49
2048,Extrato de Tomate Colonial Embalagem 860G,8.99,8.99
2049,Extrato de Tomate Colonial Lata 350G,3.69,3.69
2050,Molho de Tomate Tradicional Salsaretti 340G,1.79,1.79
2051,Molho de Tomate Tradicional Tarantella Sachê 300Gr,1.89,1.89
2052,Molho de Tomate Colonial Mio Pizza Embalagem 340G,2.49,2.49
2053,Extrato de Tomate Cajamar Lata 350G,2.99,2.99
2054,Molho de Tomate Tradicional Colonial Mio Embalagem 340G,1.99,1.99
2055,Extrato de Tomate Elefante 130G,2.69,2.69
2056,Molho de Tomate Tradicional Pomarola Lata 340G,4.39,4.39
2057,Molho de Tomate Predilecta Hot Dog 340G,2.29,2.29
2058,Extrato de Tomate Colonial Embalagem 190G,1.69,1.69
2059,Molho de Tomate Predilecta Ervas Finas 340G,2.29,2.29
2060,Extrato de Tomate Colonial Sachê 350G,2.59,2.59
2061,Molho de Tomate Predilecta Pizza 340G,2.29,2.29
2062,Molho de Tomate Predilecta Bolonhesa 340G,3.49,3.49
2063,Molho de Tomate Colonial Mio Manjericão Embalagem 340G,2.5,2.5
2064,Extrato de Tomate Colonial Lata 140G,2.39,2.39
2065,Molho de Tomate Predilecta Manjericão 340G,2.29,2.29
2066,Molho de Tomate Anchieta Refogado 340G,1.99,1.99
2067,Molho de Tomate Colonial Sache 190G,1.45,1.45
2068,Molho de Tomate Colonial Mio Hot Dog Embalagem 340G,2.39,2.39
2069,Sopa Vono Chef Creme de Cebola Sachê 58G,5.49,5.49
2070,Sopa Vono Abóbora com Carne Sachê 17G,2.49,2.49
2071,Sopão Galinha com Macarrão e Legumes Kitano 196G,6.59,6.59
2072,Sopa Vono Caldinho de Feijão Sachê 18G,2.49,2.49
2073,Sopa Vono Mandioquinha Cebola Salsa 17G,2.49,2.49
2074,Sopa Vono Peito de Frango com Queijo 17G,2.49,2.49
2075,Sopa Vono Batata com Carne Sachê 18G,2.49,2.49
2076,Sopa Vono Aipim com Costela Embalagem 18G,2.49,2.49
2077,Creme de Milho Pacha Embalagem 500G,2.99,2.99
2078,Tempero para Carnes Sazón Pacote 60G,3.99,3.99
2079,Bicarbonato de Sódio Pirata Embalagem 80G,2.29,2.29
2080,Especiarias Pacha Bicarbonato de Sódio Embalagem 1Kg,10.99,10.99
2081,Caldo de Galinha Knorr 12Un,2.99,2.99
2082,Caldo Knorr Bacon e Louro Embalagem 57G,1.59,1.59
2083,Tempero Santa Amália Alho e Sal Embalagem 300G,2.49,2.49
2084,Caldo de Galinha Oferta Knorr 57G,1.59,1.59
2085,Temp Sazon 60G Legumes,3.99,3.99
2086,"Caldo Galinha Sazón 32,5G",2.49,2.49
2087,Caldo de Galinha Knorr 57G,1.59,1.59
2088,Tempero para Feijão Sazón 60G,3.99,3.99
2089,Caldo Knorr Costela Embalagem 57G,1.59,1.59
2090,Tempero Sazón Nordeste 60G,3.99,3.99
2091,Tempero em Pasta Caseiro Receita de Casa 450G,8.32,8.32
2092,Caldo de Carne Knorr 12Un,2.99,2.99
2093,Caldo Santa Amália Bacon Embalagem 57G,1.39,1.39
2094,Tempero Sazón Massas 60G,3.99,3.99
2095,Tempero Sazón Saladas 60G,3.99,3.99
2096,Caldo Sazón Bacon Defumado,2.49,2.49
2097,Tempero Sazón Frango 60G,3.99,3.99
2098,"Caldo Carne Sazón 37,5G",2.49,2.49
2099,Tempero Completo Sabor a Mi sem Pimenta 300G,3.82,3.82
2100,Tempero Pronto Kitano Mais Sabor Carne Sachê 60G,3.49,3.49
2101,Caldo de Carne Knorr Caixa 57G,1.49,1.49
2102,Tempero Pronto Mais Sabor Nordestino Kitano 60G,3.49,3.49
2103,Tempero Santa Amália sem Pimenta 300G,2.49,2.49
2104,Tempero Sazón Arroz 60G,3.99,3.99
2105,Tempero Sabor a Mi Alho e Sal 300G,3.99,3.99
2106,Caldo em Tablete Sabor Picanha Knorr 57G com 6Un,1.59,1.59
2107,Tempero Kitano Mais Sabor 60G. Aves,3.49,3.49
2108,Caldo Arisco Galinha Caipira 57G,1.39,1.39
2109,Tempero Sazón Toque de Limão 60G,3.99,3.99
2110,"Caldo Picanha Sazón 37,5G",2.49,2.49
2111,Tempero Pronto Kitano Mais Sabor Saladas Sachê 60G,3.49,3.49
2112,Tempero Pronto Pirata Alho Sal 300G,3.59,3.59
2113,Tempero Mais Sabor Kitano Massas Embalagem 60G,3.49,3.49
2114,Tempero Meu Assado Limão e Orégano Knorr 25G,4.99,4.99
2115,Tempero Completo Sabor a Mi com Pimenta 300G,3.9,3.9
2116,Tempero Pronto Santa Amália sem Pimenta 1Kg,8.99,8.99
2117,Massa de Alho Pirata 300G,3.59,3.59
2118,Tempero Caseiro com Pimenta Receita de Casa 450G,8.32,8.32
2119,Tempero Pronto Kitano Mais Sabor Feijão Sachê 60G,3.49,3.49
2120,Tempero Alho e Cebola Meu Assado Knorr 25G,4.99,4.99
2121,Tempero em Pó para Todos Os Tipos de Carne Gril Maggi 120G,6.59,6.59
2122,Tempero Pronto Kitano Mais Sabor Legumes Sachê 60G,3.49,3.49
2123,Caldo Arisco Galinha 114G,2.19,2.19
2124,"Caldo Kitano Galinha Pacote 1,01Kg",13.99,13.99
2125,Tempero Pronto Pirata sem Pimenta 300G,3.59,3.59
2126,Tempero Completo Sabor a Mi sem Pimenta Pote 1Kg,11.89,11.89
2127,Tempero Pronto Kitano Mais Sabor Arroz Branco Sachê 60G,3.49,3.49
2128,"Caldo de Galinha Kitano em Pó Sachê 37,5G",2.09,2.09
2129,Tempero Mais Sabor Kitano Gaúcho Embalagem 60G,3.49,3.49
2130,Tempero para Pipoca Sazón Manteiga 60G,3.99,3.29
2131,Tempero Pronto Santa Amália Alho e Sal Embalagem 1Kg,8.99,8.99
2132,Tempero Completo Sabor a Mi com Pimenta 1Kg,11.89,11.89
2133,Amaciente de Carne Toque de Chef Kitano 120G,7.49,7.49
2134,Caldo Santa Amália Carne Embalagem 57G,1.39,1.39
2135,Caldo Arisco Carne 114G,2.19,2.19
2136,"Caldo Kitano Carne Pacote 1,01Kg",9.99,9.99
2137,"Caldo em Pó Kitano Carne Embalagem 37,5G",2.09,2.09
2138,Louro em Pó Sayonara 5G,1.29,1.29
2139,Caldo Santa Amalia Picanha 57G,1.39,1.39
2140,Tempero Chacon Completo 500G,3.99,3.99
2141,Caldo Santa Amália Galinha 57G,1.39,1.39
2142,Especiarias Anchieta Bicarbonato de Sódio Embalagem 110G,2.99,2.99
2143,Especiarias Sayonara Salsa Desidratado Embalagem 5G,1.49,1.49
2144,Colorífico Pacha 500G,6.99,6.99
2145,Especiarias Sayonara Colorífico Embalagem 500G,6.99,6.99
2146,Colorau Pacha 150G,2.19,2.19
2147,Tempero Pronto Sayonara Massa de Alho Embalagem 1Kg,8.99,8.99
2148,Especiarias Sayonara Canela em Pó Embalagem 30G,6.19,6.19
2149,Curry Gota D' Fogo Embalagem 10G,1.09,1.09
2150,Especiarias Sayonara Pimenta Calabresa Embalagem 7G,1.39,1.39
2151,Noz Moscada em Pó Gota de Fogo 5G,2.99,2.99
2152,Tempero Pronto Sayonara Massa de Alho Pote 300G,3.29,3.29
2153,Especiarias Sayonara Orégano Embalagem 100G,15.29,15.29
2154,Caldo Santa Amalia Costela 57G,1.39,1.39
2155,Especiarias Sayonara Colorífico Embalagem 150G,2.49,2.49
2156,Tempero Pronto para Carne Anchieta 50G,2.79,2.79
2157,Tempero Pronto Anchieta Aves 50G,2.79,2.79
2158,Cravo da Índia Sayonara 7G,2.99,2.99
2159,Especiarias Sayonara Ervas Finas Embalagem 5G,1.49,1.49
2160,Tempero Pronto Completo Sayonara Pote 300G,3.49,3.49
2161,Especiarias Sayonara Bicarbonato de Sódio Embalagem 30G,0.99,0.99
2162,Especiarias Sayonara Orégano Embalagem 25G,3.99,3.99
2163,Especiarias Sayonara Louro em Folhas Embalagem 5G,1.5,1.5
2164,Especiarias Sayonara Noz Moscada em Grão Embalagem 7G,3.99,3.99
2165,Tempero Pronto Sayonara Alho com Sal Pacote 500G,3.99,3.99
2166,Colorífico Pirata Embalagem 150G,3.69,3.69
2167,Bicarbonato de Sódio Gota de Fogo 30G,1.2,1.2
2168,Especiarias Sayonara Chimichurri Embalagem 10G,1.99,1.99
2169,Especiarias Sayonara Canela Casca Embalagem 7G,2.19,2.19
2170,Caldo de Cubo Sabor Bacon Anchieta 114G,2.19,2.19
2171,Tempero Chacon Alho e Sal 1Kg,6.99,6.99
2172,Tempero Pronto para Feijão Anchieta 50G,2.79,2.79
2173,Caldo Cubo Anchieta Carne 114G,2.19,2.19
2174,Especiarias Sayonara Pimenta do Reino em Pó Embalagem 10G,2.8,2.8
2175,Bicarbonato de Sódio Sayonara 80G,1.99,1.99
2176,Especiarias Sayonara Canela em Pó Embalagem 7G,2.5,2.5
2177,Especiarias Sayonara Noz Moscada em Pó Embalagem 7G,3.99,3.99
2178,Tempero Chacon P/Churrasco 500G,3.99,3.99
2179,Especiarias Sayonara Pimenta do Reino em Grão Embalagem 10G,2.29,2.29
2180,Alho Granulado Sayonara Embalagem 10G,2.99,2.99
2181,Especiarias Sayonara Erva Doce Embalagem 7G,1.8,1.8
2182,Louro em Pó Gota de Fogo 5G,1.09,1.09
2183,Especiarias Sayonara Coentro em Pó Embalagem 5G,0.8,0.8
2184,Tempero Sayonara Completo 500G,3.99,3.99
2185,Especiarias Pacha Bicarbonato de Sódio Embalagem 500G,5.5,5.5
2186,Caldo Cubo Anchieta Galinha 57G,1.29,1.29
2187,Caldo Cubo Bacon Anchieta 57G,1.29,1.29
2188,Leite Fermentado Desnatado Adoçado Yakult Pote 80G 6Un,10.89,10.89
2189,Bebida Láctea Cotochés Frutas Vermelhas com Coco 540G,3.99,3.99
2190,Iogurte Natural Integral Nestlé 170G,2.99,2.99
2191,Iogurte Polpa Itambé Morango e Coco Bandeja 540G,4.99,4.99
2192,Leite Fermentado Chamyto 6X75g,6.49,6.49
2193,Iogurte Natural Itambé Embalagem 500G,7.99,7.99
2194,"Iogurte Líquido Itambé Morango Garrafa 1,25Kg",12.49,12.49
2195,Iogurte Desnatado Frutas Zero Lactose Fit Itambé Bandeja 540G,6.49,6.49
2196,Iogurte Polpa Morango Itambé Bandeja 540G 6Un,4.99,4.99
2197,Iogurte Natural Integral Itambé Milk Copo 170G,2.99,2.99
2198,Iogurte de Morango Cotoches 6Un 540G,3.99,3.99
2199,Iogurte Itambé Natural Copo 170G,2.99,2.99
2200,Bebida Láctea Sabor Chocolate Chocomil Cemil 200Ml,1.09,1.09
2201,Iogurte Líquido Itambé Morango Garrafa 900G,8.99,8.99
2202,Leite Fermentado Desnatado Morango Bob Esponja Elegê Caixa 6 Unidades,6.49,6.49
2203,Bebida Láctea Itambé Polpa Frutas e Cereais Bandeja 540G,6.49,6.49
2204,Iogurte Itambé Grego Morango Zero Pote 100G,2.19,2.19
2205,Iogurte Trevinho Morango e Frutas 540G,4.69,4.69
2206,Iogurte Batavo Pedaços de Fruta Morango 100G,1.99,1.99
2207,Iogurte Natural Nestlé Desnatado 160G,2.99,2.99
2208,Petit Suisse Trevinho Morango Bandeja 360G,5.99,5.99
2209,"Iogurte Líquido Itambé Coco Garrafa 1,25Kg",12.49,12.49
2210,Sobremesa Láctea Itambé Flan com Calda Sabor Caramelo 200G,4.69,4.69
2211,Leite Fermentado Itambé 6Un Pote 450G,5.29,5.29
2212,Iogurte Apreciare Triple Morango Zero Lactose e Açúcar Bandeja 540G,6.99,6.99
2213,Bebida Láctea Uht Trevinho Morango 200Ml,1.39,1.39
2214,Bebida Láctea Goody Frutas Vermelhas e Coco 540G,2.99,2.99
2215,Iogurte Itambé Grego Sobremesa Bandeja 540G,11.29,11.29
2216,Iogurte Integral Morango Batavo Pedaços 500G,6.99,6.99
2217,Iogurte Chamyto Morango 100G,3.19,3.19
2218,"Iogurte Trevinho Morango 1,3Kg",11.49,11.49
2219,Bebida Láctea Itambé Goody Coco Embalagem 170G,1.69,1.69
2220,Bebida Láctea Goody Morango 540G,2.99,2.99
2221,Bebida Láctea Itambé Morango Goody 170G,1.69,1.69
2222,Iogurte Pedaços Morango Itambé 500G,7.99,7.99
2223,"Iogurte Líquido Itambé Vitamina Cereal Garrafa 1,25Kg",12.49,12.49
2224,Iogurte Trevinho Morango 540G,4.69,4.69
2225,Iogurte Batavo Pedaços de Fruta Pêssego 100G,1.99,1.99
2226,"Bebida Láctea Fermentada Morango Itambé Goody 1,25L",8.89,8.89
2227,Iogurte Itambé Natural Desnatado Copo 170G,2.99,2.99
2228,Iogurte Itambé Frutas Vermelhas Garrafa 170G,2.39,2.39
2229,Leite Fermentado Bob Esponja Elegê 80G,5.49,5.49
2230,Queijo Petit Suisse Morango Os Incríveis Itambé Kids Bandeja 320G 8 Unidades,6.79,6.79
2231,Iogurte Líquido Itambé Maracujá Garrafa 170G,2.39,2.39
2232,Leite Fermentado Batavito 480G com 6 Unidades,5.99,5.99
2233,Sobremesa Láctea Itambé Kids Chocolate 320G,6.49,6.49
2234,Leite Fermentado Sabor Baunilha Itambé 900G,9.29,9.29
2235,Iogurte Itambé Fit Morango Garrafa 170G,2.69,2.69
2236,Leite Fermentado Desnatado Os Incríveis 2 Itambé 6Un de 80G Cada,5.89,5.89
2237,Iogurte Itambé Frutas Vermelhas Zero Lactose Garrafa 170G,2.69,2.69
2238,"Bebida Láctea Quatazinho Vitamina Mamão, Maçã e Banana Embalagem 200Ml",0.99,0.99
2239,Bebida Láctea Cemil Sucomilho Caixa 200Ml,1.19,1.19
2240,Iogurte Itambé Coco Garrafa 170G,2.39,2.39
2241,Iogurte Parcialmente Desnatado Sabor Morango e Coco Trevinho 540G,6.49,6.49
2242,"Bebida Lácta Pulsi Salada de Frutas 1,3 Litro",14.99,14.99
2243,Iogurte Itambé Coco Zero Lactose Garrafa 170G,2.79,2.79
2244,Iogurte Itambé Grego Bicamada Morango Pote 100G,2.19,2.19
2245,Iogurte Ninho Maçã e Banana 170G,3.59,3.59
2246,Iogurte Ninho Morango 250G,8.69,8.69
