,Produto,Preço Base,Preço Final
1368,Desodorante Nivea For Men Fresh Invisible Black & White Rollon 50Ml,7.99,7.99
1369,Hidratante Paixão Sedutora,6.99,6.99
1370,Loção Hidratante Desodorante Inspiradora Paixão 400Ml,12.99,12.99
1371,Sabonete Dove Delicious Care Creme e Flor de Peônia 90G,3.49,3.49
1372,Desodorante Feminino Nivea Dry Fresh Rollon 50Ml,7.99,7.99
1373,Sabonete Dove Go Fresh Reequilíbrio 90G,3.49,3.49
1374,Desodorante Antitranspirante Rexona Feminino Rollon Active Emotion 50Ml,9.99,9.99
1375,Leite Hidratante Monange Frutas Vermelhas Embalagem 400Ml,13.99,13.99
1376,Antitranspirante Aerossol Dermo Clareador Nivea 150Ml,12.99,12.99
1377,Aparelho de Barbear Gillette Mach3 Acqua-Grip 1Un,19.99,19.99
1378,Desodorante Feminino Antitranspirante Nivea Protect & Care Embalagem Rollon 50Ml,7.99,7.99
1379,Sabonete Naturals Esfoliação Delicada Palmolive 150G,3.49,3.49
1380,Sabonete Antibacteriano em Barra Limpeza Profunda Protex 85G,3.39,3.39
1381,Hidratante Desodorante Monange Hidratação Nutritiva Frutas Vermelhas 200Ml,6.99,6.99
1382,Creme para Mãos e Pés Fashion Sebo de Carneiro Embalagem 200Ml,7.99,7.99
1383,Sabonete em Barra Naturals Hidrata & Perfuma Palmolive 150G,3.49,3.49
1384,Sabonete Protex Pro Hidrata Amêndoa 85G,3.39,3.39
1385,Sabonete Senador Classic Embalagem 130G,4.49,4.49
1386,Aparelho de Barbear Comfort 3 Normal Bic 2 Un,4.99,4.99
1387,Desodorante Antitranspirante Rexona V8 30Ml,6.99,6.99
1388,Desodorante Nivea Original Protect & Care Rollon 50Ml,7.99,7.99
1389,Sabonete em Barra Naturals Hidratação Saudável Palmolive 150G,3.49,3.49
1390,Aparelho de Barbear Probak Ii Embalagem 2 Un,4.59,4.59
1391,Desodorante Antitranspirante Rexona Invisible 50Ml,9.99,9.99
1392,Desodorante Feminino Nivea Água Coco 150Ml,12.99,12.99
1393,Desodorante Feminino Antitranspirante Nivea Protect Care Aerosol 90G,12.99,12.99
1394,Desodorante Creme Unissex Red Apple Proteção Seca sem Álcool Embalagem 55G,6.99,6.99
1395,Desodorante Nivea Activ Dry Fresh For Men Aerosol 150Ml,12.99,12.99
1396,Desodorante Antitranspirante Spray Lenha Old Spice 150Ml,12.99,12.99
1397,Desodorante Creme Antiperspirante Tabu Segredos Pote 55G,4.59,4.59
1398,Desodorante Feminino Nivea Fresh Invisible Black&White Rollon 50Ml,7.99,7.99
1399,Óleo Corporal e Capilar Coco Farmax 100Ml,6.69,6.69
1400,Óleo Corporal e Capilar Farmax Semente de Uva Embalagem 100Ml,6.69,6.69
1401,Hidratante Desodorante Inspiradora Romântica Paixão 200Ml,6.99,6.99
1402,Desodorante Antitranspirante Suave Intense Protection 150Ml,8.99,8.99
1403,Desodorante Antitranspirante Rexona Bamboo & Aloe Vera 50Ml,9.99,9.99
1404,Desodorante Antitranspirante Old Spice Vip 93G,12.99,12.99
1405,Hidratante Desodorante Monange Hidratação Nutritiva Iogurte com Aveia 200Ml,6.99,6.99
1406,Glicerina Ideal Embalagem 100Ml,5.79,5.79
1407,Desodorante Antitranspirante Rexona Feminino Cotton Dry 50Ml,9.99,9.99
1408,Desodorante Antitranspirante Suave Jasmin e Coco 150Ml,8.99,8.99
1409,Desodorante Hidratante Corporal Hidratação Intensiva Embalagem Econômica Monange 400Ml,12.99,12.99
1410,Hidratante Desodorante Monange Hidratação Intensiva Leite de Amêndoas 200Ml,6.99,6.99
1411,Hidratante Desodorante Paixão Irresistivel 400Ml,12.99,12.99
1412,Desodorante Antitranspirante Dove Men +Care Invisible Dry 50Ml,11.99,11.99
1413,Desodorante Antiperspirante Tabu Tradicional Embalagem Creme 55G,4.59,4.59
1414,Desodorante Spray Masculino Classic Très Marchand 100Ml,7.99,7.99
1415,Desodorante Antitranspirante Aerosol Dove Men +Care Minerais Sálvia 150Ml,15.99,15.99
1416,Desodorante Antitranspirante Suave Sport Fresh 150Ml,8.99,8.99
1417,Desodorante Feminino Alma de Flores Clássico Spray 90Ml,4.99,4.99
1418,Espuma de Barbear Bozzano Refrescante 200Ml,21.99,21.99
1419,Óleo Corporal Ideal Semente de Uva Embalagem 100Ml,5.39,5.39
1420,Pomada para Massagem Canela de Velho 100G,12.99,12.99
1421,Lâmina Bic Chrome Platinum Embalagem 5 Un,3.99,3.99
1422,Desodorante Antitranspirante Aerossol Masculino Bozzano Sport 150Ml,9.99,9.99
1423,Desodorante Spray Avanço Original 85Ml,7.49,7.49
1424,Hidratante Desodorante Monange Extrato de Oliva 200Ml,6.99,6.99
1425,Desodorante Leite de Rosas Embalagem 170Ml,6.99,6.99
1426,Desodorante Antiperspirante Tabu Romance Embalagem Creme 55G,4.59,4.59
1427,Desodorante Leite de Rosas Embalagem 100Ml,4.69,4.69
1428,Leite de Colônia Original 200Ml,7.99,7.99
1429,Leite de Colônia Final Fantastic Embalagem 200Ml,7.99,7.99
1430,Leite de Colônia Original 100Ml,5.99,5.99
1431,Leite de Colônia Toque Carinho 100Ml,5.99,5.99
1432,Sabonete Líquido Morango Agata 500Ml,10.99,10.99
1433,Glicerina Bi Destilada Avante 100Ml,5.99,5.99
1434,Bucha Vegetal Medeiros Média 1 Un,5.99,5.99
1435,Sabonete Líquido Jmc Madeira do Oriente 500Ml,9.99,9.99
1436,Bucha de Banho Vegetal Eg Ferreira Un,6.99,6.99
1437,Sabonete Íntimo Bella Mulher Menta Embalagem 200Ml,9.99,9.99
1438,Loção Hidratante Agata Amêndoas e Cacau 500Ml,7.99,7.99
1439,Bucha Vegetal Média Medeiros,3.99,3.99
1440,Sabonete Líquido Amazonia Jmc 500Ml,9.99,9.99
1441,Touca Banho Medeiros Plástica,2.99,2.99
1442,Creme Hidratante Cacau Bicho da Seda 230G,7.99,7.99
1443,Lixa de Unha Darma,0.2,0.2
1444,Aparelho de Barbear Bic Comfort 3 Lâminas Black Night 2Un,11.99,11.99
1445,Saboneteira Plasútil Batman com Tampa Embalagem 1 Un,6.49,6.49
1446,Bucha Vegetal Ferreira Média 1 Un,4.99,4.99
1447,Lixas Pe Pvc Tilim,3.79,3.79
1448,Cortador de Unhas Merheje Unhex para Mãos Embalagem 1 Unidade,3.19,3.19
1449,Sabonete Líquido Duolive Erva Doce Embalagem 500Ml,10.99,10.99
1450,Loção Hidratante Aveia Ágata 500Ml,7.99,7.99
1451,Sabonete Líquido Jmc Limão Siciliano 500Ml,9.99,9.99
1452,Sabonete Líquido Figo da Turquia Jmc 500 Ml,16.99,16.99
1453,Aparelho Prestobarba Gillette Champions,4.99,4.99
1454,Preservativo Prudence Clássico Embalagem 12 Un,3.99,3.99
1455,Preservativo Olla Lubrificado Display 3Unid,5.99,5.99
1456,Curativos Use It Transparente 35 Unidades,6.99,6.99
1457,Água Oxigenada Farmax 10 Volumes Embalagem 100Ml,2.19,2.19
1458,Preservativo Rilex Lubrificado Embalagem 3Un,2.89,2.89
1459,Papel Higiênico Neve Toque de Seda Leve 12 Pague 11,19.99,19.99
1460,Haste Flexível Cotonetes Johnson & Johnson 150Un,7.99,7.99
1461,Papel Higiênico Bob Premium Folha Dupla 30M Leve 12 Pague 11,13.99,13.99
1462,Hastes Flexíveis Topz Embalagem 75Un,2.19,2.19
1463,Papel Higiênico Cotton Folha Dupla Compact 12 Rolos,14.99,14.99
1464,Hastes Flexíveis de Algodão Cotonela Caixa 75 Un,1.99,1.99
1465,Papel Higiênico Elite Folha Dupla Ultra Dualette Leve 12 Pague 11Un,17.99,17.99
1466,Hastes Flexíveis Clin Off com Ponta de Algodão Caixa 75Un,1.89,1.89
1467,Hastes Flexíveis com Pontas de Algodão Cotonela Embalagem 150 Un,3.79,3.79
1468,Hastes Flexíveis Johnsons Caixa 75Un,4.49,4.49
1469,Absorvente Sym Noite e Dia Suave C/ Abas Lv 8 Pg 7,4.99,4.99
1470,Absorvente Sym com Abas Noite e Dia Odor Block Cobertura Suave Santher Leve 16 Pague 14,8.99,8.99
1471,Algodão Bola Apolo 50G,3.99,3.99
1472,Papel Higiênico Neve Toque de Seda 4 Rolos,7.49,7.49
1473,Absorvente Adapt Suave com Abas Sempre Livre 16Un,7.99,7.99
1474,Papel Higiênico Bob Neutro 30M Pacote 8 Rolos,6.69,6.69
1475,Absorvente Suave sem Abas Sym Embalagem 8Un,2.89,2.89
1476,Papel Higiênico Personal Vip Folha Dupla Neutro 30M 4 Rolos,6.99,6.99
1477,Papel Higiênico Duetto Folha Dupla 30 M C/4 Rolos,6.99,6.99
1478,Papel Higiênico Paloma Neutro 60M Pacote 8 Un,10.99,10.99
1479,Papel Higiênico Bob Neutro 30M Pacote 4Un,3.49,3.49
1480,Papel Higiênico Personal Neutro 30M Folha Simples Oferta Pacote 12Un,9.99,9.99
1481,Absorvente Suave com Abas Total Protect Santher Sym Leve 8 Pague 7,2.69,2.69
1482,Papel Higiênico Bob Neutro 60M Embalagem Leve 12 Rolos Pague 11,14.99,14.99
1483,Absorvente Externo Intimus Tripla Proteção Suave com Abas Leve 16 Pague 14,6.99,6.99
1484,Absorvente Sempre Livre Adapt com Abas Oferta 8Un,4.49,4.49
1485,Papel Higiênico Paloma Pacote 8 Rolos 30Mx10cm,5.99,5.99
1486,Papel Higiênico Folha Simples Neutro 60M Bob Pacote 8 Un,9.99,9.99
1487,Absorvente Externo Intimus Noturno Suave com Abas 8 Unidades,5.99,5.99
1488,Papel Higiênico Paloma Perfumado Pacote 4 Rolos,3.29,3.29
1489,Absorvente Noturno Suave com Abas Always 8Un,7.99,7.99
1490,Álcool em Gel Asseptgel Gel 70% Inpm 420G,12.98,12.98
1491,Protetor Diário sem Abas sem Fragrância Carefree Pacote 40Un,12.99,12.99
1492,Absorvente Externo Tripla Proteção Seca com Abas Intimus Leve 9 Pague 8,3.99,3.99
1493,Absorvente com Abas Adapt Plus Leve Mais Pague Menos Sempre Livre 16Un,8.99,8.99
1494,Papel Higiênico Tenderly Folha Dupla Neutro Pacote 12 Rolos X 30M Leve 12 Pague 11,17.99,17.99
1495,Algodão Apolo Hidrófilo 25G,2.25,2.25
1496,Absorvente Sym Total Protect Seca C/ Abas Lv 8 Pg 7,2.99,2.99
1497,Absorvente sem Abas Adapt Suave Sempre Livre 8Un,4.99,4.99
1498,Absorvente com Abas Adapt Plus Noite Dia Sempre Livre 8Un,7.99,7.99
1499,Absorvente Protetor Diário Original Carefree 15Un,6.98,6.98
1500,Absorvente Always Noites Tranquilas Seca com Abas Oferta 8Un,7.99,7.99
1501,Papel Higiênico Sublime Neutro 30M Pacote 4 Un,3.99,3.99
1502,Papel Higiênico Folha Simples Paloma 30M Pacote com 4 Rolos,3.5,3.5
1503,Absorvente Externo Intimus Noturno Seca com Abas 8 Unidades,5.99,5.99
1504,Protetor Diário Sym com Perfume Embalagem 15Un,4.29,4.29
1505,Absorvente Always Super Proteção Suave com Abas 8 Unidades,3.99,3.99
1506,Papel Higiênico Folha Simples Neutro Paloma 30M Pacote 8Un,5.99,5.99
1507,Absorvente Interno Médio Ob 10Un,9.99,9.99
1508,Absorvente Super Proteção Seca com Abas Always 8Un,3.99,3.99
1509,Absorvente Interno Super Ob 10Un,10.49,10.49
1510,Absorvente Ladysoft Normal com Abas Pacote 8 Un,2.79,2.79
1511,Absorvente Sym Girl Suave C/Abas 8 Uni,3.49,3.49
1512,Absorvente Interno Intimus Médio 16 Unidades,12.99,12.99
1513,Absorvente Noturno Normal com Abas Ladysoft 8Un,3.99,3.99
1514,Papel Higiênico Bob Neutro Folha Simples 90M 4Un,7.99,7.99
1515,Algodão Clin Off Rolo 25G,2.89,2.89
1516,Papel Higiênico Bob Rolão Neutro 60M Pacote 4 Rolos,4.99,4.99
1517,Álcool em Gel GelÁlcool Cristal Start 500G,8.49,8.49
1518,Álcool Gel Start Lavanda Embalagem 500G,8.49,8.49
1519,Absorvente Sym Total Protect Suave S/ Abas C/ 8Un,3.99,3.99
1520,Protetor Diário Always com Perfume 15 Unidades,5.49,5.49
1521,Papel Higiênico Tenderly Folha Dupla Neutro Pacote 4 Rolos,6.99,6.99
1522,Fraldas Evolution M Pacote 80 Un,51.9,51.9
1523,Absorvente Diana Teens Suave com Abas Pacote 8 Un,2.99,2.99
1524,Absorvente Ladysoft Normal Suave sem Abas Pacote 8 Un,2.99,2.99
1525,Absorvente Sym Protetor Diario sem Perfume 15 Unidades,4.99,4.99
1526,Hastes Flexíveis Use It Antigerme Embalagem 120Un,2.99,2.99
1527,Creme Dental Menta Suave Oral-B 1-2-3 70G,1.79,1.79
1528,Creme Dental Menta Suave 1-2-3 Oral B 70G,1.99,1.99
1529,Creme Dental Colgate Mpa 50G,2.69,2.69
1530,Creme Dental Colgate Tripla Ação Menta Original 90G,4.49,4.49
1531,Creme Dental Colgate Tripla Ação Hortelã 90G,4.49,4.49
1532,Creme Dental Colgate Clean Mint Total 12 50G,5.49,5.49
1533,Creme Dental Colgate Máxima Proteção Anticáries 90G,3.99,3.99
1534,Fio Dental Reach Essencial de Menta Johnson&Johnson 100M 1Un,13.99,13.99
1535,Creme Dental Tripla Ação Preço Especial Colgate 180G,6.99,6.99
1536,Creme Dental Triple Menta Close Up 70G,2.69,2.69
1537,Kit Escova Dental Oral B 123 3Un,11.99,11.99
1538,Creme Dental Close Up Triple Menta Americana 70G,2.69,2.69
1539,Creme Dental Sorriso Dentes Brancos 180G,6.99,6.99
1540,Creme Dental Colgate Total 12 Whitening 90G,9.99,9.99
1541,Antisséptico Bucal Listerine Cool Mint 250Ml,12.99,12.99
1542,Fio Dental Hillo Leve 125M Pague 100M Embalagem 1 Un,4.99,4.99
1543,Escova Dental Inova Kids Panda Macia Embalagem 1 Un,3.99,3.99
1544,Escova Dental Macia Colgate Classic Clean Oferta 3Un,11.99,11.99
1545,Enxaguante e Antisséptico Bucal Icefresh Over Mint 500Ml,15.99,15.99
1546,Enxaguante Bucal Colgate Plax Fresh Mint 180Ml,12.99,12.99
1547,Creme Dental Close Up Proteção Bioativa 70G,3.19,3.19
1548,Creme Dental Oral-B 4 em 1 Embalagem 70G,4.49,4.49
1549,Antisséptico Bucal Ice Fresh Blue Mint 500Ml,15.99,15.99
1550,Creme Dental Max Red Hot Close Up 90G Leve 12Un Pague 9Un,3.99,3.99
1551,Creme Dental Colgate Total 12 Clean Mint 90G Promo Leve 12 Pague 10,8.99,8.99
1552,Escova Dental Essencial Clean Colgate,4.49,4.49
1553,Creme Dental em Gel Close Up Proteção 360º Fresh Eucalyptus Freeze 90G.,3.79,3.79
1554,Antisséptico Bucal Listerine Cool Mint Leve 500Ml Pague 350Ml,18.99,18.99
1555,Creme Denta Máxima Proteção Anticáries L Colgate 180G,7.99,7.99
1556,Gel Dental Close Up Liquifresh Ice 100G,4.99,4.99
1557,Escova de Dente Tripla 1 2 3 Sorriso 3Un,14.99,14.99
1558,Escova Dental Oral-B Pro Embalagem 1Un,3.79,3.79
1559,Creme Dental Natural Extracts Carvão Ativado e Menta Colgate 90G,11.99,11.99
1560,Escova Dental Colgate Tandy 2Un,11.49,11.49
1561,Creme Dental Colgate Total 12 Advanced Fresh 90G,9.99,9.99
1562,Gel Dental Branqueador Close Up Natural Glow 70G,5.99,5.99
1563,Antisséptico Bucal Colgate Plax Ice Infinity 180Ml,11.99,11.99
1564,Escova Dental Sorriso Original Dura Embalagem 1 Un,3.99,3.99
1565,Escova Dental Inova Kids Girafa 6 Anos Embalagem 1 Un,4.5,4.5
1566,Escova Dental Cool Adulto Média Green,4.99,4.99
1567,Gel Dental Close Up Liquifresh Red Hot 100G,5.49,5.49
1568,Creme Dental Brilliant Mint Luminous White Colgate 70G,10.99,10.99
1569,Gel Dental Close Up Proteção 360 Fresh Menthol Paradise 90G,3.99,3.99
1570,Creme Dental Neutrocare Os Incríveis 50G,6.99,6.99
1571,Escova Dental Macia 20% Indicator Pró Saúde Oral-B 2Un,19.99,19.99
1572,Creme Dental Sensodyne Branq Extr Fresh 50G,12.99,12.99
1573,Fio Dental Predent Tradicional Embalagem 100M,3.49,3.49
1574,Creme Dental Colgate Total 12 Clean Mint 140G,14.99,14.99
1575,Creme Dental Colgate Máxima Proteção Anticáries Neutraçucar 70G,6.99,6.99
1576,Enxaguante Bucal Icefresh Menta Plus Leve 500Ml Pague 350Ml,15.99,15.99
1577,Escova Dental Inova Kids Transformes Macia 1Un,6.49,6.49
1578,Creme Dental Sorriso Fresh Plus Menthol Impact 90G,5.49,5.49
1579,Creme Dental Colgate Tandy Morangostoso 50G,7.49,7.49
1580,Escova Dental Colgate Classic Clean 1Un,4.99,4.99
1581,Escova Dental Inova Kids 3D Coelho Macia Sanifill,4.99,4.99
1582,Antisséptico Bucal Cepacol Tradicional 500Ml,15.99,15.99
1583,Fio Dental Colgate Total Menta 50M,14.99,14.99
1584,Creme Dental Sensodyne Original para Dentes Sensíveis Gsk 50G,12.99,12.99
1585,Escova Dental Oral-B Classic 123 Limpeza Embalagem 1 Un,5.29,5.29
1586,Antisséptico Bucal Cepacol Tradicional Embalagem 250Ml,11.49,11.49
1587,Antisséptico Bucal Cepacol Flúor Embalagem Leve 500Ml Pague 350Ml,15.99,15.99
1588,Escova Dental Colgate Classic Clean 1Un,4.99,4.99
1589,Enxaguante Bucal Colgate Plax Classic 250Ml,18.99,18.99
1590,Escova Dental Flex Turbo Média Inova,3.5,3.5
1591,Escova Dental Inova Flex Turbo Macia Embalagem 1 Un,3.5,3.5
1592,Creme Dental Sorriso Tripla Vitaminas 70G,3.69,3.69
1593,Creme Dental Sorriso Fresh Plus Hortelã Explosion 90G,5.49,5.49
1594,Creme Dental Boni Sofia Uva 50G,6.99,6.99
1595,Escova Dental Inova Kids My Little Pony 6 Anos Macia 1Un,6.99,6.99
1596,Porta Escova de Dente com Tampa Jaguar Ref.1616 Embalagem 1 Un,9.99,9.99
1597,Creme Dental Sorriso Super Refrescante 90G,4.49,4.49
1598,Antisséptico Bucal Oral-B Menta 250Ml,18.99,18.99
1599,Creme Dental Menta Hit Sorriso Fresh 90G,5.49,5.49
1600,Escova Dental Sorriso Original 1Un,3.99,3.99
1601,Escova Dental Tripla 123 Sorriso,8.99,8.99
1602,Escova Dent Green Cool Macia,4.69,4.69
1603,Creme Dental Sorriso Dentes Brancos 90G 12Un + Fresh 90G 3Un,3.99,3.99
1604,Escova Dental Inova Mynt Embalagem Leve 3Un Pague 2Un,8.99,8.99
1605,Escova Dental Sorriso Kolynos Original Macia Embalagem 1 Unidade,3.99,3.99
1606,Escova Dental Expert Macia Dentil,5.29,5.29
1607,Escova Dental Inova Confort Plus Macia Embalagem 1 Unidade,3.5,3.5
1608,Escova Dental Inova Max Clean Média Embalagem 1 Unidade,3.5,3.5
1609,Escova Dental Tek Macia Embalagem 1 Un,4.99,4.99
1610,Escova Dental Inova Intense Média Embalagem 1 Unidade,3.5,3.5
1611,Escova Dental Inova Kids Pinguim Macia Embalagem 1 Un,4.5,4.5
1612,Escova Dental Evolution Média Inova,3.5,3.5
1613,Escova Dental Inova Ultra White Média 1 Unidade,3.99,3.99
1614,Escova de Dente Inova Media Adulto,3.5,3.5
1615,Escova Dental com Capa Bob Zoom Inova 1Un,9.49,9.49
1616,Escova Dental Inova Comfort Plus Média Embalagem 1 Un,3.5,3.5
1617,Fio Dental Predent Própolis Embalagem 100M,3.49,3.49
1618,Escova Dental Inova Surf Capa Dura,3.99,3.99
1619,Kit Escova Dental Inova Comfort Plus Leve 3 Pague 2,8.99,8.99
1620,Escova Dental Inova White Power Macia Embalagem 1 Un,3.99,3.99
1621,Escova Dental Inova Fresh Média Embalagem 1 Un,3.5,3.5
1622,Escova Dental Infantil Donnie Super Wings Frescor,5.99,5.99
1623,Fio Dental Predent For Woman 100 Metros 1Un,4.99,4.99
1624,Kit de Escova Dental Inova Comfort Plus 2 Unidades,6.99,6.99
1625,Fio Dental Tradicional Hillo 50M,4.19,4.19
1626,Acetona Farmax Removedor de Esmaltes Embalagem 100Ml,3.29,3.29
1627,Alicate de Cutícula Mundial 522 Classic 1 Un,23.99,23.99
1628,Removedor de Esmalte sem Acetona Farmax 100Ml,3.59,3.59
1629,Tenys Pé Baruel Original Embalagem 100G,12.99,12.99
1630,Esmalte Risqué Cintilante Platino Blister 8Ml,4.99,4.99
1631,Removedor À Base de Acetona Ideal Embalagem 100Ml,3.99,3.99
1632,Removedor Esmalte Base Only Acetona Embalagem 100Ml,3.49,3.49
1633,Removedor sem Acetona Farmax Aroma Argan Embalagem 100Ml,3.59,3.59
1634,Esmalte Cremoso Preto Sépia Risqué 8Ml,4.99,4.99
1635,Esmalte Risqué Incolor Embalagem 8Ml,4.99,4.99
1636,Esmalte Risqué Cremoso Nude Embalagem 8Ml,4.99,4.99
1637,Esmalte Risqué Cintilante Pérola Embalagem 8Ml,4.99,4.99
1638,Esmalte Risqué Cintilante Cristal Embalagem 8Ml,4.99,4.99
1639,Esmalte Risqué Narutal Incolor Embalagem 8Ml,4.99,4.99
1640,Esmalte Risqué Lagrimas de Venus Embalagem 8Ml,4.99,4.99
1641,Esmalte Risqué Seda Base Embalagem 8Ml,4.99,4.99
1642,Esmalte Risqué Cremoso Rosé Bombom Embalagem 8Ml,4.99,4.99
1643,Amolecedor de Cutículas Ideal com Óleo de Algodão Embalagem 100Ml,5.99,5.99
1644,Esmalte Risqué Cremoso Energia Blister 8Ml,4.99,4.99
1645,Esmalte Risqué Metalico Maça do Amor Embalagem 8Ml,4.99,4.99
1646,Esmalte Risqué Creme Astral Embalagem 8Ml,4.99,4.99
1647,Esmalte Risqué Gabriela Cremoso Embalagem 8Ml,4.99,4.99
1648,Esmalte Cremoso Risqué Niasi Preto Sepia Embalagem 8Ml,4.99,4.99
1649,Esmalte Risqué Renda Embalagem 8Ml,4.99,4.99
1650,Esmalte Risqué Óleo Secante Embalagem 8Ml,4.99,4.99
1651,Esmalte Risqué Cremoso Malicia Embalagem 8Ml,4.99,4.99
1652,Esmalte Risqué Metalico Rubi Embalagem 8Ml,4.99,4.99
1653,Esmalte Risqué Cremoso Tamara Embalagem 8Ml,4.99,4.99
1654,Esmalte Risqué Cremoso Classic Embalagem 8Ml,4.99,4.99
1655,Esmalte Risqué Metalico Sufle de Goiaba Embalagem 8Ml,4.99,4.99
1656,Esmalte Risqué Cremoso Classic Embalagem 8Ml,4.99,4.99
1657,Lixa Tilim Pé Eva Luxo Unidade,4.49,4.49
1658,Lixa de Unha Tamanho Grande Darma,0.5,0.5
1659,Lixa Pura Arte Pequena Mini Pop 100 Unidades,0.49,0.49
1660,Esmalte Risqué Efeito Gliter Mil Purpurinas 8Ml,4.99,4.99
1661,Esmalte Risqué Technology Cobertura Brilhante Embalagem 8Ml,5.99,5.99
1662,Amendoim Anchieta Vermelho 500G,13.99,13.99
1663,Amendoim Pachá Embalagem 500G,14.99,14.99
1664,Amendoim Doce Yoki Pralinê Pacote 150G,6.99,6.99
1665,Amendoim Torrado Anchieta Embalagem 500G,9.99,9.99
1666,Amendoim Torrado Pachá 500G,9.49,9.49
1667,Amendoim Branco Anchieta 500G,9.99,9.99
1668,Amendoim Branco Pacha Embalagem 500G,10.99,10.99
1669,Amendoim Torrado Pink Embalagem 500G,10.99,10.99
1670,Amendoim Japonês Yoki Pacote 150G,6.49,6.49
1671,Amendoim Pacha Torrado e Moído 500G,9.49,9.49
1672,Amendoim Crocante Pacha Salsa e Cebola Embalagem 500G,13.99,13.99
1673,Amendoim Torrado e Salgado Pachá 500G,13.99,13.99
1674,Amendoim Crocante Pacha Pimenta Embalagem 500G,13.99,13.99
1675,Amendoim Pachazitos Salsa e Cebola 50G,2.19,2.19
1676,Amendoim Crocante Pachazitos Salgado 50G,2.19,2.19
1677,Amendoim Pachazitos Salgado 500G,13.99,13.99
1678,Biscoito Rosquinha Coco Mabel Pacote 700G,7.99,7.99
1679,Biscoito Marilan Maizena 200G,2.79,2.79
1680,Biscoito Aymoré Tortini Trufa 90G,1.79,1.79
1681,Biscoito Recheado de Chocolate Passatempo 130G,2.39,2.39
1682,Aymoré Biscoito Amanteigado Leite com Gotas 330G,5.29,5.29
1683,Biscoito Wafer Bauducco Chocolate Pacote 140G,3.29,3.29
1684,Biscoito Aymoré Tortini Chocolate 90G,1.79,1.79
1685,Biscoito Doce Aymoré Maizena 200G,2.59,2.59
1686,Biscoito Marilan Amanteigado Chocolate 330G,4.99,4.99
1687,Biscoito Aymoré Tortini Morango 90G,1.79,1.79
1688,Choco Biscuit Ao Leite Bauducco 80G,6.99,6.99
1689,Aymoré Biscoito Recheado Brigadeiro 120G,1.69,1.69
1690,Biscoito Maisena Marilan 350G,5.39,5.39
1691,Wafer Bauducco 140G Choco C Avela,3.29,3.29
1692,Cookies Bauducco Maxi Chocolate 96G,4.99,4.99
1693,Biscoito Wafer Maxi Chocolate Bauducco 117G,3.29,3.29
1694,Biscoito Wafer Bauducco Morango 140G,3.29,3.29
1695,Biscoito Rosquinha Leite Mabel Pacote 700G,7.99,7.99
1696,Biscoito Cookies Bauducco Original 100G,4.99,4.99
1697,Aymoré Biscoito Recheado Chocolate 120G,1.69,1.69
1698,Biscoito Wafer de Chocolate Visconti 120G,2.29,2.29
1699,Biscoito Doce Aymoré Maria 200G,2.59,2.59
1700,Biscoito Marilan Coco 400G,6.49,6.49
1701,Biscoito Doce Maizena Aymoré 375G,5.49,5.49
1702,Aymoré Biscoito Amanteigado Chocolate 330G,5.29,5.29
1703,Biscoito Doce Recheado Nestlé Negresco Pacote 140G,2.89,2.89
1704,Biscoito Aymoré Rosquinha Coco 400G,5.69,5.69
1705,Biscoito Doce Aymoré Maizena Duo 200G,2.59,2.59
1706,Biscoito Recheado Original Oreo 90G,3.49,3.49
1707,Biscoito Wafer Visconti Morango Pacote 120G,2.29,2.29
1708,Biscoito Marilan Leite 400G,6.49,6.49
1709,Danix Biscoito Recheado Morango 130G,2.19,2.19
1710,Biscoito Recheado Visconti Chocolate Pacote 125G,1.69,1.69
1711,Aymoré Biscoito Amanteigado Coco 330G,5.29,5.29
1712,Rosquinha Vilma Coco Embalagem 800G,7.99,7.99
1713,Biscoito Recheado Danix Chocolate 130G,2.19,2.19
1714,Biscoito Doce Recheado Morango Visconti Pacote 125G,1.69,1.69
1715,Biscoito Rosquinha Marilan Coco 400G,6.99,6.99
1716,Biscoito Recheado Renata Divertix Chocolate 112G,1.59,1.59
1717,Biscoito Maria Marilan 400G,4.99,4.99
1718,Recheadinho Bauducco Goiabinha 112G,2.79,2.79
1719,Aymoré Biscoito Amanteigado Leite 330G,5.29,5.29
1720,Cookies Visconti Original Embalagem 60G,1.69,1.69
1721,Biscoito Wafer Sabor Limão Aymoré 115G,2.49,2.49
1722,Bisc Nestle Negresco Rech 140G Trad,2.89,2.89
1723,Biscoito Doce Recheado Bauducco Moran 140G,1.99,1.99
1724,Biscoito Doce Recheado Hipopó Embalagem 110G,1.49,1.49
1725,Biscoito Doce Aymoré Coco 200G,3.29,3.29
1726,Biscoito Doce Recheado Hipopo Morango Embalagem 110G,1.49,1.49
1727,Biscoito Cookie Chocolate com Gotas de Chocolate Bauducco 100G,4.99,4.99
1728,Biscoito Wafer Aymoré Chocolate 115G,2.49,2.49
1729,Biscoito Doce Recheado Chocolate Bauducco 140G,1.99,1.99
1730,Biscoito Doce Bauducco Maizena Embalagem 170G,2.29,2.29
1731,Cookies de Chocolate Visconti Embalagem 60G,1.69,1.69
1732,Recheadinho Bauducco Chocolate 104G,2.79,2.79
1733,Biscoito Rosquinha Marilan Leite 400G,2.99,2.99
1734,Biscoito Aymoré Wafer Choco Avelã 115G,2.49,2.49
1735,Aymoré Biscoito Recheado Morango 120G,1.69,1.69
1736,Biscoito de Maisena Vilma Embalagem 200G,1.99,1.99
1737,Biscoito Doce Recheado Vilma Limão Embalagem 120G,1.99,1.99
1738,Biscoito Aymoré Wafer Especial Chocolate Branco 80G,2.39,2.39
1739,Biscoito Doce Krokan Leite Embalagem 800G,8.59,8.59
1740,Biscoito Aymoré Integral Banana Canela 200G,3.69,3.69
1741,Biscoito Marilan Amanteigado Coco 330G,4.69,4.69
1742,Biscoito Aymoré Wafer Especial Chocolate 80G,2.39,2.39
1743,Danix Biscoito Recheado Choco Shake 130G,2.19,2.19
1744,Biscoito Integral Cereale Cacau e Castanhas Bauducco 170G,3.49,3.49
1745,Biscoito Doce Recheado Vilma Chocolate Embalagem 120G,1.99,1.99
1746,Biscoito Recheado Tortuguita Chocolate 130G,1.99,1.99
1747,Biscoito Recheado Pit Stop Chocolate 124G,3.99,3.99
1748,Danix Biscoito Leite 86G,1.59,1.59
1749,Biscoito Recheado Tortuguita Brigadeiro 130G,1.99,1.99
1750,Biscoito Recheado Tortuguita Baunilha 130G,1.99,1.99
1751,Aymoré Biscoito Recheado Choco Creme 120G,1.69,1.69
1752,Biscoito Tortuguita Wafer Morango 85G,1.99,1.99
1753,Biscoito Recheado Milkshake de Morango Oreo 90G,3.49,3.49
1754,Biscoito Vilmar Wafer Chocolate 115G,2.39,2.39
1755,Biscoito Recheado Tortuguita Morango 130G,1.99,1.99
1756,Biscoito Cereale Cacau Aveia & Mel Bauducco 170G,3.99,3.99
1757,Biscoito Marilan Tortinhas Chocolate 160G,3.49,3.49
1758,Biscoito Recheado Sabor Chocolate Oreo 90G,3.49,3.49
1759,Biscoito Doce Champagne Flamboyant Embalagem 360G,8.99,8.99
1760,Biscoito Integral Cereal Mix Aveia e Mel Aymoré Pacote 200G,3.69,3.69
1761,Biscoito Marilan Manteiga 400G,6.29,6.29
1762,Biscoito Recheado de Morango Vilma 120G,1.99,1.99
1763,Biscoito Wafer Vilma 115G,2.39,2.39
1764,Biscoito Wafer Itamaraty Look Cookies & Cream Embalagem 55G,2.99,2.99
1765,Biscoito Cereale Maçã & Uva Passa Ao Leite Bauducco 141G,3.49,3.49
1766,Biscoito Cookie Toddy Baunilha e Chocolate 60G,2.29,2.29
1767,Rosquinha de Leite Aymoré 330G,5.69,5.69
1768,Sequilho Vale do Prata Coco Embalagem 350G,5.49,5.49
1769,Biscoito Aymoré Integral Chocolate e Avelã 200G,3.69,3.69
1770,Biscoito Aymoré Wafer Especial Limão 80G,2.39,2.39
1771,Biscoito Doce Krokero Sortido Coco 800G,8.59,8.59
1772,Biscoito de Polvilho Tradicional Vale do Prata Embalagem 170G,5.49,5.49
1773,Biscoito Wafer Morango Vilma Pacote 115G,2.39,2.39
1774,Biscoito Santa Luzia Polvilho Escaldado 120G,4.39,4.39
1775,Biscoito Duda Gomes 320G Rosca Coco,7.99,7.99
1776,Biscoito Doce Petisco Rosquinha Sabor Coco 800G,6.99,6.99
1777,Rosquinha Duda Gomes Churros 320G,7.99,7.99
1778,Rosquinha Vilma Chocolate Embalagem 330G,4.59,4.59
1779,Sequilho Vale do Prata Leite Embalagem 350G,5.49,5.49
1780,Rosquinha Duda Gomes Leite 320G,7.99,7.99
