,Produto,Preço Base,Preço Final
0,Cloro Super Cloro Classic Extra Forte 1 Litro,3.99,3.99
1,Água Sanitária Classic 5 Litros,10.99,10.99
2,Água Sanitária Santa Clara Embalagem 2 Litros,5.49,5.49
3,Lustra Móveis Ypê Lavanda 200Ml,5.49,5.49
4,Álcool Líquido 70% Start 1L,10.49,10.49
5,Água Sanitária Santa Clara Embalagem 1 Litro,2.99,2.99
6,Água Sanitária Santa Clara 5L,12.49,12.49
7,Água Sanitária Classic Embalagem 2 Litros,4.49,4.49
8,Desinfetante Santa Clara Lavanda Embalagem 2 Litros,6.49,6.49
9,Lustra Móveis Uau Perfumado Rosas e Sedução 200Ml,5.39,5.39
10,Desinfetante Casa Km Casa & Perfume Passione Embalagem 1L,7.99,7.99
11,Limpador Cremoso Cif Original 250Ml,7.89,7.89
12,Lustra-Móveis Lavanda Peroba 200Ml,5.99,5.99
13,Água Sanitária Classic 1Litro,2.79,2.79
14,Limpador Perfumado Casa e Perfume Sensualidad Leve 1L Pague 900Ml,6.99,6.99
15,Limpador Multiuso Gold Original Veja 500Ml,3.99,3.99
16,Desinfetante Batuta Oceano Ação Limpa Pisos Elimina Germes e Bactérias Embalagem 2L,6.99,6.99
17,Limpador Sanitário Limpeza Profunda Gel Marine Pato 750Ml,12.49,12.49
18,Água Sanitária Ypê 2L,7.99,7.99
19,Limpador Limpa Alumínio Politriz Tradicional Embalagem 500Ml,2.69,2.69
20,"Álcool Líquido Araucária 46,2º Embalagem 500Ml",4.99,4.99
21,Água Sanitária Super Globo Embalagem 2 Litros,6.49,6.49
22,Desinfetante Batuta Lavanda Embalagem 2L,6.99,6.99
23,Limpador Brilhalumínio Tradicional Embalagem 500Ml,2.49,2.49
24,Super Cloro Classic Extra Forte 2L,6.99,6.99
25,Desengordurante Uau Squeeze 500Ml,5.99,5.99
26,Limpador Cremoso Cif Original 450Ml,11.99,11.99
27,Soda Cáustica Escorpião 1Kg,23.99,23.99
28,Soda Cáustica Yara 950G,11.99,11.99
29,Pedra Sanitária Master Sortida 25G,1.99,1.99
30,Limpador Uau Multiuso Desengordurante Limão Siciliano 500Ml,3.39,3.39
31,Limpador Casa e Perfume Sensualidad 1L,7.99,7.99
32,Desinfetante Classic Capim Limão Eucalipto Embalagem 2 Litros,4.29,4.29
33,Gel Adesivo Sanitário Marine Refil Pato 12G,7.49,7.49
34,Limpador Uau Perfumes Flores Vermelhas Embalagem 1 Litro,4.99,4.99
35,Limpador Uau Multiuso Lavanda 500Ml,3.39,3.39
36,Querosene Jacaré Lata 900Ml,16.99,16.99
37,Limpador Multiuso Ação Clareadora Uau 500Ml,3.39,3.39
38,Limpador Desengordurante Cozinha Limão Veja 500Ml 20% de Desconto,8.99,8.99
39,Casa e Perfume Sensazine 500Ml,4.79,4.79
40,Limpador Multiuso Uau Cloro Ativo 500Ml,7.49,7.49
41,Removedor King Embalagem 1L,19.99,19.99
42,Limpador Uau Perfumes Lavanda e Conforto Embalagem L1p800ml,4.99,4.99
43,Sapólio Radium Pó Clássico,5.19,5.19
44,Limpa Alumínio Polylar Limão 500Ml,2.49,2.49
45,Pastilha Adesiva Pato Lavanda Oferta Embalagem 3Un,7.99,7.99
46,Desinfetante Classic Floral 5 Litros,12.99,12.99
47,Limpador Uau Cloro Ativo Limpeza Pesada 500Ml,5.69,5.69
48,Tira Limo Azulim Embalagem 500Ml,4.19,4.19
49,Limpador Perfumado Uau Cuidado e Carinho Embalagem 1 Litro,4.99,4.99
50,Limpa Forno Diabo Verde Embalagem 250G,9.99,9.99
51,Limpador Sensualidad Casa e Perfume 500Ml,4.79,4.79
52,Água Sanitária Ypê 1L,3.99,3.99
53,Limpa Forno Uau 450Ml,13.99,13.99
54,Limpador Azulim Azulejo Citrus Embalagem 1L,5.99,5.99
55,Brilha-Móveis Lavanda Destac Squeeze 500Ml Grátis 20% de Desconto,9.99,9.99
56,Limpador Uau Multiuso Flores e Folhas 500Ml,3.39,3.39
57,Limpador Azulim Lavanda Embalagem 1L,6.39,6.39
58,Desinfetante Original Bruto Lysoform 1L,9.99,9.99
59,Cera Líquida Ingleza Maxx Incolor 750Ml,14.99,14.99
60,Desinfetante Pinho Sol Original 500Ml,5.49,5.49
61,Limpador Uau Requinte 500Ml,3.49,3.49
62,Limpa Piso Uau Cerâmicas 750Ml,7.99,7.99
63,Limpador Limpeza Pesada Veja X-14 Grátis 20% de Desconto Frasco 500Ml,5.89,5.89
64,Desinfetante Ypê Bak Lavanda 500Ml,3.29,3.29
65,Limpador Diluível Ajax Fresh 500Ml,7.49,7.49
66,Limpador Multiuso com Álcool Brilho Instantâneo Uau Frasco 500Ml,3.39,3.39
67,Limpador Cif Original Embalagem Leve 500Ml Pague 400Ml,3.99,3.99
68,Água Sanitária Superglobo Embalagem 1L,3.49,3.49
69,Desinfetante Batuta Floral Embalagem 2L,6.99,6.99
70,Limpador Desengordurante Cozinha Laranja Mr Músculo 400Ml,8.29,8.29
71,Lustra Móveis Líquido Lavanda Embeleza Bravo 200Ml,6.59,6.59
72,Soda Caustica Escorpião Embalagem 500G,13.69,13.69
73,Limpador Uau Perfumes Cuidado e Carinho 500Ml,3.49,3.49
74,Desinfetante Ypê Bak Floral 500Ml,3.49,3.49
75,Limpador Uau Flores e Sonhos 500Ml,3.49,3.49
76,Limpador Perfumado Uau Requinte Embalagem 1 Litro,4.99,4.99
77,Pedra Sanitária Marine Oferta Pato,3.49,3.49
78,Limpador Multiuso Veja Lavanda e Álcool Oferta 500Ml,4.29,4.29
79,Desinfetante Pinho Sol Original 1000Ml,9.99,9.99
80,Limpador Uau Multiuso Cloro Ativo 5 em 1 Lavanda 500Ml,7.99,7.99
81,Desinfetante Pinho Sol Lavanda 1000Ml,9.99,9.99
82,Desinfetante Classic Eucalipto 5 Litros,12.99,9.99
83,Desengordurante Multiuso Limão Classic 500Ml,3.69,3.69
84,Desinfetante Santa Clara Herbal Embalagem 2 Litros,6.49,6.49
85,Desinfetante Batuta Lavanda Embalagem 1 Litro,3.99,3.99
86,Desinfetante Classic Jasmim Embalagem 2 Litros,4.29,4.29
87,Cera Líquida para Piso de Pedra Ardósia Verde Ingleza Embalagem 750Ml,8.99,8.99
88,Limpador Multiuso Uau Flores e Frescor Ingleza 500Ml,3.39,3.39
89,Limpador Multiuso Ypê Controle de Odor 500Ml,3.99,3.99
90,Desinfetante Pinho Trop Pinho e Menta 500Ml,3.29,3.29
91,Limpador Multiuso Classic Tradicional 500Ml,2.89,2.89
92,Desinfetante Classic Floral Embalagem 2 Litros,4.29,4.29
93,Uau Cloro Ativo Limpa sem Esforço 4 em 1 Embalagem 500Ml,15.99,15.99
94,Limpador Uau Harmonia 500Ml,3.49,3.49
95,Cera Líquida Nugget Preto 33% de Desconto Embalagem 60Ml,14.99,14.99
96,Óleo de Peroba King 100Ml,7.99,7.99
97,Limpador Perfumado Uau Flores e Sonhos Embalagem Leve 1 Litro Pague 800Ml,4.99,4.99
98,Desinfetante Eucalipto Santa Clara 2L,6.49,6.49
99,Desinfetante Pinho Ypê Lavanda 500Ml,4.99,4.99
100,Pedra Sanitária Bouquet de Lavanda Glade 25G,3.39,3.39
101,Sapólio Radium Pedra Clássico 200G,2.69,2.69
102,Limpador Uau Perfumes Brisa e Frescor Ingleza Frasco 1L 20% de Desconto,4.99,4.99
103,Desinfetante Trop Pinho Lavanda Inglesa 500Ml,3.29,3.29
104,Limpador Multiuso Veja Pitanga 500Ml,4.29,4.29
105,Limpeza Pesada Ypê Original 500Ml,5.49,5.49
106,Cloro Aditivado Floral Vim 700Ml,9.29,9.29
107,Desinfetante Classic Lavanda Embalagem 2 Litros,4.29,4.29
108,Desinfetante Ypê Bak Eucalipto 500Ml,2.99,2.99
109,Desinfetante Batuta Eucalipto Embalagem 1 Litro,3.99,3.99
110,Limpador Perfumado Super Globo Vida Marinha Embalagem 500Ml,3.99,3.99
111,Limpador Multiuso Classic Floral 500Ml,2.89,2.89
112,Pedra Sanitária Q-Odor Lavanda 40G,1.69,1.69
113,Limpeza Pesada Uau Rosas e Sedução 500Ml,5.69,5.69
114,Pedra Sanitária Bosque de Pinho Glade 25G,3.19,3.19
115,Desengordurante Veja Limão Refil 500Ml,9.99,9.99
116,Limpador Multiuso Classic Hortelã 500Ml,2.89,2.89
117,Desinfetante Uso Geral Ufe 750Ml,8.99,8.99
118,Pedra Sanitário Q-Odor Jasmim Embalagem 40G,1.69,1.69
119,Limpador Multiuso Super Globo Embalagem 500Ml,4.99,4.99
120,Limpador Perfumado Uau Concentrado Flores Vermelhas 130Ml,5.99,5.99
121,Graxa para Sapatos Nugget Pasta Preto 36G,7.59,7.59
122,Pedra Sanitária Q Odor Floral Embalagem 1Un,1.69,1.69
123,Cera Ingleza Ardosia Incolor Embalagem 750Ml,8.99,8.99
124,Desinfetante Pinho Trop Limão Embalagem 500Ml,3.29,3.29
125,Limpador Multiuso Original Veja 500Ml,3.99,3.99
126,Limpador Gel Brilhex 3 em 1 Herbal 1Kg,6.69,6.69
127,Limpa Vidros Classic Alvejante 500Ml,3.39,3.39
128,Cera Ingleza Brilhowax Incolor 850Ml,8.99,8.99
129,Limpador Brilhex Limpa Cerâmicas e Azulejos 1 Litro,6.49,6.49
130,Limpador Multiuso Rosas e Sedução Uau 500Ml,3.39,3.39
131,Limpa Uau Perfumada Flores Vermelho 500Ml,3.49,3.49
132,Limpador Acido Muriatico Mais 1L,4.99,4.99
133,Limpador Perfumado Uau Brisa Frescor 500Ml,3.49,3.49
134,Limpador Uau Perfumes Lavanda 500Ml,3.49,3.49
135,Desinfetante Classic Capim Limão e Eucalipto 5 Litros,12.99,12.99
136,Limpa Brilha Alum Brilhex Tradicional 500Ml,2.99,2.99
137,Limpa Alumínio Brilhex Plus Embalagem 500Ml,2.39,2.39
138,Soda Cáustica Indaia Embalagem 1Kg,10.99,10.99
139,Pedra Sanitária Bouquet Lavanda Embalagem com 25% de Desconto Glade 25G,3.39,3.39
140,Evita Mofo Inspira Lavanda Pote 230G,9.99,9.99
141,Eliminador de Odores Multiuso Hortelã Uau 500Ml,3.39,3.39
142,Odorizador Toque de Frescor Lavanda Aparelho + Refil Glade 12Ml,14.99,14.99
143,Neutralizador de Odores Cheirinho de Talco Bom Ar Frasco Embalagem Econômica 360Ml,9.99,9.99
144,Desodorizador Gel Pequenos Ambientes Lavanda Glade 70G,7.19,7.19
145,Odorizador Lembranças de Infância Oferta Glade 360Ml,11.99,11.99
146,Evita Mofo Limppano Inspira Embalagem 230G,9.99,9.99
147,Desodorizador e Aromatizante Toque de Frescor Lembranças de Infância Glade Refil 12Ml,10.49,10.49
148,Desodorizador Aerossol Frutas e Flores Vibrantes Glade 360Ml,11.99,11.99
149,Bom Ar Air Wick Campos de Lavanda 360Ml,9.99,9.99
150,Anti Mofo Master Embalagem 25G,4.49,4.49
151,Detergente Ypê Clear 500Ml,1.99,1.99
152,Detergente Ypê Neutro 500Ml,1.99,1.99
153,Detergente Coco Ypê 500Ml,1.99,1.99
154,Detergente Limpol Coco 500Ml,1.99,1.99
155,Detergente Ypê Capim Limão 500Ml,1.99,1.99
156,Detergente Ypê Limão 500Ml,1.99,1.99
157,Detergente Líquido Limpol Cristal Embalagem 500Ml,1.99,1.99
158,Detergente Líquido Neutro Limpol 500Ml,1.99,1.99
159,Detergente Ypê Clear Care 500Ml,1.99,1.99
160,Detergente Limpol Maçã 500Ml,1.99,1.99
161,Detergente Limpol Limão 500Ml,1.99,1.99
162,Detergente Líquido Maçã Ypê 500Ml,1.99,1.99
163,Detergente Líquido Limpol Jabuticaba 500Ml,1.99,1.99
164,Detergente Classic Maçã 500Ml,1.59,1.59
165,Limpa Alumínio em Pasta Alumil Start 500G,6.49,6.49
166,Detergente Líquido Classic Neutro 500Ml,1.59,1.59
167,Pasta Multiuso Cristal Rosa 500G,3.89,3.89
168,Detergente Líquido Classic Nature Clear 5 Litros,14.99,14.99
169,Detergente Líquido Classic Nature Neutro 5 Litros,14.99,14.99
170,Inseticida Sbp Aerosol Eucalipto 450Ml,13.69,13.69
171,Inseticida Raid Elétrico Eucalipto Pastilha Oferta Refil 12 Un,6.99,6.99
172,Inseticida Aerosol Ação Total Baygon 360Ml,9.99,9.99
173,"Inseticida Raid 30 Noites Elétrico Refil 21,9Ml",9.99,9.99
174,Inseticida Raid Mata Baratas Formigas Oferta 420Ml,14.99,14.99
175,Inseticida Detefon Espiral 10Un,3.99,3.99
176,"Repelente Elétrico Raid Líquido Refil 32,9Ml",14.79,14.79
177,Repelente Espiral Metal Baygon com 10Un,4.69,4.69
178,"Repelente Elétrico Liquido 45 Noites Refil Original Raid 32,9M",13.99,13.99
179,Inseticida Boa Noite Original Espiral 96G,2.99,2.99
180,Repelente Elétrico Raid Pastilha Oferta Refil 12Un,4.49,4.49
181,Kit Aparelho + Repelente Elétrico Líquido Sbp Refil 35Ml,9.99,9.99
182,Naftalina Master 25G,2.5,2.5
183,Inseticida Raid Aerosol Mult Insetos Base Água 420Ml,12.49,12.49
184,Inseticida Baygon Ação Total Embalagem Leve 450Ml Pague 300Ml,9.99,9.99
185,1Un Lava Roupa Omo Lavagem Perfeita 1.6Kg Grátis 150G.,16.99,16.99
186,"Lava Roupas em Pó Tixan Ypê Maciez Leve 2Kg Pague 1,9Kg",13.99,13.99
187,Sabão em Barra Neutro Ypê 1Kg,10.99,10.99
188,Sabão Omo 800G,8.99,8.99
189,Lava Roupas Tixan Ypê Primavera 1Kg,8.99,8.99
190,"Lava Roupa Brilhante Pó 1,6Kg Gratis 150G",16.99,16.99
191,Amaciante Downy Brisa do Verão 500Ml,9.99,9.99
192,Sabão em Pó Classic Plus 2Kg,9.49,9.49
193,Sabão em Pó Omo Lavagem Perfeita 400G,5.99,5.99
194,Lava Roupas em Pó Tixan Ypê Primavera 500G,4.99,4.99
195,Amaciante Classic Nature Floral 5 Litros,13.79,13.79
196,Lava Roupas em Pó Primavera Tixan Ypê 2Kg,13.99,13.99
197,Lava Roupas Tixan Ypê Maciez 1Kg,8.99,8.99
198,Lava-Roupas Líquido Omo Lavagem Perfeita Galão 3L,29.99,29.99
199,Sabão em Pó Classic Plus 1Kg,4.79,4.79
200,Amaciante Concentrado Downy Collections Adorable 500Ml,9.99,9.99
201,Amaciante Ypê Aconchego 2L,7.99,7.99
202,Amaciante Concentrado Brisa de Verão Downy 1L,15.99,15.99
203,Amaciante Concentrado Cuidado Essencial Comfort Refil 900Ml,13.99,13.99
204,"Lava Roupas em Pó Limpeza Total Brilhante 1,6Kg",14.99,14.99
205,Amaciante Concentrado Downy Lírio do Campo 1L,15.99,15.99
206,Amaciante Comfort Tradicional Explosão Azul 1.8L,12.99,12.99
207,"Lava-Roupas Pó Omo Lavagem Perfeita Sanitiza & Higieniza Caixa 1,6Kg",17.99,17.99
208,Lava Roupas em Pó Tixan Ypê Maciez 500G,4.99,4.99
209,Amaciante Downy Lirios do Campo 500Ml,9.99,9.99
210,Cloro Santa Clara Super Forte Embalagem 1 Litro,3.99,3.99
211,Tira Manchas Gel Multiuso Vanish 500Ml,8.99,8.99
212,Cloro Santa Clara Super Forte Unidade 2L,7.59,7.59
213,Detergente Líquido Lava Roupas Ariel Refil Cores Radiante 700Ml,9.99,9.99
214,Amac Mon Bijou 2L Azul,7.79,7.79
215,Amaciante Concentrado Comfort Intense Puro Cuidado 500Ml,9.99,9.99
216,Tira Manchas Vanish Roupas Brancas 450G,27.99,27.99
217,Tira Manchas Pó Vanish Roupas Coloridas Refil 400G,16.99,16.99
218,Amaciante Concentrado Downy Frescor da Primavera Embalagem 500Ml,9.99,9.99
219,Lava Roupas Brilhante Limpeza Total 400G,4.99,4.99
220,Amaciante Toque de Carinho Baby Soft 2L,7.99,7.99
221,Sabao Ype Neutro Glicerinado 200G,2.99,2.99
222,Sabão Líquido Uau Active Embalagem 3L,17.99,17.99
223,Tira Manchas Vanish Super Barra 75G,4.59,4.59
224,Tira Manchas em Pó Vanish Oxi Action Crystal White Refil 400G,17.99,17.99
225,Amaciante Baby Soft Toque Envolvente 2L,7.99,7.99
226,Lava-Roupas Pó Omo Lavagem Perfeita Sanitiza & Higieniza Caixa 800G,9.99,9.99
227,Tira Manchas Vanish Super Barra Roupas Brancas 75G,4.59,4.59
228,Lava Roupas Sanitizante em Pó Brilhante Delicadeza Total 800G,7.99,7.99
229,Lava Roupas Pó Coquel Natureza Limpa Caixa Pg800g. e Lv.1Kg,10.79,10.79
230,Amaciante Toque de Poesia Luxo Amacitel 2L,6.99,6.99
231,Sabão em Barra Minuano Glicerinado 1Kg,9.99,9.99
232,Detergente Lava Roupas em Pó Surf 5Em1 Cuidado do Coco 800G,8.49,8.49
233,Amaciante Amacitel Luxo Momento de Carinho 2L,6.99,6.99
234,Detergente Lava Roupas em Pó Surf 5Em1 Limão e Bicarbonato 800G,8.49,8.49
235,Amaciante Downy Água Fresca 500Ml,9.99,9.99
236,Amaciante Baby Soft Toque de Cuidado 2L,7.99,7.99
237,Sabão Líquido Uau Rosas e Sedução 3 Litros,17.99,17.99
238,Lava Roupas Desinfetante em Pó Brilhante Higiene Total Combate Germes e Bactérias 800G,9.99,9.99
239,Lava Roupas Sanitizante em Pó Brilhante Delicadeza Total 1.6Kg,16.99,16.99
240,Amaciante Ypê Aconchego 500Ml,3.79,3.79
241,Detergente Lava Roupas em Pó Surf 5Em1 Rosas e Flor de Lis 800G,8.59,8.59
242,Sabão em Barra Ypê Aloe Vera 1Kg,12.99,12.99
243,Amaciante Uau Glamour 2 Litros,8.99,8.99
244,Lava Roupas Desinfetante em Pó Brilhante Higiene Total Combate Germe e Bactérias 1.6Kg,15.99,15.99
245,Amaciante Concentrado Comfort Intense Cuidado Essencial 500Ml,8.99,8.99
246,Amaciante Classic Talco 2 Litros,5.99,5.99
247,Amaciante Ypê Carinho 2L,7.99,7.99
248,Sabão em Barra Ypê Multiativo 200G,2.69,2.69
249,Amaciante Baby Soft Toque de Maciez 2L,7.99,7.99
250,Sabão Pedra Ypê Glicerinado Fresh 200G,2.99,2.99
251,Amaciante Concentrado Fofo Tradicional 500Ml,7.49,7.49
252,Amaciante Amacitel Luxo Sonho Encantado 2 Litros,6.99,6.99
253,Lava Roupas em Pó Tixan Ypê Primavera 5Kg,39.99,39.99
254,Sabão em Barra com Coco e Toque de Aveia Ypê 1Kg,13.99,13.99
255,Amaciante Classic Nature Bouquet Rosa 2 Litros,5.99,5.99
256,Sabão em Pó Comfort Fiber Protect 1.6Kg,17.99,17.99
257,Amaciante Uau Sedução 2 Litros,8.99,8.99
258,Sabão Líquido Classic Plus 3 Litros,16.29,16.29
259,Sabão Gel Classic Pinho 2 Litros,9.99,9.99
260,Sabão em Barra Ypê Aloe Vera 200G,2.99,2.99
261,Amaciante Mon Bijou Harmonia 2 Litros,7.79,7.79
262,Amaciante Concentrado Ypê Liberdade 500Ml,9.99,9.99
263,Sabão Líquido para Roupas de Coco Ola 500Ml,14.79,13.99
264,Sabão em Barra Santa Clara Coco Embalagem 200G,2.99,2.99
265,Amaciante Concentrado Uau Lavanda Frescor 500Ml,7.49,7.49
266,Amaciante Concentrado Fofo Cheirinho de Infância 500Ml,7.49,7.49
267,Sabão em Barra Ypê Coco e Toque de Aveia 200G,3.29,3.29
268,Amaciante Aconchego Uau Perfumes Embalagem 2L,8.99,8.99
269,Sabão em Pasta Ufe Coco 500G,4.99,4.99
270,Amaciante Classic Floral Embalagem 2 Litros,5.99,5.99
271,Cloro Santa Clara Super Forte Embalagem 5 Litros,16.99,16.99
272,Amaciante Carinho Ypê 500Ml,3.79,3.79
273,Corante de Roupa Tingecor Guarany Turquesa 40G,3.99,3.99
274,Corante de Roupa Tingecor Guarany Bege 40G,3.99,3.99
275,Cloro Classic Extra Forte Embalagem 5 Litros,14.99,14.99
276,Sabão Glicerinado Neutro Barra Classic 5X200g,8.89,8.89
277,Esponja Santa Clara Oferta 4Un,3.99,3.99
278,Esponja de Aço Bombril Pacote 60G,1.79,1.79
279,Esponja Multiuso Esfrebom Oferta 4Un,4.99,4.99
280,Esponja de Aço Assolan 60G,1.49,1.49
281,Esponja de Aço 60G Bombril com 8Un,1.79,1.79
282,Esponja Multiuso Limpeza Pesada Limppano Pacote 4Un,4.49,4.49
283,Esponja Multiuso Wish C/ 1Un,0.99,0.99
284,Esponja Multiuso Tinindo Leve 4 Pague 3,3.59,3.59
285,Esponja Condor Multiuso Leve 4 Un Pague 3 Un,3.99,3.99
286,Luva Esfrebom 1Par,12.99,12.99
287,Prendedor Madeira Keeprend Embalagem 12 Un,2.19,2.19
288,Esponja de Limpeza Extrema Scotch-Brite 4Un,5.99,5.99
289,Esponja Esfrebom Não Risca 1Un,2.99,2.99
290,Esponja Multiuso Esfrebom,1.49,1.49
291,Esponja Brilhus Multiuso 1 Unidade,0.89,0.89
292,Escova para Roupas Condor Oval Madeira Embalagem 1 Un,2.99,2.99
293,Vassoura Bettanin Noviça com Cabo,17.99,17.99
294,Rodo para Piá Plasútil 16Cm 1 Unidade,7.99,7.99
295,Escova Noviça Limpeza Delicada 1Un,4.99,4.99
296,Saco de Lixo Baianinha Super Forte 50L 30 Un,14.99,14.99
297,Escova Bettanin Rec Rec Cozinha Noviça,8.99,8.99
298,Esponja Prateada Scotch-Brite,6.99,6.99
299,Vassoura Bettanin Varry 1000 com Cabo,16.99,16.99
300,Esponjas Buchabrilho Inoxidavel Embalagem 1 Un,3.49,3.49
301,Rodo Brilhus Médio 1Un,20.99,20.99
302,Esponja Esfrebom Prateada Embalagem 1 Un,4.99,4.99
303,Escova Noviça Bettajeans 1Un,5.79,5.79
304,Esponja Esfrebom Protege Unhas 1Un,3.99,3.99
305,Vassoura Madri Condor com Cabo,12.99,12.99
306,Escova Sanitária com Pote Branca Sanilux 1Un,16.89,16.89
307,Pa de Lixo Cabo Longo Nitronplast Embalagem 1 Un,8.99,8.99
308,Palha de Aço Brilho Fácil N°0 Embalagem 25G,1.49,1.49
309,Vassoura Brilhus Multiuso com Cabo,12.99,12.99
310,Vassoura Bettanin Casa e Rua com Cabo,19.99,19.99
311,Palha de Aço Açobom N2 Embalagem 22G,1.29,1.29
312,Lã de Aço Q'lustro Pacote 8 Un,1.7,1.7
313,Escova Noviça Adapt 1Un,14.99,14.99
314,Esponja de Limpeza Metálica Inox Limppano 1Un,3.99,3.99
315,Pá para Lixo Noviça Clipa 1Un,10.99,10.99
316,Pá de Lixo Ercaplast de Plástico 1 Un,6.0,6.0
317,Esponja Kharis Lava Car 1Un,7.79,7.79
318,Palha de Aço Açobom N0 Embalagem 22G,1.3,1.3
319,Escova Sanilux sem Pote 1Un,11.99,11.99
320,Saco Alvejado Pasqualini 1Un,8.99,8.99
321,Saco de Lixo Super Forte 30 Litros Embalagem 50 Un,14.99,14.99
322,Esponja Multiuso Flash Limp Aço Inox Embalagem 1Un,3.99,3.99
323,Rodo Plástico Purezitta Puxa Seca 40Cm 1Un,12.99,12.99
324,Vassoura Purezitta Piaçava Nº5 1Un,26.99,26.99
325,Rodo Purezitta Puxa Seca 30Cm 1Un,10.99,10.99
326,Rodo Distak Plástico 30Cm 1 Un,11.99,11.99
327,Saco de Lixo Baianinha 100 L C/10 Unid.,14.99,14.99
328,Palha de Aço Número 1 Açobom 22G,1.29,1.29
329,Vassoura Purezitta Piaçava 1Un Ref 00001,23.99,23.99
330,Pano Microfibra Ferreira G,5.99,5.99
331,Saco Sacaria Alvejado T-24 Medeiros,8.99,8.99
332,Açúcar Cristal Laçúcar 5Kg,16.99,16.99
333,Açúcar Cristal LAçúcar Embalagem 2Kg,7.99,7.99
334,Açúcar Cristal Laçúcar Embalagem 1Kg,3.69,3.69
335,Adoçante Sacarina Zero Cal 100Ml,5.49,5.49
336,Adoçante Sacarina Zero Cal 200Ml,10.99,10.99
337,Adocante Linea Sucralose 25Ml,5.99,5.99
338,Adoçante Líquido Stevia Linea 60Ml,15.99,15.99
339,Adoçante Líquido Assugrin Embalagem 100Ml,6.99,6.99
340,Açúcar Cristal Cristal de Minas 1Kg,3.99,3.99
341,Açúcar Mascavo Contemper 500G,7.99,7.99
342,Açúcar Cristal Brucucar 5Kg,16.99,16.99
343,Arroz Tia Ju 5Kg,23.99,23.99
344,Arroz Tipo 1 Super Ecco Pacote 5Kg,18.99,18.99
345,Arroz Tipo 1 Super Ecco Pacote 2Kg,9.99,9.99
346,Arroz Tipo 1 Pilecco Nobre Pacote 5Kg,26.99,26.99
347,Arroz Tipo 1 Super Ecco Pacote 1Kg,6.29,6.29
348,Arroz Parboilizado Prato Fino Tipo 1 Pacote 5Kg,27.99,27.99
349,Arroz Tipo 1 Prato Fino Agulinha Embalagem 1Kg,6.99,6.99
350,Arroz Tipo 1 Prato Fino Pacote 5Kg,26.99,26.99
351,Arroz Integral Prato Fino Pacote 1Kg,6.99,6.99
352,Arroz Tipo 1 Pilecco Nobre Pacote 1Kg,6.49,6.49
353,Arroz Tipo 1 Parboilizado Pilecco Nobre Pacote 5Kg,26.99,26.99
354,Arroz Tipo 2 Trivial Pacote 5Kg,18.99,18.99
355,Arroz Integral Pilecco Nobre Pacote 1Kg,8.79,8.79
356,Arroz Carnaroli Pileco Nobre 1Kg,19.99,19.99
357,Arroz Pró-Integral Grãos do Sul com Linhaça Pilecco Nobre 1Kg,9.99,9.99
358,Arroz Branco Uai Tchê 5Kg,19.99,19.99
359,Arroz Tipo 1 Prato Fino Embalagem 2Kg,13.99,13.99
360,Fubá Mimoso Fino Sinhá 1Kg,4.99,4.99
361,Tapioca Pacha Embalagem 500G,4.89,4.89
362,Farofa Pronta Yoki Temperada 500G,6.39,6.39
363,Farinha de Trigo Tia Ofélia Tipo 1 Embalagem 1Kg,3.99,3.99
364,Farinha de Trigo Vilma Pacote 1Kg,4.89,4.89
365,Farinha Panko Pink Embalagem 200G,6.39,6.39
366,Cuscuz Sinhá 500G,2.79,2.79
367,Flocos de Milho Anchieta Flocão 500G,3.69,3.69
368,Amido de Milho Pacha Embalagem 500G,3.69,3.69
369,Amido de Milho Anchieta 500G,3.99,3.99
370,Farinha de Mandioca Torrada Anchieta Embalagem 1Kg,5.29,5.29
371,Farofa de Mandioca Tradicional Yoki Embalagem 250G,3.19,3.19
372,Farinha de Trigo com Fermento Vilma 1Kg,4.99,4.99
373,Tapioca Anchieta Hidratada 500G,4.35,4.35
374,Farofa de Mandioca Anchieta Temperada 250G,2.79,2.79
375,Amido de Milho Maizena Tradicional 200G,3.99,3.99
376,Farinha de Milho Flocada Yoki Kimilho Flocão 500G,3.99,3.99
377,Tapioca Pink 500G,5.99,5.99
378,Farinha de Mandioca Pachá Torrada Embalagem 1Kg,4.79,4.79
379,Farinha de Mandioca Zumbi Torradinha 1Kg,4.89,4.89
380,Farinha de Rosca Pink Embalagem 500G,3.99,3.99
381,Farofa Pronta de Mandioca Pacha Sabor Bacon Embalagem 300G,1.99,1.99
382,Farinha de Mandioca Zumbizinha 1Kg,3.79,3.79
383,Amido de Milho Pink Embalagem 500G,3.99,3.99
384,Fubá Mimoso Pacha Embalagem 1Kg,5.29,5.29
385,Farinha de Mandioca Pink Branca Embalagem 1Kg,4.69,4.69
386,Farinha de Mandioca Pink Torrada Fina Embalagem 1Kg,4.99,4.99
387,Farofa de Milho Pronta Yoki 500G,5.99,5.99
388,Farinha de Mandioca Anchieta Branca 1Kg,4.19,4.19
389,Polvilho Azedo Pink Embalagem 1Kg,9.99,9.99
390,Amido Milho Maizena 500G,8.99,8.99
391,Fubá Pink Embalagem 1Kg,4.99,4.99
392,Fubá Mimoso Anchieta 1Kg,5.39,5.39
393,Farinha de Milho Pink Pacote 500G,4.39,4.39
394,Farofa Pronta Pacha Sabor Picanha Picante Embalagem 300G,1.99,1.99
395,Farinha Flocão de Milho Pachá 500G,3.89,3.89
396,Polvilho Azedo Anchieta Embalagem 1Kg,7.99,7.99
397,Farofa Pronta de Mandioca Pacha Embalagem 250G,2.79,2.79
398,Farinha de Mandioca Pacha Branca Embalagem 1Kg,4.19,4.19
399,Farinha de Milho Anchieta Biju 500G,4.39,4.39
400,Farinha de Milho Biju Pacha 500G,4.29,4.29
401,Farofa de Milho Pacha Embalagem 300G,2.59,2.59
402,Farofa Pronta Bacon Anchieta 250G,2.79,2.79
403,Farinha de Mandioca Torrada Zumbi Embalagem 1Kg,4.59,4.59
404,Farinha de Rosca Pacha 500G,4.39,4.39
405,Farinha de Mandioca Mais 1Kg,3.79,3.79
406,Farofa de Mandioca Pronta Pacha Embalagem 300G,1.99,1.99
407,Farofa Pronta Anchieta Picante 250G,2.79,2.79
408,Fubá Mimoso Anchieta 500G,2.79,2.79
409,Proteína de Soja Contemper 300G,11.99,11.99
410,Farinha de Linhaça Marrom Contemper 200G,7.99,7.99
411,Farinha de Rosca Anchieta Embalagem 500G,4.19,4.19
412,Tapioca Zumbizinha 500G,3.69,3.69
413,Extrato de Soja Contemper 250G,10.99,10.99
414,Polvilho Azedo Olinda 25Kg,126.22,126.22
415,Fubá Grosso Anchieta Embalagem 5Kg,17.99,17.99
416,Farinha de Milho Anchieta Torrada Moída 1Kg,9.29,9.29
417,Polvilho Doce Marinez 1Kg,7.99,7.99
418,Farinha de Mandioca Biju Pacha Embalagem 300G,1.79,1.79
419,Proteina de Soja Grossa Contemper 200 Gramas,8.99,8.99
420,Fubá Mimoso Zumbizinha 1Kg,3.99,3.99
421,Farelo de Trigo Contemper 250G,4.49,4.49
422,Farofa Pronta de Mandioca Anchieta Carne Seca Embalagem 250G,2.79,2.79
423,Feijão Carioca Jóia Rara 1Kg,7.99,7.99
424,Feijão Preto Jóia Rara 1Kg,7.99,7.99
425,Feijão Roxo Pink Embalagem 1Kg,10.99,10.99
426,Feijão Carioca Premium Tipo 1 Zumbi 1Kg,6.49,6.49
427,Feijão Branco Pachá Embalagem 500G,8.19,8.19
428,Feijão Carioca Rapidim 1Kg,6.99,6.99
429,Feijão Preto Ligeirinho Embalagem 1Kg,6.49,6.49
430,Milho de Pipoca Pacha 500G,4.19,4.19
431,Canjica de Milho Pink Embalagem 500G,3.59,3.59
432,Milho para Pipoca Yoki 500G,3.89,3.89
433,Milho para Pipoca Anchieta 500G,3.99,3.99
434,Milho Pipoca Pacha Premium 500G,4.59,4.59
435,Milho para Pipoca Tipo 1 Yoki Premium 500G,5.49,5.49
436,Milho para Pipoca Pink Embalagem 500G,4.99,4.99
437,Pipoca Microondas Pacha Bacon 100G,1.79,1.79
438,Canjica Branca Pacha Embalagem 500G,4.29,4.29
439,Milho para Pipoca Pink Embalagem 500G,4.39,4.39
440,Trigo para Kibe Pachá Embalagem 500G,4.19,4.19
441,Canjica de Milho Pacha Amarela Embalagem 500G,2.39,2.39
442,Canjiquinha Amarela Pacha 500G,2.69,2.69
443,Milho Pipoca Anchieta Premium 500G,4.39,4.39
444,Pipoca para Micro-Ondas Natural com Sal,1.89,1.89
445,Pipoca de Microondas Popcorn Manteiga de Cinema Yoki 100G,1.89,1.89
446,Pipoca de Microondas Temperada com Toque de Chef Yoki 100G,1.89,1.89
447,Canjiquinha Anchieta 500G,2.49,2.49
448,Canjiquinha Pink Amarela 500G,2.69,2.69
449,Pipoca Microondas Pacha Manteiga Suave 100G,1.79,1.79
450,Pipoca de Microondas Yoki Popcorn Manteiga 100G,1.89,1.69
451,Ervilha Seca Pachá 500G,6.99,6.99
452,Trigo para Quibe Pink Embalagem 500G,3.99,3.99
453,Grão de Bico Pachá 500G,7.99,7.99
454,Canjica Branca Anchieta 500G,3.99,3.99
455,Pipoca Microondas Pacha Queijo 100G,1.79,1.79
456,Pipoca para Microondas Yoki Manteiga Embalagem 100G,1.89,1.89
457,Pipoca Microondas Pacha Natural 100G,1.79,1.79
458,Pipoca de Micro-Ondas Sabor Bacon Yoki 100G,1.89,1.89
459,Pipoca para Microondas Anchieta Queijo Embalagem 100G,1.79,1.79
460,Trigo para Quibe Anchieta 500G,3.99,3.99
461,Pipoca de Microondas Yoki Sabor Natural Pacote 100G,1.89,1.89
462,Pipoca para Microondas Anchieta Natural 100G,1.79,1.79
