,Produto,Preço Base,Preço Final
0,Água Sanitária Classic 5 Litros,12.99,12.99
1,Água Sanitária Super Globo Embalagem 5 Litros,14.99,14.99
2,Álcool Etílico Hidratado 70º Inpm Uzu 1L,7.99,7.99
3,Álcool Líquido 70º Inpm Flop's 1L,7.99,7.99
4,Limpador Multiuso Veja 10% Desconto 500Ml,4.99,4.99
5,Água Sanitária Marina Embalagem 2L,5.69,5.69
6,"Agua Sanitaria Super Globo Pague 1,8Ltr Leve 2Ltr",6.99,4.99
7,Desinfetante Marina Lavanda 2L,5.99,5.99
8,Água Sanitária Classic Embalagem 2 Litros,5.69,5.69
9,Água Sanitária Santa Clara Embalagem 2 Litros,6.49,6.49
10,Água Sanitária Clarix 2 Litros,5.69,5.69
11,Água Sanitária Santa Clara Embalagem 1 Litro,3.49,3.49
12,Água Sanitária Ypê 2L,8.99,8.99
13,Querosene Jacaré Lata 900Ml,24.99,24.99
14,Limpador Uau Multiuso Desengordurante Limão Siciliano 500Ml,4.69,4.69
15,Limpador Multiuso Uau Rosas Sedução 500Ml,4.69,4.69
16,Limpador Multiuso Super Globo Floral Embalagem 500Ml,3.99,3.99
17,Limpador Brilhalumínio Tradicional Embalagem 500Ml,2.99,2.99
18,Saponáceo Cremoso Multiuso Limão Bom Bril Sapólio Radium 250Ml,9.99,9.99
19,Pastilha Adesiva Pato Lavanda Oferta Embalagem 3Un,9.99,9.99
20,Limpador Sensazione Casa & Perfume 1L,7.99,7.99
21,Super Cloro Classic Extra Forte 2L,7.99,7.99
22,Limpador Uau Multiuso Flores e Folhas 500Ml,4.69,4.69
23,Limpador Cremoso Cif Original 450Ml,12.99,12.99
24,Limpador Sanitário Limpeza Profunda Gel Marine Pato 750Ml,14.99,14.99
25,Desengordurante Uau Squeeze 500Ml,8.99,8.99
26,Limpador Uau Multiuso Lavanda 500Ml,4.69,4.69
27,Desinfetante Marina Marine Embalagem 2 Litros,5.99,5.99
28,Limpador Uau Perfumes Cuidado e Carinho 500Ml,4.49,4.49
29,Limpador Uau Perfumes Flores Vermelhas e Sedução 500Ml,4.49,4.49
30,Desinfetante Original Bruto Lysoform 1L,12.99,12.99
31,Lustra Móveis Poliflor Lavanda 200Ml,8.99,8.99
32,Cera Líquida Special Taco/Madeiras Ingleza Maxx 750Ml,16.99,16.99
33,Desinfetante Santa Clara Herbal Embalagem 2 Litros,6.99,5.69
34,Limpador Uau Cloro Ativo Limpeza Pesada 500Ml,7.99,7.99
35,Limpador Desengordurante Cozinha Laranja Mr Músculo 400Ml,11.99,11.99
36,Desinfetante Ypê Bak Lavanda 500Ml,3.99,3.99
37,Limpador Azulim Lavanda Embalagem 1L,7.99,7.99
38,Bry Lustra Móveis de Lavanda Ingleza 200Ml,6.99,6.99
39,Limpador Multiuso Uau Cloro Ativo 500Ml,8.99,8.99
40,Pastilha Adesiva Floral Pato 3 Unidades,9.99,9.99
41,Desinfetante Ypê Bak Floral 500Ml,3.99,3.99
42,Limpador Uau Flores e Sonhos 500Ml,4.49,4.49
43,Desinfetante Pinho Trop 1L,7.99,7.99
44,Limpador Perfumado Uau Cuidado e Carinho Embalagem 1 Litro,6.99,6.99
45,Limpador Diluível Ajax Fresh Limão 500Ml,6.99,6.99
46,Limpador para Banheiro X14 Tira Limo Refil Veja 500Ml,14.99,14.99
47,Limpador Multiuso Veja Floral 500Ml,4.99,4.99
48,Limpador Uau Perfumes Lavanda e Conforto Ingleza Embalagem 500Ml,4.49,4.49
49,Limpador Multiuso Ação Clareadora Uau 500Ml,4.69,4.69
50,Limpador Multiuso Veja Floral Oferta 500Ml,4.99,4.99
51,Água Sanitária Superglobo Embalagem 1L,3.99,3.99
52,Desinfetante Batuta Floral Embalagem 2L,7.99,7.99
53,Limpador Multiuso Veja Campestre Oferta 10% de Desconto 500Ml,4.99,4.99
54,Limpador Multiuso Veja Gold Campestre 500Ml,4.99,4.99
55,Desinfetante Batuta Lavanda Embalagem 2L,7.99,7.99
56,Lustra Móveis Flores e Folhas Uau 200Ml,6.99,6.99
57,Cera Líquida para Piso de Pedra Ardósia Verde Ingleza Embalagem 750Ml,11.99,11.99
58,Desinfetante Lavanda Pinho Sol 500Ml,6.99,6.99
59,Álcool Mega Gel Neutro 70º Embalagem 500Ml,7.99,7.99
60,Limpador Uau Brisa Frescor 500Ml,4.49,4.49
61,Desinfetante Pinho Sol Original 500Ml,6.99,6.99
62,Limpador Mr Músculo Limpa Limo Oferta 500Ml,24.99,24.99
63,Limpa Forno Diabo Verde Embalagem 250G,12.99,12.99
64,Limpador Multiuso Super Globo Lavanda 500Ml,3.99,3.99
65,Cera Líquida Ingleza Maxx Incolor 750Ml,16.99,16.99
66,Pedra Sanitária Santa Clara Lavanda Unidade 25G,2.49,2.49
67,Cloro Aditivado Vim Original 700 Ml,11.99,11.99
68,Pedra Sanitária Marine Oferta Pato,3.99,3.99
69,Álcool Líquido Flops 96 Embalagem 500Ml,5.99,5.99
70,Soda Caustica Escorpião Embalagem 500G,16.99,16.99
71,Desinfetante Líquido Original Lysoform 500Ml,6.99,6.99
72,Desinfetante Marina Floral Embalagem 2 Litros,5.99,5.99
73,Limpador Bela Flore Casa e Perfume 500Ml,4.99,4.99
74,Limpa Piso Uau Cerâmicas 750Ml,9.99,9.99
75,Desinfetante Marina Eucalipto Embalagem 2L,5.99,5.99
76,Desinfetante Santa Clara Floral Embalagem 2 Litros,6.99,5.69
77,Limpador Multiuso Floral Uau Embalagem 500Ml,4.69,4.69
78,Limpador Multiuso Ypê Controle de Odor 500Ml,4.99,4.99
79,Desinfetante Pinho Sol Lavanda Oferta 500Ml,6.99,6.99
80,Desinfetante Pinho Trop Fresh 500Ml,4.69,4.69
81,Cera Líquida Ingleza Max Ardosia Verde Embalagem 750Ml,16.99,16.99
82,Cera Super Tacolac 500Ml,12.99,12.99
83,Limpador Multiuso Cremoso Limão Cif 250Ml,7.99,7.99
84,Limpador de Cozinha Mr Músculo Oferta 500Ml,16.99,16.99
85,Limpador Casa e Perfume Intuizione New Embalagem 1L,7.99,7.99
86,Pedra Sanitária Bosque de Pinho Oferta Glade 25G,3.99,3.99
87,Limpador Multiuso Veja Lavanda e Álcool 500Ml,4.99,4.99
88,Desinfetante Pinho Sol Original 1000Ml,12.99,12.99
89,Limpador Multiuso Limpol Clássico 500Ml,3.99,3.99
90,Desinfetante Classic Jasmim Embalagem 2 Litros,5.99,5.99
91,Lustra Móveis Bry Jasmim Embalagem 200Ml,6.99,6.99
92,Limpador Diluível Ajax Fresh 500Ml,6.99,6.99
93,Limpador Multiuso Uau Flores e Frescor Ingleza 500Ml,4.69,4.69
94,Limpador Mistero Di Amore Casa & Perfume 1L,7.99,7.99
95,Desinfetante Suave Odor Lysoform Bruto Bombril 1L,12.99,12.99
96,Limpador Multiuso Super Globo Original Embalagem 500Ml,3.99,3.99
97,Limpador Multiuso Limpol com Álcool 500Ml,3.99,3.99
98,Desinfetante Trop Pinho Lavanda Inglesa 500Ml,4.69,4.69
99,Óleo de Peroba King 100Ml,8.99,8.99
100,Desinfetante Classic Floral Embalagem 2 Litros,5.99,5.99
101,Limpador Uau Multiuso Folhas Verdes Embalagem 500Ml,4.69,4.69
102,Limpador Mr Músculo Cozinha Oferta Embalagem 500Ml,14.99,14.99
103,Desinfetante Eucalipto Santa Clara 2L,6.99,5.69
104,Desinfetante Ypê Bak Eucalipto 500Ml,3.99,3.99
105,Limpa Piso Elimina Odores Super Globo 750Ml,8.99,8.99
106,Limpador Uau Desengordurante 500Ml,12.99,12.99
107,Desinfetante Batuta Oceano Ação Limpa Pisos Elimina Germes e Bactérias Embalagem 2L,7.99,7.99
108,Cera Líquida Nugget Preto 33% de Desconto Embalagem 60Ml,19.99,19.99
109,Desinfetante Pinho Trop Pinho e Menta 500Ml,4.69,4.69
110,Desinfetante Pinho Trop Fresh Leve 1000Ml Pague 900Ml,7.99,7.99
111,Limpador Multiuso Limpol Limão 500Ml,3.99,3.99
112,Desinfetante Batuta Eucalipto Embalagem 2L,7.99,7.99
113,Limpa Vidro Super Globo 500Ml,6.99,6.99
114,Limpador Perfumado Paixão Super Globo Embalagem 500Ml,3.99,3.99
115,Limpador Multiuso Classic Floral 500Ml,3.29,3.29
116,Desinfetante Marina Pinho Embalagem 2L,5.99,5.99
117,Desinfetante Super Globo Eucalipto 2 Litros,6.99,6.99
118,Limpa Forno Easy Off 250Ml,16.99,16.99
119,Anil Líquido Colman 200Ml,19.99,19.99
120,Limpador Multiuso Super Globo Campestre Embalagem 500Ml,3.99,3.99
121,Limpador Multiuso Pratice Limpol Floral Embalagem 500Ml,3.99,3.99
122,Limpador Limpeza Pesada 4 em 1 Alta Performance Uau 500Ml,6.99,6.99
123,Limpador Multi Uso Clareadora Super Globo 500Ml,4.99,4.99
124,Desinfetante Pinho Trop Citrus Leve 1000Ml Pague 900Ml,7.99,7.99
125,Desinfetante Pinho Trop Pínho Menta Embalagem Leve 1L Pague 900Ml,7.99,7.99
126,Desinfetante Pinho Trop Limão Embalagem 500Ml,4.69,4.69
127,Graxa para Sapato em Pasta Preta Nugget Lata 36G,12.99,12.99
128,Cera Líquida para Sapato Nugget Incolor 60Ml,19.99,19.99
129,Limpador Multiuso Super Globo Embalagem 500Ml,5.99,5.99
130,Limpador Perfumado Super Globo Jardim Embalagem 500Ml,3.99,3.99
131,Limpador Multiuso Squeeze com Alcool Super Globo 500Ml,3.99,3.99
132,Graxa para Sapato em Pasta Marrom Nugget Lata 36G,12.99,12.99
133,Limpa Piso Super Globo Acao Clareadora 750Ml,8.99,8.99
134,Desinfetante Marina Erva Doce Embalagem 2 Litros,5.99,5.99
135,Desinfetante Ufe Tradicional Embalagem 1L,11.99,11.99
136,Desinfetante Panter Aromas Lavanda 500Ml,7.99,7.99
137,Cera Panter Piso Pedra Verde 850Ml,11.99,11.99
138,Desinfetante Panter Lavanda 750Ml,3.99,3.99
139,"Álcool Uzu Cean 92,8% 1Lt",9.99,9.99
140,Limpeza Diária Aromas Floral Panter,7.99,7.99
141,Multiuso Mil Floral 500Ml,3.69,3.69
142,Pedra Sanitária Eucalipto Santa Clara Embalagem 25G,2.49,2.49
143,Cera Liquida Incolor Panter Wax Embalagem 850 Ml,11.99,11.99
144,Cera Líquida Incolor Auto Brilho Panter Plus 850Ml,13.99,13.99
145,Cera Panter Polly Mil Incolor 750Ml,10.99,10.99
146,Desinfetante Pinho Panter Marine 2L,6.99,6.99
147,Limpador Multiuso Super Globo Citrus 500Ml,3.99,3.99
148,Pinho Tradicional Panter,6.99,6.99
149,Pedra Sanitária Santa Clara Floral Unidade 25G,2.49,2.49
150,Cera Liquida Incolor Panter Plus 850Ml,13.99,13.99
151,"Limpador Classic Limpa Porcelanato 1,5 Litro",11.99,11.99
152,Desinfetante Panter Lavanda 2 Litros,6.99,6.99
153,Limpa Ar Condicionado Lavanda Mundial Prime 200Ml,19.99,19.99
154,Desinfetante Panter Pinho Tradicional 500Ml,3.99,3.99
155,Cloro Clarix 2L,7.99,7.99
156,Pedra Sanitária Santa Clara Tutti Frutti Unidade 25G,2.49,2.49
157,Limpa Brilha Alum Brilhex Tradicional 500Ml,2.99,2.99
158,Desinfetante Panter Eucalipto 2 Litros,6.99,6.99
159,Ácido Muriático Mais Embalagem 1 Litro,6.99,6.99
160,Eliminador de Odores Multiuso Hortelã Uau 500Ml,4.69,4.69
161,Pastilha Adesiva Pato Citrus 20% de Desconto 3Un,9.99,9.99
162,Essência de Eucalipto Marina 140Ml,9.99,9.99
163,Desodorizador Aerossol Frutas e Flores Vibrantes Glade 360Ml,14.99,14.99
164,Difusor de Aromas Sensação Citronela Secar Embalagem 100Ml,22.99,22.99
165,Essência Aromatec Violeta 140Ml,9.99,9.99
166,Odorizador Toque de Frescor Infância Glade 12Ml,16.99,16.99
167,Essência de Lavanda Marina 140Ml,9.99,9.99
168,Aromatizante Kharis Spray Lava 60Ml,13.99,13.99
169,Desodorizador Gel Pequenos Ambientes Lavanda Glade 70G,9.99,9.99
170,Desodorizador Gel Pequenos Ambientes Citrus Glade 70G,9.99,9.99
171,Aromatizante Kharis Spray Carr 60Ml,13.99,13.99
172,Antimofo Secar Kids 80 Gr,3.69,3.69
173,Detergente Ypê Clear 500Ml,2.89,2.89
174,Detergente Ypê Neutro 500Ml,2.89,2.89
175,Detergente Coco Ypê 500Ml,2.89,2.89
176,Detergente Limpol Coco 500Ml,2.69,1.99
177,Detergente Líquido Limpol Cristal Embalagem 500Ml,2.69,1.99
178,Detergente Ypê Limão 500Ml,2.89,2.89
179,Detergente Ypê Clear Care 500Ml,2.89,2.89
180,Detergente Ypê Capim Limão 500Ml,2.89,2.89
181,Detergente Líquido Neutro Limpol 500Ml,2.69,1.99
182,Detergente Líquido Lava Louças Minuano 1300 Neutro 500Ml,2.69,2.69
183,Detergente Líquido Lava Louça Minuano 1300 Coco 500Ml,2.69,2.69
184,Detergente Limpol Maçã 500Ml,2.69,1.99
185,Detergente Micelar Minuano 500Ml,2.69,2.69
186,Detergente Líquido Lava Louças Minuano 1300 Marine 500Ml,2.69,2.69
187,Detergente Líquido Suprema Coco Embalagem 500Ml,2.29,2.29
188,Detergente Limpol Limão 500Ml,2.69,1.99
189,Lava-Louças Líquido Clear Minuano Embalagem 500Ml,2.69,2.69
190,Detergente Líquido Maçã Ypê 500Ml,2.89,2.89
191,Detergente Lava Louças Minuano 1300 Limão Líquido 500Ml,2.69,2.69
192,Detergente Líquido Lava Louça Minuano 1300 Maçã 500Ml,2.69,2.69
193,Limpa Alumínio em Pasta Alumil Start 500G,9.99,9.99
194,Inseticida Mat Inset Multi Cintronela 360Ml,12.99,9.99
195,Inseticida Kaocid Carbaril Pó Lata 50G,7.99,7.99
196,Naftalina Sanilar em Bolas Embalagem 50G,2.99,2.99
197,Inseticida Raid Ação Total 285Ml,14.99,14.99
198,K-Othrine 30Ml,11.99,11.99
199,Inseticida Raid Multi Insetos Base Água 420Ml,14.99,14.99
200,Inseticida Citronela Sbp 380Ml,14.99,14.99
201,Inseticida Raid Acqua Protec Aerosol 420Ml,14.99,14.99
202,Inseticida Raid Multi Insetos Eucalipto Oferta 420Ml,14.99,14.99
203,"Repelente Elétrico Liquido 45 Noites Aparelho e Refil Original Raid 32,9M",16.99,16.99
204,Inseticida Raid Multi Insetos Citronela Oferta 420Ml,14.99,14.99
205,Inseticida Mat Inset Multi Inseticidas Aerosol 360Ml,12.99,9.99
206,Inseticida Baygon Multi Insetos 285Ml,12.99,12.99
207,Repelente Elétrico Raid Pastilha Oferta Refil 12Un,5.99,5.99
208,Inseticida Aerosol Ação Total Óleo de Eucalipto Baygon 360Ml,12.99,12.99
209,Inseticida Aerosol Ação Total Baygon 360Ml,12.99,12.99
210,Inseticida Mata Baratas Baygon 360Ml,12.99,12.99
211,Inseticida Aerossol Ultra Baygon Embalagem Econômica 360Ml,12.99,12.99
212,Repelente Espiral Metal Baygon com 10Un,6.99,6.99
213,Inseticida Multi Mat Inset Eucalipto Embalagem 400Ml Grátis +33%,12.99,9.99
214,Sbp Repelente Elétrico Líquido 45 Noites 50% Grátis 2ª Unidade 35Ml,19.99,19.99
215,Inseticida Detefon Espiral 10Un,4.99,4.99
216,Kit Aparelho + Repelente Elétrico Líquido Sbp Refil 35Ml,14.99,14.99
217,Inseticida Sbp Óleo de Eucalipto 380Ml,14.99,14.99
218,Inseticida Aerossol Mata Baratas e Formigas Raid 285Ml,14.99,14.99
219,Sbp Multi Inseticida Aerossol Embalagem Econômica 380Ml,14.99,14.99
220,Inseticida Espiral Alladin Boa Noite 10Un,3.99,3.99
221,Formicida Granulado Fortex 50G,1.99,1.99
222,1Un Lava Roupa Omo Lavagem Perfeita 1.6Kg Grátis 150G.,24.99,24.99
223,Lava-Roupas Pó Lavagem Perfeita Omo 800G,13.99,13.99
224,Sabão em Pó Omo Lavagem Perfeita 400G,7.99,7.99
225,Sabão em Barra Neutro Ypê 1Kg,14.99,14.99
226,Cloro Marina 5L,16.99,16.99
227,Amaciante Downy Brisa do Verão 500Ml,10.99,10.99
228,Lava Roupas em Pó Cuidado Total Brilhante Sachê 1.6Kg,21.99,21.99
229,"Amaciante de Roupa Aconchego Ypê Frasco Leve 2L Pague 1,8L",10.99,10.99
230,"Amaciante Azul Aconchego Ypê Leve 2L Pague 1,6L",10.99,10.99
231,Lava-Roupas Líquido Omo Lavagem Perfeita Galão 3L,44.99,44.99
232,Lava-Roupas Líquido Omo Lavagem Perfeita Sachê 900Ml Refil Econômico,12.99,12.99
233,Lava Roupas em Pó Tixan Ypê Primavera 800G,11.99,11.99
234,Sabão em Pó Tripla Ação Floral Assim 900G,10.99,10.99
235,"Lava-Roupas Pó Concentrado Maciez Tixan Ypê 1,6Kg",21.99,21.99
236,Amaciante Comfort Tradicional Explosao Azul 1.8L,19.99,19.99
237,Lava Roupas em Pó Concentrado Maciez Tixan Ypê 800G,11.99,11.99
238,Amaciante Concentrado Brisa de Verão Downy 1L,24.99,24.99
239,"Lava-Roupas em Pó Concentrado Primavera Tixan Ypê 1,6Kg",21.99,21.99
240,Amaciante Brisa da Primavera Urca 2L,6.99,6.99
241,"Amaciante Ypê Aconchego Leve 5L Pague 4,5L",26.99,26.99
242,"Amaciante Tradicional Puro Cuidado Comfort 1,8L",19.99,19.99
243,"Lava-Roupas Pó Omo Lavagem Perfeita Sanitiza & Higieniza Caixa 1,6Kg",24.99,24.99
244,Lava Roupas Líquido Vida Macia Bebê Embalagem 500Ml,11.99,11.99
245,Detergente em Pó Aloe Vera Klip 1Kg,7.99,7.99
246,Amaciante Downy Lirios do Campo 500Ml,10.99,10.99
247,"Lava Roupas em Pó para Roupas Brancas e Coloridas Limpeza Total Brilhante 1,6Kg",21.99,21.99
248,Sabão em Pó Klip 1Kg,7.99,7.99
249,Lava-Roupas em Pó Roupas Brancas e Coloridas Delicadeza Total Brilhante 800G,11.99,11.99
250,Sabão em Pó Tripla Ação Assim 900G,10.99,10.99
251,"Lava-Roupas em Pó Roupas Brancas e Coloridas Brilhante Limpeza Total Pacote 1,6Kg",21.99,21.99
252,Amaciante para Roupinhas de Bebê Vida Macia Amêndoas Embalagem 1Lt,11.99,11.99
253,Sabão em Barra Glicerinado Barra com 5 Unidades Pacote 1Kg,11.99,7.99
254,Amaciante para Roupinhas de Bebê Vida Macia Camomila Embalagem 1L,11.99,11.99
255,Sabão em Barra Glicerinado Neutro Ypê 180G,3.69,3.69
256,Sabão em Barra Minuano Glicerinado 1Kg,11.99,11.99
257,Lava Roupas em Pó Roupas Brancas e Coloridas Brilhante Cuidado Total 800G,11.99,11.99
258,Lava-Roupas em Pó Concentrado Maciez Tixan Ypê 400G,6.99,6.99
259,Amaciante Comfort Profissional Classic 5 Litros,39.99,39.99
260,Lava Roupas Líquido Brilhante Limpeza Total Refil 1L,11.99,11.99
261,Tira Manchas Gel Vanish Crystal White sem Cloro Refil 500Ml,11.99,11.99
262,Amaciante Amacitel Luxo Momento de Carinho 2L,8.99,8.99
263,Detergente Lava Roupas em Pó Surf 5Em1 Rosas e Flor de Lis 800G,9.99,9.99
264,Sabão em Pó Alquimisa Amarelo Ecológico 1Kg,7.99,7.99
265,Amaciante para Roupas de Bebê Vida Macia Amêndoas Embalagem 500Ml,6.99,6.99
266,Sabão Líquido Vida Macia Bebê Casa Km 1L,19.99,19.99
267,Lava-Roupas Pó Omo Lavagem Perfeita Sanitiza & Higieniza Caixa 800G,13.99,13.99
268,Tira Manchas Vanish Super Barra 75G,7.99,7.99
269,Amaciante Urca Estação em Flor 2L,6.99,6.99
270,Amaciante Baby Soft Toque de Cuidado 2L,7.99,7.99
271,Detergente Lava Roupas em Pó 5 em 1 Cuidado do Coco Surf 800G,9.99,9.99
272,Amaciante Baby Soft Toque Envolvente 2L,7.99,7.99
273,Amaciante de Roupa Concentrado Collection Místico Downy 450Ml,10.99,10.99
274,Amaciante Ypê Aconchego 500Ml,3.99,3.99
275,Amaciante Toque de Poesia Luxo Amacitel 2L,8.99,8.99
276,"Lava-Roupas Pó Omo Puro Cuidado Caixa 1,6Kg",24.99,24.99
277,Cloro Marina Embalagem 2 Litros,7.99,7.99
278,Sabão em Pó Klip Perfumes Intenso Embalagem 1Kg,7.99,7.99
279,Sabão Barra Ypê Flores e Frutas 200G,3.99,3.99
280,Amaciante Uau Sedução 2 Litros,9.99,9.99
281,Amaciante Baby Soft Toque de Maciez 2L,7.99,7.99
282,Amac Comfort Conc Intense 500Ml,10.99,10.99
283,Lava Roupas Desinfetante Pó Brilhante Higiene Total Combate Germes e Bactérias 400G,6.99,6.99
284,Amaciante Ternura Ypê 500Ml,3.99,3.99
285,Amaciante Amacitel Luxo Sonho Encantado 2 Litros,8.99,8.99
286,Lava-Roupas em Pó Concentrado Primavera Tixan Ypê 400G,6.99,6.99
287,Amaciante Diluído Toque Sedutor Baby Soft 2L,7.99,7.99
288,Sabão em Barra Glicerinado Coco Ypê 180G,4.99,4.99
289,Sabão em Barra Fresh Ypê 180G,3.99,3.99
290,Sabão em Barra Multiativo Ypê 180G,3.99,3.99
291,Tira Manchas Vanish Karpex Carpetes e Tapetes 500Ml,16.99,16.99
292,Amaciante Marina Prazer 2 Litros,6.99,6.99
293,Sabão Pedra Ypê Glicerinado Fresh 200G,3.99,3.99
294,Amaciante Alegres Encantos Amacitel 2L,8.99,8.99
295,Amaciante Classic Nature Bouquet Rosa 2 Litros,6.99,6.99
296,Amaciante Floral Bouquet Urca 2L,6.99,6.99
297,Amaciante Aconchego Uau Perfumes Embalagem 2L,9.99,9.99
298,Sabão Líquido Ufe Coco 500Ml,6.99,6.99
299,Sabonete em Barramandarina La Fruta150g,4.99,4.99
300,Sabão Líquido Coquel Coco 500Ml,11.99,11.99
301,Amaciante Amacitel Luxo Diversão Embalagem 2 Litros,8.99,8.99
302,Lava Roupas Sanitizante em Pó Brilhante Limpeza Total Combate Germes e Bactérias 800G,11.99,11.99
303,Sabão em Barra Ufe Coco Pacote 200G,4.99,4.99
304,Amaciante Classic Floral Embalagem 2 Litros,6.99,6.99
305,"Lava Roupas em Pó Sports Antiodor Omo 1,6Kg",24.99,24.99
306,Amaciante Classic Violeta Embalagem 2 Litros,6.99,6.99
307,"Amaciante de Roupas Intenso Ypê Leve 2L Pague 1,8L",10.99,10.99
308,Amaciante Marina Flores Embalagem 2 Litros,6.99,6.99
309,Sabão em Barra Clarix Coco Embalagem 200G,3.69,3.69
310,Amaciante Marina Conforto Embalagem 2 Litros,6.99,6.99
311,Amaciante Marina Carícia Embalagem 2 Litros,6.99,6.99
312,"Lava Roupa em Pó Astra 1,6Kg",11.99,8.99
313,Esponja de Aço Bombril Pacote 60G,2.69,2.69
314,Esponja Multiuso Esfrebom Oferta 4Un,6.99,6.99
315,Esponja Scotch-Brite Limpeza Pesada com 4Un,7.99,7.99
316,Esponja de Aço Assolan 60G,2.29,2.29
317,Esponja Santa Clara Oferta 4Un,4.99,3.99
318,Esponja de Aço Assolam Ypê 45G,2.29,2.29
319,Esponja Condor Multiuso Leve 4 Un Pague 3 Un,3.99,3.99
320,Prendedor Madeira Keeprend Embalagem 12 Un,2.99,2.99
321,Esponja Brilhus Dupla Face Oferta 4 Unidades,4.99,4.99
322,Esponja Multiuso Tinindo Leve 4 Pague 3,4.99,4.99
323,Esponja Multiuso Esfrebom,2.49,2.49
324,Rodo para Piá Plasútil 16Cm 1 Unidade,9.99,9.99
325,Pano de Piá Alvejado Alklin 28X30cm Embalagem 1 Un,2.99,2.99
326,Esponja Multiuso Starlux Pacote Leve 4Un Pague 3,3.99,3.99
327,Esponja Jeitosa 1Un,1.99,1.99
328,Pano de Limpeza de Microfibra Camesa Embalagem 3 Un,12.99,12.99
329,Luva Mucambo Amarela 280 M Embalagem 1 Par,6.99,6.99
330,Escova Noviça Cantos 1Un,9.99,9.99
331,Escova Noviça Limpeza Delicada 1Un,7.99,7.99
332,Vassoura Bettanin Noviça com Cabo,19.99,19.99
333,Esponja Brilhus Multiuso 1 Unidade,1.49,1.49
334,Escova Sanitária com Suporte Sanibrisa Limpamania 1 Un,7.99,7.99
335,Escova para Roupas Condor Oval Madeira Embalagem 1 Un,3.99,3.99
336,Esponja Esfrebom Não Risca 1Un,5.99,5.99
337,Pano Multiuso Esfrebom Azul Oferta 7Un,9.99,9.99
338,Saco Pano União Alvejado Encopa 46Cmx69cm,5.99,5.99
339,Pano de Limpeza Leve Alklin Azul 33X50cm Embalagem 5 Un,7.99,7.99
340,Pano Multiuso Alklin 36X40cm Unidade 2Un,7.99,7.99
341,Vassoura Brilhus Multiuso com Cabo,19.99,19.99
342,Vassoura Bettanin Varry 1000 com Cabo,19.99,19.99
343,Escova Sanitária Brisa Limpamania sem Suporte Ref 302 1 Unidade,4.99,4.99
344,Palha de Aço Açobom N2 Embalagem 22G,1.69,1.69
345,Esponja Multiuso Flash Limp Poliéster 1Un,3.99,3.99
346,Palha de Aço Gavião N1 Embalagem 1 Un,1.69,1.69
347,Esponja Esfrebom Protege Unhas 1Un,5.99,5.99
348,Vassoura Bettanin Casa e Rua com Cabo,29.99,29.99
349,Escova Noviça Bettajeans 1Un,9.99,9.99
350,Balde Arqplast 20 Litros,19.99,19.99
351,Palha de Aço Açobom N0 Embalagem 22G,1.69,1.69
352,Esponja Aço Sampa Clean 10G,4.99,4.99
353,Esponja Esfrebom Limpeza Pesada 1Un,7.99,7.99
354,Saco para Lixo Super Globo 100L com 15Un,14.99,14.99
355,Esponja Alklin Salva Unhas Multiuso 1 Un,2.99,2.99
356,Bacia Plástica Rd Unidade 75 Litros,59.99,59.99
357,Escova para Lustrar Sapato Condor,9.99,9.99
358,Vassoura de Nylon Big Mileva,19.99,19.99
359,Rodo Margarida Plástico 60Cm 1 Un,19.99,19.99
360,Saco Encopa Colorido 45Cmx70cm,5.99,5.99
361,Rodo Santanna Madeira 30Cm,7.99,7.99
362,Saco de Lixo Embala Lixo 100L 18Un,14.99,14.99
363,Saco P Lixo Saco Forte 15Lt C20 Rolo Mini,7.99,7.99
364,Saco de Lixo Lixo Forte 15L 20 Un,4.99,4.99
365,Balde Km Plast 16L,14.99,14.99
366,Esponja Brasileirinha Multiuso Dupla Face 1 Un,0.99,0.99
367,Saco de Lixo Globo Reforçado 50L 30 Un,14.99,14.99
368,Pá para Lixo Margarida Cabo Médio 1 Un,11.99,11.99
369,Rodo Margarida Plus Passa Cera 1 Un,11.99,11.99
370,Rodo para Piá Wilson 1Un,5.99,5.99
371,Saco de Lixo Lixo Forte 100L 5 Un,4.99,4.99
372,Vassoura de Piá Santanna Lavatina Un,4.99,4.99
373,Lixeira Plástica Rainha com Pedal Unidade 14 Litros,39.99,39.99
374,Pano de Prato Master com Viés 1 Un,5.99,5.99
375,Rodo Margarida Plástico Duplo 30Cm 1 Un,14.99,14.99
376,Espanador de Pó Nylon Shangrila 50Cm 1Un,11.99,11.99
377,Balde Plástico Terraplas Extra com Alça Unidade 12 Litros,12.99,12.99
378,Saco de Lixo Lixo Forte Reforçado 60L 10 Un,5.99,5.99
379,Saco de Lixo 30L Lixo Forte 10Un,4.99,4.99
380,Saco de Lixo Lixo Forte Reforçado 100L 5 Un,5.99,5.99
381,Desentupidor Sanitário Margarida,14.99,14.99
382,Saco Lixo Embalando Lixo 50L 30Un,14.99,14.99
383,Saco de Lixo Ideal Plus 50L 10 Un,3.99,3.99
384,Vassoura Victoria 1 Un,19.99,19.99
385,Saco de Lixo Lixo Forte 50L 10 Un,4.99,4.99
386,Pano de Prato Xadrez 45X75cm,5.99,5.99
387,Açúcar Refinado União 1Kg,5.99,5.99
388,Açúcar Cristal Tryunpho 5Kg,19.99,15.99
389,Açúcar Cristal Tryumpho 2Kg,8.99,8.99
390,Açúcar Cristal Tryumpho 1Kg,4.5,4.5
391,Açúcar Demerara Orgânico Itajá 1Kg,9.99,9.99
392,Adoçante Sacarina Zero Cal 100Ml,6.99,6.99
393,Adoçante Sacarina Zero Cal 200Ml,12.99,12.99
394,Adoçante Líquido Sucralose Linea 75Ml,16.99,16.99
395,Adoçante Stévia Zero Cal 80Ml,12.99,12.99
396,Adoçante Stevia Líquido Linea 25Ml,9.99,9.99
397,Açúcar Cristal Eurocucar Embalagem 1Kg,4.5,4.5
398,Adoçante Dietético Líquido Magro 100Ml,6.99,6.99
399,Adoçante Líquido Stevia Linea 60Ml,12.99,12.99
400,Adoçante Magro Tradicional Líquido 200Ml,11.99,11.99
401,Açúcar Light Fit com Stevia Magro 500G,11.99,11.99
402,Adoçante Magro com Sucralose Líquido 80Ml,11.99,11.99
403,Açúcar Mascavo Viver Embalagem 500G,6.99,6.99
404,Açúcar Demerara Viver Bem Embalagem 500G,6.99,6.99
405,Arroz Camil Agulhinha - 5Kg,22.99,22.99
406,Arroz Prato Fino Branco Tipo 1 Pacote 5Kg,26.99,26.99
407,Arroz Tipo 1 Vasconcelos Pacote 5Kg,24.99,22.99
408,Arroz Codisul Tipo 1 Pacote 5Kg,19.99,19.99
409,Arroz Tipo 1 Patosul Embalagem 5Kg,18.99,16.99
410,Arroz Prato Fino Tipo1 2Kg,13.99,13.99
411,Arroz Tipo 1 Pilecco Nobre Pacote 5Kg,26.99,26.99
412,Arroz Alegrete Tipo 1 Agulinha Pacote 5Kg,19.99,19.99
413,Arroz Branco Trivial Embalagem 5Kg,17.99,17.99
414,Arroz Polido Tipo 1 Alegrete 2Kg,8.99,8.99
415,Arroz Prato Fino 5Kg Parbolizado,26.99,26.99
416,Arroz Arbóreo Tipo 1 Pilecco Nobre 1Kg,12.99,12.99
417,Arroz Integral Pilecco Nobre Pacote 1Kg,8.99,8.99
418,Arroz Diversos Alegrete Unidade 1 Kg,4.5,4.5
419,Farinha de Trigo sem Fermento Dona Benta 1Kg,6.49,6.49
420,Farofa Pronta Yoki Temperada 500G,6.99,6.99
421,Fubá Mimoso Fino Sinhá 1Kg,3.99,3.99
422,Cuscuz Sinhá 500G,2.99,2.99
423,Farinha de Trigo Vilma Pacote 1Kg,5.99,5.99
424,Farinha de Trigo com Fermento Vilma 1Kg,6.99,6.99
425,Fubá Mimoso Anchieta 1Kg,3.89,3.89
426,Amido de Milho Anchieta 500G,3.99,3.99
427,Amido de Milho Pacha Embalagem 500G,4.99,4.99
428,Tapioca Pacha Embalagem 500G,5.99,5.99
429,Farofa de Mandioca Anchieta Temperada 250G,3.49,3.49
430,Farinha de Rosca Pacha 500G,5.99,5.99
431,Farinha de Mandioca Pachá Torrada Embalagem 1Kg,6.99,6.99
432,Polvilho Azedo Amafil 1Kg,9.99,9.99
433,Amido de Milho Maizena Tradicional 200G,4.99,4.99
434,Farofa Pronta de Mandioca Pacha Sabor Bacon Embalagem 300G,2.99,2.99
435,Fubá Mimoso Pacha Embalagem 1Kg,3.89,3.89
436,Farinha de Mandioca Zumbizinha 1Kg,5.99,5.99
437,Flocos de Milho Pré-Cozido Quaker Milharina Pacote 500G,6.99,6.99
438,Amido de Milho Kimimo 200G,3.99,3.99
439,Farofa Pronta Pacha Sabor Picanha Picante Embalagem 300G,2.99,2.99
440,Farinha Flocão de Milho Pachá 500G,3.69,3.69
441,Polvilho Doce Amafil 1Kg,9.99,9.99
442,Farofa Pronta de Mandioca Pacha Embalagem 250G,2.99,2.99
443,Farinha de Mandioca Pacha Branca Embalagem 1Kg,5.99,5.99
444,Polvilho Azedo Pacha Embalagem 1Kg,9.99,9.99
445,Amido de Milho Kimimo 500G,9.99,9.99
446,Farinha de Mandioca Codil 1Kg,5.99,5.99
447,Farinha de Arroz Integral Pilecco Nobre 560G,5.99,5.99
448,Farofa de Milho Pacha Embalagem 300G,2.99,2.99
449,Farofa Pronta Bacon Anchieta 250G,3.49,3.49
450,Amido de Milho Vita + Maizena 500G,8.99,8.99
451,Farinha de Milho Biju Pacha 500G,3.99,3.99
452,Farinha de Mandioca Torrada Zumbi Embalagem 1Kg,6.99,6.99
