,Produto,Preço Base,Preço Final
974,Cerveja Original Pilsen Antártica 350Ml,3.6,3.6
975,Cerveja Antártica 473Ml,3.69,3.69
976,Cerveja Puro Malte Petra Origem Lata 350Ml,3.29,3.29
977,Cerveja Lager Puro Malte Crystal Tiger 473Ml,3.99,3.99
978,Cerveja Puro Malte Stella Artois 350Ml,4.19,4.19
979,Cerveja Heineken Zero Lata 350Ml,4.99,4.99
980,Cerveja Budweiser 473Ml,4.49,4.49
981,Cerveja Puro Malte Bohemia 473Ml,3.99,3.99
982,Cerveja sem Glúten Puro Malte Stella Artois 330Ml,5.49,5.49
983,Cerveja Stella Artois Long Neck 330Ml,5.49,5.49
984,Cerveja Pilsen Chopp Brahma 350Ml,3.19,3.19
985,Cerveja Spaten Puro Malte Lata 350Ml,3.41,3.41
986,Cerveja Pilsen Brahma 473Ml,4.19,3.89
987,Cerveja Spaten Puro Malte Garrafa 600Ml,8.49,8.49
988,Cerveja Budweiser 330Ml,5.19,5.19
989,Cerveja Eisenbahn Pilsen Puro Malte Long Neck 355Ml,4.99,4.99
990,Cerveja Escura Caracu 350Ml,4.19,4.19
991,Cerveja Original Antarctica 473Ml,4.49,4.49
992,Cerveja Zero Brahma 350Ml,3.99,3.99
993,Cerveja Stella Artois 600Ml,8.99,8.99
994,Cerveja Colorado Appia Garrafa 600Ml,11.99,11.99
995,Cerveja Eisenbahn Pilsen Puro Malte Garrafa 600Ml,7.99,7.99
996,Cerveja Ipa Patagonia 350Ml,5.49,5.49
997,Cerveja Puro Malte Skol 473Ml,3.69,3.49
998,Cerveja Puro Malte Beck's 600Ml,9.49,9.49
999,Cerveja Extra Lager Brahma 350Ml,3.19,3.19
1000,Cerveja Estrella Galicia Puro Malte Long Neck 355Ml,5.99,5.99
1001,Cerveja Puro Malte Itaipava Lata 473Ml,3.99,3.49
1002,Cerveja Puro Malte Beck's 330Ml,5.39,5.39
1003,Cerveja Skol Pilsen Lata 473Ml Pack 12Un,3.99,3.79
1004,Cerveja Escura Caracu 355Ml,4.99,4.99
1005,Cerveja Ipa Patagonia 355Ml,6.99,6.99
1006,Cerveja Estrella Sirius Pilsen Garrafa 600Ml,3.99,3.99
1007,Cerveja Puro Malte Origem Petra 473Ml,3.99,3.99
1008,Ice Syn Lemon 300Ml,3.99,3.99
1009,Ice Kislla Limão 275Ml,3.99,3.99
1010,Coquetel Corote Limão 500Ml,3.99,3.99
1011,Conhaque Presidente 900Ml,14.99,14.99
1012,Cachaça do Barril Garrafa 500Ml,3.99,3.99
1013,"Comary Coquetel Alcoólico Composto Cantina da Serra 1,5L",14.99,14.99
1014,Bebida Keep Cooler Classic Uva 275Ml,7.99,7.99
1015,Vodka Ousadia Limão 500Ml,5.99,5.99
1016,Bebida Keep Cooler Classic Citrus 275Ml,7.99,7.99
1017,Bebida Keep Cooler Black Pêssego 275Ml,7.99,7.99
1018,Bebida Keep Cooler Classic Morango 275Ml,7.99,7.99
1019,Bebida Catuaba Selvagem Açaí 1L,16.99,16.99
1020,Cachaça Salinas Tradicional Garrafa 600Ml,32.99,32.99
1021,Jurubeba Leão Do Norte Garrafa 600Ml,14.99,14.99
1022,Cachaça Prata Cabaré Garrafa 700Ml,29.99,29.99
1023,Vodka Blue Spirit Ice 275Ml,5.99,5.99
1024,Cachaça 88 Old Cesar Garrafa 965Ml,14.99,14.99
1025,Coquetel Corote Maracujá 500Ml,3.99,3.99
1026,Cachaça Brasilizar Ouro Ypioca 965Ml,19.99,19.99
1027,Bebida Alcoólica Mista Hard Lemonade Mike's 275Ml,6.99,6.99
1028,Aguardente Chora Rita Aninha 600Ml,6.99,6.99
1029,Cachaça Barrilzinho de Minas 470Ml,3.49,3.49
1030,Ice Kislla Red Fruits 275Ml,3.99,3.99
1031,Bebida Ice Syn Vodka Apple 300Ml,3.99,3.99
1032,Drink Pronto Beats Senses Skol Beats 269Ml,4.94,4.94
1033,Drink Pronto Beats Drinks Ginger Sabor Moscow Mule Skol 269Ml,5.84,5.84
1034,Bebida Catuaba Comary Selvagem 1L,16.99,16.99
1035,Bebida Mista Senses Skol Beats 269Ml,6.99,6.99
1036,Drink Pronto Beats Drinks Mint Sabor Mojito Skol 269Ml,5.84,5.84
1037,Smirnoff Ice Original 275Ml,10.99,10.99
1038,Drink Pronto Hard Lemonade Limão Mike's 269Ml,5.39,5.39
1039,Bebida Catuaba Selvagem Mel e Limão 1L,16.99,16.99
1040,Catuaba Selvagem 300Ml,5.99,5.99
1041,Vinho Tinto Suave Nacional de Mesa Pérgola 1L,22.99,22.99
1042,"Vinho Tinto Campo Largo Suave Garrafa 1,47 Litro",26.99,26.99
1043,"Vinho Tinto Suave Nacional de Mesa Pérgola 1,47L",26.99,26.99
1044,Vinho Tinto Brasileiro Suave Dom Bosco 750Ml,14.99,14.99
1045,Vinho Tinto Suave Cantina da Serra 880Ml,8.99,8.99
1046,Vinho Tinto Brasileiro Chapinha Suave Garrafa 750Ml,13.99,13.99
1047,Vinho Rose Frisante Suave Relax Garibaldi 750Ml,29.99,29.99
1048,Vinho Tinto Seco Nacional de Mesa Pérgola 1L,22.99,22.99
1049,Vinho Tinto Campo Largo Seco Garrafa 750Ml,14.99,14.99
1050,Vinho Branco Campo Largo Suave 750Ml,14.99,14.99
1051,Vinho Vino Di Bartolo Tinto Seco 750Ml,14.99,14.99
1052,Vinho Tinto Brasileiro Sangue de Boi de Mesa Suave Garrafa 750Ml,16.99,16.99
1053,Vinho Tinto Suave Canção 750Ml,16.99,16.99
1054,Vinho Branco Seco Campo Largo 750Ml,14.99,14.99
1055,Vinho Branco Frisante Demi-Sec Relax Garibaldi 750Ml,29.99,29.99
1056,Vinho Vermouth Tinto Cortezano Doce Garrafa 900Ml,19.99,19.99
1057,"Vinho Brasileiro Branco Seco Vino Di Bartolo Serra Gaúcha Garrafa 1,5L",26.99,26.99
1058,Sidra Cereser Maça 660Ml,12.99,12.99
1059,Vinho Tinto Brasileiro Canção Seco Garrafa 750Ml,16.99,16.99
1060,Vinho Tinto Chapinha Seco Garrafa 750Ml,13.99,13.99
1061,Sabonete Giovanna Baby Blue 90G,3.99,3.99
1062,Sabonete Giovanna Baby Classic 90G,3.99,3.99
1063,Sabonete Barra Huggies Extra Suave 75G,3.99,3.99
1064,Shampoo de Glicerina Johnson's Baby 200Ml,14.99,14.99
1065,Lenço Umedecido Use It Baby Aloe Vera Embalagem 50 Un,7.99,7.99
1066,Fralda Personal Soft & Protect Tamanho P 30Un,24.99,24.99
1067,Toalhas Umedecidas Personal Baby 50Un,9.99,9.99
1068,Lenços Umedecidos Use It Azul Pote 70 Un,5.99,5.99
1069,Fralda M Pampers Supersec 30Un,29.99,29.99
1070,Fraldas Descartáveis Cremer Disney Prática Grandinhos G Embalagem 14Un,24.99,24.99
1071,Fralda Huggies Tripla Proteção P 46 Fraldas,39.99,39.99
1072,Fraldas Mili Love & Care Jumbo Xg 22Un,29.99,29.99
1073,Fraldas Mili Love & Care Xxg Jumbo 20Un,29.99,29.99
1074,Fralda Jumbinho Tripla Xg Huggies com 12Un,21.99,19.9
1075,Fralda M Personal Jumbo 32 Unidades,24.99,24.99
1076,Condicionador Johnsons Baby Regular Embalagem 200Ml,16.99,16.99
1077,Lenços Umedecidos Baby Use It 70Un,2.99,2.99
1078,Fralda Huggies Tripla Proteção P 36 Fraldas,29.99,29.99
1079,Toalhas Umedecidas Hora de Brincar Isababy 140Un,14.99,12.99
1080,Fralda Huggies Tripla Proteção M 32 Fraldas,29.99,29.99
1081,Fraldas Descartáveis Evolution Eg Pacote 64 Un,59.99,59.99
1082,Fraldas Descartáveis Mili Love & Care Jumbo G 24Un,29.99,29.99
1083,Fralda Baby G Turma da Mônica 24Un,29.99,29.99
1084,Lenços Umedecidos Use It Baby Azul Refil 400 Un,12.99,12.99
1085,Lenço Umedecido Use It Baby Rosa Balde 400 Un,19.99,19.99
1086,Fralda Descartável Infantil Tripla Proteção Jumbinho Tamanho G Huggies 14Un,21.99,19.9
1087,Toalha Umedecida Use It Embalagem 100Un,14.99,14.99
1088,Fralda Turma da Mônica Baby M Pacote 28Un,29.99,29.99
1089,Fralda Huggies Tripla Proteção Xxg 12 Fraldas,21.99,19.9
1090,Fralda P Cremer Disney Prática 30Un,24.99,24.99
1091,Fraldas Descartáveis Cremer Disney Prática G Pacote 24 Un,24.99,24.99
1092,Sabonete Líquido Baby Dove Hidratação Enriquecida 200Ml,24.99,24.99
1093,Fralda Cremer Jumbo Disney M 26 Unidades,24.99,24.99
1094,Fraldas Descartáveis Cremer Prática Disney Xg Pacote 20Un,24.99,24.99
1095,Fralda Tripla Jumbinho Tamanho P Huggies 18Un,21.99,19.9
1096,Fralda Descartável Infantil Tripla Proteção Tamanho M Huggies 16Un,21.99,19.9
1097,Fralda Descartável Ultra Seca Jumbo Tamanho M Pacote Mili com 32Un,29.99,29.99
1098,Lenços Umedecidos Use It Baby Rosa Pote 70 Un,5.99,5.99
1099,Fralda Xg Personal Jumbo 24 Unidades,24.99,24.99
1100,Lenço Umedecido Use It Baby Azul Balde 400 Un,19.99,19.99
1101,Fralda Mili Love & Care Jumbo M 26 Unidades,29.99,29.99
1102,Fralda Descartável Baby Tamanho Xxg Turma da Mônica 16Un,29.99,29.99
1103,Mamadeira New Baby Chuquinha 1Un,7.99,7.99
1104,Fralda Turminha Bumbum Econômica P 50U,29.99,29.99
1105,Mamadeira Relevo Azul Petita 240Ml,9.99,9.99
1106,Bico Chupeta para Bebês Manita,6.99,6.99
1107,Chupeta Ventilada de Silicone Mamita 1 Unidade,4.5,4.5
1108,Fralda Turminha Bumbum Econômica Eg C/24,29.99,29.99
1109,Fralda Descartável Turminha do Bumbum M com 40 Unidades,29.99,29.99
1110,Toalhinhas Umedecidas 20 X 15Cm Isababy Leve 100 Pague 90,14.99,14.99
1111,Mamadeira Anplas Rosa Bico Lolly 240Ml,9.99,9.99
1112,Fralda Infantil Turminha do Bumbum G 28Un,29.99,29.99
1113,Mamadeira Neon Cor Rosa Babygo 240Ml,19.99,19.99
1114,Kit Skala Bomba de Vitaminas 12X1 Restauração Shampoo 325Ml e Condicionador 325Ml,16.99,16.99
1115,Creme de Hidratação Potão do Amor 18 Elementos Skala 1Kg,8.99,8.99
1116,Creme de Tratamento Skala Expert Potão Desmaiado 1Kg,8.99,8.99
1117,Creme de Tratamento Expert Dona Skala 1Kg,8.99,8.99
1118,Kit Tresemmé Detox Capilar Shampoo 400Ml + Condicionador 200Ml,22.99,22.99
1119,Creme para Pentear Salon Line Hidra Embalagem 300Ml,14.99,14.99
1120,Creme de Jaborandi Kanechom 1Kg,7.99,7.99
1121,Creme Yamasterol com Babosa Embalagem 320G,9.99,9.99
1122,Shampoo Darling Tília 350Ml,9.99,9.99
1123,Creme de Hidratação Skala Banho de Cristal 1Kg,8.99,8.99
1124,Shampoo Seda Pureza Detox Refrescante 325Ml,10.99,10.99
1125,Gel Fix Kanechom Incolor 230G,5.99,5.99
1126,Água Oxigenada Avante 40 Volumes 40Ml,2.29,2.29
1127,Creme Kanechom Ceramidas 1Kg,7.99,7.99
1128,Creme de Hidratação Skala Ceramidas G3 Plus 1Kg,8.99,8.99
1129,Creme de Argam Kanechom 1Kg,7.99,7.99
1130,Creme de Hidratação Skala Óleo de Coco 1Kg,8.99,8.99
1131,Shampoo Tok Bothanico Óleo de Argan 500Ml,6.99,6.99
1132,Creme de Hidratação Expert Mais Cachos Condicionador 2 em 1 100% Vegano & 0% Origem Animal Skala 1Kg,8.99,8.99
1133,Creme de Hidratação Skala Óleo de Argan 1Kg,8.99,8.99
1134,Creme de Hidratação Skala Expert Amido de Milho 100% Vegano & 0% Origem Animal 1Kg,8.99,8.99
1135,Kit Niely Gold Pós Química Shampoo + Condicionador,19.99,19.99
1136,Shampoo Condicionador Darling 2 em 1 350Ml,9.99,9.99
1137,Shampoo Neutrox S.O.S. 300Ml,11.99,11.99
1138,Creme Condicionante Restauração Total de Manteiga de Karité Kanechom 1Kg,7.99,7.99
1139,Condicionador Neutrox Clássico 500Ml,14.99,14.99
1140,Kit Skala Amido de Milho Shampoo 325Ml e Condicionador 325Ml,16.99,16.99
1141,Creme de Hidratação Skala Expert Condicionador 2 em 1 Divino Potão 100% Vegano & 0% Origem Animal 1Kg,8.99,8.99
1142,Gel Condicionador Fixador Ny Looks Fator 4 240G,8.99,8.99
1143,Shampoo Anticaspa Limpeza Diária 2Em1 Clear 200Ml,19.99,19.99
1144,Shampoo Palmolive Naturals Neutro 350Ml,9.99,8.99
1145,Shampoo Hidratação Resgata Colágeno Pantene 175Ml,16.99,16.99
1146,Tintura para Cabelo Preto 2.0 Cor & Ton 130,14.99,14.99
1147,Shampoo Pantene Restauração 175Ml,16.99,16.99
1148,Shampoo Bio Extratus Antiqueda Embalagem 250Ml,26.99,26.99
1149,Shampoo Seda Ceramidas 325Ml,10.99,10.99
1150,Shampoo Darling Ceramidas 350Ml,9.99,9.99
1151,Kit Skala Bomba de Banana Shampoo 325Ml e Condicionador 325Ml,16.99,16.99
1152,Condicionador Kolene Original 300Ml,7.99,7.99
1153,Shampoo Anti-Frizz Seda 325Ml,10.99,10.99
1154,Shampoo Micelar Seda 325Ml,10.99,10.99
1155,Condicionador Seda Ceramidas 325Ml,11.99,11.99
1156,Shampoo Liso Perfeito Seda 325Ml,10.99,10.99
1157,Condicionador Monange Hidrata com Poder 325Ml,8.99,8.99
1158,Shampoo Tok Bothanico Pera sem Sal 500Ml,6.99,6.99
1159,Creme para Pentear Seda Cachos Definidos 300Ml,11.99,11.99
1160,Creme para Pentear Cachos Perfeitos Monange Embalagem 300Ml,9.99,9.99
1161,Creme de Hidratação Coquetel de Frutas Skala 1Kg,8.99,8.99
1162,Descolorante em Pó de Camomila Care Liss 20G,4.99,4.99
1163,Condicionador Liso Perfeito Seda 325Ml,11.99,11.99
1164,Creme de Aloe Vera Kanechom 1Kg,7.99,7.99
1165,Pó Descolorante Cless Care Liss Proteínas da Soja Sachê 20G,4.99,4.99
1166,Kit Skala Bomba de Abacate Shampoo 325Ml e Condicionador 325Ml,16.99,16.99
1167,Kit Skala Óleo de Argan Shampoo 325G e Condicionador 325G,16.99,16.99
1168,Reparador de Pontas Bicho da Seda Oil Siliconado Embalagem 30Ml,8.99,8.99
1169,Creme para Tratamento Skala Vinagre de Maçã com Keratina,8.99,8.99
1170,Água Oxigenada Volume 30 Ideal 70Ml,2.99,2.99
1171,Grampo para Cabelo Darma Nº5 Cor Preto Embalagem 100 Un,4.99,4.99
1172,Condicionador Monange Lisos Te Quero 325Ml,8.99,8.99
1173,Creme de Alisamento Embelleze Hair Life Solto & Natural Embalagem 160G,14.99,14.99
1174,Condicionador Darling Tília 350Ml,9.99,9.99
1175,Shampoo Tok Bothânico Babosa Embalagem 500Ml,6.99,6.99
1176,Salon Line Meu Liso Amido de Milho Capilar com Proteína do Trigo e Mix de Aminoácidos Uso Diário Embalagem 300Ml,16.99,16.99
1177,Tintura para Cabelo Maxton Louro Médio Acobreado 7.4 Embalagem 50G,14.99,14.99
1178,Creme Desmaia Cabelo Kanechom 1Kg,7.99,7.99
1179,Tintura para Cabelo Preto Azulado Especial Cor & Ton 50G,14.99,14.99
1180,Gel Condicionador Fixador Ny Looks 1 240G,8.99,8.99
1181,Tintura para Cabelo Natucor Amora Preto Suave 2.0 Embalagem 1 Unidade,9.99,9.99
1182,Shampoo Neutrox Xtreme 300Ml,11.99,11.99
1183,Creme para Alisamento Embelleze Hair Life Liso & Natural Embalagem 180G,14.99,14.99
1184,Água Oxigenada 10V Ideal 70Ml,2.99,2.99
1185,Shampoo Monange Restaura Que Eu Gosto 325Ml,7.99,7.99
1186,Tintura de Cabelo Wella Koleston Preto 20,22.99,22.99
1187,Tintura Vermelho Cereja 6.66 Maxton,14.99,14.99
1188,Pó Descolorante Cless Lightner Gérmen de Trigo Sachê 20G,6.99,6.99
1189,Amônia Avante Embalagem 100Ml,2.29,2.29
1190,Shampoo Tok Bothânico Quiabo com Abacate Embalagem 500Ml,6.99,6.99
1191,Shampoo Cachos Que Tal Monange Embalagem 325Ml,7.99,7.99
1192,Creme de Tratamento Queratina Absoluta Novex Embalagem 400G,14.99,14.99
1193,Shampoo Seda Recarga Natural Bambu e Biotina 325 Ml,10.99,10.99
1194,Shampoo Naturals Ceramidas Force Palmolive 350Ml,9.99,8.99
1195,Tintura para Cabelo 4.66 Ruiva Luminosacor e Tom 125G,16.99,16.99
1196,Shampoo Tok Bothânico Broto de Bambu sem Sal Embalagem 500Ml,6.99,6.99
1197,Condicionador Monange Boost Crescimento 325Ml,8.99,8.99
1198,Condicionador Kolene Embalagem 300Ml,7.99,7.99
1199,Shampoo Reconstrução Completa Dove 200Ml,12.99,12.99
1200,Creme para Pentear Monange Hidratação Intensiva com 300Ml,9.99,9.99
1201,Condicionador Monange Cachos Que Tal 325Ml,8.99,8.99
1202,Tintura para Cabelo Natucor Castanho Escuro 3.0 Embalagem 1 Unidade,9.99,9.99
1203,Condicionador Detox Darling 350Ml,9.99,9.99
1204,Shampoo Seda Anti Quebra 325Ml,10.99,10.99
1205,Gel Fixador Bozzano Efeito Molhado 2 Fixação Média Embalagem 300G,16.99,16.99
1206,Tintura para Cabelo Castanho Escuro 3.0 Cor e Ton 125G,14.99,14.99
1207,Tintura de Cabelo Cor Castanho Claro Luxuoso 5.0 Biocolor,14.99,14.99
1208,Shampoo Seda Bomba Argan 325Ml,10.99,10.99
1209,Condicionador Seda Hidratação Micelar 325Ml,11.99,11.99
1210,Condicionador Monange Detox Terapia Embalagem 325Ml,8.99,8.99
1211,Creme para Pentear Seda Ceramidas 300Ml,11.99,11.99
1212,Condicionador Kolene Original 500Ml,9.99,9.99
1213,Gel Condicionador Fixador Ny Looks Fator 3 240G,8.99,8.99
1214,Condicionador Naturals Iluminador Pretos Palmolive 350Ml,11.99,11.99
1215,Tintura Maxton Preto Natural 2.0 Embelleze,14.99,14.99
1216,Condicionador Seda Bambu e Biotina 325Ml,11.99,11.99
1217,Shampoo Naturals Iluminador Pretos Palmolive 350Ml,9.99,8.99
1218,Tintura para Cabelo Louro Cinza Claro 8.1 Cor & Ton 125G,14.99,14.99
1219,Shampoo Palmolive Naturals Reparação Completa 350Ml,9.99,8.99
1220,Shampoo Tok Bothânico Camomila Embalagem 500Ml,6.99,6.99
1221,Condicionador Darling Ceramidas 350Ml,9.99,9.99
1222,Shampoo Seda Pretos Luminosos 325Ml,10.99,10.99
1223,Condicionador Seda Cachos Definidos 325Ml,11.99,11.99
1224,Shampoo Hidratação Antinós Seda 325Ml,10.99,10.99
1225,Creme para Pentear By Raiza Babosa + Óleos Seda 300Ml,11.99,11.99
1226,Tintura de Cabelo Biocolor Louro Escuro Clássico 6.0,14.99,14.99
1227,Tintura Maxton Castanho Natural 4.0,14.99,14.99
1228,Kit Coloração Maxton Preto 1.0 Embelleze Embalagem 1Un,14.99,14.99
1229,Shampoo Seda Óleo Hidratação 325Ml,10.99,10.99
1230,Creme para Pentear Liso Perfeito Seda 300Ml,11.99,11.99
1231,Água Oxigenada Cremosa 40V Ideal 70Ml,2.99,2.99
1232,Condicionador Seda Recarga Natural Bomba Coco 325Ml,11.99,11.99
1233,Tintura de Cabelo Biocolor Louro Acinzentado 8.1,14.99,14.99
1234,Condicionador Palmolive Naturals Neutro 350Ml,11.99,11.99
1235,Solução de Amonia Ideal 100Ml,2.29,2.29
1236,Creme para Pentear Yamasterol Queratina Embalagem 320Ml,9.99,9.99
1237,Tintura de Cabelo Biocolor Louro Claro Radiante 8.0,14.99,14.99
1238,Creme de Tratamento Embelleze Novex Azeite de Oliva Pote 400G,14.99,14.99
1239,Shampoo Crespo Force By Gabi Oliveira Seda 325Ml,10.99,10.99
1240,Pó Descolorante Cless Care Liss Camomila Sachê 8G,2.99,2.99
1241,Óleo Atalaia Embalagem 120Ml,26.99,26.99
1242,Tintura para Cabelo Marcia 2.0 Preto Suave Embalagem 1 Un,9.99,9.99
1243,Shampoo Crismas Brilho e Maciez Embalagem 330Ml,12.99,12.99
1244,Condicionador Recarga Natural Bomba de Argan Seda 325Ml,11.99,11.99
1245,Shampoo Cachos Livres Palmolive 350Ml Babosa,9.99,8.99
1246,Shampoo Suave Detox Refrescante Babosa e Pepino 325Ml,8.99,8.99
1247,Tintura de Cabelo Maxton Marsala Escuro 5.26 Embalagem 60G,14.99,14.99
1248,Tintura Natucor Chá Preto Natural 1.0 Embalagem 1 Un,9.99,9.99
1249,Condicionador Seda Recarga Natural Mel Anti-Quebra 325Ml,11.99,11.99
1250,Creme Alisante Issy Tradicional Embalagem 80G,14.99,14.99
1251,Creme para Pentear Pantene Crespo Definido 240G,18.99,18.99
1252,Shampoo Tok Bothânico Jaborandi Embalagem 500Ml,6.99,6.99
1253,Gel Fixador Condicionador Bozzano Proteção Solar Fixação Forte Fator 3 300G,16.99,16.99
1254,Condicionador Seda Pretos Luminosos Secagem Rápida 325Ml,11.99,11.99
1255,Tintura para Carros Embelleze Fleury Castanho Escuro 3.0,8.99,8.99
1256,Condicionador Palmolive Cachos Livres Extrato de Coco 350Ml,11.99,11.99
1257,Alisante Guanidina Regular Salon Line 218G,26.99,26.99
1258,Creme para Pentear Seda Pretos Luminosos 300Ml,11.99,11.99
1259,Condicionador Naturals Ceramidas Force Palmolive 350Ml,11.99,11.99
1260,Shampoo Queratina com Mandioca Tok Bothânico 400Ml,6.99,6.99
1261,Shampoo Tok Bothânico Ceramidas Embalagem 500Ml,6.99,6.99
1262,Óleo Capilar Avante Coco Embalagem 100Ml,6.99,6.99
1263,Tintura para Cabelo Alfaparf Alta Moda Louro Escuro Cinza 6.1 Embalagem 1 Un,14.99,14.99
1264,"Shampoo Tok Bothânico Camomila Embalagem 1,9 Litro",14.99,14.99
1265,Pó Descolorante Sache Camomila Maxilluring,4.99,4.99
1266,Pente Fino para Piolho Darma sem Cabo 2Un,2.99,2.99
1267,Condicionador Crismas Casulão Hidratação Intensa Embalagem 330Ml,14.99,14.99
1268,Escova Cabelo Darma Oval Referencia 186,2.99,2.99
1269,Água Oxigenada Avante Vol 20 Embalagem 90Ml,2.29,2.29
1270,Pente Darma com Cabo Un,2.99,2.99
1271,Creme de Pentear Crismas Brilho de Resina Embalagem 170Ml,9.99,9.99
1272,Água Oxigenada Avante 20 Volumes 30Ml,2.29,2.29
1273,Aparelho de Barbear Prestobarba Ultragrip Fixa Azul Gillete 2Un,3.69,3.69
1274,Sabonete Johnsons Amêndoas 80G,3.29,2.99
1275,Sabonete Lux Buquê de Jasmim 85G,2.29,2.29
1276,Sabonete Johnson's Erva Doce 80G,3.29,2.99
1277,Sabonete Johnsons 80G Lavanda,3.29,2.99
1278,Sabonete Dove Original 90G,4.49,4.49
1279,Sabonete Francis Branco 85G,2.69,2.69
1280,Sabonete Lux Flor de Verbena 85G,2.29,2.29
1281,Sabonete Francis Orquídea 85G,2.69,2.69
1282,Sabonete Francis Alfazema 85G,2.69,2.69
1283,Ap Barb Gilette Ultragrip Cab Movel Und,3.69,3.69
1284,Sabonete de Erva Doce Nivea 85G,3.69,3.69
1285,Sabonete Flor de Ypê Suave Rosas Brancas e Avelã 85G,2.49,2.49
1286,Desodorante Antitranspirante Aerosol Original Dove 150Ml,19.99,19.99
1287,Sabonete Flor de Ypê Flor de Laranjeira e Damasco 85G,2.49,2.49
1288,Sabonete Proteina do Leite Marluce 90G,2.69,2.69
1289,Sabonete Nivea Lavanda Embalagem 85G,3.69,3.69
1290,Aparelho de Barbear Regular Gillette,2.99,2.99
1291,Sabonete Francis Suave Relaxamento Gardenia 85G,2.69,2.69
1292,Sabonete com Hidratante Nivea Aveia 85G,3.69,3.69
1293,Sabonete em Barra Flor de Maçã e Framboesa Flor de Ypê 85G,2.49,2.49
1294,Sabonete Odor de Rosas Phebo 90G,4.99,4.99
1295,Sabonete Rosas Brancas e Avelã Flor de Ypê Suave 85G,2.49,2.49
1296,Desodorante Antitranspirante Aerossol Powder Dry Motionsense Rexona 150Ml,16.99,16.99
1297,"Sabonete Líquido Tok Botânico Erva Doce Embalagem 1,9L",22.99,22.99
1298,Aparelho Descartável Bic Soleil com 3 Lâminas Embalagem 1Un,5.99,5.99
1299,Sabonete Phebo Toque de Lavanda Unidade 90G,4.99,4.99
1300,Sabonete Hidratante Proteínas do Leite Nivea 85G,3.69,3.69
1301,Sabonete com Hidratante Orquídeas Nivea 85G,3.69,3.69
1302,Aparelho de Barbear Prestobarba 3 Champions Gillette,7.99,7.99
1303,Sabonete Barra Flor de Ype Frésia e Pêssego 85G,2.49,2.49
1304,Sabonete Palmolive Naturals Toque Radiante 85G,2.99,2.99
1305,Desodorante Antitranspirante V8 Amarelo Rexona 150Ml,16.99,16.99
1306,Antitranspirante Roll-On Original Dove 50Ml,12.99,12.99
1307,Desodorante Aerossol Masculino Fresh Bozzano 150Ml,11.99,11.99
1308,Nivea Loção Hidratante Milk Pele Seca a Extrasseca 200Ml,16.99,16.99
1309,Sabonete Flor do Ypê Suave Água de Coco e Alecrim 85G,2.49,2.49
1310,Hidratante Corporal Amêndoas e Macadâmia Origem Nazca 380Ml,7.99,7.99
1311,Aparelho para Barbear Sensitive Shaver Bic,1.69,1.69
1312,Sabonete Cerejeira do Oriente Francis 90G,3.69,3.69
1313,Desodorante sem Perfume Aerossol Antitranspirante Monange Feminino Sensível 150Ml,11.99,11.99
1314,Sabonete em Barra Jasmim do Nilo Francis 90G,3.69,3.69
1315,Loção Hidratante Flor de Baunilha Paixão 200Ml,8.99,8.99
1316,Sabonete Íntimo Líquido Topz Embalagem 2Un de 200Ml,19.99,19.99
1317,Sabonete em Barra Bambu e Musgo Francis 90G,3.69,3.69
1318,Touca de Banho Santa Clara Luxo,2.99,2.99
1319,Desodorante Above Women Sport Energy 90G,11.99,11.99
1320,Aparelho de Barbear Bic Sensitive Shaver Oferta Embalagem 7Un,7.99,7.99
1321,Talco Perfumado Tabu Embalagem 100G,9.99,9.99
1322,Desodorante Antitranspirante em Creme Herbissimo Tradicional Pote 55G,5.99,5.99
1323,Desodorante Feminino Above Candy Aerosol 150Ml,11.99,11.99
1324,Aparelho de Barbear Probak Ii 2Un,3.99,3.99
1325,Sabonete Francis Rosas de Versailles 90G,3.69,3.69
1326,Saboneteira com Escorredor e Tampa Cores Sortidas Jaguar,3.99,3.99
1327,Aparelho de Barbear Bic Comfort 2 (1 Unidade),3.99,3.99
1328,Esponja de Banho Branca e Verde Bettabanho,5.99,5.99
1329,Sabonete de Lavandas de Grasse Francis 90G,3.69,3.69
1330,Sabonete Francis Rosa Negra da Turquia 90G,3.69,3.69
1331,Desodorante Aerosol Masculino Invisible Black & White Nivea 150Ml,14.99,14.99
1332,Sabonete Protex Erva Doce 85G,3.99,3.99
1333,Sabonete Phebo Raiz Do Oriente Unidade 90G,4.99,4.99
1334,Desodorante Antitranspirante Active Emotion Rexona 150Ml,16.99,16.99
1335,Sabonete Francis Suave Equilíbrio Erva Doce 85G,2.69,2.69
1336,Sabonete em Barra Naturals Hidratação Intensiva Palmolive 85G,2.99,2.99
1337,Desodorante Antitranspirante Antibacterial Invisible Rexona 150Ml,16.99,16.99
1338,Desodorante Antitranspirante Aerosol Invisible Men Rexona 150Ml,16.99,16.99
1339,Desodorante Aerosol Masculino Original Protect Nivea 150Ml,14.99,14.99
1340,Sabonete Barra Protex Suave 85G,3.99,3.99
1341,Sabonete em Barra Lavanda La Flore Davene 150G,4.99,4.99
1342,Aparelho Barbear Comfort3 Pele Sensível Bic,4.99,4.99
1343,Sabonete Dove Equilibrio de Oleosidade 90G,4.49,4.49
1344,Desodorante Aerosol Men Sport Above 150Ml,11.99,11.99
1345,Desodorante Above Elements Vulcan 150Ml,11.99,11.99
1346,Ap.Probak Ii C/2,2.49,2.49
1347,Sabonete em Barra Naturals Sensação Purificante Palmolive 85G,2.99,2.99
1348,Desodorante Antitranspirante Aerosol Dove Invisible 150Ml,19.99,19.99
1349,Loção Hidratante Framboesa Negra Paixão 200Ml,8.99,8.99
1350,Sabonete Lux Botanicals Rosas Francesas 125G,3.69,3.69
1351,Sabonete Naturals Esfoliação Delicada Palmolive 85G,2.99,2.99
1352,Nivea Loção Hidratante Lotion Express 48H Hidratação Profunda 200Ml,16.99,16.99
1353,Sabonete Barra Nivea Hidrante Água de Coco 85G,3.69,3.69
1354,Sabonete Líquido Palmolive Naturals Jasmim Refil 120Ml,5.99,5.99
1355,Loção Hidratante Skala Água de Coco Embalagem 500Ml,8.99,8.99
1356,Desodorante Antitranspirante Spray Lenha Old Spice 150Ml,16.99,16.99
1357,Sabonete em Barra Lux Buquê Dos Sonhos Unidade 125G,3.69,3.69
1358,Desodorante Masculino Antitranspirante Nivea Invible Balck & White Embalagem Rollon 50Ml,8.99,8.99
1359,Aparelho de Barbear Prestobarba 2 Ultragrip Sensitive Gillette,3.69,3.69
1360,Sabonete em Barra Dálias da Espanha Francis 90G,3.69,3.69
1361,Hidratante Corporal Amêndoas Doces Skala 400Ml,8.99,8.99
1362,Desodorante Nivea For Men Fresh Invisible Black & White Rollon 50Ml,8.99,8.99
1363,Desodorante Feminino Above Lady Aerosol 150Ml,11.99,11.99
1364,Desodorante Aerosol Bozzano Dry Proteção Seca Frasco 90G,11.99,11.99
1365,Sabonete em Barra Vegetal Flor de Maracujá La Flore Davene 150G,4.99,4.99
1366,Sabonete Barra Vegetal Flor de Cereja La Flore Davene 180G,4.99,4.99
1367,Desodorante Antitranspirante Rexona V8 50Ml,9.99,9.99
1368,Desodorante Masculino Antitranspirante Nivea Men Dry Impact Embalagem Aerosol 150Ml,14.99,14.99
1369,Desodorante Aerosol Bozzano Power Protection Carvão Ativado 150Ml,11.99,11.99
1370,Sabonete em Barra Naturals Hidratação Saudável Palmolive 85G,2.99,2.99
1371,Sabonete Líquido Protex Pro Hidrata Vitamina e Refil 120Ml,7.99,7.99
1372,Sabonete Palmolive Naturals Nutrição & Suavidade 150G,4.99,4.99
1373,Sabonete Classico Orquídea e Quarzo Francis 90G,3.69,3.69
1374,Desodorante Antitranspirante Suave Invisible 150Ml,11.99,11.99
1375,Desodorante Nivea Activ Dry Fresh For Men Aerosol 150Ml,14.99,14.99
1376,Desodorante Feminino Antitranspirante Nivea Protect Care Aerosol 90G,14.99,14.99
1377,Loção Hidratante de Avelã Paixão 200Ml,8.99,8.99
1378,Desodorante Feminino Alma de Flores Essência de Jasmim Embalagem Spray 90Ml,7.99,7.99
1379,Desodorante Feminino Antitranspirante Dry Comfort Plus Aerosol Nivea 150Ml,14.99,14.99
1380,Sabonete em Barra Vegetal Flor de Vanila La Flore Davene 150G,4.99,4.99
1381,Sabonete Palmolive Naturals Hidratação Intensiva 150G,4.99,4.99
1382,Desodorante Antitranspirante Suave Invisible 150Ml,11.99,11.99
1383,Hidratante Desodorante Nivea Soft Milk 200Ml,16.99,16.99
1384,Hidratante Desodorante Monange Hidratação Intensiva Leite de Amêndoas 200Ml,7.99,7.99
1385,Aparelho de Barbear Gillette Mach3 Acqua-Grip 1Un,24.99,24.99
