,Produto,Preço Base,Preço Final
0,Água Sanitária Classic 5 Litros,12.55,12.55
1,Limpador Multiuso Veja 10% Desconto 500Ml,4.29,4.29
2,"Agua Sanitaria Super Globo Pague 1,8Ltr Leve 2Ltr",5.69,5.69
3,Água Sanitária Santa Clara Embalagem 2 Litros,5.39,4.98
4,Alcool Anhanguera 70 Embalagem 1 Litro,7.39,7.39
5,Soda Cáustica Escorpião 1Kg,30.99,30.99
6,Tira Limo Veja X14 Cloro Ativo Squeeze Oferta 500Ml,14.15,14.15
7,Kit Limpador Multiuso Azulim 550Ml 3Un,8.39,8.39
8,Água Sanitária Classic 1Litro,3.29,3.29
9,Limpador Multiuso Cif Cremoso Original Oferta 450Ml,13.39,13.39
10,Tira Limo Azulim Embalagem 500Ml,4.25,3.99
11,Limpador Desengordurante Cozinha Limão Veja 500Ml 20% de Desconto,9.99,9.99
12,Pedra Sanitária Mil Aromas Fragrâncias Embalagem 25G,2.49,2.49
13,Pastilha Adesiva Pato Lavanda Oferta Embalagem 3Un,9.2,9.2
14,Limpador Uau Perfumes Lavanda e Conforto Embalagem L1p800ml,5.95,5.95
15,Sapólio Radium Pó Clássico,5.65,4.99
16,Pedra Sanitária Inspira Lavanda 1Un,2.79,2.79
17,Limpador Uau Multiuso Lavanda 500Ml,4.2,4.2
18,Limpador Limpeza Pesada Veja 500Ml,7.55,7.55
19,Cera Líquida Special Taco/Madeiras Ingleza Maxx 750Ml,14.29,14.29
20,Desentupidor de Piá Diabo Verde Embalagem 300G,18.85,18.85
21,Desinfetante Pinho Lavanda Super Globo 500Ml,3.25,3.25
22,Detergente Tablete para Máquina de Lavar Louças Limpol Caixa 20G Cada 25 Unidades,33.1,33.1
23,Cera Líquida Incolor Brilho Fácil 750Ml,11.15,11.15
24,Limpador Azulim Lavanda Embalagem 1L,6.89,5.99
25,Cera Líquida Brilhowax Incolor 750Ml,9.59,9.59
26,Álcool Mega Gel Neutro 70º Embalagem 500Ml,6.25,6.25
27,Limpador Multiuso Uau Cloro Ativo 500Ml,7.89,7.89
28,Desengordurante Azulim Limpeza Pesada Limão Embalagem 500Ml,4.99,4.99
29,Sapólio Radium Cremoso Clássico Multiuso Bombril 250Ml,8.89,8.89
30,Desinfetante Pinho Bril Campos de Lavanda 500Ml,3.79,3.79
31,Cera Líquida para Piso de Pedra Ardósia Verde Ingleza Embalagem 750Ml,9.89,9.89
32,Limpador Cif Banheiro Tira Limo com Cloro 450Ml,7.69,7.69
33,Limpador Multiuso Azulim Original Azul 500Ml,2.69,2.69
34,Limp Alumínio Mix Embalagem 500Ml,2.49,2.49
35,Desinfetante Pinho Sol Original 500Ml,7.29,7.29
36,Pedra Sanitária Marine Oferta Pato,3.45,3.45
37,Lustra Móveis Lavanda Preço Especial Poliflor 500Ml,16.35,16.35
38,Álcool Líquido Flops 96 Embalagem 500Ml,5.29,5.29
39,Cloro Aditivado Vim Original 700 Ml,10.79,10.79
40,Soda Caustica Escorpião Embalagem 500G,17.95,17.95
41,Desinfetante Citrus Lysoform 1L,12.6,12.6
42,Sapólio Radium Pó Lavanda 300G,5.65,4.99
43,Gel Adesivo Sanitário Pato Citrus Refil 38G,15.49,15.49
44,Desinfetante Líquido Original Lysoform 500Ml,5.85,5.85
45,Desinfetante Multiuso Antibac Cif 500Ml,3.99,3.99
46,Desinfetante Santa Clara Floral Embalagem 2 Litros,5.7,5.7
47,Limpador Multiuso Coco Veja Power Fusion Squeeze 500Ml,9.59,9.59
48,Limpador Veja Limpeza Pesada Floral Campestre 500Ml,12.35,12.35
49,Pedra Sanitária Bosque de Pinho Oferta Glade 25G,3.45,3.45
50,Limpa Alumínio Feroz Embalagem 500 Ml,2.98,2.98
51,Óleo de Peroba King 100Ml,9.1,9.1
52,Óleo de Peroba 200Ml,13.99,13.99
53,Limpador Multiuso Uau Flores e Frescor Ingleza 500Ml,4.2,4.2
54,Limpador Multiuso Super Globo Original Embalagem 500Ml,3.39,3.39
55,Cera Polylar Incolor 750Ml,5.25,5.25
56,Lustra Móveis Bravo Líquido Lavanda Embalagem 200Ml,8.65,8.65
57,Cera Ingleza Ardosia Incolor Embalagem 750Ml,9.89,9.89
58,Cera Líquida Nugget Preto 33% de Desconto Embalagem 60Ml,12.98,12.98
59,Desinfetante Pinho Sol Limão 500Ml,7.29,7.29
60,Desinfetante Omo Pinho 1L,9.39,9.39
61,Óleo King Peroba Embalagem 500Ml,23.99,23.99
62,Graxa para Sapato em Pasta Preta Nugget Lata 36G,10.25,10.25
63,Limpador Multiuso Super Globo Embalagem 500Ml,4.65,4.65
64,Desinfetante Uso Geral Ufe 750Ml,13.85,13.85
65,Desinfetante Omo Pinho 1.75L,13.98,13.98
66,Querosene Solar 900Ml,16.69,16.69
67,Cera Líquida Brilhowax Vermelha 750Ml,9.59,9.59
68,Limpa Vidros Classic Alvejante 500Ml,4.2,4.2
69,Soda Cáustica Yara 480G,9.98,9.98
70,Água Sanitária Du Lar 1L,3.25,3.25
71,Cloro Cloro Mais 2 Litros,6.79,6.79
72,Desinfetante e Alvejante Cloro Mais 2L,6.79,6.79
73,Limpador Acido Muriatico Mais 1L,6.35,6.35
74,Pedra Sanitária Bouquet Lavanda Embalagem com 25% de Desconto Glade 25G,3.45,3.45
75,Eliminador de Odores Multiuso Hortelã Uau 500Ml,4.2,4.2
76,Evita Mofo Secar Lavanda 80G,5.2,5.2
77,Antimofo Secar Lavanda Embalagem 80G,5.2,5.2
78,Bloco Higiênico Limppano Inspira Campos de Lavanda Embalagem 1 Un,11.99,11.99
79,Aromatizador de Ambientes Spray Lavanda e Baunilha Oferta Glade 269Ml,32.85,32.85
80,Aromatizador Air Wick Freshmatic Spray Automático Lavanda Refil 250Ml,26.7,26.7
81,Pedra Inspira Perfumada Pinho 25%Desconto,2.79,2.79
82,Desumidificador Secar Original Natural Embalagem 80G,5.2,5.2
83,Detergente Ypê Clear 500Ml,2.75,2.75
84,Detergente Ypê Neutro 500Ml,2.75,2.75
85,Detergente Coco Ypê 500Ml,2.75,2.75
86,Detergente Limpol Coco 500Ml,2.39,2.39
87,Detergente Ypê Clear 500Ml Oferta 6Un Grátis Esponja,15.45,15.45
88,Lava Louças com 10% de Desconto Clear Ypê 500Ml com 6Un,14.2,14.2
89,Detergente Líquido Limpol Cristal Embalagem 500Ml,2.39,2.39
90,Detergente Ypê Limão 500Ml,2.75,2.75
91,Detergente Líquido Azulim Neutro 500Ml,1.99,1.99
92,Detergente Limpol Maçã 500Ml,2.39,2.39
93,Detergente Limpol Limão 500Ml,2.39,2.39
94,Detergente Líquido Maçã Ypê 500Ml,2.75,2.75
95,Detergente Líquido Azulim Clear 500Ml,1.99,1.99
96,Pasta Multiuso Cristal Rosa 500G,5.25,5.25
97,Detergente Liquido Maçã Smart 500Ml,1.99,1.99
98,Naftalina Sanilar em Bolas Embalagem 50G,1.89,1.89
99,K-Othrine 30Ml,10.7,10.7
100,Inseticida Raid Multi Insetos Base Água 420Ml,13.79,12.98
101,Inseticida Raid Acqua Protec Aerosol 420Ml,13.79,12.98
102,Inseticida Raid Multi Insetos Eucalipto Oferta 420Ml,13.79,12.98
103,"Repelente Elétrico Liquido 45 Noites Aparelho e Refil Original Raid 32,9M",13.85,13.85
104,Inseticida Raid Mata Baratas Formigas Oferta 420Ml,13.79,12.98
105,Inseticida Boa Noite Original Espiral 96G,3.2,3.2
106,"Inseticida Raid 30 Noites Elétrico Refil 21,9Ml",13.19,13.19
107,Inseticida Raid Multi Insetos Citronela Oferta 420Ml,13.79,12.98
108,Repelente Elétrico Raid Pastilha Oferta Refil 12Un,4.45,4.45
109,Inseticida Aerosol Ação Total Baygon 360Ml,11.89,11.89
110,Repelente Espiral Metal Baygon com 10Un,4.9,4.9
111,Sbp Multi Inseticida Aerossol Embalagem Econômica 380Ml,10.85,10.85
112,Sbp Repelente Elétrico Líquido 45 Noites Refil 35Ml,12.49,12.49
113,Inseticida Detefon Ação Total Aerosol 300Ml,12.89,12.89
114,"Lava Roupas Limpeza Total Brilhante 1,6Kg",19.59,19.59
115,Sabão em Pó Classic Plus 2Kg,12.8,12.8
116,Sabão em Pó Omo Lavagem Perfeita 400G,9.1,9.1
117,Lava-Roupas Pó Lavagem Perfeita Omo 800G,15.89,15.89
118,Sabão em Pó Urca Maxx Sachê 1Kg,6.79,6.79
119,Lava Roupas Sanitizante em Pó Brilhante Limpeza Total 2.2Kg,26.49,21.98
120,Sabao Glic Ype Neutro 900G,14.85,13.49
121,"Tira Manchas Suprema Ultra Remoção Embalagem 1,5L",8.59,8.59
122,Lava-Roupas Líquido Omo Lavagem Perfeita Galão 3L,48.59,48.59
123,Lava Roupas em Pó Tixan Ypê Primavera 800G,14.49,14.49
124,Lava Roupas em Pó Baby Soft 2Kg,16.75,16.75
125,Sabão em Pó Classic Plus 1Kg,6.45,6.45
126,"Lava-Roupas em Pó Concentrado Primavera Tixan Ypê 1,3Kg",18.2,18.2
127,Lava Roupas Pó Coquel Natureza Limpa Caixa Pg800g. e Lv.1Kg,9.65,9.65
128,"Amaciante Concentrado Downy Brisa de Verão 1,5L",32.29,32.29
129,Alvejante Classic sem Cloro 2 Litros,14.89,14.89
130,Sabão em Barra Glicerinado Neutro Ypê 180G,3.59,3.59
131,Amaciante Concentrado Comfort Intense Puro Cuidado 500Ml,10.49,10.49
132,"Amaciante para Roupas Baby Soft Carinho 1,8L",6.99,6.99
133,Lava-Roupas em Pó Concentrado Maciez Tixan Ypê 400G,6.89,6.89
134,Sabão em Barra Glicerinado Neutro Minuano 1Kg,15.75,15.75
135,Sabão Líquido Urca 3L,17.29,17.29
136,Sabão em Barra Glicerinado Minuano 180G,3.69,3.69
137,Amaciante Amacitel Luxo Momento de Carinho 2L,7.99,6.98
138,Amaciante para Roupas Amacitel Momentos de Carinho Branco Embalagem 2L,7.99,6.98
139,Tira Manchas Vanish Super Barra 75G,8.95,8.95
140,Sabão Líquido Surf 5Em1 Cuidado do Coco 3L,24.29,24.29
141,Tira Manchas Vanish Super Barra Roupas Brancas 75G,8.95,8.95
142,Amaciante Toque de Poesia Luxo Amacitel 2L,7.99,6.98
143,Lava Roupas em Pó para Roupas Brancas e Coloridas Cuidado Total Brilhante 400G,6.99,6.99
144,Amaciante Concentrado Fofo Tradicional 500Ml,7.59,7.59
145,Amaciante para Roupas Diversão Amarelo Amacitel 2L,7.99,6.98
146,Amaciante Rosa Alegres Encantos Amacitel 2L,7.99,6.98
147,Tira Manchas Vanish Pré-Lavagem Resolv Tradicional 450Ml,17.79,17.79
148,Sabão em Barra Multiativo Ypê 180G,3.59,3.59
149,Amaciante Alegres Encantos Amacitel 2L,7.99,6.98
150,Alvejante Classic Poder 02 sem Cloro 450G,16.35,16.35
151,Sabão Líquido Ufe Coco 500Ml,9.45,9.45
152,Amaciante Amacitel Luxo Diversão Embalagem 2 Litros,7.99,6.98
153,Sabão em Pedra de Coco Ufe com 5Un de 180G Cada,25.52,25.52
154,Sabão em Barra Ufe Coco Pacote 200G,4.45,4.45
155,Sabão Barra Glicerinado Flores e Frutas Ypê 180G,3.69,3.69
156,Sabão Líquido para Roupas Classic Plus Galão 5 Litros,26.7,26.7
157,Sabão Barra Classic 200G 5Un,11.69,11.69
158,Esponja de Aço Bombril Pacote 60G,2.65,2.65
159,Esponja de Aço Assolan 60G,2.35,2.35
160,Esponja Santa Clara Oferta 4Un,3.79,3.79
161,Esponja Multiuso Limpeza Pesada Limppano Pacote 4Un,4.65,4.65
162,Esponja Multiuso Assolan 3Un,2.99,2.99
163,Esponja Multiuso Wish C/ 1Un,0.98,0.98
164,Esponja de Aço Assolam Ypê 45G,2.35,2.35
165,Escova Lava Roupas Fricci Plástica,2.89,2.89
166,Luva Mucambo Profissional Azul G Embalagem 1 Par,4.79,4.79
167,Pano de Chão Alklin Esfregão Embalagem Leve 3 Un Pague 2,11.49,11.49
168,Pano Multiuso Perfex Azul 5Un,7.55,7.55
169,Pano de Piá Alvejado Alklin 28X30cm Embalagem 1 Un,2.15,2.15
170,Vassoura Bettanin Noviça com Cabo,18.79,18.79
171,Esponja Limppano Antiaderente Embalagem 1 Un,2.15,2.15
172,Saco de Lixo Vare 50L 40Un,12.98,12.98
173,Pano Multiuso Limppano Toalex Reutilizáveis Embalagem 50 Un,12.95,12.95
174,Espoja Scotch-Briet Economia Embalagem Unitária,1.9,1.9
175,Saco de Lixo 15 Litros Peg Lixo com 80 Sacos,12.98,12.98
176,Palha de Aço Brillo Grossa N2 25G,1.29,1.29
177,Saco Lixo Bye Bye 100 Litros,9.55,9.55
178,Esponja Brilhus Protege Unhas 1Un,3.39,3.39
179,Saco de Lixo Bye Bye 100L 15 Un,9.49,9.49
180,Saco de Lixo Preto 30L Peg Lixo Rolo 40Un,12.98,12.98
181,Saco de Lixo Bye Bye Especial 100 Litros Embalagem 5 Un,4.25,4.25
182,Saco de Lixo Peg Lixo 50L 40 Un,13.69,13.69
183,Esponja Inox Flash Limp Limpeza Pesada 1Un,4.89,4.89
184,Saco de Lixo Vare 100L 20Un,12.98,12.98
185,Saco de Lixo Bye Bye Especial 50L 10 Un,4.25,4.25
186,Palha de Aço Açobom N2 Embalagem 22G,1.29,1.29
187,Saco de Lixo Vare 15L 80Un,11.98,11.98
188,Saco de Lixo Bye Bye 15 Litros Embalagem 20 Un,3.45,3.45
189,Luva Volk Multiuso Latex Grande,6.35,6.35
190,Saco de Lixo Bye Bye 50L 30 Un,10.99,10.99
191,Palha de Aço Açobom N0 Embalagem 22G,1.29,1.29
192,Saco Bye Bye Lixo 50L Reforçado 10Un,7.45,7.45
193,Palha de Aço Gavião N1 Embalagem 1 Un,1.29,1.29
194,Saco de Lixo Bye Bye 30 Litros Embalagem 10 Un,4.25,4.25
195,Saco Bye Bye Lixo Reforçado 200L 10Un,10.65,10.65
196,Pá para Lixo Purezitta com Cabo 60Cm 1 Un,6.99,6.99
197,Pá para Lixo Purezitta Galvanizada 30Cm 1 Un,6.3,6.3
198,Saco de Lixo Lixo Forte Reforçado 100L 5 Un,5.15,5.15
199,Saco Alvejado Arauprata 43X65cm 1Un,7.7,7.7
200,Pano de Prata Arauprata Vies Embalagem 1 Un,4.05,4.05
201,Saco de Lixo Baglixo Piá e Banheiro 100 Un,8.29,8.29
202,Luva Multi Uso Tamanho G Volk,6.35,6.35
203,Saco de Lixo Lixo Forte Reforçado 60L 10 Un,5.15,5.15
204,Flanela Microfibra Arauprata 35X55cm 1Un,7.25,7.25
205,Pano de Prato Overlock Arauprata Unidade,3.9,3.9
206,Flanela Arauprata Laranja 38X58cm 1Un,3.3,3.3
207,Saco de Lixo Ideal Plus 50L 10 Un,2.99,2.99
208,Vassoura Purezitta Varre Mais 1Un,15.65,15.65
209,Pano Piso Arauprata 60X80cm,6.99,6.99
210,Pano Piso Arauprata Alvejado Padrão 48X70cm,7.69,7.69
211,Esponja Multiuso 20% Desconto Limppano 3 Unidades,3.49,3.49
212,Balde Formplast Unidade 6L,7.55,7.55
213,Açúcar Refinado União 1Kg,5.79,5.79
214,Açúcar Refinado Guarani 1Kg,5.25,5.25
215,Açucar União Demerara 1Kg,7.99,7.99
216,Adoçante com Stevia Magro 80Ml,8.79,8.79
217,Adoçante Sacarina Zero Cal 200Ml,10.35,10.35
218,Adoçante em Pó Sucralose Linea 50Un,8.99,8.99
219,Adoçante Dietético Líquido Assugrin 200Ml,8.05,8.05
220,Adocante Linea Stevia 2X30ml 50% Desconto Na Segunda Unidade,17.99,17.99
221,Açúcar Mascavo Vivamais Pacote 500G,6.15,6.15
222,Açúcar Cristal Brucucar 1Kg,3.85,3.85
223,Açúcar Cristal Brucucar 5Kg,15.99,15.99
224,Arroz Tipo 1 Camil 5Kg,23.4,23.4
225,Arroz Camil Agulhinha - 5Kg,23.4,23.4
226,Arroz Bianco Tipo 1 Sepé 5Kg,20.99,20.99
227,Arroz Bianco Tipo 1 Sepé 2Kg,9.85,9.85
228,Arroz Prato Fino Branco Tipo 1 Pacote 5Kg,28.4,28.4
229,Arroz Tipo 1 Carrijo Embalagem 5Kg,18.3,18.3
230,Arroz Agulhinha Vare Embalagem 5Kg,21.4,21.4
231,Arroz Tipo 1 Palmares Branco Pacote 5Kg,21.4,21.4
232,Arroz Prato Fino 1Kg Tp1,6.49,6.49
233,Arroz Bianco Tipo 1 Sepé 1Kg,4.95,4.95
234,Arroz Prato Fino 5Kg Parbolizado,27.99,27.99
235,Cesta Básica Pequena,93.74,93.74
236,Cesta Básica Grande,134.1,134.1
237,Fubá Mimoso Fino Sinhá 1Kg,4.05,4.05
238,Farinha de Trigo Vilma Pacote 1Kg,6.35,6.35
239,Farinha de Trigo com Fermento Vilma 1Kg,6.99,6.99
240,Farinha de Trigo Boa Sorte Tipo 1 Pacote 1Kg,5.99,5.99
241,Farinha de Trigo Original Tipo 1 Globo Pacote 1Kg,5.25,5.25
242,Tapioca Preciosa Embalagem 400G,4.15,4.15
243,Fubá Mimoso Big Jo Embalagem 1Kg,4.15,4.15
244,Amido de Milho Pacha Embalagem 500G,4.05,4.05
245,Amido de Milho Maizena Tradicional 200G,3.95,3.95
246,Tapioca Anchieta Hidratada 500G,5.85,5.85
247,Polvilho Azedo Amafil 1Kg,9.95,9.95
248,Farofa Pronta de Mandioca Pacha Sabor Bacon Embalagem 300G,3.25,3.25
249,Fubá Mimoso Pacha Embalagem 1Kg,4.05,4.05
250,Flocos de Milho Pré-Cozido Quaker Milharina Pacote 500G,5.89,5.89
251,Farinha de Mandioca Pink Branca Embalagem 1Kg,7.45,7.45
252,Farinha de Mandioca Amafil Torrada 1Kg,7.45,7.45
253,Farofa de Milho Pronta Yoki 500G,10.49,10.49
254,Polvilho Azedo Amafil Pacote Plástico 1Kg,9.95,9.95
255,Polvilho Azedo Marinez Embalagem 1Kg,9.95,9.95
256,Farinha de Milho Pink Pacote 500G,3.89,3.89
257,Farinha de Milho Big Jo 500G,3.69,3.69
258,Farinha Flocão de Milho Pachá 500G,3.05,3.05
259,Farinha de Milho Flocada Pink 500G,4.05,4.05
260,Farofa Pronta Temperada Picanha Pink 250G,3.15,2.99
261,Farinha de Mandioca Acigal 1Kg,5.45,5.45
262,Farinha de Milho Biju Pacha 500G,3.75,3.75
263,Farofa Temperada Preciosa Apimentada Embalagem 400G,6.49,6.49
264,Farofa de Mandioca Pronta Pacha Embalagem 300G,3.25,3.25
265,Farofa Pronta Tradicional Pink Embalagem 250G,3.15,2.99
266,Farelo de Trigo Contemper 250G,5.29,5.29
267,Farinha de Rosca Big Jo 500G,6.25,6.25
268,Farinha de Linhaça Dourada Contemper 100G,5.99,5.99
269,Fubá Grosso Turama 5Kg,13.49,13.49
270,Feijão Carioca Vare Embalagem 1Kg,7.45,7.45
271,Feijão Carioca Pink Tipo 1 Embalagem 1Kg,10.79,10.79
272,Feijão Preto Anchieta 1Kg,7.35,7.35
273,Feijão Preto Pachá 1Kg,9.65,9.65
274,Feijão Fradinho Pachá 500G,5.1,5.1
275,Feijão Branco Pink Embalagem 500G,8.75,8.75
276,Milho para Pipoca Pink Embalagem 500G,4.29,3.79
277,Canjica Branca Pacha Embalagem 500G,6.1,6.1
278,Canjiquinha Amarela Pacha 500G,2.59,2.59
279,Pipoca de Microondas Temperada com Toque de Chef Yoki 100G,3.05,3.05
280,Pipoca de Microondas Yoki Popcorn Manteiga 100G,3.05,3.05
281,Milho Pipoca Anchieta Premium 500G,4.49,4.49
282,Ervilha Seca Pachá 500G,7.45,7.45
283,Trigo para Quibe Pink Embalagem 500G,5.1,5.1
284,Pipoca para Microondas Pink Bacon Embalagem 100G,3.35,2.68
285,Canjica Branca Big Jo 500G,6.59,6.59
286,Pipoca de Micro-Ondas Sabor Bacon Yoki 100G,3.05,3.05
287,Pipoca de Micro-Ondas Sabor Natural Yoki 100G,3.05,3.05
288,Canjiquinha Pink Amarela 500G,3.15,3.15
289,Pipoca para Microondas Pink Natural Embalagem 100G,3.35,2.68
290,Pipoca para Micro-Ondas Pink Manteiga 100G,3.35,2.68
291,Trigo para Quibe Big Jo 500G,4.69,4.69
292,Canjiquinha Big Jo 500G,2.45,2.45
293,Canjiquinha Big Jo 1Kg,4.59,4.59
294,Milho para Pipoca Big Jo 500G,3.95,3.95
295,Semente de Chia Viva Mais 150G,8.65,8.65
296,Milho Turama 5Kg,13.49,13.49
297,Macarrão Vilma Espaguete 9 500G,5.29,5.29
298,Macarrão Vilma Linguine 500G,5.29,5.29
299,Macarrão Massa Ovos Vilma Espaguete 8 500G,5.29,5.29
300,Macarrão Instantâneo Nissin Lámen Galinha 85G,2.55,2.55
301,Macarrão de Sêmola Espaguete Nº8 Galo 500G,3.45,3.45
302,Macarrão Massa Ovos Vilma Penne 500G,5.29,5.29
303,Macarrão Espaguete Yara Sêmola N8 Embalagem 500G,4.05,4.05
304,Macarrão Parafuso Tricolor Santa Amália Embalagem 500G,7.05,7.05
305,Macarrão Parafuso Yara Sêmola Embalagem 500G,4.05,4.05
306,Macarrão Instantâneo Nissin Costela 85G,2.55,2.55
307,Macarrão Instantâneo Express Galinha Caipira Renata 85G,1.39,1.39
308,Macarrão de Sêmola Galo Linguine Pacote 500G,3.45,3.45
309,Macarrão Instantâneo Renata Express Galinha Pacote 85G,1.39,1.39
310,Macarrao Instantaneo Renata 85G Express Carne,1.39,1.39
311,Macarrão Instantâneo Panco Lámen Tradicional Galinha Capira 85G,1.29,1.29
312,Macarrão Espaguete Vilma Ovos N10 Embalagem 500G,5.29,5.29
313,Macarrão Santa Amália Ovos Tagliarini 500G,7.4,6.59
314,Macarrão Parafuso Santa Amália com Ovos Pacote 500G,4.85,4.85
315,Macarrão Pena com Ovos Santa Amália 500G,4.85,4.85
316,Macarrão Vilma C/ Ovos Ave Maria 500G,5.29,5.29
317,Macarrão Instantâneo Santa Amália Picanha Pacote 85G,1.69,1.59
318,Macarrão Santa Amália com Ovos Linguine Pacote 500G,4.85,4.85
319,Macarrão Instantâneo Nissin Bacon 85G,2.55,2.55
320,Macarrão Pena Santa Amália Vegetais com Ovos Pacote 500G,7.05,7.05
321,Macarrão com Ovos Parafuso Renata 500G,4.05,3.46
322,Massa Lasanha Vilma Sêmola Embalagem 500G,9.39,9.39
323,Macarrão Santa Amália com Ovos Fettuccine N3 Pacote 500G,7.4,6.59
324,Macarrão Instantâneo Santa Amália Galinha Caipira Pacote 85G,1.69,1.59
325,Macarrão Instantâneo Panco Lámen Galinha Tradicional 85G,1.29,1.29
326,Macarrão Massa Ovos Vilma Pai Nosso 500G,5.29,5.29
327,Macarrão Espaguete Santa Amália com Ovos N8 Pacote 500G,4.85,4.85
328,Macarrão Instantâneo Panco Lámen Tradicional Carne 85G,1.29,1.29
329,Macarrão de Sêmola Galo Ave Maria Pacote 500G,3.45,3.45
330,Macarrão Instantâneo Nissin Talharim Carbonara 99G,3.35,3.35
331,Lasanha Pré Cozida Galo Pacote 200G,3.65,3.65
332,Macarrão Vilma Gnocchi com Ovos Embalagem 500G,5.29,5.29
333,Macarrão Integral Espaguete 8 Vilma 500G,6.79,6.79
334,Macarrão Instantâneo Nissin Espaguete 500G,8.49,8.49
335,Macarrão Instantâneo Nissin Yakissoba Tradicional 87G,2.55,2.55
336,Macarrão Ave Maria Yara Embalagem 500G,4.05,4.05
337,Macarrão Instantâneo Cup Noodles Galinha Caipira 69G,5.1,5.1
338,Macarrão Instantâneo Santa Amália Carne Pacote 85G,1.69,1.59
339,Macarrão Santa Amália com Ovos Ave Maria Pacote 500G,4.85,4.85
340,Macarrão Parafusinho Santa Amália com Ovos Pacote 500G,4.85,4.85
341,Macarrão Serpentinni Vilma com Ovos Embalagem 500G,5.29,5.29
342,Macarrão Santa Amália com Ovos Padre Nosso Pacote 500G,4.85,4.85
343,Macarrão Instantâneo Nissin Turma do Chico Bento Canja de Galinha 75G,2.55,2.55
344,Macarrão Pappardelle Vilma com Ovos Embalagem 500G,7.15,7.15
345,Macarrão Instantâneo Nissin Talharim Carne com Tomate 99G,3.35,3.35
346,Macarrão com Ovos Renata Ave Maria Pacote 500G,4.05,3.46
347,Macarrão Caracol Vilma com Ovos Pacote 500G,5.29,5.29
348,Macarrão Instantâneo Nissin Turma do Chico Bento Caldinho com Feijão Suave 85G,2.55,2.55
349,Macarrão Instantâneo Chico Bento Milho Na Manteiga Nissin 75G,2.55,2.55
350,Macarrão Instantâneo Amo Galinha 60G,1.29,1.29
351,Macarrão Instantâneo Amo Galinha Caipira 63G,1.29,1.29
352,Macarrão Instantâneo Amo Carne 63G,1.29,1.29
353,Óleo de Soja Abc 900Ml,8.1,8.1
354,Óleo de Soja Liza 900Ml,8.29,8.29
355,Azeite Português Extra Virgem Andorinha Vidro 500Ml,32.35,32.35
356,Óleo de Soja Refinado Abc Pet 900Ml,8.1,8.1
357,Vinagre de Álcool Belmont Pet 750Ml,3.39,3.39
358,Azeite de Oliva Extra Virgem Gallo 500Ml,32.9,32.9
359,Azeite de Oliva Cocinero Extra Virgem Embalagem 500Ml,28.75,28.75
360,Azeite Chileno Extra Virgem O-Live Vidro 500Ml,28.69,28.69
361,Vinagre de Álcool Toscano Colorido Embalagem 750Ml,2.55,2.55
362,Óleo de Milho Sinhá 900Ml,17.95,17.95
363,Vinagre Toscano com Limão Embalagem 750Ml,5.39,5.39
364,Vinagre de Maça Belmont Pet 750Ml,6.25,6.25
365,Ovo Branco Perfa Grande 30Un,21.59,21.59
366,Ovo Branco Perfa 30Un,21.59,21.59
367,Ovo Vermelho Perfa 12Un,10.49,10.49
368,Ovo Branco Perfa 12Un,8.99,8.99
369,Ovos Vermelho Perfa 12Un,10.49,10.49
370,Ovo Branco Ho 12Un,8.99,8.99
371,Ovo Bco G Perfa Filmado Pente,21.59,21.59
372,Ovos Branco Pente,21.59,21.59
373,Ovos Brancos Duzia Perfa Alimentos,8.99,8.99
374,Ovos Branco Perfa 12Un,8.99,8.99
375,Ovo Vermelho Wph 12Un,10.49,10.49
376,Ovos Perfa Vermelho Grande 12Un,10.49,10.49
377,Sal Refinado Globo Pacote 1Kg,1.89,1.89
378,Sal Temperado Pacha Embalagem 500G,4.69,4.69
379,Sal Especial Gigante Pacote 1Kg,1.45,1.45
380,Sal Refinado Iodado Gigante 1Kg,1.45,1.45
381,Uva Passa Escura La Violetera sem Semente Sachê 100G,3.35,3.35
382,Ameixa Seca La Violetera sem Caroço Pacote 100G,8.79,8.79
383,Frutas Cristalizadas Ananda,9.55,9.55
384,Tempero Alho Cheiroso Massa 1Kg,14.15,14.15
385,Sobrecoxa com Osso Nat 1Kg,13.89,13.89
386,Coxa Sobrecoxa Resfriada Kg,10.25,10.25
387,Frango À Passarinho Congelado Iqf Na 1Kg,12.69,12.69
388,Frango Congelado Filé de Peito Nat 1Kg,22.89,22.89
389,Peito Frango Resfriado Kg,13.55,13.55
390,Asa Resfriada Frango Kg,14.35,14.35
391,Coxa de Frango Congelado Nat 1Kg,11.99,11.99
392,Peito de Frango Cozido e Desfiado Congelado Nat 400G,15.49,13.99
393,Filé de Peito de Frango Congelado Sadia 1Kg,22.99,22.99
394,Frango Pif Paf Fígado Embalagem 500G,3.79,3.79
395,Filé Peito Frango Perdigão Bandeja 1Kg,23.65,23.65
396,Peito Frango Tropeira Desfiado 400G,16.95,16.95
397,Ac Pe Frango Kg,5.89,5.89
398,File de Peito Nat. 1Kg,22.89,22.89
399,Pescoço Peru Congelado Kg,18.21,18.21
400,Alcatra,38.99,38.99
401,Açougue Patinho Bovino Kg,37.99,37.99
402,Fígado de Boi Açougue,18.15,18.15
403,Chá Dentro Bovino Kg,37.65,37.65
404,Acém Bovino Pedaço Kg,29.99,29.99
405,Fraldinha Kg,35.9,35.9
406,Bife Ancho Kg,44.99,44.99
407,Músculo 1Kg,27.99,27.99
408,Lingua Bov Congelada Kg,26.99,26.99
409,Dobradinha 500 Klg,14.0,14.0
410,Maçã Peito Bovino Kg,29.99,29.99
411,Músculo Moído Kg,27.99,27.99
412,Auto Carne Bovína Contra Filé Kg,46.65,46.65
413,Bacon Manta,26.49,26.49
414,Bacon em Cubos Saudali 200G,6.85,5.49
415,Bacon Paleta,22.3,22.3
416,Bacon Fatiado Tropeira 200G,7.89,6.98
417,Sadia Linguiça Calabresa Kg,27.75,27.75
418,Linguiça Churrasco Perdigão Kg,17.65,17.65
419,Linguiça Tropeira Tipo Calabresa Gomo 400G,12.35,12.35
420,Linguiça Calabresa Mista Tropeira Embalagem 240G,6.05,6.05
421,Linguiça Tropeira Tipo Calabresa Cozida e Defumada,11.79,11.79
422,Linguiça Toscana Ciacarne,18.99,18.99
423,Linguiça Suína Defumada com Pimenta Tropeira 400G,15.15,15.15
424,Salsicha Nobre,10.89,10.89
425,Linguiça Paio Cozida Defumada Tropeira Embalagem 400G,12.35,12.35
426,Linguiça Calabresa Mista Tropeira Embalagem 500G,10.99,10.99
427,Linguiça Salaminho,16.75,16.75
428,Linguiça Churrasco Saudali Kg,14.49,12.99
429,Linguiça Churrasco Cozido Premiada Kg,14.99,14.99
430,Linguiça Churrasco Pernil Perdigão Kg,25.55,25.55
431,Linguiça Suína Defumada Kg,25.55,25.55
432,Linguiça Frango Fina Bandeja 500G,24.4,24.4
433,Filé de Tilápia Aurora 800G,37.45,32.98
434,Filé de Tilápia Brazilian Fish 300G,10.89,10.89
435,Ac Pernil Suino sem Osso/Pele Kg,16.49,16.49
436,Bisteca Suína (E) Kg,15.45,15.45
437,Copa Lombo,16.98,16.98
438,Lombo Tropeira Tipo Canadense Cozido Defumado 400G,16.35,16.35
439,Toucinho Comum Kg,11.79,11.79
440,Carne Suína Pezinho,4.99,4.99
441,Toucinho Especial Barriguinha 450Gr,21.39,21.39
442,Costelinha Kg,20.2,20.2
443,"Água Mineral com Gás Crystal 1,5L",3.75,3.75
444,Água Crystal com Gás 500Ml,2.55,2.55
445,Água Crystal sem Gás 5L,11.1,11.1
446,"Água Crystal sem Gás 1,5L",3.59,3.59
447,Água Crystal sem Gás 1L,3.1,3.1
448,Agua Min Sao Lourenco 510Ml C Gas,2.59,2.59
449,Água de Coco Esterilizada Kero Coco Caixa 1L,10.79,10.79
450,Água Crystal sem Gás 500Ml,2.15,2.15
451,Água de Coco Esterilizada Kero Coco 200Ml,3.1,3.1
452,Água Crystal Sparkling Limão 510Ml,2.75,2.75
453,Água de Coco Tial 1L,9.2,7.99
454,Água de Coco Esterilizada Kero Coco 330Ml,4.95,4.95
455,Energético Jack Power 2 Litros,7.45,6.99
456,Energético Energy Green Monster 473Ml,8.35,8.35
457,Isotônico de Morango com Maracujá Gatorade 500Ml,4.89,4.89
458,Energético Ultra Monster 473Ml,8.35,8.35
459,Isotônico de Tangerina Gatorade 500Ml,4.89,4.89
460,Isotônico de Maracujá Gatorade 500Ml,4.89,4.89
461,Isotônico de Limão Gatorade 500Ml,4.89,4.89
462,Isotônico de Uva Gatorade 500Ml,4.89,4.89
463,Energético Monster Energy Ultra Violet Lata 473Ml,8.35,8.35
464,Energético Monster Khaos Lata 473Ml,8.35,8.35
465,Isotônico I9 Sabor Maracujá Powerade 500Ml,4.2,4.2
466,Energético Red Bull Tradicional 250Ml,9.25,9.25
467,Isotônico de Limão Powerade 500Ml,4.2,4.2
468,Energético Red Bull Energy Drink Tropical 250Ml,9.25,9.25
469,Energético Summer Melancia Red Bull Lata 250Ml,9.25,9.25
470,Energy Drink The Summer Edition Sabor Pitaya Red Bull 250Ml,9.29,9.29
471,Energético Monster Khaos 500Ml,8.35,8.35
472,Energético Monster Ultra Paradise Zero Açúcar Lata 473Ml,8.35,8.35
473,Coca-Cola Original 2L,8.99,8.99
474,Coca-Cola 2L,8.99,8.99
475,Refrigerante Antarctica Guaraná 1 Litro Garrafa 2Un,5.99,5.99
476,Coca- Cola sem Açucar 2L,8.99,8.99
477,Coca-Cola Original 200Ml,2.0,2.0
478,Kit 1 Coca-Cola Original 2L + 1 Fanta Laranja 2L,15.1,15.1
479,Kit 1 Coca-Cola Original + 1Fanta Laranja 2L,15.1,15.1
