,Produto,Preço Base,Preço Final
1811,Salgadinho Sabor Queijo Parmesão Gulão 120G,3.49,3.49
1812,Salgadinho Kerus Churrasco 50G,1.2,1.2
1813,Snack de Batata Original Stax Elma Chips 163G,12.99,12.99
1814,Batata Palha Temperada Cebola e Salsa Croques 100G,5.99,5.99
1815,Salgadinho Gulão Cebola e Salsa Embalagem 120G,3.49,3.49
1816,Salgadinho de Milho Cebola Elma Chips Cebolitos 110G,11.99,11.99
1817,Batata Frita Lisa Peito de Peru Elma Chips 45G,5.49,5.49
1818,Batata Palha Anchieta Extra Fina 120G,5.99,5.99
1819,Batata Palha Yoki Extrafina Cebola Salsa 100G,7.99,7.99
1820,Salgadinho Krokero Requeijão 50G,1.2,1.2
1821,Batata Frita Ruffles 96G Cebola Salsa,8.99,8.99
1822,Salgadinho de Milho Lua Sabor Queijo Yokitos 39G,2.99,2.99
1823,Snack À Base de Batata com Cebola Stax Elma Chips 156G,12.99,12.99
1824,Batata Chips Petisco Croques Embalagem 45G,3.49,3.49
1825,Batata Lays American Barbecue 80G,8.99,8.99
1826,Batata Kerus Deora Original 45G,2.99,2.99
1827,Batata Kerus Deora Churrasco 45G,2.99,2.99
1828,Batata Yoki Palha Extra Fina Hotdog 100Gr,7.99,7.99
1829,Salgadinho Gulão Requeijão Embalagem 120G,3.49,3.49
1830,Batata Ruffles Original 145G,13.99,13.99
1831,Salgadinho de Milho Sortido Mix de Queijo Elma Chips Cheetos 115G.,8.99,8.99
1832,Batata Ruffles Cebola e Salsa Embalagem 41G,3.99,3.99
1833,Salgadinhos Gulão Presunto Embalagem 120G,3.49,3.49
1834,Batata Palha Anchieta Tradicional 120G,5.99,5.99
1835,Salgadinho Doritos Sweet Chilli 48G,4.99,4.99
1836,Salgadinho Gulão Pururuca Sabor Bacon Gulozitos 100G,3.49,3.49
1837,Torresmo Frito Tradição das Gerais Pacote 60G,5.99,5.99
1838,Pipoca Doce Aritaninha 20G,0.99,0.99
1839,Salgadin Bacon Aritana 15G,0.99,0.99
1840,Pastel de Angu Frango com Requeijão Maria Angu 300G,9.99,9.99
1841,Salgadinho Tradição Pimenta 150G,3.99,3.99
1842,Banana Chips Quero Mais 90G,3.99,3.99
1843,Pellet de Bacon Tradição 50G,3.99,3.99
1844,Torresmo Sabor Quero Mais 80 G,5.99,5.99
1845,Salgadinho Delma Pelet de Bacon Embalagem 50G,2.99,2.99
1846,Salgadinho Vovo Delma Bolinha Bacon 100G,3.49,3.49
1847,Salgadinhos Delma Embalagem 100G,3.49,3.49
1848,Batata Chips Quero Mais 100G,4.99,4.99
1849,Refresco em Pó Sabor Laranja Fresh 15G,1.49,1.49
1850,Mortadela Pif Paf Tradição 400G,4.99,4.99
1851,Presunto Pif Paf Peça,26.99,26.99
1852,Mortadela Tubular Peça Kg,12.99,12.99
1853,Apresuntado Pif Paf Peca / Pedaço,24.99,24.99
1854,Mortadela Defumada Seara Peça Pedaço Kg,26.99,26.99
1855,Mortadela Defumada Aurora Fatiado,29.99,16.99
1856,Presunto Cozido Premiada Peça Kg,24.99,24.99
1857,Mortadela Defumada Ouro Perdigão Peça Kg,26.99,26.99
1858,Mortadela Bologna Perdigão Pedaço Kg,24.99,24.99
1859,Margarina Cremosa com Sal Qmix Qualy 500G,9.99,8.99
1860,Margarina com Sal Delícia 500G,9.99,9.99
1861,Manteiga Sabor da Serra com Sal 200G,8.99,8.99
1862,Manteiga Suacui 200G,9.99,9.99
1863,Requeijão Cremoso Porto Alegre 400G,16.99,16.99
1864,Manteiga com Sal Porto Alegre 500G,24.99,24.99
1865,Manteiga Porto Alegre com Sal Pote 200G,9.99,9.99
1866,Margarina com Sal Delícia 1Kg,16.99,16.99
1867,Manteiga com Sal Itambé Primeira Qualidade Pote 500G,29.99,29.99
1868,Requeijão Cremoso Porto Alegre Light Pote 420G,16.99,16.99
1869,Requeijão Cremoso Light Ladelli 200G,7.99,7.99
1870,Manteiga e Margarina Suaçuí 500G,22.99,19.99
1871,Requeijão Cremoso Itambé Tradicional Pote 420G,19.99,19.99
1872,Requeijão Cremoso Itambé Copo 220G,12.99,12.99
1873,Banha Refinada Seara 1Kg,16.99,16.99
1874,Requeijão Cremoso Sabor da Serra Tradicional 350G,11.99,11.99
1875,Margarina com Sal Delícia 250G,4.99,4.99
1876,Requeijão Porto Alegre Light 200G,8.99,8.99
1877,Creme Vegetal Claybom Sabor Manteiga 500G,7.99,7.99
1878,Requeijão Cremoso Porto Alegre Copo 200G,8.99,8.99
1879,Margarina com Sal Claybom 250G,4.99,4.99
1880,Requeijão Cremoso Light Itambé 220G,12.99,12.99
1881,Margarina Qualy Cremosa com Sal Pote 250G,6.99,6.99
1882,Margarina Claybom Sabor Manteiga com Sal 250G,4.99,4.99
1883,Requeijão Trevinho Tradicional 200G,9.99,9.99
1884,Requeijão Vaidosa 270G,11.99,11.99
1885,Requeijao Barra Vaidosa Kg,56.99,56.99
1886,Creme de Ricota Tradicional Itambé 200G,7.99,7.99
1887,Requeijão Vaidosa 200G,8.99,8.99
1888,Massa Fresca de Pastel Médio Nutritex 500G,6.99,6.99
1889,Massa Fresca para Pastel Nutritex Rolo 500G,6.99,6.99
1890,Massa de Pastel Pequena Nutritex 500G,6.99,6.99
1891,Massa Fresca para Pastel Nutritex Grande Embalagem 500G,6.99,6.99
1892,Massa Fresca para Lasanha Nutritex Embalagem 500G,9.99,9.99
1893,Massa para Mini Pizza Coração de Minas 600G,19.99,19.99
1894,Queijo Parmesão Ralado Porto Alegre Embalagem 50G,4.99,4.99
1895,Queijo Canastra,49.99,49.99
1896,Coalho Ha La Enzima Quimosina para Fabricação de Queijos Embalagem 200Ml,6.99,6.99
1897,Queijo Parmesão Ralado Pachá 50G,5.99,5.99
1898,Queijo Parmesão Rm Ralado 50G,6.99,6.99
1899,Queijo Provolone Vaidosa Kg,59.99,59.99
1900,Queijo Mussarela Suacui Pedaço Kg,49.99,39.99
1901,Queijo Minas Ad Kg,49.99,49.99
1902,Sardinha Coqueiro em Óleo de Soja 125G,5.99,5.99
1903,Sardinhas com Óleo Gomes da Costa 125G,5.99,5.99
1904,Atum Coqueiro Ralado em Óleo 170G,7.99,7.99
1905,Sardinha Coqueiro com Molho de Tomate Lata 125G,5.99,5.99
1906,Sardinha Palmeira em Óleo Lata 84G,4.99,4.99
1907,Sardinha Palmeira em Molho de Tomate Lata 125G,4.99,4.99
1908,Sardinhas com Molho de Tomate Gomes da Costa 125G,5.99,5.99
1909,Feijoada Anglo a Brasileira Lata 310G,8.99,8.99
1910,Atum Ralado Ao Molho de Tomate Gomes da Costa 170G,7.99,7.99
1911,Atum Coqueiro Ralado Ao Molho de Tomate Lata 160G,7.99,7.99
1912,Feijoada Oderich Lata 830G,18.99,18.99
1913,Azeitona Verde Fatiada Sachê Tozzi 340G,5.99,5.99
1914,Milho Crocante Fugini Ao Vapor 200G,3.49,3.49
1915,Milho Verde Stella D'oro 170G,3.49,3.49
1916,Ervilha Olé Lata 170G,3.99,3.99
1917,Azeitona Verde com Caroço Campo Belo 500G,12.99,12.99
1918,Pimenta Malagueta Pirata Vermelha em Conserva Pet 30G,7.99,7.99
1919,Azeitonas Verdes Tozzi Fatiada 80G,3.99,3.99
1920,Milho e Ervilha Minas Mais 170G,4.99,4.99
1921,Azeitonas Verdes C/ Caroço Tozzi 500G,12.99,12.99
1922,Palmito Inteiro Braspalm Lata 500Gr,26.99,26.99
1923,Palmito Picado Anchieta 300G,11.99,11.99
1924,Milho Verde Olé Vidro 170G,4.99,4.99
1925,Azeitona Verde sem Caroço Predilecta 120G,6.99,6.99
1926,Salsicha Anglo Lata 180G,4.99,4.99
1927,Cogumelo em Conserva Tozzi Fatiado Embalagem 100G,8.99,8.99
1928,Azeitonas Verdes Tozzi sem Caroço 80G,3.99,3.99
1929,Azeitona Verde Tozzi sem Caroço Vidro 150G,11.99,11.99
1930,Azeitona Verde Recheada Sachê Tozzi 260G,5.99,5.99
1931,Azeitonas Verdes com Caroço Tozzi Embalagem 70G,2.99,2.99
1932,Azeitona C/ Caroço Sachê Tozzi 200G,5.99,5.99
1933,Azeitonas Verdes Tozzi Recheada 80G,3.99,3.99
1934,Azeitona Verde Tio Paco com Caroço Vidro 100G,3.99,3.99
1935,Seleta de Legumes Predilecta Lata 200G,4.69,4.69
1936,Palmito Vianeza Picado Vidro 300G,11.99,11.99
1937,Palmito Açaí Braspalm Embalagem 120G,9.99,9.99
1938,Azeitona Vianeza com Caroço Sachê 150G,4.99,4.99
1939,Pimenta Malagueta Alheiro Batida 200Ml,6.99,6.99
1940,Azeitonas Verdes Vianeza sem Caroço Sachê 150G,6.99,6.99
1941,Azeitonas Verdes Vianeza Recheada Sachê 150G,6.99,6.99
1942,Palmito Anchieta Inteiro Vidro 540G,19.99,19.99
1943,Maionese Tradicional Hellmann's 500G,9.99,9.99
1944,Maionese Tradicional Hellmann's 250G,6.99,6.99
1945,Molho Shoyu Tradicional Sakura 150Ml,4.99,4.99
1946,Mostarda Predilecta 180G,4.99,4.99
1947,Ketchup Hellmann's Tradicional 380G,9.99,9.99
1948,Molho Inglês Pirata Embalagem 500Ml,11.99,11.99
1949,Molho Inglês Kenko Embalagem 150Ml,4.99,4.99
1950,Ketchup Predilecta 400G,6.99,4.99
1951,Maionese Liza Pote 500G,6.99,6.99
1952,Maionese Quero 495G,6.99,6.99
1953,Maionese Quero Sachê 200G,2.69,2.69
1954,Ketchup Tradicional Heinz 397G,14.99,14.99
1955,Molho de Soja Aji No Shoyu 150Ml,4.99,4.99
1956,Ketchup Tradicional Arisco 370G,6.99,6.99
1957,Catchup Picante Colonial 400G,5.99,5.99
1958,Molho de Alho Pirata Embalagem 150Ml,4.99,3.49
1959,Maionese Heinz 390G,14.99,14.99
1960,Maionese Tradicional Arisco 500G,6.99,6.99
1961,Maionese Predilecta 200G,2.99,2.99
1962,Maionese Liza Pote 250G,3.99,3.99
1963,Molho de Pimenta Kenko Pimenta Vermelha Embalagem 150Ml,4.99,4.99
1964,Molho de Pimenta Pirata Extra Forte Pet 150Ml,5.99,5.99
1965,Molho de Pimenta Pirata Pet 150Ml,4.99,3.49
1966,Molho de Pimenta Pirata Embalagem 500Ml,11.99,11.99
1967,Molho para Salada Kenko Rosé Embalagem 236Ml,6.99,6.99
1968,Molho de Alho Pirata com Pimenta Embalagem 500Ml,11.99,11.99
1969,Maionese Limão Hellmann's 500G,11.99,11.99
1970,Maionese Heinz 215G,11.99,11.99
1971,Catchup Predilecta Picante 400G,6.99,4.99
1972,Molho Kenko Barbecue Embalagem 180Ml,6.99,6.99
1973,Molho de Pimenta Kenko Extra Picante Embalagem 150Ml,4.99,4.99
1974,Molho de Alho Pirata com Pimenta Pet 150Ml,4.99,3.49
1975,Molho de Alho Kenko Embalagem 150Ml,4.99,4.99
1976,Molho de Alho Pirata Embalagem 500Ml,11.99,11.99
1977,Molho Inglês Pirata Embalagem 150Ml,4.99,3.49
1978,Molho Alho Alheiro 200Ml,3.99,3.99
1979,Molho para Salada Kenko Limão Embalagem 236Ml,6.99,6.99
1980,Ketchup Heinz Bacon & Cebola Caramelizada 397G,14.99,14.99
1981,Molho para Salada Ervas Finas Kenko 236Ml,6.99,6.99
1982,Molho de Pimenta Calabresa Kenko Embalagem 150Ml,4.99,4.99
1983,Ketchup Picante Heinz 397G,14.99,14.99
1984,Molho Carne Alheiro Pet 200Ml,3.99,3.99
1985,Molho de Pimenta Pirata Picante Pet 150Ml,6.99,6.99
1986,Molho para Carne Pirata 150Ml,4.99,3.49
1987,Molho Chimichurri Alheiro 200Ml,3.99,3.99
1988,Molho Barbecue Colonial 400 Gramas,5.99,5.99
1989,Molho Shoyu Alheiro 200Ml,3.99,3.99
1990,Molho Shoyu Alheiro 500Ml,6.99,6.99
1991,Molho Shoyu Pirata Embalagem 500Ml,11.99,11.99
1992,Molho Alheiro Alho/Ervas Finas 200Ml,3.99,3.99
1993,Molho de Chimichurri Alheiro 500Ml,6.99,6.99
1994,Maionese Chapadão 3Kg,22.99,22.99
1995,Catchup Tradicional Chapadão Embalagem 370G,3.49,3.49
1996,Mostarda Chapadão 200G,3.99,3.99
1997,Molho de Pimenta Alheiro 500Ml,6.99,6.99
1998,Molho Inglês Alheiro 200Ml,3.99,3.99
1999,Molho para Carnes Alheiro 500Ml,6.99,6.99
2000,Molho de Cebola Alheiro 500Ml,6.99,6.99
2001,Molho de Alho Alheiro com Ervas Finas 500Ml,6.99,6.99
2002,Molho Barbecue Anchieta Embalagem 200G,6.99,6.99
2003,Extrato Elefante Tomate 310G,5.99,5.99
2004,Molho de Tomate com Pedaços Tradicional Heinz 300G,3.29,3.29
2005,Molho de Tomate Tradicional Pomarola 300G,2.99,2.99
2006,Molho de Tomate Tradicional Predilecta 300G,1.99,1.99
2007,Molho de Tomate Tradicional Salsaretti 300G,2.49,2.49
2008,Molho de Tomate Tradicional Pomarola Sachê 340G,2.99,2.99
2009,Molho de Tomate Tradicional Stella D'oro 300G,1.49,1.49
2010,Molho de Tomate Tradicional Tarantella 300G,2.49,2.49
2011,Molho de Tomate Heinz Tradicional 250G,2.49,2.49
2012,Extrato de Tomate Elefante Tradicional Lata 375G,5.99,5.99
2013,Molho de Tomate Tradicional Salsaretti 340G,2.49,2.49
2014,Extrato de Tomate Colonial Lata 350G,4.99,4.99
2015,Molho de Tomate Colonial Mio Pizza Embalagem 340G,2.69,2.69
2016,Extrato de Tomate Elefante 130G,3.29,3.29
2017,Extrato de Tomate Predilecta 340G,3.69,2.79
2018,Molho de Tomate Tradicional Colonial Mio Embalagem 340G,2.49,2.49
2019,Extrato de Tomate Cajamar Lata 350G,4.29,4.29
2020,Molho de Tomate Pre Hot Dog 300G,2.69,2.69
2021,Extrato de Tomate Elefante Lata 850G,12.99,12.99
2022,Molho de Tomate Tarantella Manjericão Sachê 340G,2.99,2.99
2023,Molho de Tomate Hot Dog Tarantella Sachê 340G,2.99,2.99
2024,Molho de Tomate Bolonhesa Heinz Pouch 300G,3.99,3.99
2025,Extrato de Tomate Colonial Copo 190G,4.99,4.99
2026,Molho de Tomate Sabor Bolonhesa Tarantella 300G,3.69,3.69
2027,Molho de Tomate Pomarola Bolonhesa Sachê 300G,3.99,3.99
2028,Molho de Tomate Pizza Predilecta 300G,2.69,2.69
2029,Extrato de Tomate Cajamar Lata 140G,2.69,2.69
2030,Molho de Tomate com Ervas Finas Predilecta 300G,2.69,2.69
2031,Molho de Tomate Predilecta Manjericão 340G,2.69,2.69
2032,Extrato de Tomate Colonial Embalagem 190G,1.69,1.69
2033,Extrato de Tomate Olé Copo 190G,2.99,2.99
2034,Extrato de Tomate Colonial Sachê 350G,2.99,2.99
2035,Molho de Tomate Pizza Predilecta 300G,2.69,2.69
2036,Molho de Tomate À Bolonhesa Predilecta 300G,3.99,3.99
2037,Extrato de Tomate Olé Copo 260G,3.99,3.99
2038,Extrato de Tomate Predilecta Copo 190G,3.99,3.99
2039,Molho de Tomate Salsaretti Bolonhesa Sachê 340G,3.99,3.99
2040,Molho de Tomate Bolonhesa Salsaretti 300G,3.99,3.99
2041,Molho de Tomate Colonial Mio Manjericão Embalagem 340G,2.69,2.69
2042,Extrato de Tomate Colonial Lata 140G,2.46,2.46
2043,Molho de Tomate Colonial Mio Hot Dog Embalagem 340G,2.69,2.69
2044,Molho de Tomate Anchieta Refogado 340G,1.99,1.99
2045,Extrato Tomate Anchieta 340G,2.69,2.69
2046,Molho de Tomate Colonial Sache 190G,1.29,1.29
2047,Creme de Cebola Maggi 68G,4.99,4.99
2048,Sopão Maggi Galinha com Legumes 200G,9.99,9.99
2049,Sopão de Carne com Legumes Maggi 200G,9.99,9.99
2050,Sopa Maggi Cebola 63G,4.99,4.99
2051,Tempero para Carnes Sazón Pacote 60G,4.99,4.99
2052,Caldo de Galinha Knorr 12Un,3.69,3.69
2053,Alho Frito Alheiro 20G,2.99,2.99
2054,Caldo de Galinha Knorr 57G,1.99,1.99
2055,Bicarbonato de Sódio Pirata Embalagem 80G,3.49,3.49
2056,Tempero Alheiro Ervas Finas 8G,1.99,1.99
2057,Canela em Casca Alheiro 7G,2.49,2.49
2058,Temp Sazon 60G Legumes,4.99,4.99
2059,Alho Pirata Desidratado 20G,2.49,2.49
2060,Tempero Pronto Pirata Alho Sal Pote 500G,7.99,7.99
2061,Pimenta do Reino Preta em Pó Alheiro 7G,2.49,2.49
2062,Pimenta Calabresa em Grão Alheiro 10G,2.49,2.49
2063,Tempero Sazón Nordeste 60G,4.99,4.99
2064,Caldo de Bacon Knorr 57G,1.99,1.99
2065,Tempero Completo Pirata Pote 500G,7.99,7.99
2066,Massa de Alho Pirata Embalagem 500G,7.99,7.99
2067,"Caldo Galinha Sazón 32,5G",2.69,2.69
2068,Caldo de Carne Knorr 12Un,3.69,3.69
2069,Tempero para Feijão Sazón 60G,4.99,4.99
2070,Caldo de Carne Knorr 57G,1.99,1.99
2071,Tempero Sazón Massas 60G,4.99,4.99
2072,Tempero Alheiro Louro Po 5G,1.99,1.99
2073,Condimento Canela Po Alheiro 7Gr,2.49,2.49
2074,Tempero Completo Sabor a Mi sem Pimenta 300G,4.24,4.24
2075,Tempero Pronto Alho Sal Pirata 1Kg,12.99,12.99
2076,Tempero Sazón Frango 60G,4.99,4.99
2077,Caldo de Costela Knorr 57G,1.99,1.99
2078,Tempero Meu Assado Caipira Knorr 23G,6.99,6.99
2079,Alho Desidratado Alheiro 20G,2.49,2.49
2080,Caldo de Picanha Knorr 57G,1.99,1.99
2081,Tempero Pronto Kitano Mais Sabor Carne Sachê 60G,3.69,3.69
2082,"Caldo em Pó Sazon Sabor Carne 32,5G",2.69,2.69
2083,Tempero Sazón Alho 60G,4.99,4.99
2084,Tempero Sabor a Mi Alho e Sal 300G,4.24,4.24
2085,Tempero Pronto Mais Sabor Nordestino Kitano 60G,3.69,3.69
2086,Tempero Mais Sabor Kitano Gaúcho Embalagem 60G,3.69,3.69
2087,Tempero Sazón Toque de Limão 60G,4.99,4.99
2088,Tempero Completo Pirata sem Pimenta Pote 500G,7.99,7.99
2089,Pimenta do Reino em Grãos Alheiro 7G,2.49,2.49
2090,"Caldo em Pó de Costela Sazón 37,5G",2.69,2.69
2091,Tempero Completo Sabor a Mi com Pimenta 300G,4.24,4.24
2092,Tempero Alheiro Louro em Folha 5G,1.99,1.99
2093,Tempero Mais Sabor Kitano Massas Embalagem 60G,3.69,3.69
2094,Tempero Pronto Kitano Mais Sabor Feijão Sachê 60G,3.69,3.69
2095,Tempero Caseiro com Pimenta Receita de Casa 450G,10.19,10.19
2096,Tempero Completo Pirata sem Pimenta Pote 1Kg,12.99,12.99
2097,"Tempero Pronto Pirata Feija2o, Ovos e Arroz 60G",3.99,3.99
2098,Tempero Sazón Arroz 60G,4.99,4.99
2099,Massa de Alho Pirata 300G,4.99,4.99
2100,"Caldo em Pó Picanha Na Brasa Sazón 37,5G",2.69,2.69
2101,Tempero Sabor a Mi Alho e Sal 1Kg,14.44,14.44
2102,Tempero em Pasta Caseiro Receita de Casa 450G,10.19,10.19
2103,Tempero Pronto Alheiro Alho e Sal 250G,3.99,3.99
2104,Tempero Pronto Pirata sem Pimenta 300G,4.99,4.99
2105,Massa de Alho Pirata Pote 1Kg,12.99,12.99
2106,Tempero Completo Pirata Pote 1Kg,12.99,12.99
2107,"Tempero Pronto Pirata Carne, Legumes e Arroz 60G",3.99,3.99
2108,Tempero Mix Temper Carnes Nobres 200G,9.99,9.99
2109,Alecrim Pirata 6G,1.99,1.99
2110,Bicarbonato de Sódio Pachá 80G,2.99,2.99
2111,Tempero Completo Alheiro com Pimenta 250G,3.99,3.99
2112,Chimichurri Tradicional Alheiro 20G,2.99,2.99
2113,Tempero Alheiro Lemon Pepper 30G,2.99,2.99
2114,Caldo Cubo Bacon Anchieta 57G,1.99,1.25
2115,Caldo Anchieta Carne 57G,1.99,1.25
2116,Cominho Alheiro 7G,1.99,1.99
2117,Açafrão Pirata 20G,1.99,1.99
2118,Tempero Pronto Completo Alheiro 1Kg,9.99,9.99
2119,Noz Moscada em Pó Alheiro 7G,2.99,2.99
2120,Colorífico Alheiro 30G,1.99,1.99
2121,Condimentos Açafrão Alheiro 20Gr,1.99,1.99
2122,Pirata Canela Moída 10G,2.49,2.49
2123,Coentro Moído Pirata 10G,1.99,1.99
2124,Pimenta do Reino Moída Pura Pachá 30G,4.99,4.99
2125,Tempero Alheiro Coentro Grão 7G,1.99,1.99
2126,Bicarbonato de Sódio Pirata 30G,1.99,1.99
2127,"Cebola, Alho e Salsa Pirata 20G",3.99,3.99
2128,Noz Moscada Alheiro Bola 1Un,2.99,2.99
2129,Tempero Completo Alheiro Pote 500G,5.99,5.99
2130,Caldo Cubo Anchieta Galinha 57G,1.99,1.25
2131,Especiarias Pacha Bicarbonato de Sódio Embalagem 500G,9.99,9.99
2132,Orégano Pirata 100G,16.99,16.99
2133,"Tempero Pronto Pirata Aves, Peixes e Arroz 60G",3.99,3.99
2134,Colorau Pacha 150G,2.99,2.99
2135,Mix Temper - Tempero Pronto 230G,9.99,9.99
2136,Erva Doce Pirata 10G,2.99,2.99
2137,Tempero Baiano Alheiro 30Gr,2.99,2.99
2138,Condimento Cheiro Verde Alheiro 10Gr,2.49,2.49
2139,Orégano Pirata 5G,1.99,1.99
2140,Pirata Louro Folha 6G,2.99,2.99
2141,Chimichurri com Pimenta Alheiro 20G,2.99,2.99
2142,Cravo Índia Alheiro 7G,2.99,2.99
2143,Colorau Pirata 30G,1.99,1.99
2144,Canela em Pó Tubo Pirata 40G,6.99,6.99
2145,Condimento Orégano Alheiro150g,12.99,12.99
2146,Pimenta Malagueta em Pó Alheiro 20G,2.49,2.49
2147,Noz Moscada Pirata 2Un,4.99,4.99
2148,Erva Doce Alheiro 7G,1.99,1.99
2149,Cominho Moído Pirata 10G,1.99,1.99
2150,Pirata Pimenta Calabresa 10G,2.99,2.99
2151,Condimento Camomila Alheiro 5Gr,2.49,2.49
2152,Pimenta do Reino Preta em Grãos Pirata 10G,1.99,1.99
2153,Canela em Casca Pirata 10G,2.99,2.99
2154,Cravo da Índia Pirata 10G,3.99,3.99
2155,Salsa Desidratada Pirata 5G,1.99,1.99
2156,Tempero Alheiro Coentro em Po 7G,1.99,1.99
2157,"Iogurte Porto Alegre Morango 1,25 Litro",11.99,11.99
2158,Bebida Láctea Sabor Chocolate Chocomil Cemil 200Ml,1.49,1.49
2159,Iogurte Polpa Morango Itambé Bandeja 540G 6Un,5.99,5.99
2160,Bebida Láctea de Morango e Coco Brasil Bandeja 540G,3.99,3.99
2161,Petit Suisse Itambé Kids Morango Maçã Banana Cereais 360G,8.99,8.99
2162,"Iogurte Líquido Porto Alegre Sal Frutas Garrafa 1,25 Litro",11.99,11.99
2163,Iogurte de Morango Porto Alegre 540G,4.99,4.99
2164,Bebida Láctea Itambé Polpa Frutas e Cereais Bandeja 540G,7.99,7.99
2165,Iogurte Porto Alegre Morango e Coco 540G,4.99,4.99
2166,Iogurte Ninho Polpa 540G Trisabor,7.99,7.99
2167,Bebida Láctea Brasil Morango 540G,3.99,3.99
2168,Iogurte Trevinho Morango e Frutas 540G,4.99,4.99
2169,Leite Fermentado Trevinho 480G 6Un,5.99,5.99
2170,Bebida Láctea Goody Morango 540G,4.99,4.99
2171,Sobremesa Itambe Pudim Pote 200G,6.99,6.99
2172,Petit Suisse Trevinho Morango Banana Bandeja 360G,6.99,6.99
2173,Bebida Láctea Itambé Pedaços Coco Embalagem 500G,9.99,9.99
2174,Sobremesa Láctea Itambé Kids Chocolate 320G,8.49,8.49
2175,Petit Suisse Trevinho Morango Bandeja 360G,6.99,6.99
2176,Bebida Láctea Brasil Salada de Fruta 540G,3.99,3.99
2177,"Bebida Láctea Quatazinho Vitamina Mamão, Maçã e Banana Embalagem 200Ml",1.29,1.29
2178,Bebida Láctea Goody Morango Garrafa 850G,7.99,7.99
2179,Iogurte Pedaços Morango Itambé 500G,9.99,9.99
2180,Bebida Láctea Goody Frutas Vermelhas e Coco 540G,4.99,4.99
2181,Coalhada Itambé Natural Integral Copo 130G,3.29,3.29
2182,Leite Fermentado Itambé 6Un Pote 450G,6.99,6.99
2183,Iogurte Pulsi Morango 1300G,9.99,9.99
2184,Iogurte Trevinho Frutas Garrafa 180G,2.29,2.29
2185,Bebida Láctea Chocomil Black Embalagem 200Ml,1.69,1.69
2186,Iogurte Parcialmente Desnatado Morango + Salada de Frutas + Banana Os Incríveis 2 Itambé Kids Bandeja 540G 6 Unidades,7.99,7.99
2187,Iogurte Morango Itambé Gf 170G,2.99,2.99
2188,Iogurte de Mamão Maçã Banana Cereais e Morango Neston Nestlé 510G,7.99,7.99
2189,Iogurte Trevinho Morango 180G,2.29,2.29
2190,Queijo Petit Suisse Morango Os Incríveis Itambé Kids Bandeja 320G 8 Unidades,8.99,8.99
2191,Bebida Láctea Pulsi Morango Garrafa 180G,1.99,1.99
2192,Bebida Láctea Cemil Sucomilho Caixa 200Ml,1.49,1.49
2193,Iogurte Grego Tradicional Itambé 400G,11.99,11.99
2194,Iogurte Itambé Coco Garrafa 170G,2.99,2.99
2195,Sobremesa Láctea Itambé Chocolate 180G,5.29,5.29
2196,Iogurte Bicamada Morango Trevinho 150G,3.49,3.49
2197,Iogurte Itambé Frutas Vermelhas Garrafa 170G,2.99,2.99
2198,Iogurte Trevinho Ball Morango Confeitos 130G,4.99,4.99
2199,Iogurte Sabor Coco Porto Alegre 1250G,11.99,11.99
2200,Bebida Láctea Vaidosa 500Ml,3.99,3.99
2201,Iogurte Diversos Lactea Vaidosa 900G,4.49,4.49
2202,Iogurte Vaidosa 1000G,7.99,7.99
2203,Iogurte Vaidosa Sabores 120G,0.99,0.99
2204,Leite Pó All Lac Instantâneo 400G,6.99,6.99
2205,Leite em Pó Nutril Integral Embalagem 400G,21.99,21.99
2206,Leite em Pó Integral Itambé 400G,21.99,21.99
2207,Leite em Pó Instantâneo Itambé Integral Sachê 400G,21.99,21.99
2208,Fórmula Infantil Nan Comfor 2 Lata 800G,58.99,58.99
2209,Leite em Pó Camponesa Integral Embalagem 400G,18.99,18.99
2210,Fórmula Infantil Aptanutri Original Premium+ 3 Danone 800G,58.99,58.99
2211,Leite em Pó Instantâneo Itambé Fortificado Integral 400G,21.99,21.99
2212,Leite em Pó Integral Itambé Fortificado 400G,21.99,21.99
2213,Leite em Pó Integral Instantâneo Camponesa 400G,18.99,18.99
2214,Leite em Pó Leite Camponesa Zero Lactose Integral 1L Leite Camponesa Zero Lactose Integral 1L Leite Camponesa Zero Lactose Integral 1L,7.69,7.69
2215,Leite sem Lactose Itambé Nolac Semidesnatado Caixa 1L,7.99,7.99
2216,Leite Desnatado Itambé Nolac Zero Lactose Caixa 1L,7.99,7.99
2217,Leite Integral Uht Longa Vida Uai 1L,4.99,4.69
2218,Leite Uht Integral Porto Alegre 1 Litro,5.69,5.69
2219,Leite Uht Integral Cotochés 1L,5.69,5.69
2220,Leite Integral Jussara 1L Caixa 12 Un,4.99,4.69
2221,Leite Uht Integral Camponesa Caixa 1L,5.69,5.69
2222,Leite Desnatado com Tampa Uai 1L,4.99,4.69
2223,Leite Uht Semidesnatado Camponesa Zero Lactose 1L,7.69,7.69
2224,Leite Desnatado Longa Vida Quatá Caixa 1L,4.99,4.69
2225,Leite Uht Desnatado Camponesa 1L,5.69,5.69
2226,Leite Integral Itambé Nolac Zero Lactose Caixa 1L,7.99,7.99
2227,Bala Erlan Sortida 600G,6.99,6.99
2228,Bala de Gelatinas Minhocas Fini 90G,5.99,5.99
2229,Bala Fini Gelatina Dentaduras Embalagem 90G,5.99,5.99
2230,Pirulito Cherry Pop Cereja Pacote 700G,12.99,12.99
2231,Bala Fini Tubes Morango Cítrico 80G,5.99,5.99
2232,Bala Halls Lyptus Menta 28G,1.5,1.5
2233,Bala Mastigável Mentos Rainbow,2.99,2.99
2234,Pastilha de Hortelã Garoto 17G,1.5,1.5
2235,Bala Halls Extra Forte Embalagem 28G,1.5,1.5
2236,Bala de Gelatina Minhoca Citrica Fini 90G,5.99,5.99
2237,Marshmallow Fini Torção Pacote 80G,5.99,5.99
2238,Pirulito Push Pop Duo 15G,4.99,4.99
2239,Bala Gelatinas Beijos Sabor Morango e Nata Fini 90G,5.99,5.99
2240,Goma de Mascar Trident Melancia Embalagem 8G,1.99,1.99
2241,Goma de Mascar Trident Tutti Frutti Embalagem 8G,1.99,1.99
2242,Marshmallow Docile Maxmallows Recheado Twist Color Embalagem 220G,7.99,7.99
2243,Bala Fini Gelatinas Amoras Embalagem 90G,5.99,5.99
2244,Pirulito Pop Mania Cherry Pacote 600G,12.99,12.99
2245,Goma de Mascar Herbal Trident X Fresh 8G 5Un,1.99,1.99
2246,Goma de Mascar Trident Morango Embalagem 8G,1.99,1.99
2247,Tic Tac Pastilhas Sabor Menta 16G,2.99,2.99
2248,Goma de Mascar Xfresh Intense Trident Envelope 8G,1.99,1.99
2249,"Bala Mastigável Mentos Tutti-Frutti 37,5G",2.99,2.99
2250,Bala Fini Tubes Super Gigante Twister Embalagem 27G,2.49,2.49
2251,Bala de Gelatina Tubes de Morango Fini 80G,5.99,5.99
2252,Pastilha Sabor Hortelã Fini 14G,1.5,1.5
2253,Goma de Mascar Menta sem Açúcar Trident 8G,1.99,1.99
2254,Chiclete Fini Salada de Frutas Azedinha Embalagem 80G,5.99,5.99
2255,Goma de Mascar Trident Canela Embalagem 8G,1.99,1.99
2256,Bala Fini Tubes Sabores Sortidos Embalagem 80G,5.99,5.99
2257,Bala Cereja Halls 28G,1.5,1.5
2258,Bala Gelatin Beijos Morango a Fini 15G,2.49,2.49
2259,Bala Dori Pescoço de Girafa Yogurte Embalagem 30G,1.99,1.99
2260,Bala Dori Regaliz Pescoço de Girafa Morango Embalagem 30G,1.99,1.99
2261,Bala Gelatinas Bananas Fini 90G,5.99,5.99
2262,Marshmallow Docile Twist Color Unicórnio Baunilha e Morango 220G,7.99,7.99
2263,Bala de Goma Gomets Iogurte 32G,0.99,0.99
2264,Tic Tac Pastilhas Sabor Frutas Como Te Gusta 16G,2.99,2.99
2265,Goma de Mascar Trident Cereja Ice Fresh Embalagem 8G,1.99,1.99
2266,Bala Fini Tubes Ácido Super Gigante Morango Embalagem 27G,2.49,2.49
2267,Tic Tac Pastilhas Sabor Laranja 16G,2.99,2.99
2268,Bala Fini Frutiê Mix de Frutas Vermelhas Embalagem 70G,5.99,5.99
2269,Chiclete Fini Ovos de Dinossauro Azedinhos Embalagem 80G,5.99,5.99
2270,Bala Dori Pescoço Girafa Framboesa 30G,1.99,1.99
2271,Tic Tac Pastilhas Sabor Melancia Mix 16G,2.99,2.99
2272,Bala Fruittella Sabor Mirtilo 40G,2.99,2.99
2273,Bala Fini Tubes Super Gigante Iogurte de Morango Embalagem 27G,2.49,2.49
2274,Bala Fruittella Swirl Vita C Morango e Creme de Leite 41G,2.99,2.99
2275,Tic Tac Pastilhas Sabor Morango 16G,2.99,2.99
2276,Torre Push Pop Tradicional Sortidas 15G Unitario,4.99,4.99
2277,Bala Fini Tubes Azedinhos Frutas Silvestres e Nata Embalagem 80G,5.99,5.99
2278,Bala Fini Tubes Ácido Uva Embalagem 80G,5.99,5.99
2279,Pastilha Tic Tac Sabor Coca Cola 16G,2.99,2.99
2280,Bala Butter Toffees Torta de Limão 500G,16.99,16.99
2281,Bala Pocket Milk Embalagem 500G,14.99,14.99
2282,Tic Tac Pastilhas Sabor Menta Crush 16G,2.99,2.99
2283,Bala Fruittella Caramelo com Leite Condensado 41G,2.99,2.99
2284,Bala Icekiss Sortida Embalagem 600G,6.99,6.99
2285,Bala Arcor Butter Toffes Maracujá 500G,16.99,16.99
2286,Bala Coffee Pocket 100G,0.3,0.3
2287,Goma de Mascar Buzzy Tattoo Tribal Sabor Morango Caixa 400G,9.99,9.99
2288,Balas Sortidas Icekiss 500G,6.99,6.99
2289,Ala Pocket Milk 500 Grs,0.3,0.3
