,Produto,Preço Base,Preço Final
0,Água Sanitária Classic 5 Litros,11.99,11.99
1,Álcool Líquido 70 Araucaria 1L,9.98,9.98
2,"Álcool Líquido Araucaria Uso Geral 46,2 Embalagem 1L",7.98,7.98
3,Álcool Líquido 70º Inpm Flop's 1L,7.99,7.99
4,Limpador Multiuso Veja 10% Desconto 500Ml,4.49,4.49
5,Água Sanitária Santa Clara 5L,11.99,11.99
6,"Agua Sanitaria Super Globo Pague 1,8Ltr Leve 2Ltr",5.99,5.99
7,Água Sanitária Santa Clara Embalagem 2 Litros,5.48,5.48
8,Água Sanitária Classic Embalagem 2 Litros,5.49,5.49
9,Kit Banheiro Azulim 500Ml,11.9,11.9
10,Água Sanitária Santa Clara Embalagem 1 Litro,3.29,3.29
11,Alcool Anhanguera 70 Embalagem 1 Litro,6.99,6.99
12,Sapólio Cremoso Radium Lavanda 250Ml,7.99,7.99
13,Soda Cáustica Escorpião 1Kg,28.99,28.99
14,Tira Limo Veja X14 Cloro Ativo Squeeze Oferta 500Ml,11.98,11.98
15,Querosene Jacaré Lata 900Ml,26.99,26.99
16,Kit Limpador Multiuso Azulim 550Ml 3Un,9.9,9.9
17,Água Sanitária Classic 1Litro,3.29,3.29
18,Água Sanitária Super Globo Embalagem 2 Litros,5.98,5.98
19,Desinfetante Casa Km Casa & Perfume Passione Embalagem 1L,7.89,7.89
20,Limpador Uau Multiuso Desengordurante Limão Siciliano 500Ml,3.98,3.98
21,Limpador Multiuso Uau Rosas Sedução 500Ml,3.98,3.98
22,Kit Econômico Azulim Multiuso 4X1,12.99,12.99
23,Cloro Super Cloro Classic Extra Forte 1 Litro,3.98,3.98
24,Saponáceo Cremoso Multiuso Limão Bom Bril Sapólio Radium 250Ml,7.99,7.99
25,Limpador Uau Cloro Ativo 2 Unidades de 500Ml Cada + Grátis Multiuso Lavanda 500Ml,14.99,14.99
26,Limpa Box Uau Blindex 200Ml,11.89,11.89
27,Pastilha Adesiva Pato Lavanda Oferta Embalagem 3Un,8.99,8.99
28,"Água Sanitária Ypê Leve 2L Pague 1,8L Grátis 200Ml",6.98,6.98
29,Super Cloro Classic Extra Forte 2L,6.99,6.99
30,Bilha Alumínio Alumil Embalagem 500Ml,3.49,3.49
31,Casa e Perfume Sensazine 500Ml,4.98,4.98
32,Limpador Uau Perfumes Flores Vermelhas Embalagem 1 Litro,5.98,5.98
33,Limpador Multiuso Veja Gold Original 750Ml Embalagem Econômica,8.49,8.49
34,Sapólio Radium Pó Clássico,4.98,4.98
35,Desengordurante Uau Squeeze 500Ml,6.98,6.98
36,Desinfetante Classic Capim Limão Eucalipto Embalagem 2 Litros,5.99,5.99
37,Desinfetante Santa Clara Lavanda Embalagem 2 Litros,5.49,5.49
38,Limpador Multiuso Ypê Clássico 500Ml,4.99,4.99
39,Gel Adesivo Sanitário Marine Refil Pato 12G,11.9,11.9
40,Pedra Sanitária Sampa Clean 25G,2.49,2.49
41,Limpador Uau Multiuso Lavanda 500Ml,3.98,3.98
42,Limpador Uau Multiuso Flores e Folhas 500Ml,3.98,3.98
43,Limpador Uau Perfumes Flores Vermelhas e Sedução 500Ml,3.98,3.98
44,Limpador Uau Perfumes Cuidado e Carinho 500Ml,3.98,3.98
45,Limpador Limpeza Pesada Veja X-14 Grátis 20% de Desconto Frasco 500Ml,9.9,9.9
46,Desinfetante de Lavanda Lysoform 1L,11.99,11.99
47,Soda Cáustica Yara 950G,13.99,13.99
48,Pedra Sanitária de Lavanda Azulim 25G,1.98,1.98
49,Limpador Veja Perfumes Lavanda Oferta 500Ml,4.98,4.98
50,Desinfetante Original Bruto Lysoform 1L,13.5,13.5
51,Sapólio Radium Po com Cloro 300G,4.98,4.98
52,Água Sanitária Ypê 1L,4.49,4.49
53,Limpador Multiuso Veja Lavanda e Álcool Oferta 500Ml,4.49,4.49
54,Limpador Multiuso Veja com Álcool 500Ml,4.49,4.49
55,Limpador Azulim Lavanda Embalagem 1L,7.99,7.99
56,Desinfetante Classic Floral 5 Litros,12.99,12.99
57,Limpador Uau Limpa Vidros Embalagem 500Ml,7.89,7.89
58,Cera Líquida Brilhowax Incolor 750Ml,8.99,8.99
59,Pastilha Adesiva Floral Pato 3 Unidades,8.99,8.99
60,Limpador Veja Gold Limpeza Pesada Oferta 1L,16.99,16.99
61,Desinfetante Batuta Floral Embalagem 2L,7.49,7.49
62,Limpador Multiuso Veja Floral 500Ml,4.49,4.49
63,Limpador Azulim Multiuso com Álcool para Inox Embalagem 550Ml,3.49,3.49
64,Limpador Uau Flores e Sonhos 500Ml,3.98,3.98
65,Gel Adesivo Pato Marine Rf 38G com Aparelho,19.9,19.9
66,Limpador Multiuso Veja Floral Oferta 500Ml,4.49,4.49
67,Água Sanitária Superglobo Embalagem 1L,3.48,3.48
68,Limpador Multiuso Ação Clareadora Uau 500Ml,3.98,3.98
69,Limpador Uau Perfumes Lavanda e Conforto Ingleza Embalagem 500Ml,3.98,3.98
70,Sapólio Radium Cremoso Clássico Multiuso Bombril 250Ml,7.99,7.99
71,Cera Líquida para Piso de Pedra Ardósia Verde Ingleza Embalagem 750Ml,9.89,9.89
72,Desinfetante Batuta Lavanda Embalagem 2L,7.49,7.49
73,Secador Abrilhantador Finish para Lava Louças 250Ml,39.9,39.9
74,Limpador Multiuso Azulim Original Azul 500Ml,3.49,3.49
75,Limpador Uau Multiuso Cloro Ativo 5 em 1 Lavanda 500Ml,7.98,7.98
76,Limpador Uau Brisa Frescor 500Ml,3.98,3.98
77,Desinfetante Pinho Sol Original 500Ml,7.99,7.99
78,Multiuso Limpa e Desinfecta Ação Bactericida Azulim 550Ml,3.49,3.49
79,Limpador Spray Multiuso Power Fusion Limão Veja 500Ml,16.99,16.99
80,Pedra Sanitária Marine Oferta Pato,3.29,3.29
81,Limpador Mr. Músculo Banheiro Sachet Menor Preço 400Ml,10.99,10.99
82,Cera Líquida Ingleza Maxx Incolor 750Ml,12.89,12.89
83,Desinfetante Citrus Lysoform 1L,13.5,13.5
84,Soda Caustica Escorpião Embalagem 500G,16.99,16.99
85,Limpador Multiuso com Álcool Brilho Instantâneo Uau Frasco 500Ml,3.98,3.98
86,Desinfetante Líquido Original Lysoform 500Ml,6.89,6.89
87,Kit Limpador Uau Desengordurante Cozinha Limão 500Ml 2Un,11.48,11.48
88,Cera Líquida Ingleza Max Ardosia Verde Embalagem 750Ml,11.98,11.98
89,Limpador Multiuso Floral Uau Embalagem 500Ml,3.98,3.98
90,Limpador Casa e Perfume Amable 500Ml,4.98,4.98
91,Desinfetante Pinho Bril Brisa do Mar 500Ml,3.89,3.89
92,Limpador Casa e Perfume Passione Embalagem 500Ml,4.98,4.98
93,Desinfetante Pinho Bril Silvestre Plus 1L,6.99,6.99
94,Limpador Multiuso Coco Veja Power Fusion Squeeze 500Ml,9.9,9.9
95,Limpa Casa e Perfume Mistero Di Amore Embalagem 500Ml,4.98,4.98
96,Limpador Multiuso Azulim Florata 550Ml,3.49,3.49
97,Gel Adesivo Pato Marine Aparelho Embalagem 2 Discos,16.99,16.99
98,Limpador Gel Azulim Start Lavanda 500G,7.98,7.98
99,Limpador Banheiro Oferta Mr Músculo 500Ml,12.99,12.99
100,Desinfetante Classic Eucalipto 5 Litros,12.99,12.99
101,Pedra Sanitária Bosque de Pinho Oferta Glade 25G,3.99,3.99
102,Desinfetante Pinho Sol Original Oferta 1000Ml,12.99,12.99
103,Pedra Sanitária Harpic Ar Plus Flores do Campo 25G,3.49,3.49
104,Cera Líquida Ingleza Maxx Vermelha 750Ml,12.89,12.89
105,Saponáceo em Pó Multiuso Limão Bom Bril Sapólio Radium 300G,4.98,4.98
106,Limpador Perfumado Amora Sense Euforia Veja 500Ml,5.98,5.98
107,Limpador Casa e Perfume Speciale Embalagem 500Ml,4.98,4.98
108,Limpador Banheiro Cif sem Cloro Refil 450Ml,10.98,10.98
109,Desengordurante Multiuso Limão Classic 500Ml,4.79,4.79
110,Limpa Piso Porcelanato e Cerâmica Super Globo 750Ml,8.49,8.49
111,Limpador Uau Harmonia 500Ml,3.98,3.98
112,Lustra Móveis Bry Alfazema Embalagem 200Ml,5.99,5.99
113,Desinfetante Classic Jasmim Embalagem 2 Litros,5.99,5.99
114,Pedra Sanitária Jasmin Azulim 25G,1.98,1.98
115,Desinfetante Pinho Bril Brisa do Mar 1000Ml,6.99,6.99
116,Limpador Diluível Ajax Fresh 500Ml,8.99,8.99
117,Solução Acida para Limpeza Pesada Start Embalagem 1L,15.99,15.99
118,Desinfetante Suave Odor Lysoform Bruto Bombril 1L,11.99,11.99
119,Desengordurante Veja Gold Laranja Refil 400Ml,9.98,9.98
120,Lustra Móveis Bry Jasmim Embalagem 200Ml,5.99,5.99
121,Limpador Multiuso Uau Flores e Frescor Ingleza 500Ml,3.98,3.98
122,Limpa Forno Uau 450Ml,16.98,16.98
123,Limpador Mr Músculo Cozinha Oferta Spray 500Ml,24.98,24.98
124,Limpa Pisos Uau Ação Clareadora Embalagem 750Ml,8.99,8.99
125,Desinfetante Classic Floral Embalagem 2 Litros,5.99,5.99
126,Limpador Multiuso Classic Tradicional 500Ml,3.49,3.49
127,Polidor para Metais Brasso 200Ml,29.9,29.9
128,Limpador Uau Desengordurante Refil Embalagem 500Ml,12.98,12.98
129,Desinfetante Banheiro Lavanda Squeeze Veja 500Ml,11.89,11.89
130,Desinfetante para Superfícies Original em Spray Lysoform 250Ml,13.99,13.99
131,Desinfetante Batuta Oceano Ação Limpa Pisos Elimina Germes e Bactérias Embalagem 2L,7.49,7.49
132,Limpa Piso Elimina Odores Super Globo 750Ml,8.49,8.49
133,Desinfetante Pinho Trop Fresh Leve 1000Ml Pague 900Ml,6.49,6.49
134,Cera Ingleza Ardosia Incolor Embalagem 750Ml,9.89,9.89
135,Cera Líquida Nugget Preto 33% de Desconto Embalagem 60Ml,10.98,10.98
136,Limpador Perfumado Azulim Carinho 500Ml,4.49,4.49
137,Limpador Diluível Ajax Fresh Blue 500Ml,8.99,8.99
138,Desinfetante Pinho Flores de Limão Leve 500Ml Pague 450Ml,3.89,3.89
139,Cera Líquida Brilho Fácil Vermelha 750Ml,11.98,11.98
140,Desinfetante Pinho Sol Limão 1L,12.99,12.99
141,Desinfetante Pinho Trop Pinho e Menta 500Ml,3.75,3.75
142,Desengordurante Veja Laranja Refil 500Ml,14.98,14.98
143,Desinfetante Batuta Eucalipto Embalagem 2L,7.49,7.49
144,Limpa Inox Uau 200Ml,11.89,11.89
145,Pedra Sanitária Azulim Eucalipto,1.98,1.98
146,Desinfetante Classic Lavanda Embalagem 2 Litros,5.99,5.99
147,Limpador Multiuso Classic Floral 500Ml,3.49,3.49
148,Pedra Sanitária Dia a Dia Lavanda Embalagem 25G,2.99,2.99
149,Limpador Desengordurante com Gatilho Uau 500Ml,16.98,16.98
150,Cera Líquida Politriz Verde Embalagem 750Ml,4.99,4.99
151,Pedra Sanitária Dia a Dia Jasmim Embalagem 25G,2.99,2.99
152,Limpa Forno Easy Off 250Ml,17.98,17.98
153,Pedra Sanitária Dia a Dia Eucalipto Embalagem 25G,2.99,2.99
154,Desinfetante Pearson Creolina Embalagem 50Ml,11.98,11.98
155,Desinfetante Pinho Trop Citrus Leve 1000Ml Pague 900Ml,6.49,6.49
156,Desinfetante Santa Clara Floral Embalagem 5 Litros,15.98,15.98
157,Kit Econômico Cozinha Azulim Limpa + 3X500ml,11.9,11.9
158,Desinfetante Pinho Trop Limão Embalagem 500Ml,3.75,3.75
159,Limpador Multiuso Classic Hortelã 500Ml,3.49,3.49
160,Limpa Vidros Uau Gatilho 500Ml,15.99,15.99
161,Graxa para Sapato em Pasta Preta Nugget Lata 36G,9.98,9.98
162,Limpa Porcelanatos Azulim Power Citrus Embalagem 750Ml,7.99,7.99
163,Limpador Uau Limpeza Pesada Alta Performance Embalagem 500Ml,5.98,5.98
164,Graxa para Sapato em Pasta Marrom Nugget Lata 36G,9.98,9.98
165,Desinfetante Start Azulim Absolute Embalagem 2L,8.98,8.98
166,Desinfetante Classic Eucalipto Embalagem 2 Litros,5.99,5.99
167,Cera para Calçados Ingleza Preta Embalagem 60Ml,9.98,9.98
168,Kit Uau 2Multiuso + Limpa Vidros 500Ml,11.48,11.48
169,Cera Líquida Polylar Amarela Embalagem 750Ml,4.98,4.98
170,Cera Polylar Vermelha 750Ml,4.98,4.98
171,Cera Poliflor Brilho Máximo Vermelho 750Ml,12.98,12.98
172,Desinfetante Creolina Pearson Embalagem 100Ml,15.99,15.99
173,Silicone Gel Centralsul Lavanda 250G,19.99,19.99
174,Álcool 70% Liquido Start 1L,8.49,8.49
175,Limpador Gel Brilhex Citronela 1Kg,8.39,8.39
176,Desinfetante Pinholle Brilhex 2 L,9.48,9.48
177,Limpadores Aguarras Vila 900Ml,19.98,19.98
178,Limpa Pedras Brilhex Embalagem 1Lt,7.48,7.48
179,Limpador Perfumado Classic Requinte 1 Litro,5.89,5.89
180,Desinfetante Classic Lavanda 5 Litros,12.99,12.99
181,Soda Cáustica Yara 480G,9.98,9.98
182,Desinfetante Classic Capim Limão e Eucalipto 5 Litros,12.99,12.99
183,Limpa Vidros Classic Alvejante 500Ml,4.49,4.49
184,Limpa Alumínio Amarelo Brilhex 500Ml,2.99,2.99
185,Limpa Brilha Alum Brilhex Tradicional 500Ml,2.29,2.29
186,Solução Hidróxido Sódio de Sodio Start 2L,45.9,45.9
187,Desinfetante Brilhex de Lavanda 2L,9.48,9.48
188,Limpador Limpa Tudo Brilhex 750Ml,12.98,12.98
189,Desinfetante Brilhex Eucalipto 2L,9.48,9.48
190,"Limpador Classic Limpa Porcelanato 1,5 Litro",9.9,9.9
191,Pedra Sanitária Dia a Dia Tutti Frutti Embalagem 25G,2.99,2.99
192,Desinfetante Concentrado Dia a Dia Erva Doce 140Ml,13.99,13.99
193,Limpador Perfumado Classic Suave Harmonia 1 Litro,5.89,5.89
194,Limpador Perfumado Classic Momentos Especiais 1 Litro,5.89,5.89
195,Limpador Brilhex Limpa Cerâmicas e Azulejos 1 Litro,5.98,5.98
196,Pedra Sanitária Limppano Inspira Lavanda Embalagem 35G,3.49,3.49
197,Pedra Sanitária Bouquet Lavanda Embalagem com 25% de Desconto Glade 25G,3.99,3.99
198,Pastilha Adesiva Pato Citrus 20% de Desconto 3Un,8.49,8.49
199,Essência Capim Limão Aromatec 140Ml,7.98,7.98
200,Neutralizador de Odores Cheirinho de Talco Bom Ar Frasco Embalagem Econômica 360Ml,13.89,13.89
201,Desodorizante Sanitário Sampa Clean 3 Unidades,5.99,5.99
202,Desodorizador de Ambiente Automático Brisa Cítrica de Verão Glade 269Ml,34.9,34.9
203,Essência Aromatec Lavanda Embalagem Leve 140Ml Pague 100Ml,7.98,7.98
204,Essência Aromatec Floral 140Ml,7.98,7.98
205,Desodorizador Aerossol Lavanda Oferta Especial Glade 360Ml,14.99,14.99
206,Essência Aromatec Violeta 140Ml,7.98,7.98
207,Difusor de Ambiente Lavanda Glade 100Ml,23.9,23.9
208,Odorizador Lembranças de Infância Oferta Glade 360Ml,13.98,13.98
209,Odorizador de Ambiente Brisa Cítrica de Verão Toque de Frescor Refil Glade Leve 3 Pague 2,25.9,25.9
210,Pedra Sanitária Harpic Aroma Plus Citrus 25G,3.49,3.49
211,Anti Mofo Relva Dia a Dia 25G,6.99,6.99
212,Difusor de Ambiente Lembranças de Infância Glade 100Ml,23.9,23.9
213,Purificador de Ar Brisa Cítrica de Verão Glade 360Ml,15.99,15.99
214,Essência Aromatec Talco Embalagem 140Ml,7.98,7.98
215,Óleo de Eucalipto Naturales Embalagem 140Ml,13.99,13.99
216,Óleo de Eucalipto Aromatec 140Ml,7.98,7.98
217,Anti Mofo Dia a Dia Embalagem 25G,4.49,4.49
218,Desodorizador Gel Pequenos Ambientes Citrus Glade 70G,7.99,7.99
219,Óleo de Citronela Aromatec Embalagem 140Ml Leve 140Ml Pague 100Ml,7.98,7.98
220,Essência Aromatec Palmer 140Ml,7.98,7.98
221,Essência de Erva Doce Aromatec 140Ml,7.98,7.98
222,Óleo Aromatec Pinho 140Ml,7.98,7.98
223,Sachê Natural de Babosa Vegano Soft Hair 15Ml,4.99,4.99
224,Essen.Aromatec Jasmim 140Ml,7.98,7.98
225,Detergente Ypê Clear 500Ml,2.49,2.49
226,Detergente Ypê Neutro 500Ml,2.49,2.49
227,Detergente Coco Ypê 500Ml,2.49,2.49
228,Detergente Limpol Coco 500Ml,2.49,2.49
229,Detergente Líquido Limpol Cristal Embalagem 500Ml,2.49,2.49
230,Detergente Ypê Limão 500Ml,2.49,2.49
231,Detergente Ypê Clear Care 500Ml,2.49,2.49
232,Detergente Liq.Limpol 500Ml Lavanda,2.49,2.49
233,Detergente Ypê Capim Limão 500Ml,2.49,2.49
234,Detergente Líquido Neutro Limpol 500Ml,2.49,2.49
235,Detergente Azulim Coco 500Ml,1.89,1.89
236,Detergente Líquido Azulim Neutro 500Ml,1.89,1.89
237,Detergente Líquido Odd Clear 500Ml,2.59,2.59
238,Detergente Líquido Azulim Citrus 500Ml,1.89,1.89
239,Detergente Limpol Maçã 500Ml,2.49,2.49
240,Detergente Líquido Coco Odd 500Ml,2.59,2.59
241,Detergente Líquido Odd Neutro 500Ml,2.59,2.59
242,Detergente Líquido Odd Original 500Ml,2.59,2.59
243,Detergente Limpol Limão 500Ml,2.49,2.49
244,Sapólio Radium Cremoso Multiuso C/Cloro 250Ml,7.99,7.99
245,Detergente Líquido Odd Limão 500Ml,2.59,2.59
246,Detergente Líquido Odd Maçã 500Ml,2.59,2.59
247,Detergente Líquido Maçã Ypê 500Ml,2.49,2.49
248,Detergente Líquido Azulim Clear 500Ml,1.89,1.89
249,Pasta Multiuso Cristal Rosa 500G,4.98,4.98
250,Detergente Liquido Maçã Smart 500Ml,1.89,1.89
251,"Lava Roupas em Pó Máximo Cuidado Minuano 1,6Kg",21.9,21.9
252,"Inseticida Raid Aparelho Elétrico 45N 3 Refils Embalagem 32,9Ml",26.9,26.9
253,Inseticida Mat Inset Multi Cintronela 360Ml,11.99,11.99
254,Inseticida Citronela Sbp 380Ml,14.98,14.98
255,Inseticida Raid Multi Insetos Base Água 420Ml,15.99,15.99
256,Inseticida Raid Acqua Protec Aerosol 420Ml,15.69,15.69
257,Inseticida Raid Multi Insetos Eucalipto Oferta 420Ml,15.99,15.99
258,Inseticida Baygon Multi Insetos 285Ml,15.99,15.99
259,"Repelente Elétrico Liquido 45 Noites Aparelho e Refil Original Raid 32,9M",15.99,15.99
260,Inseticida Raid Mata Baratas Formigas Oferta 420Ml,15.99,15.99
261,"Repelente Elétrico Líquido 45 Noites Raid Family Caixa 2 Unidades 32,9Ml",25.9,25.9
262,Inseticida Aerosol Ação Total Óleo de Eucalipto Baygon 360Ml,15.99,15.99
263,Inseticida Raid Multi Insetos Citronela Oferta 420Ml,15.99,15.99
264,Inseticida Mat Inset Multi Inseticidas Aerosol 360Ml,11.99,11.99
265,Refil Pastilha Eletrica Raid com 12Un,4.99,4.99
266,Inseticida Aerosol Ação Total Baygon 360Ml,15.99,15.99
267,Inseticida Aerossol Ultra Baygon Embalagem Econômica 360Ml,16.99,16.99
268,Inseticida Mata Baratas Baygon 360Ml,15.99,15.99
269,"Repelente Raid Elétrico Liquido 1 Aparelho + 1 Refil 32,9Ml",19.98,19.98
270,Inseticida Multi Mat Inset Eucalipto Embalagem 400Ml Grátis +33%,11.99,11.99
271,Inseticida Raid Elétrico Eucalipto Pastilha Oferta Refil 12 Un,5.98,5.98
272,Inseticida Mat Inset Multi sem Cheiro Aerosol 360 Ml,11.99,11.99
273,Repelente Espiral Metal Baygon com 10Un,7.99,7.99
274,Sbp Multi Inseticida Aerossol Óleo de Citronela Leve+ Pague- 450Ml,14.98,14.98
275,"Repelente Elétrico Raid Líquido Refil 32,9Ml",15.99,15.99
276,Inseticida Sbp Insetos Base Água 273Ml,9.98,9.98
277,Inseticida Líquido Baygon Ação Total Base Água Oferta Embalagem 475Ml,19.99,19.99
278,Inseticida Sbp Multi Inset Citronela Aerosol 273Ml,9.98,9.98
279,Inseticida Sbp Anti Aedes Aegypti Spray 450Ml,14.98,14.98
280,Ratoeira Adesiva Cola Rato,5.99,5.99
281,Iinseticida Era Mosca em Pó 25G,5.49,5.49
282,Inseticida Baratox 100Ml,5.99,5.99
283,Inseticida Baratox Isca Embalagem 25G,5.99,5.99
284,"Sabão Po Minuano Ação Profunda Sachê 1,8Kg",17.99,17.99
285,"Lava Roupas em Pó Tixan Ypê Maciez Leve 2Kg Pague 1,9Kg",21.9,21.9
286,Sabão em Pó Maxima Proteção Minuano 450G,6.99,6.99
287,Sabão em Pó Classic Plus 2Kg,12.99,12.99
288,1Un Lava Roupa Omo Lavagem Perfeita 1.6Kg Grátis 150G.,22.9,22.9
289,Sabão em Pó Omo Lavagem Perfeita 400G,7.99,7.99
290,Lava-Roupas Pó Lavagem Perfeita Omo 800G,14.79,14.79
291,Sabão em Pó Toque de Poesia Amacitel 2Kg,13.99,13.99
292,"Lava Roupas Pó Concentrado Máxima Perfumação Minuano 1,6Kg",21.9,21.9
293,Sabão em Pó Uzzilim Lavanda Embalagem 1Kg,6.99,6.99
294,Sabao Glic Ype Neutro 900G,13.29,13.29
295,Amaciante Downy Brisa do Verão 500Ml,9.98,9.98
296,Lava Roupas Uzzilim Flores 1Kg,6.99,6.99
297,"Amaciante de Roupa Aconchego Ypê Frasco Leve 2L Pague 1,8L",11.99,11.99
298,Lava Roupas em Pó para Roupas Brancas e Coloridas Alegres Encantos Amacitel 1Kg,7.99,7.99
299,Lava Roupas em Pó para Roupas Brancas e Coloridas Limpeza Total Brilhante Sachê 800G,13.99,13.99
300,Amaciante de Roupa Concentrado Brisa de Verão Downy Leve 500Ml Pague 450Ml,8.99,8.99
301,Lava Roupas em Pó Tixan Ypê Primavera 800G,12.99,12.99
302,Amaciante Classic Nature Floral 5 Litros,14.99,14.99
303,Sabão em Pó Uzzilim Lavanda 500G,4.99,4.99
304,Amaciante Comfort Tradicional Explosao Azul 1.8L,19.9,19.9
305,Sabão em Pó Classic Plus 1Kg,6.99,6.99
306,Lava-Roupas Pó Puro Cuidado Omo 800G,14.99,14.99
307,Lava Roupas em Pó Concentrado Maciez Tixan Ypê 800G,12.99,12.99
308,"Lava-Roupas em Pó Concentrado Primavera Tixan Ypê 1,6Kg",21.9,18.9
309,"Lava-Roupas Pó Omo Lavagem Perfeita Pacote 2,4Kg Tamanho Família",34.99,34.99
310,Amaciante Concentrado Downy Lírio do Campo 1L,19.99,19.99
311,Lava Roupas em Pó Máxima Limpeza Minuano 800G,11.99,11.99
312,Lava Roupas em Pó Limpeza Total Brilhante 400G,8.99,8.99
313,Lava Roupas em Pó Roupas Brancas e Coloridas Alegres Encantos Amacitel 2Kg,14.99,14.99
314,Lava Roupas em Pó Rosas e Flor de Lis Surf 800G,8.99,8.99
315,"Amaciante Tradicional Puro Cuidado Comfort 1,8L",19.9,19.9
316,Lava-Roupas Líquido Omo Puro Cuidado Galão 3L,44.9,44.9
317,Amaciante Downy Lirios do Campo 500Ml,9.98,9.98
318,"Lava Roupas em Pó Concentrado Primavera Tixan Ypê Leve 1,6Kg Pague 1,52Kg",21.9,18.9
319,"Lava Roupas em Pó para Roupas Brancas e Coloridas Limpeza Total Brilhante 1,6Kg",21.99,21.99
320,Alvejante Classic sem Cloro 2 Litros,14.98,14.98
321,"Lava Roupas em Pó Máxima Limpeza Minuano 1,6Kg",21.9,21.9
322,"Lava-Roupas em Pó Concentrado Maciez Tixan Ypê Caixa Leve 1,6Kg Pague 1,52Kg",21.9,18.9
323,Amaciante para Roupinhas de Bebê Vida Macia Camomila 500Ml,5.49,5.49
324,Amaciante para Roupinhas de Bebê Vida Macia Amêndoas Embalagem 1Lt,9.98,9.98
325,Amaciante para Roupinhas de Bebê Vida Macia Camomila Embalagem 1L,9.98,9.98
326,Sabão em Pó Flores Uzzilim 2Kg,9.9,9.9
327,Sabão em Barra Glicerinado Neutro Ypê 180G,3.99,3.99
328,Lava Roupas Sanitizante em Pó Brilhante Delicadeza Total 800G,10.98,10.98
329,Detergente em Pó Limão e Bicarbonato Surf 800G,8.99,8.99
330,Lava-Roupas Concentrado para Diluir Brilhante Limpeza Total Refil Econômico Frasco 500Ml,19.98,19.98
331,Detergente Líquido Lava Roupas Ariel Refil Cores Radiante 700Ml,13.99,13.99
332,Sabão Barra Glicerinado Uzzilim 5Un,12.99,12.99
333,Lava Roupas Inteligente em Pó Antibac Assim 800G,9.9,9.9
334,Amaciante de Roupa Concentrado Brisa Intenso Downy 500Ml,9.98,9.98
335,Sabão em Barra Glicerinado Neutro Minuano 1Kg,14.99,14.99
336,Amaciante Uau Glamour 2 Litros,8.99,8.99
337,Amaciante Ypê Delicado 2L,11.99,11.99
338,Tira Manchas Gel Vanish Roupas Coloridas 500Ml,15.99,15.99
339,Amaciante Amacitel Luxo Momento de Carinho 2L,7.98,7.98
340,Amaciante para Roupas de Bebê Vida Macia Amêndoas Embalagem 500Ml,5.49,5.49
341,Tira Mancha Oxi Action Crystal White Multi Power Vanish 30G,1.98,1.98
342,Detergente Lava Roupas em Pó Surf 5Em1 Rosas e Flor de Lis 800G,8.88,8.88
343,Amaciante Concentrado Downy Frescor da Primavera Embalagem 500Ml,9.98,9.98
344,Tira Manchas Semorin Embalagem 100Ml,11.99,11.99
345,Lava Roupas Desinfetante em Pó Brilhante Higiene Total Combate Germes e Bactérias 800G,12.99,12.99
346,Tira Manchas em Pó Vanish Multi Power 30G,2.49,2.49
347,Lava Roupas Sanitizante em Pó 5Em1 Cuidado do Coco Surf 1.6Kg,16.98,16.98
348,Amaciante Baby Soft Toque de Cuidado 2L,7.99,7.99
349,Detergente Lava Roupas em Pó 5 em 1 Cuidado do Coco Surf 800G,8.99,8.99
350,Amaciante Baby Soft Infinity 2L,7.99,7.99
351,Anil Imperial Colman 90G,19.99,19.99
352,Cloro Santa Clara Super Forte Embalagem 1 Litro,4.99,4.99
353,Detergente Lava Roupas em Pó Surf 5 em 1 Lavanda 800G Nova Formula,8.99,8.99
354,Amaciante de Roupa Concentrado Collection Místico Downy 450Ml,9.98,9.98
355,"Lava-Roupas Pó Omo Puro Cuidado Caixa 1,6Kg",24.9,24.9
356,Sabão em Pó Alquimisa Amarelo Ecológico 1Kg,6.99,6.99
357,Amaciante Downy Paixão 450Ml,9.98,9.98
358,Amaciante Toque de Poesia Luxo Amacitel 2L,7.89,7.89
359,"Lava Roupas Ariel Refil 1,5L",26.9,26.9
360,Lava Roupas Bebê Ola 500Ml,17.98,17.98
361,Amaciante Classic Talco 2 Litros,6.99,6.99
362,Amaciante Diluído Toque Sedutor Baby Soft 2L,7.99,7.99
363,Amaciante Concentrado Ypê Blue 500Ml,10.99,10.99
364,Sabão em Barra Glicerinado Tira-Manchas Multiativo Ypê,14.98,14.98
365,Amaciante Clássico Máxima Proteção Minuano Embalagem 2L,9.9,9.9
366,Sabão em Barra Ypê Multiativo Perfumado 1Kg,16.99,16.99
367,Sabão em Barra Minuano Coco 1Kg,19.9,19.9
368,Sabão em Barra Glicerinado Coco Ypê 180G,4.99,4.99
369,Amaciante Ypê Carinho 2L,11.99,11.99
370,Tira Manchas Brilhante Utile Fresh 380G,13.99,13.99
371,Lava-Roupas Pó Omo Cuidado Intensivo Caixa 800G,13.98,13.98
372,Sabão Líquido Classic Plus 3 Litros,20.99,20.99
373,Amaciante Ypê Ternura Embalagem 2 Litros,11.99,11.99
374,Amaciante Alegres Encantos Amacitel 2L,7.89,7.89
375,Amaciante Classic Nature Bouquet Rosa 2 Litros,6.99,6.99
376,Sabão em Barra de Coco Ufe 500G,10.99,10.99
377,Lava Roupas Ola Original 500Ml,17.98,17.98
378,Sabão Gel Classic Pinho 2 Litros,10.99,10.99
379,Sabão em Barra Glicerinado de Coco Ypê 5Un 900G,17.99,17.99
380,Alvejante Classic Poder 02 sem Cloro 450G,16.98,16.98
381,Sabão em Pó Ufe Coco 500G,13.98,13.98
382,Sabão em Barra Glicerinado Fresh Ypê 900G,14.98,14.98
383,Sabão em Barra Glicerinado Flores e Frutas Ypê 900G com 5Un,14.98,14.98
384,Sabão em Pedra Azul Limpeza Perfumada Minuano 5X180g,16.99,16.99
385,Lava Roupas Omo 450Ml Roupas Finas & Delicadas Original,9.99,9.99
386,Sabão em Pedra de Coco Ufe com 5Un de 180G Cada,21.9,21.9
387,Lava-Roupas Pó Omo Proteção Antiodor Caixa 800G,13.99,13.99
388,Sabão Líquido Coquel Roupas Escuras 500Ml,10.98,10.98
389,Sabão em Barra Glicerinado Azul Uzzilim 1Kg,12.99,12.99
390,Amaciante Classic Floral Embalagem 2 Litros,6.99,6.99
391,Sabão Líquido Classic 1Un 2L,13.98,13.98
392,Amaciante Classic Violeta Embalagem 2 Litros,6.99,6.99
393,Sabão em Pó Uzzilim Flores Sachê 500G,4.99,4.99
394,Sabão em Barra Glicerinado Multiuso Limão Minuano Pacote 900G com 5 Unidades 180G,16.99,16.99
395,Sabão Líquido de Ervas Coquel 500Ml,10.98,10.98
396,Lava Roupas em Pó Máxima Perfumação Minuano 400G,6.99,6.99
397,Sabão em Barra Artesanal Coco Uzzilim 200G,14.99,14.99
398,Sabão em Barra Glicerinado Limão 200G Cada Uzzilim 1Kg,12.99,12.99
399,"Amaciante de Roupa Toque de Carinho Baby Soft 1,5 L",6.99,6.99
400,Cloro Classic Extra Forte Embalagem 5 Litros,15.99,15.99
401,Amaciante Classic Bouquet de Rosas 5 Litros,14.99,14.99
402,Sabão Barra Classic 200G 5Un,13.99,13.99
403,Lava-Roupas em Pó Concentrado Suave Máximo Cuidado Minuano 800G,11.99,11.99
404,Sabão Glicerinado Neutro Barra Classic 5X200g,10.99,10.99
405,"Sabão em Pó Clean Care Tuff 1,6Kg",16.98,16.98
406,Pinho Gel Floral Classic 2L,10.99,10.99
407,Amaciante Classic Talco 5 Litros,14.99,14.99
408,Esponja de Aço Bombril Pacote 60G,2.19,2.19
409,Esponja Multiuso Limpeza Pesada Limppano Pacote 4Un,4.99,4.99
410,Esponja Multiuso Wish C/ 1Un,1.29,1.29
411,Esponja de Aço Assolam Ypê 45G,1.89,1.89
412,Esponja Condor Multiuso Leve 4 Un Pague 3 Un,4.49,4.49
413,Prendedor Madeira Keeprend Embalagem 12 Un,3.49,3.49
414,Esponja Limppano Antiaderente Embalagem 3 Un,6.98,6.98
415,Luva Plástica Descartável Talge Transparante 100Un,1.0,1.0
416,Pano Reutilizável Scott Duramax Rolo 58 Unidades,12.99,12.99
417,Luva Limppano Multiuso M Embalagem 1 Par,11.98,11.98
418,Esponja Wish Multiuso Embalagem 4 Un,5.49,5.49
419,Limpa Tudo Gatilho Brilhex 750Ml,16.98,16.98
420,Esponja Limppano Antiaderente Embalagem 1 Un,2.49,2.49
421,Espoja Scotch-Briet Economia Embalagem Unitária,2.29,2.29
422,Luva Multiuso Slim Volk P,7.99,7.99
423,Saco de Lixo Forte Reforçado 100L 20 Un,13.99,13.99
424,Luva Wish Multi Uso Amarelo Grande Embalagem 1 Par,9.98,9.98
425,Esponja Limppano Maxxi Embalagem 4 Un Pague 3,5.89,5.89
426,Saco de Lixo Forte 30L 55 Un,13.99,13.99
427,Pano Multiuso Limppano Furatto Lavanda Embalagem 5 Un,7.48,7.48
428,Luva Multiuso Limppano Tam G Embalagem 1 Unidade,11.98,11.98
429,Esponja Prateada Scotch-Brite,8.99,8.99
