,Produto,Preço Base,Preço Final
2718,Alho Desidratado Alheiro 20G,1.99,1.99
2719,Caldo de Picanha Knorr 57G,1.95,1.95
2720,Tempero Pronto Kitano Mais Sabor Carne Sachê 60G,4.99,4.99
2721,Tempero Kitano Mais Sabor 60G. Aves,4.99,4.99
2722,"Caldo em Pó Sazon Sabor Carne 32,5G",2.49,2.49
2723,Tempero em Pó Caipira Meu Assado Knorr 23G,5.49,5.49
2724,Tempero Sazón Alho 60G,4.79,4.79
2725,Temp Maggi Fondor 120G,6.99,6.99
2726,Tempero Sabor a Mi Alho e Sal 300G,4.24,4.24
2727,Tempero Completo Pirata sem Pimenta Pote 500G,6.99,6.99
2728,Tempero Sazón Toque de Limão 60G,4.79,4.79
2729,Pimenta do Reino em Grãos Alheiro 7G,2.29,2.29
2730,Alho Frito Granulado Sabor 30G,5.6,5.6
2731,Canela em Pó Alheiro 30G,4.99,4.99
2732,Tempero Alheiro Louro em Folha 5G,1.99,1.99
2733,Tempero Mais Sabor Kitano Massas Embalagem 60G,3.79,3.79
2734,Tempero em Pó para Todos Os Tipos de Carne Gril Maggi 120G,5.98,5.98
2735,Caldo de Carne Knorr Embalagem 57G,1.95,1.95
2736,Caldo de Carne Maggi Tablete 57G,1.69,1.69
2737,Tempero Caseiro Meu Assado Knorr 25G,5.49,5.49
2738,Tempero Caseiro com Pimenta Receita de Casa 450G,10.19,10.19
2739,Tempero Completo Pirata sem Pimenta Pote 1Kg,11.99,11.99
2740,Tempero Completo Pirata com Pimenta Embalagem 300G,3.89,3.89
2741,"Tempero Pronto Pirata Feija2o, Ovos e Arroz 60G",3.48,3.48
2742,Massa de Alho Pirata 300G,3.89,3.89
2743,Tempero Sazón Arroz 60G,4.79,4.79
2744,Tempero Completo Sabor a Mi sem Pimenta Pote 1Kg,14.44,14.44
2745,Caldo de Carne Maggi 114G,2.99,2.99
2746,"Cebola, Alho e Salsa Sabor 20G",3.49,3.49
2747,Condimento Cebola Granulada Alheiro 20G,2.29,2.29
2748,"Caldo em Pó Picanha Na Brasa Sazón 37,5G",2.49,2.49
2749,Temp Maggi Amac 120G Carnes,7.99,7.99
2750,Caldo Arisco Carne 57G,1.59,1.59
2751,Tempero Sazón Tempera e Empana Tradicional 60G,3.38,3.38
2752,Tempero em Pasta Caseiro Receita de Casa 450G,10.19,10.19
2753,Tempero Sazón Alecrim 60G,4.48,4.48
2754,Tempero Pronto Kitano Mais Sabor Arroz Branco Sachê 60G,4.99,4.99
2755,Tempero Pronto Pirata sem Pimenta 300G,3.89,3.89
2756,Tempero Pronto Alheiro Alho e Sal 250G,3.15,3.15
2757,Alho Granulado Sabor Embalagem 100G,12.99,12.99
2758,Massa de Alho Pirata Pote 1Kg,11.99,11.99
2759,"Tempero Pronto Pirata Carne, Legumes e Arroz 60G",3.48,3.48
2760,Alho e Sal Alheiro 500G,4.69,4.69
2761,Amaciante de Carne com Tempero Sabor 30G,2.79,2.79
2762,Caldo Arisco Carne 114G,2.55,2.55
2763,Tempero Pronto Alho e Sal Alheiro 500G,3.15,3.15
2764,Curry Gota D' Fogo Embalagem 10G,1.15,1.15
2765,Tempero Pronto Completo Alheiro 1Kg,7.99,7.99
2766,Louro em Pó Gota de Fogo 5G,1.15,1.15
2767,Tomilho Flocos Alheiro 10G,2.19,2.19
2768,Condimento Coentro em Grão Gota D Fogo 10G,1.15,1.15
2769,Noz Moscada Moída Sabor 8G,4.78,4.78
2770,Cravo da Índia Pirata 10G,3.68,3.68
2771,Condimento Alecrim Gota de Fogo 05G,1.15,1.15
2772,Pimenta do Reino em Grão Gota de Fogo 10G,1.25,1.25
2773,Páprica Picante Gota de Fogo 25G,2.25,2.25
2774,Noz Moscada Sabor Bola 8G,4.78,4.78
2775,Louro em Po Sabor 5G,2.65,2.65
2776,Cebolinha Verde Desidratada Sabor 5G,2.65,2.65
2777,Colorau Gota de Fogo 100G,2.29,2.29
2778,Pimenta Rosa Sabor 8G,3.98,3.98
2779,Canela em Pó Tubo Pirata 40G,5.79,5.79
2780,Manjericão Desidratado Sabor 5G,2.15,2.15
2781,Tempero Sabor Aves 40G,3.85,3.85
2782,Condimento Canela Casca Gota de Fogo 5G,1.15,1.15
2783,Colorau Alheiro 150G,4.99,4.99
2784,Tempero Pronto para Arroz Pachá 50G,2.98,2.98
2785,Canela em Casca Sabor 8G,3.19,3.19
2786,Pimenta Caiena Alheiro 20G,2.29,2.29
2787,Alecrim Alheiro 6G,1.79,1.79
2788,Orégano Gota de Fogo 3G,1.15,1.15
2789,Tempero Pronto para Frango Pacha 50G,2.98,2.98
2790,Canela em Pó Sabor 8G,3.18,3.18
2791,Pimenta do Reino em Pó Gota de Fogo 10G,1.15,1.15
2792,Tempero do Chefe Alheiro 30G,2.79,2.79
2793,Tempero Misto Sabor 10G,2.65,2.65
2794,Oregano Gota de Fogo 20G,2.75,2.75
2795,Especiarias Sabor Orégano Embalagem 5G,1.79,1.79
2796,Pimenta Calabresa Gota de Fogo 10G,1.15,1.15
2797,Chimichurri Sabor 10G,3.59,3.59
2798,Cominho Moído Pirata 10G,1.29,1.29
2799,Tempero Baiano Gota de Fogo 25G,2.25,2.25
2800,Caldo Knorr Bacalhau 57G,1.95,1.95
2801,Cominho em Pó Gota de Fogo 10G,1.15,1.15
2802,Açafrão Gota de Fogo 10G,1.15,1.15
2803,Cominho Alheiro 7G,1.69,1.69
2804,Tempero Pronto Pacha Feijão 50G,2.98,2.98
2805,Tempero do Chefe para Churrasco Sabor 12G,3.75,3.75
2806,Tempero Baiano Sabor 10G,4.1,4.1
2807,Tempero Alheiro Coentro Grão 7G,1.59,1.59
2808,Especiarias Anchieta Bicarbonato de Sódio Embalagem 110G,2.98,2.98
2809,Erva Doce Gota de Fogo 5G,1.15,1.15
2810,Coentro em Pó Sabor 10G,2.19,2.19
2811,Manjericão Desidratado Alheiro 10G,2.15,2.15
2812,Pimenta do Reino em Grão Sabor 10G,2.59,2.59
2813,Bicarbonato Alheiro 30G,1.39,1.39
2814,Condimento Camomila Alheiro 5Gr,1.99,1.99
2815,Tempero Alheiro Lemon Pepper 30G,2.49,2.49
2816,Sabor Condimentos Açafrão Terra e Pimenta Caíena 10G,2.89,2.89
2817,"Tempero Pronto Pirata Legumes, Verduras e Arroz 60G",3.48,3.48
2818,"Caldo de Galinha Junior Embalagem 1,01Kg",12.89,12.89
2819,Curry Sabor 10G,3.15,3.15
2820,Ervas Finas Desidratada Sabor 10G,3.79,3.79
2821,Especiarias Sabor Bicarbonato de Sódio Embalagem 280G,8.99,8.99
2822,Tempero Baiano Alheiro 30Gr,2.49,2.49
2823,Tempero Pronto Pamps Churrasco Embalagem 500G,4.99,4.99
2824,Vinagrete Sabor 30G,7.25,7.25
2825,Chimichurri Tradicional Alheiro 20G,2.49,2.49
2826,"Tempero Pronto Pirata Aves, Peixes e Arroz 60G",3.48,3.48
2827,Noz Moscada Gota de Fogo 2Un,1.15,1.15
2828,Folhas de Louro Gota D'fogo 3G,1.15,1.15
2829,Condimentos Açafrão Alheiro 20Gr,1.99,1.99
2830,Pimenta do Reino em Pó Alheiro 15G,1.99,1.99
2831,Pimenta do Reino Preta Moída Pirata 30G,6.98,6.98
2832,Noz Moscada em Pó Gota de Fogo 5G,2.75,2.75
2833,Tempero Pronto Pacha Legumes 50G,2.98,2.98
2834,Condimento Cheiro Verde Alheiro 10Gr,2.39,2.39
2835,Colorau Alheiro 500G,9.98,9.98
2836,Colorífico Pacha 500G,5.49,5.49
2837,Pimenta do Reino em Pó Gota D' Fogo 30G,3.98,3.98
2838,Açafrão em Pó Sabor 10G,2.19,2.19
2839,Alho Desidratado Gota D´Fogo 10G,1.25,1.25
2840,Noz Moscada Pirata 2Un,4.99,4.99
2841,Condimento Sabor Cheiro Verde 5Gr,2.85,2.85
2842,Condimento Orégano Alheiro150g,8.99,8.99
2843,Pimenta Calabresa Sabor 10G,2.59,2.59
2844,Colorau Sabor 30G,2.39,2.39
2845,Salsa Desidratada Pirata 5G,1.05,1.05
2846,Bicarbonato de Sódio Pachá 80G,2.49,2.49
2847,Orégano Pirata 5G,1.89,1.89
2848,Pimenta Caiena Sabor 10G,2.59,2.59
2849,Condimento Canela Po Gota D Fogo (Tubo) 30G,3.49,3.49
2850,Páprica Doce Gota de Fogo 25G,2.25,2.25
2851,Chimichurri com Pimenta Gota de Fogo 15G,2.25,2.25
2852,Colorau Sabor 155G,5.99,5.99
2853,Páprica Picante Alheiro Pacote 30G,1.89,1.89
2854,Páprica Picante Sabor 10G,2.55,2.55
2855,Canela em Casca Pirata 10G,2.49,2.49
2856,Cominho em Grão Sabor 10G,2.89,2.89
2857,Noz Moscada em Pó Alheiro 7G,2.59,2.59
2858,Pirata Canela Moída 10G,2.49,2.49
2859,Cravo da Índia Sabor 5G,2.69,2.69
2860,Condimento Canela Po Gota de Fogo 05G,1.15,1.15
2861,Salsa Desidratada Sabor 5G,2.65,2.65
2862,Tempero Pronto Sabor para Peixe 40G,3.85,3.85
2863,Orégano Sabor 11G,2.69,2.69
2864,Erva Doce Alheiro 7G,1.79,1.79
2865,Páprica Doce Alheiro 30G,1.89,1.89
2866,Bicarbonato de Sódio Sabor 30G,2.48,2.48
2867,Colorífico Alheiro 30G,1.99,1.99
2868,Pimenta do Reino em Pó Sabor 10G,2.59,2.59
2869,Chimichurri com Pimenta Alheiro 20G,2.49,2.49
2870,Colorau Pirata 30G,1.19,1.19
2871,Alecrim Sabor 5G,2.1,2.1
2872,Condimento Colorau Gota de Fogo 30G,1.15,1.15
2873,Cravo Índia Alheiro 7G,2.29,2.29
2874,Bicarbonato Gota de Fogo 80G,1.89,1.89
2875,Tempero Pronto para Carnes Pacha 50G,2.98,2.98
2876,Especiarias Pacha Bicarbonato de Sódio Embalagem 500G,6.99,6.99
2877,Colorau Pacha 150G,1.98,1.98
2878,Cebola Alho e Salsa Gota de Fogo 20G,2.25,2.25
2879,Leite Fermentado Desnatado Adoçado Yakult Pote 80G 6Un,10.8,10.8
2880,Bebida Láctea Fermentada Pulsi Tri Sabores Bandeja 540G,3.99,3.99
2881,Leite Fermentado Chamyto Nestlé 75G com 6Un,6.99,6.99
2882,"Iogurte Porto Alegre Morango 1,25 Litro",13.99,13.99
2883,Iogurte Polpa Itambé Morango e Coco Bandeja 540G,5.99,5.99
2884,Leite Fermentado Bob Esponja Elegê Tradicional Caixa 480G 6 Unidades,5.98,5.98
2885,Iogurte Polpa Morango Itambé Bandeja 540G 6Un,5.99,5.99
2886,Bebida Láctea Cotochés Frutas Vermelhas com Coco 540G,4.29,4.29
2887,Iogurte Itambé Polpa de Coco Bandeja 540G,5.99,5.99
2888,"Iogurte Líquido Porto Alegre Sal Frutas Garrafa 1,25 Litro",13.99,13.99
2889,"Iogurte Líquido Itambé Morango Garrafa 1,25Kg",13.99,13.99
2890,Leite Fermentado Desnatado Morango Bob Esponja Elegê Caixa 6 Unidades,5.98,5.98
2891,Iogurte Porto Alegre Morango e Coco 540G,5.49,5.49
2892,Leite Fermentado Desnatado Uva Bob Esponja Elegê Caixa 480G Pack 6 Unidades,5.98,5.98
2893,"Leite Fermentado Desnatado Laranja Itambé Garrafa 1,2Kg",13.99,13.99
2894,Leite Fermentado Trevinho 480G 6Un,5.99,5.99
2895,Bebida Láctea Chocolate 15G de Proteína Yopro 250Ml,9.98,9.98
2896,Iogurte Itambé Natural Copo 170G,3.49,3.49
2897,Petit Suisse Chambinho Morango 320G,8.99,8.99
2898,Bebida Láctea Goody Morango 540G,4.99,4.99
2899,Leite Fermentado Desnatado Os Incríveis 2 Itambé 6Un de 80G Cada,6.99,6.99
2900,Bebida Láctea Itambé Goody Chocolate Caixa 200Ml,1.49,1.49
2901,Sobremesa Itambe Pudim Pote 200G,6.89,6.89
2902,"Iogurte de Salada de Frutas Goody Itambé 1,25Kg",10.49,10.49
2903,Iogurte Apreciare Triple Morango Zero Lactose e Açúcar Bandeja 540G,6.98,6.98
2904,Sobremesa Chambinho Chocolate 320G,8.99,8.99
2905,Iogurte Natural Integral Itambé Milk Copo 170G,3.49,3.49
2906,Bebida Láctea Goody Frutas Vermelhas e Coco 540G,4.99,4.99
2907,Iogurte Integral Trevinho 170G,2.85,2.85
2908,Leite Fermentado Batavito 480G com 6 Unidades,5.99,5.99
2909,Leite Fermentado Itambé 6Un Pote 450G,6.49,6.49
2910,Sobremesa Láctea Itambé Flan com Calda Sabor Caramelo 200G,4.98,4.98
2911,Iogurte Kids Cereal Sabor Morango Itambé 120G,5.49,5.49
2912,Iogurte Chamyto Morango 100G,3.49,3.49
2913,Iogurte Itambé Natural Desnatado Copo 170G,3.49,3.49
2914,"Iogurte Líquido Itambé Vitamina Cereal Garrafa 1,25Kg",13.99,13.99
2915,Bebida Láctea Chocomil Black Embalagem 200Ml,1.59,1.59
2916,Bebida Láctea Pulsi Morango Garrafa 180G,1.99,1.99
2917,Bebida Láctea Cemil Sabor Cappuccino Embalagem 190Ml,1.79,1.79
2918,Suplemento de Vitaminas Taff Man e Yakult Frasco 110Ml,4.28,4.28
2919,Leite Fermentado Chamyto 6X120g,10.99,10.99
2920,"Iogurte Líquido Itambé Coco Garrafa 1,25Kg",13.99,13.99
2921,Iogurte Parcialmente Desnatado Morango + Salada de Frutas + Banana Os Incríveis 2 Itambé Kids Bandeja 540G 6 Unidades,6.98,6.98
2922,Bebida Láctea Itambé Morango Goody 170G,2.49,2.49
2923,Iogurte Chamyto Morango + Cereais Caramelo 130G,4.99,4.99
2924,"Bebida Láctea Fermentada Morango Itambé Goody 1,25L",10.49,10.49
2925,Activia Shot Framb/Hibisco Lf 100G,4.39,4.39
2926,Iogurte Itambé Frutas Vermelhas Zero Lactose Garrafa 170G,3.28,3.28
2927,Iogurte Morango Itambé Gf 170G,2.95,2.95
2928,Queijo Petit Suisse Morango Os Incríveis Itambé Kids Bandeja 320G 8 Unidades,7.99,7.99
2929,Iogurte Itambé Fit Mamão e Laranja 850G,13.99,13.99
2930,Iogurte Itambé Nolac Grego Frutas Vermelhas Maracujá Tradicional Bandeja 540G,13.99,13.99
2931,Queijo Petit Suisse Morango + Banana Os Incríveis Itambé Kids Bandeja 320G 8 Unidades,7.99,7.99
2932,Bebida Láctea Itambé Vitamina 1L,7.99,7.99
2933,Iogurte Grego Porto Alegre Integral 90G,2.79,2.79
2934,Bebida Láctea Itambé Goody Coco Embalagem 170G,1.99,1.99
2935,Bebida Láctea Pulsi Salada de Frutas 180G,1.99,1.99
2936,"Iogurte Sabor Coco Embalagem Econômica Itambé Goody 1,25Kg",10.49,10.49
2937,Iogurte Nestlé Bicamada Morango 150G,4.29,4.29
2938,Iogurte Porto Alegre Frutas Vermelhas 170G,2.79,2.79
2939,Iogurte Nestlé Grego Tradicional 90G,3.25,3.25
2940,Iogurte Polpa Morango Good Fruti Itambé 900Ml,6.49,6.49
2941,Bebida Láctea Pulsi Morango 900G,5.49,5.49
2942,"Iogurte Cremoso Parcialmente Desnatado Sabor Frutas Vermelhas Itambé 1,25Kg",13.99,13.99
2943,Iogurte Itambé Fit Morango Garrafa 170G,3.28,3.28
2944,Bebida Láctea Cemil Sucomilho Caixa 200Ml,1.49,1.49
2945,Iogurte Itambé Grego Integral Embalagem 100G,2.78,2.78
2946,Iogurte Itambé Coco Garrafa 170G,2.95,2.95
2947,Iogurte Itambé Nolac Coco 850G,13.99,13.99
2948,Iogurte Ninho Morango 170G,3.49,3.49
2949,Sobremesa Láctea Itambé Chocolate 180G,4.98,4.98
2950,Bebida Láctea Pulsi Salada de Frutas 900G,7.99,7.99
2951,Bebida Láctea Cemil Caramelo Embalagem 200Ml,1.49,1.49
2952,Bebida Láctea Pulsi Morango 900G,7.69,7.69
2953,Leite Fermentado Os Incríveis Sabor Morango Itambé 6Un de 80G Cada,6.99,6.99
2954,Iogurte Grego Apreciare Morango Maracujá Embalagem 540G,8.99,8.99
2955,Iogurte Líquido Itambé Maracujá Garrafa 170G,2.95,2.95
2956,Bebida Láctea Itambé Fit Mamão e Laranja Garrafa 170G,3.28,3.28
2957,Iogurte Chamyto Vitamina de Frutas 100G,3.49,3.49
2958,Iogurte Itambé Frutas Vermelhas Garrafa 170G,2.95,2.95
2959,Iogurte Trevinho Ball Morango Confeitos 130G,5.49,5.49
2960,Iogurte Itambé Natural Laranja Cenoura Mel Copo 170G,3.49,3.49
2961,Iogurte Itambé Kids Morango Garrafa 170G,2.95,2.95
2962,Iogurte Ninho Maçã Banana 850G,13.99,13.99
2963,Iogurte Neston Maçã e Banana 170G,3.25,3.25
2964,Iogurte Líquido Porto Alegre Coco 170G,2.79,2.79
2965,Iogurte Trevinho Ball Confeitos 130G,5.49,5.49
2966,Bebida Láctea Performance Embalagem 1 Litro,4.98,4.98
2967,Leite em Pó Ninho Integral Forti+ Nestlé 380G,23.9,23.9
2968,Leite em Pó Integral Itambé Sachê 200G,12.49,12.49
2969,Leite em Pó Ninho Integral Fort+ Nestlé 750G,44.9,44.9
2970,Leite em Pó Integral Camponesa 800G,44.9,44.9
2971,Leite em Pó Integral Itambé 400G,18.99,18.99
2972,Composto Lácteo Forti+ Restritivo Zero Lactose Ninho Nestlé 380G,29.9,29.9
2973,Leite em Pó Instantâneo Itambé Integral Sachê 400G,19.9,19.9
2974,Leite em Pó Itambé Desnatado Instantâneo Pacote 200G,9.88,9.88
2975,Leite em Pó Camponesa Integral Embalagem 400G,21.9,21.9
2976,Leite em Pó Instantâneo Itambé Fortificado Integral 400G,21.9,21.9
2977,Leite em Pó Instantâneo Integral Itambé Sachê 200G,9.98,9.98
2978,Leite em Pó Instantâneo Integral Itambé Sachê 800G,44.9,44.9
2979,Leite em Pó Integral Itambé Fortificado 400G,21.9,21.9
2980,Leite em Pó Itambé Desnatado Embalagem 300G,19.9,19.9
2981,Leite em Pó Integral Itambé Sachê 800G,44.9,44.9
2982,Composto Lácteo com Maltodextrina Itambé Sachê 400G,14.99,14.99
2983,Leite sem Lactose Porto Alegre 1 Litro,7.49,7.49
2984,Leite sem Lactose Cemil Integral 1 Litro,5.99,5.99
2985,Leite sem Lactose Cemil Longa Vida Embalagem 1 Litro,5.99,5.99
2986,Leite sem Lactose Itambé Nolac Semidesnatado Caixa 1L,6.19,6.19
2987,Leite Uht Integral Camponesa Zero Lactose 1L,7.29,7.29
2988,Leite Desnatado Itambé Nolac Zero Lactose Caixa 1L,6.39,6.39
2989,Leite Uht Desnatado Camponesa Zero Lactose 1L,7.29,7.29
2990,Leite Habitus Uht Integral 1L,4.98,4.98
2991,Leite Integral Uht Longa Vida Uai 1L,5.49,5.49
2992,Leite Uht Integral Cemil 1L,5.39,5.39
2993,Leite Uht Integral Porto Alegre 1 Litro,6.39,6.39
2994,Leite Integral Longa Vida Quatá Caixa 1L,4.99,4.99
2995,Leite Semidesnatado Cemil Longa Vida 1L,5.39,5.39
2996,Leite Desnatado Cemil Embalagem 1 Litro,5.39,5.39
2997,Leite Uht Integral Camponesa Caixa 1L,5.45,5.45
2998,Leite Integral Itambé Caixa 1L,5.99,5.99
2999,Leite Uht Semidesnatado Camponesa Zero Lactose 1L,7.29,7.29
3000,Leite Uht Desnatado Porto Alegre 1 Litro,6.39,6.39
3001,Leite Integral sem Lactose Porto Alegre 1L,7.49,7.49
3002,Leite Longa Vida Uht Semidesnatado Itambé Caixa 1L,5.99,5.99
3003,Leite Desnatado Longa Vida Quatá Caixa 1L,4.99,4.99
3004,Leite Integral Itambé Nolac Zero Lactose Caixa 1L,6.19,6.19
3005,Leite Integral Longa Vida Itambé Natural Milk Caixa 1L,7.49,7.49
3006,Leite Uht Desnatado Camponesa 1L,5.45,5.45
3007,Leite Uht Semidesnatado Camponesa Embalagem 1L,5.45,5.45
3008,Leite Uht Itambé Desnatado Fit 1L,6.39,6.39
3009,Bala Butter Toffees Chocolate 100G,4.99,4.99
3010,Bala de Goma Frutas Sortidas Dori Gomets 32G,1.0,1.0
3011,Goma Gomets Ursinhos de Frutas Dor 100G,4.49,4.49
3012,Bala Dadinho Doce Embalagem 600G,9.9,9.9
3013,Goma Gelatina Dori Minhoca Ácida Embalagem 85G,4.49,4.49
3014,Trident Hortelã 8G com 5Un,2.5,2.5
3015,Bala Fini Gelatina Dentaduras Embalagem 90G,6.99,6.99
3016,"Goma de Mascar Trident Blueberry 30,6G",6.99,6.99
3017,Bala Halls Lyptus Menta 28G,1.5,1.5
3018,Bala Fini Tubes Morango Cítrico 80G,6.99,6.99
3019,Bala Halls Extra Forte Embalagem 28G,1.5,1.5
3020,Pirulito Pop Minions By Push 13G,1.0,1.0
3021,Bala Butter Toffees Mousse de Maracujá Pacote 100G,4.99,4.99
3022,Bala de Gelatina Minhoca Citrica Fini 90G,7.49,7.49
3023,Goma de Mascar Trident Fresh Intense 5 Unidades,2.5,2.5
3024,Bala Gelatinas Beijos Sabor Morango e Nata Fini 90G,7.49,7.49
3025,Goma Gomets Anel de Frutas Ácidas Dori 100G,4.49,4.49
3026,Goma de Mascar Trident Melancia Embalagem 8G,2.5,2.5
3027,Bala de Gelatina Ursinhos de Ouro Frutas do Mundo Haribo 80G,5.98,5.98
3028,Goma de Mascar Trident Tutti Frutti Embalagem 8G,2.5,2.5
3029,Bala Fini Gelatinas Aros Azedinhos Morango Embalagem 90G,7.49,7.49
3030,Bala Fini Gelatinas Amoras Embalagem 90G,7.49,7.49
3031,Goma Gelatina Boca Dori 85G,4.49,4.49
3032,Bala de Leite Butter Toffees 100G,4.99,4.99
3033,Bala Halls Melancia Embalagem 28G,1.5,1.5
3034,Goma de Mascar Herbal Trident X Fresh 8G 5Un,2.5,2.5
3035,Goma de Mascar Trident Morango Embalagem 8G,2.5,2.5
3036,Bala Gomets Creme e Frutas Embalagem 32G,1.0,1.0
3037,Bala Gelatina Melancia Haribo 80G,5.98,5.98
3038,Bala de Goma Frutas Ácidas Deliket Dori 100G,4.49,4.49
3039,Tic Tac Pastilhas Sabor Menta 16G,2.99,2.99
3040,Goma de Mascar Xfresh Intense Trident Envelope 8G,2.5,2.5
3041,Goma Gomets Pudim Creme e Frutas Dori Pacote 100G,4.49,4.49
3042,Goma de Mascar Menta sem Açúcar Trident 8G,2.5,2.5
3043,Goma Gelatina Dori Minhoca Embalagem 85G,4.49,4.49
3044,Pastilha Sabor Hortelã Fini 14G,1.35,1.35
3045,Bala Dori Regaliz Tubo Morango Embalagem 70G,4.49,4.49
3046,Haribo Bala de Gelatina Ursinhos de Ouro 100G,5.98,5.98
3047,Trident X Fresh Goma de Mascar Cereja Ice Trident 8G,2.5,2.5
3048,Bala Dori Regaliz Pescoço de Girafa Morango Embalagem 30G,1.99,1.99
3049,Bala Fini Super Gigante Tubes Regaliz Morango 27G,2.49,2.49
3050,Bala Dori Pescoço de Girafa Yogurte Embalagem 30G,1.99,1.99
3051,Goma de Gelatina Dori Urso 85G,4.49,4.49
3052,Bala Fini Tubes Twister Embalagem 80G,7.49,7.49
3053,Goma de Mascar Trident Xfresh Herbal 8G,2.5,2.5
3054,Goma Regaliz Tubo Yogurte Dori 70G,4.49,4.49
3055,"Goma de Mascar Menta Blueberry sem Açúcar Trident Max 16,5G",6.99,6.99
3056,"Goma de Mascar sem Açúcar Cool White Fresh Mentos 8,5G",1.99,1.99
3057,Tic Tac Pastilhas Sabor Laranja 16G,2.99,2.99
3058,Goma Dori Gelatina Amora 85G,4.49,4.49
3059,Pastilha sem Açúcar Mentos Kiss Xtreme Frozen Menta Forte 35G 50 Unidades,9.9,9.9
3060,Goma de Mascar Sabor Melancia Trident 14Un,6.49,6.49
3061,Haribo Bala de Gelatina Wummis 100G,5.98,5.98
3062,Chiclete Fini Ovos de Dinossauro Azedinhos Embalagem 80G,6.99,6.99
3063,Goma de Mascar Hortelã Fresca Zero Açúcar Trident Max 5Un,6.99,6.99
3064,Bala Dori Goma Recheado Morango Acido Tubo 70G,4.49,4.49
3065,Bala Fine Tubes Azedinhos Tutti Frutti Embalagem 80G,6.99,6.99
3066,Bala de Gelatina 7 Belo Framboesas 70G,3.49,3.49
3067,Bala Fini Ovos Fritos 90G,6.99,6.99
3068,Pastilha sem Açúcar Mentos Kiss Morango 35G 50 Unidades,9.9,9.9
3069,Goma Gelatina Dori Banana Embalagem 85G,4.49,4.49
3070,Goma Regaliz Flor Recheada Dori 85G,4.49,4.49
3071,Haribo Bala de Gelatina Dentinhos 100G,5.98,5.98
3072,Bala de Gelatina Sabor Morango com Creme 7 Belo 70G,3.49,3.49
3073,Bala Dori Regaliz Tubo Recheado Ácido Uva 70G,4.49,4.49
3074,Balla Sticks Morango Ácido Haribo 80G,5.98,5.98
3075,Haribo Bala de Gelatina Sweet Bananas 100G,5.98,5.98
3076,Balla Sticks Sabor Morango Haribo 80G,5.98,5.98
3077,Pastilha sem Açúcar Mentos Kiss Mint 35G,9.9,9.9
3078,Haribo Bala de Gelatina Wummis Zourr 100G,5.98,5.98
3079,Bala Anchieta Leite Malto Pacote 400G,8.99,8.99
3080,Haribo Bala de Gelatina Cream Kiss 100G,5.98,5.98
3081,Bala Ursinho Amora Haribo 90G,5.98,5.98
3082,Pirulito Blong Black Frutas Vermelhas com Recheio de Chiclete Peccin 672G com 24Un,16.99,16.99
3083,Bala de Gelatina Barbie Sabor Uva Haribo 80G,5.98,5.98
3084,Bala de Gelatina Frutas Barbie Haribo 80G,5.98,5.98
3085,Pirulito Blong Uva Embalagem 672G,16.99,16.99
3086,Bombom Especialidades Nestlé Caixa 251G,12.99,12.99
3087,Chocolate Bis Lacta 126G,6.99,6.99
3088,Chocolate Bis Laka 126G,6.99,6.99
3089,Bombom Garotices Sortidos Garoto 250G,11.99,11.99
3090,Chocolate em Pó Solúvel 50% Cacau Dois Frades Nestlé 200G,15.98,15.98
3091,Wafer Recheado Ouro Branco Mondelez 25G,2.49,2.49
3092,Chocolate Barra Neugebauer Meio Amargo 40% Cacau Embalagem 90G,5.89,5.89
3093,Chocolate Lacta Ao Leite 90G,6.99,6.99
3094,"Chocolate Ao Leite Kitkat 41,5G",4.49,4.49
3095,Chocolate Lacta Laka Oreo 90G,6.99,6.99
3096,Chocolate Alpino 90G,7.99,7.99
3097,Barra de Chocolate Preto e Branco Neugebauer 90G,5.89,5.89
3098,Chocolate Shot Lacta 90G,6.99,6.99
3099,Bites Duo Trento 40G,2.99,2.99
3100,Chocolate Barra Ao Leite Lacta 165G,11.99,11.99
3101,Chocolate Barra Neugebauer Amendoim Embalagem 90G,5.89,5.89
3102,Chocolate Lacta Branco Laka 90G,6.99,6.99
3103,Chocolate Barra Neugebauer Ao Leite Embalagem 90G,5.89,5.89
3104,Chocolate Kinder Bueno 39G White Embalagem 2 Uni,6.99,6.99
3105,Barra de Chocolate Hershey's Ao Leite 92G,5.99,5.99
3106,Chocolate Barra Neugebauer Flocos Embalagem 90G,5.89,5.89
3107,Bombom Sonho Valsa Lacta 20G,1.5,1.5
3108,Bombom Ouro Branco 20G,1.5,1.5
3109,"Ferrero Rocher 3Un 37,5G",7.99,7.99
3110,Chocolate Coloridos Disqueti Dori Embalagem 18G,1.79,1.79
3111,Chocolate Meio Amargo 40% Cacau Classic Nestlé 80G,7.49,7.49
3112,Chocolate Barra Neugebauer Branco com Cookies 90G,5.89,5.89
3113,Bombom Sonho de Valsa 20G,1.5,1.5
3114,Chocolate Lacta Diamante Negro Laka 90G,6.99,6.99
3115,Barra de Chocolate Caju Passas Garoto 80G,6.99,6.99
3116,Chocolate Hershey's Special Dark Aerado Barra 85G,8.99,8.99
3117,Barra B-Ready Wafer Recheado Nutella 22G,4.49,4.49
3118,Barra de Chocolate Hershey's Extra Cremoso 92G,7.99,7.99
3119,Chocolate Duo Trento 32G,2.99,2.99
3120,Chocolate Lacta Diamante Negro 90G,6.99,6.99
3121,Chocolate Nestlé Classic Meio Amargo 90G,7.99,7.99
3122,Chocolate Barra Hersheys Chocolate Branco Embalagem 92G,7.99,7.99
3123,"Chocolate em Pó Pink Embalagem 1,01Kg",31.9,31.9
3124,Chocolate Massimo Duo Trento 30G,2.99,2.99
3125,Kinder Joy 20G,8.99,8.99
3126,Ferrero Rocher com 8 Bombons 100G,25.9,25.9
3127,Chocolate Barra Neugebauer Branco Embalagem 90G,5.89,5.89
3128,Chocolate Massimo Nuts Trento 30G,2.99,2.99
3129,Chocolate Stikadinho Sticks Morango 32G,2.29,2.29
3130,Chocolate Bis Xtra Ao Leite Lacta 45G,2.98,2.98
3131,Barra Chocolate Branco Garoto 80G,6.99,6.99
3132,Chocolate Amaro Lacta 90G,6.99,6.99
3133,Chocolate Original Twix 40G,2.99,2.99
3134,Chocolate em Pó Predilecta 200G,6.49,6.49
3135,Chocolate Barra Diamante Negro Lacta 165G,11.99,11.99
3136,Disqueti de Chocolate Branco Dori 60G,5.49,5.49
3137,Chocolate Classic Duo Nestlé 80G,6.99,6.99
3138,Chocolate Batom Duo Branco Garoto 16G,1.59,1.59
3139,"Chocolate Ao Leite Recheio de Baunilha Tortuguita Arcor 15,5G",1.75,1.75
3140,Trento Bites Branco-Dark,2.99,2.99
3141,Chocolate Baton Ao Leite 16G,1.59,1.59
3142,Chocolate Disqueti Dori Chocolate Branco Embalagem 40G,2.49,2.49
3143,Chocolate Trento Branco Dark 32G,2.99,2.99
3144,Chocolate Baton Branco 16G,1.59,1.59
3145,Chocolate Trento Bites Torta de Limão 40G,2.99,2.99
3146,Chocolate Lacta Shot 165G,11.99,11.99
3147,Chocolate Branco Trento Massimo com Cookies 30G,2.99,2.99
3148,Chocolate Wafer Trento Speci Branco Avelã Peccin 26G,3.49,3.49
3149,Caixa de Bombom Favoritos Lacta 250G,13.99,13.99
3150,Chocolate Prestígio Dark Nestlé 33G,1.99,1.99
3151,Chocolate Trento Mousse de Maracujá 32G,2.99,2.99
3152,Chocolate Garoto Baton Recheada com Morango 16G,1.59,1.59
3153,Chocolate Bibs Sticks Mousse de Limão 32G,2.29,2.29
3154,Chocolate Disqueti Ao Leite Dori Pacote 40G,2.49,2.49
3155,Chocolate Trento Torta de Limão 32G,2.99,2.99
3156,Chocolate Ao Leite com Castanha-De-Caju Garoto 80G,6.99,6.99
3157,Chocolate Laka Lacta 165G,11.99,11.99
3158,Chocolate Trento Creme 32G,2.99,2.99
3159,Chocolate Garoto Ao Leite 90G,6.98,6.98
3160,Chocolate Tortuguita Chocovinhos com Recheio de Chocolate 50G,3.99,3.99
3161,Chocolate Neugebauer Bib's Branco Sticks 32G,2.29,2.29
3162,Chocolate Disqueti Dori Amendoim Embalagem 80G,5.99,5.99
3163,Chocolate Trento Massimo Paçoca 30G,2.99,2.99
3164,Chocolate Ao Leite com Recheio Oreo Lacta 90G,6.99,6.99
3165,Chocolate Lacta Amaro Mix Castanha 90G,6.99,6.99
3166,Confeito de Chocolate Ao Leite M&Ms 45G,3.99,3.99
3167,Chocolate Chokito 32G,1.95,1.95
3168,Chocolate com Wafer Torta de Maçã Trento 32G,2.99,2.99
3169,Chocolate Bis Xtra Black Lacta 45G,2.98,2.98
3170,Chocolate Trento Allegro! Choco Amendoim 35G,2.99,2.99
3171,Chocolate Trento Cheesecake de Morango 32G,2.99,2.99
3172,Confeito Disqueti Ovinhos de Chocolate Dori Embalagem 90 G,9.98,9.98
3173,Confeito de Chocolate Ao Leite M&Ms Tubo 30G,3.99,3.99
3174,Kinder Ovo Rosa 20G,8.99,8.99
3175,Confeito M&Ms Chocolate Crispy 35G,3.99,3.99
3176,Chocolate em Barra Laka Lacta 20G,2.5,2.5
3177,Chocolate com Morango Trento 32G,2.99,2.99
3178,Chocolate Garoto Baton Creme Ao Leite 16G,1.59,1.59
3179,Chocolate Bibs Sticks Ao Leite 32G,2.29,2.29
3180,Chocolate Lacta Diamante Negro 20G,2.5,2.5
3181,Chocolate Trento Allegro Choco Branco Amendoim 35G,2.99,2.99
3182,Chocolate Lacta Laka Oreo 20G,2.5,2.5
3183,Chocolate Bibs Sticks Dark 32G,2.29,2.29
3184,Confeito de Chocolate Ao Leite com Amendoim M&Ms 45G,3.99,3.99
3185,Chocolate Branco Lacta com Biscoito Oreo Tamanho Família Laka 165G,11.99,11.99
3186,Kinder Ovo Azul 1 Unidade 20G,8.99,8.99
3187,Chocolate Barra Linea Ao Leite Zero Lactose Embalagem 30G,9.98,9.98
3188,Chocolate Barra Ao Leite Aymoré 80G,5.49,5.49
