,Produto,Preço Base,Preço Final
947,Removedor À Base de Acetona Ideal Embalagem 100Ml,3.59,3.59
948,Tenys Pé Woman Baruel 100G,10.99,10.99
949,Removedor de Esmalte sem Acetona Farmax 100Ml,5.15,5.15
950,Desodorante em Pó para Os Pés Tenys Pé Baruel Canforado Embalagem 100G,10.99,10.99
951,Esmalte Risqué Cremoso Escarlate Blister 8Ml,5.29,5.29
952,Esmalte Risqué Branco Cremoso Paris 8Ml,5.29,5.29
953,Lixa de Unha 1Un,0.2,0.2
954,Esmalte Risqué Paris Cremoso Embalagem 8Ml,5.29,5.29
955,Amendoim Pachá Embalagem 500G,14.2,14.2
956,Amendoim Japonês Yoki Pacote 500G,14.25,14.25
957,Amendoim Crocante Sabor Cebola e Salsa Pettiz Dori 120G,5.49,5.49
958,Amendoim Japonês Elma Chips 145G,8.2,8.2
959,Amendoim Tabasco Pettiz 110G,6.75,6.75
960,Amendoim Confeitado Dori 70G,3.2,3.2
961,Amendoim Dori Chocolate Pacote 70G,3.2,3.2
962,Amendoim Frito e Salgado sem Pele Elma Chips 100G,8.25,8.25
963,Rosquinhas de Coco Panco 500G,6.09,4.99
964,Biscoito Rosquinha Coco Mabel Pacote 700G,12.15,12.15
965,Biscoito Recheado de Chocolate Passatempo 130G,3.2,3.2
966,Biscoito Wafer Bauducco Chocolate Pacote 140G,3.99,3.99
967,Choco Biscuit Ao Leite Bauducco 80G,7.49,7.49
968,Biscoito Wafer de Chocolate Visconti 120G,2.89,2.68
969,Biscoito Passatempo Leite Nestlé 150G,3.2,3.2
970,Aymoré Biscoito Recheado Chocolate 120G,2.65,2.65
971,Biscoito Doce Rosquinha de Chocolate Panco 500G,6.09,4.99
972,Biscoito Aymoré Tortini Chocolate 90G,2.25,2.25
973,Biscoito Doce Vilma Maizena Embalagem 360G,5.29,5.29
974,Biscoito Doce Recheado - Trakinas Chocolate Embalagem 126G,3.15,3.15
975,Biscoito Wafer Visconti Morango Pacote 120G,2.89,2.68
976,Biscoito Doce Maizena Aymoré 375G,6.1,6.1
977,Aymoré Biscoito Recheado Brigadeiro 120G,2.65,2.65
978,Biscoito Rosquinha Coco Mabel Pacote 350G,6.99,6.99
979,Cookies Bauducco Maxi Chocolate 96G,5.2,5.2
980,Biscoito Doce Mabel Rosquinha de Coco Pacote 800G,12.15,12.15
981,Biscoito Amanteigado Sabor Coco Aymoré 248G,5.65,5.65
982,Biscoito Doce Aymoré Maizena 200G,3.1,3.1
983,Biscoito Doce Recheado Panco Golden Black Baunilha Pacote 140G,2.35,2.35
984,Biscoito Doce Recheado Duplo Chocolate Bauducco 140G,2.69,2.69
985,Biscoito Rosquinha Leite Mabel Pacote 700G,12.15,12.15
986,Pão de Mel com Cobertura Sabor Chocolate Panco 200G,8.35,8.35
987,Biscoito Wafer Montevergine Tub-In Recheado de Chocolate Pacote 48G,2.35,2.35
988,Biscoito Wafer Maxi Chocolate Bauducco 117G,3.99,3.99
989,Aymoré Biscoito Recheado Morango 120G,2.65,2.65
990,Biscoito Recheado Baunilha Gulosos Bauducco 140G,2.69,2.69
991,Biscoito Choker Cobertura Chocolate 95G,4.39,4.39
992,Biscoito Wafer Stick Look Chocolate Pacote 55G,2.99,2.99
993,Biscoito Doce Recheado Panco Golden Black Mousse de Morango 140G,2.35,2.35
994,Biscoito Recheado Danix Chocolate 130G,2.89,2.89
995,Biscoito Rechedo Golden Black Baunilha 42G,0.79,0.79
996,Cookie Gotas de Baunilha Negresco 60G,2.89,2.89
997,Biscoito Doce Recheado Sabor Trufado Panco Pacote 140G,2.35,2.35
998,Cookie Classic Gotas de Chocolate Nestlé 60G,2.89,2.89
999,Biscoito Recheado Renata Divertix Chocolate 112G,1.85,1.69
1000,Biscoito Doce Aymoré Coco 200G,4.29,4.29
1001,Biscoito Rosquinha Coco Aymoré 350G,6.59,6.59
1002,Biscoito Waffer Chocolate com Avelã Aymoré 105G,3.39,3.39
1003,Biscoito Doce Recheado Morango Visconti Pacote 125G,2.25,2.25
1004,Cookie Bauducco Chocolate Pacote 110G,5.2,5.2
1005,"Cookies Wickbold 100% Integral Cacau, Avelã e Castanha do Pará Embalagem 60G",4.15,4.15
1006,Biscoito Doce Bauducco Maizena Embalagem 170G,2.99,2.99
1007,Rosquinhas de Baunilha Panco Pacote 500G,6.09,4.99
1008,Biscoito Doce Recheado Bauducco Moran 140G,2.69,2.69
1009,Biscoito Wafer Montevergine Tub In Napolitano 48G,2.35,2.35
1010,Biscoito Panco Recheado Chocolate Pacote 140G,2.35,2.35
1011,Biscoito Wafer Passion Chocolate 80G,3.05,3.05
1012,Pão de Mel Bauducco Chocolate 240Gr,8.99,8.99
1013,Biscoito Recheado com Leite Passatempo 130G,3.2,3.2
1014,Biscoito Recheado Original Oreo 90G,3.85,3.85
1015,Biscoito Recheado de Morango com Leite Sucrilhos Kellogg's 110G,2.4,2.4
1016,Biscoito Doce Panco Maria Pacote 200G,3.85,3.85
1017,Danix Biscoito Recheado Morango 130G,2.89,2.89
1018,Danix Biscoito Recheado Choco Choco 130G,2.89,2.89
1019,Pão de Mel Barion Chocolate 90G,3.75,3.75
1020,Biscoito Doce Recheado Chocolate Bauducco 140G,2.69,2.69
1021,Biscoito Tub-In Montevergine Avelã Pacote 54G,2.35,2.35
1022,Biscoito Integral Cereal Mix Banana e Canela Aymoré 135G,3.49,3.49
1023,Rosquinhas de Milho Verde Panco 500G,6.09,4.99
1024,Biscoito Doce Recheado Itamaraty Atrevidos Brigadeiro Embalagem 90G,2.29,2.29
1025,Biscoito Cookie Chocolate com Gotas de Chocolate Bauducco 100G,5.2,5.2
1026,Recheadinho Bauducco Chocolate 104G,3.5,3.5
1027,Biscoito Wafer Panco Chocolate Pacote 140G,3.05,3.05
1028,Biscoito Recheado Chocolate Galak Passatempo 96G,3.2,3.2
1029,Biscoito Coberto Chocolate Ao Leite Nestlé 80G,7.49,7.49
1030,Biscoito Integral Cereale Cacau e Castanhas Bauducco 170G,4.1,4.1
1031,Biscoito Maria Aymoré 185G,3.1,3.1
1032,Biscoito Wafer Panco Limão Pacote 140G,3.05,3.05
1033,Biscoito Cereal Mix de Aveia e Mel Aymoré 135G,3.49,3.49
1034,Biscoito Wafer Panco Golden Black Chocolate Suíço Pacote 140G,3.05,3.05
1035,Biscoito Recheado Chocolate Baton Passatempo 96G,3.2,3.2
1036,Biscoito Recheado Tub In Morango Montevergine Embalagem 48G,2.35,2.35
1037,Biscoito Doce Mabel Rosquinha de Leite Pacote 800G,12.15,12.15
1038,Biscoito Doce Tica Sortido Pacote 500G,5.65,5.65
1039,Biscoito de Chocolate Eclipse Negresco Nestlé 100G,3.19,3.19
1040,Palito Brigadeiro Cory Embalagem 90G,3.05,3.05
1041,Biscoito Wafer Recheado de Trufas Tub-In Montevergine 54G,2.35,2.35
1042,Biscoito Fininho Recheio de Limão Siciliano Bono 57G,1.99,1.99
1043,Biscoito Wafer Panco Morango Pacote 140G,3.05,3.05
1044,Biscoito Recheado de Morango Vilma 120G,2.45,2.45
1045,Danix Biscoito Recheado Choco Shake 130G,2.89,2.89
1046,Biscoito Doce Recheado Morango Panco 140G,2.35,2.35
1047,Biscoito Doce Recheado Marilan Teens Chocolate Branco 80G,4.55,4.55
1048,Biscoito Recheado com Coco Bono 100G,3.35,3.35
1049,Biscoito Wafer Passion Chocolate Branco com Limão 80G,3.05,3.05
1050,Biscoito Divertix Recheio Brigadeiro Renata 112G,1.85,1.85
1051,Biscoito Passatempo Maisena Nestlé 170G,3.89,3.89
1052,Biscoito Maizena Marilan 170G,3.69,3.69
1053,Biscoito Wafer Panco Golden Black Baunilha Pacote 140G,3.05,3.05
1054,Biscoito Wafer Panco Abacaxi com Coco Pacote 140G,3.05,3.05
1055,Biscoito Doce Recheado Brigadeiro - Montervergine Embalagem 48G,2.35,2.35
1056,Biscoito Waffer Sabor Morango Aymoré 105G,3.39,3.39
1057,Biscoito Cookies Vilma Chocolate 60G,2.05,2.05
1058,Cookie Gotas de Chocolate Nescau 60G,2.89,2.89
1059,Biscoito Maizena Sabor Chocolate Panco 200G,3.85,3.85
1060,Biscoito Recheado Sabor Chocolate Oreo 90G,3.85,3.85
1061,Biscoito Doce Panco Coco Pacote 200G,3.85,3.85
1062,Biscoito Cream Cracker Marilan 170G,4.2,4.2
1063,Biscoito Doce Recheado Vilma Chocolate Embalagem 120G,2.45,2.45
1064,Alfajor Chocolate Doce Leite 50G,3.69,3.69
1065,Biscoito Rosquinha Mabel Banana e Canela 400G,6.99,6.99
1066,Biscoito Rosquinha de Leite Aymoré 350G,6.59,6.59
1067,Biscoito de Maizena Duo Aymoré 164G,3.1,3.1
1068,Biscoito Wafer Morango Vilma Pacote 115G,2.89,2.89
1069,Rosquinha de Coco Vilma 700G,9.55,9.55
1070,Biscoito de Maizena Aymoré 170G,3.09,3.09
1071,Biscoito Doce Recheado Vilma Morango Embalagem 115G,2.45,2.45
1072,Biscoito Recheado de Chocolate Vilma 115G,2.45,2.45
1073,Biscoito Aymoré Salpet Tradicional 200G,3.49,3.49
1074,Biscoito Salgado Vilma Cream Cracker Embalagem 360G,5.29,5.29
1075,Biscoito Club Social Regular Original Multipack 144G,4.99,4.99
1076,Biscoito de Polvilho Nazinha Tradicional Pacote 100G,5.09,5.09
1077,Biscoito Cream Cracker Aymoré 164G,3.1,3.1
1078,Biscoito Salgado Panco Palitos Pacote 500G,8.89,8.89
1079,Biscoito de Água e Sal Aymoré 164G,3.09,3.09
1080,Biscoito de Polvilho Nazinha Queijo 100G,5.09,5.09
1081,Biscoito Aymoré Cream Cracker 375G,6.29,6.29
1082,Biscoito Pit Stop Recheado Misto Quente 105G,5.45,5.45
1083,Biscoito Pit Stop Pão Na Chapa 162G,5.2,5.2
1084,Biscoito Queijo Club Social 6 Unidades 141G,4.99,4.99
1085,Biscoito Club Social Recheado Requeijão Multipack 106G,4.89,4.89
1086,Biscoito Club Social Regular Presunto Multipack 141G,4.99,4.99
1087,Biscoito Salgado Vilma Cream Cracker Embalagem 200G,2.95,2.95
1088,Biscoito Salgado Cracker Gergelim Panco 200G,4.09,4.09
1089,Biscoito Cracker Sabor Manteiga Aymoré 164G,4.45,4.45
1090,Biscoito Cebola com Sour Cream Club Social 141G 6Un,4.99,4.99
1091,Biscoito Salgado Panco Cracker Manteiga Pacote 200G,4.09,4.09
1092,Biscoito de Polvilho Vovô Clara Tradicional Embalagem 150G,5.65,5.65
1093,Biscoito Polvilho Moedense com Queijo 350G,10.6,10.6
1094,Biscoito Estouradinho de Queijo Moedense 300G,10.6,10.6
1095,Salgadinho Onda Requeijão Elma Cheetos 45G,2.99,2.99
1096,Batata Palha Tradicional Croques 100G,4.1,4.1
1097,Fandangos Presunto Elma Chips 37G,2.49,2.49
1098,Salginho Cebolitos Elma Chips 31G,2.99,2.99
1099,Doritos Queijo Nacho Elma Chips 53G,4.99,4.99
1100,Salgadinho de Batata Original Pringles 114G,14.99,14.99
1101,Salgadinho de Lua Parmesão Cheetos 40G,2.99,2.99
1102,Batata Palha Extra Fina 90G,5.85,5.85
1103,Salgadinho de Trigo Bacon Torcida Jr. 45G,1.99,1.99
1104,Batata Ruffles Original 40G,3.99,3.99
1105,Batata Palha Tradicional Elma Chips 110G,5.85,5.85
1106,Salgadinho Sabor Churrasco Torcida Jr 38G,1.99,1.99
1107,Batata Palha Extra Fina Croques 120G,5.15,5.15
1108,Salgadinho Sabor Presunto Fandangos 115G,11.99,11.99
1109,Fandangos Espiga Queijo 37G,2.49,2.49
1110,Batata Palha Vare Tradicional 300G,10.2,10.2
1111,Salgadinho Fandangos Queijo 44G,2.49,2.49
1112,Salgadinho Onda Requeijão Cheetos 122G,11.99,11.99
1113,Salgadinho de Milho Queijo Nacho Doritos 140G,13.99,13.99
1114,Salgadinho de Milho Doritos® Queijo Nacho 84G,8.99,8.99
1115,Salgadinho Batata Ruffles Churrasco Elma Chips 40G,3.99,3.99
1116,Palitinho de Trigo Salgado Stiksy Elma Chips 120G,6.99,6.99
1117,Batata de Creme e Cebola Pringles 120G,14.99,14.99
1118,Pururuca Pacha Listrada Embalagem 400G,6.45,6.45
1119,Fandangos Queijo 37G,2.49,2.49
1120,Snack Panetini Presunto Defumado Eqlibri 40G,3.99,3.99
1121,Pipoca Doce Plinc Embalagem 100G,2.85,2.85
1122,Salgadinho de Trigo Cebola Torcida Jr. 45G,1.99,1.99
1123,Salgadinho Lin Pimenta 150G,4.89,4.89
1124,Salgadinho Sweet Chili Doritos 53G,4.99,4.99
1125,Batata Ruffles Cebola e Salsa Elma Chips 40G,3.99,3.99
1126,Salgadinho de Milho Onda Requeijão Elma Chips Cheetos 75G,5.99,5.99
1127,Salgadinho de Milho Fandangos Sabor Presunto 80G,5.99,5.99
1128,Salgadinho de Trigo Queijo Torcida Jr. 45G,1.99,1.99
1129,Salgadinho de Trigo Churrasco Torcida 100G,4.65,4.65
1130,Torresmo Pronto Torresminas Embalagem 80G,6.49,6.49
1131,Salgadinho Panco Bisnack Churrasco Pacote 80G,2.05,2.05
1132,Salgadinho de Trigo Pimenta Mexicana Torcida 100G,4.65,4.65
1133,Salgadinho de Milho Cebola Elma Chips Cebolitos 110G,11.99,11.99
1134,Batata Frita Lisa Clássica Lay's 45G,4.99,4.99
1135,Salgadinho Lua Parmesão Cheetos Elma Chips110g,11.99,11.99
1136,Salgadinho Sabor Baconzitos Elma Chips 31G,2.99,2.99
1137,Batata Frita Lisa Clássica Lays 45G,4.99,4.99
1138,Salgadinho de Trigo Bacon Elma Chips Pingo Douro 120G,6.99,6.99
1139,Batata Ruffles Elma Chips Original 92G,8.99,8.99
1140,Salgadinho Panco Bisnack Cebola Pacote 80G,2.05,2.05
1141,Batata Frita Lisa Creme de Cebola Lays 80G,8.99,8.99
1142,Salgadinhos Panco Bacon Embalagem 80G,2.05,2.05
1143,Salgadinho Bisnack Sabor Pizza Panco 80G,2.05,2.05
1144,Batata Sabor Queijo Ruffles 40G,3.99,3.99
1145,Salgadinho Bisnack Salaminho Panco 80G,2.05,2.05
1146,Batata Frita Ruffles Churrasco 92G,8.99,8.99
1147,Batata Ruffles Original 145G,13.99,13.99
1148,Bisnack Panco Sabor Galeto 80G,2.05,2.05
1149,Salgadinho Bisnack Pimenta Mexicana Panco 80G,2.05,2.05
1150,Salgadinho Pão de Alho Bisnack Panco 80G,2.05,2.05
1151,Salgadinho de Milho Sortido Mix de Queijo Elma Chips Cheetos 115G.,7.89,7.89
1152,Salgadinho Lin Bacon 150G,4.95,4.95
1153,Batata Ruffles Churrasco 96G,8.99,8.99
1154,Batata Frita Lay's Creme de Cebola Elma Chips 45G,4.99,4.99
1155,Batata Chips Quero Mais 100G,5.4,5.4
1156,Torresmo Sabor Quero Mais 80 G,6.09,6.09
1157,Salgadinho Gulão Queijo 100G,3.65,3.65
1158,Salgadinho Gulão Presunto 100G,3.65,3.65
1159,Salgadinho Gulão Bacon 100G,3.65,3.65
1160,Salgadinho Sabor Churrasco Gulão 100G,3.65,3.65
1161,Bananas Fritas Puro Sabor 90G,3.75,3.75
1162,Salgadinho de Milho Assado Sabor Requeijão Rupper's 100G,2.45,2.45
1163,Torresmo Semi-Pronto 200G,8.5,8.5
1164,Salgadinho Buen Apetit Bacon Embalagem 70G,3.59,3.59
1165,Batata Ondulada Ruppers Salsa e Cebola 90G,5.1,5.1
1166,Batata Ondulada Ruppers Tradicional 90G,5.1,5.1
1167,Pururuca Ruppers Bacon 70G,2.45,2.45
1168,Refresco em Pó Sabor Laranja Fresh 15G,1.25,1.25
1169,Presunto Pif Paf,25.89,25.89
1170,Presunto Perdigão,25.9,25.9
1171,Presunto Sadia,29.99,29.99
1172,Presunto Fatiado Seara 180G,8.59,8.59
1173,Mortadela Defumada Sadia Fatiada,21.15,21.15
1174,Mortadela Defumada Fatiada Seara Gourmet 180G,6.2,6.2
1175,Salame Italiano Gourmet Fatiado Seara 100G,9.15,9.15
1176,Banha Suína Sadia 500G,9.75,9.75
1177,Apresuntado Cozido Premiada Kg,19.98,19.98
1178,Mortadela Defumada Perdigão Kg,25.85,25.85
1179,Margarina Cremosa com Sal Qmix Qualy 500G,10.55,10.55
1180,Margarina Cremosa com Sal Doriana 500G,8.99,7.99
1181,Manteiga Suacui 200G,10.15,10.15
1182,Requeijão Cremoso Porto Alegre 400G,15.25,15.25
1183,Margarina com Sal Claybom 500G,7.39,7.39
1184,Manteiga com Sal Porto Alegre 500G,26.99,26.99
1185,Manteiga Cotochés com Sal Embalagem 200G,11.85,11.85
1186,Manteiga de Primeira Qualidade com Sal Itambé 200G,11.55,11.55
1187,Requeijão Poços de Caldas Tradicional Copo 200G,8.59,8.59
1188,Manteiga Porto Alegre com Sal Pote 200G,10.95,10.95
1189,Requeijão Cremoso Lightporto Alegre 400G,15.25,15.25
1190,Manteiga com Sal Itambé Primeira Qualidade Pote 500G,27.95,27.95
1191,Margarina com Sal Qualy 250G,5.65,5.65
1192,Requeijão Cremoso Itambé Tradicional Pote 420G,17.45,17.45
1193,Requeijão Cremoso Itambé Copo 220G,10.49,10.49
1194,Requeijão Poços de Caldas Light Copo 200G,9.49,9.49
1195,Cream Cheese Tradicional Itambé Embalagem 150G,6.98,6.98
1196,Requeijão Cremoso Itambé Ervas Finas Copo 250G,11.55,11.55
1197,Requeijão Cremoso Porto Alegre Copo 200G,8.59,8.59
1198,Requeijão com Queijo Cremoso Cotoches 400G,15.95,15.95
1199,Requeijão Cremoso Light Itambé 220G,11.55,11.55
1200,Margarina Qualy Cremosa com Sal Pote 250G,5.65,5.65
1201,Margarina Claybom Sabor Manteiga com Sal 250G,4.59,4.59
1202,Requeijão Trevinho Tradicional 200G,8.65,8.65
1203,Requeijao Carmolac Cremoso 400G,15.55,15.55
1204,Manteiga Saldanha com Sal Embalagem 500G,20.15,20.15
1205,Requeijão Cremoso Porto Alegre Embalagem 220G,8.59,8.59
1206,Creme de Ricota Tradicional Itambé 200G,7.59,7.59
1207,Massa para Pastel Joselito Média Embalagem 500G,9.29,9.29
1208,Massa Fresca de Pastel Médio Nutritex 500G,6.75,6.75
1209,Massa Fresca para Pastel Nutritex Grande Embalagem 500G,6.75,6.75
1210,Massa Fresca para Lasanha Nutritex Embalagem 500G,6.98,6.98
1211,Queijo Mussarela,39.49,39.49
1212,Queijo Mussarela Fatiado Itambé 150G,9.45,9.45
1213,Queijo Parmesão Ralado President 50G,5.35,4.98
1214,Queijo Mussarela Fatiado President 150G,9.05,9.05
1215,Queijo Prato Itambé Fatiado 150G,9.45,9.45
1216,Queijo Parmesão Ralado Itambé 50G,5.2,5.2
1217,Queijo Tipo Cottage 200Gr,8.1,8.1
1218,Condimento Tomilho Sabor 10G,2.29,2.29
1219,Queijo Parmesão Ralado Itambé 100G,9.95,9.95
1220,Queijo Minas Padrão Suacui Kg,69.99,69.99
1221,Queijo Porto Alegre Meia Cura Kg,62.5,62.5
1222,Queijo Minas Serro Kg,45.77,45.77
1223,Sardinha Coqueiro com Óleo 125G,6.45,6.45
1224,Sardinha Coqueiro em Óleo de Soja 125G,6.45,6.45
1225,Sardinhas com Óleo Gomes da Costa 125G,6.25,6.25
1226,Sardinha Coqueiro com Tomate Embalagem 125G,6.45,6.45
1227,Sardinha Coqueiro com Molho de Tomate Lata 125G,6.45,6.45
1228,Sardinhas com Molho de Tomate Gomes da Costa 125G,6.25,6.25
1229,Atum Sólido Ao Natural Gomes da Costa 170G,11.75,11.75
1230,Atum em Pedaços Ao Natural Gomes da Costa 170G,10.79,10.79
1231,Feijoada Anglo a Brasileira Lata 310G,8.45,8.45
1232,Atum Ralado Ao Molho de Tomate Gomes da Costa 170G,6.45,6.45
1233,Atum Ralado Ao Molho de Tomate Picante Gomes da Costa 170G,7.1,7.1
1234,Atum Sólido em Óleo Gomes da Costa 170G,10.49,10.49
1235,Milho Verde Conserva Fugini Sachê 170G,3.35,3.35
1236,Milho Stella D'oro 280G,3.2,2.79
1237,Ervilha Fugini Sachê 170G,2.49,2.49
1238,Milho Knorr 170G,4.75,4.75
1239,Dueto Milho e Ervilha Sachê Fugini 170G,3.35,2.99
1240,Azeitona Verde Vale Fértil sem Caroço Sachê 120G,6.35,6.35
1241,Azeitona Verde Vale Fértil Fatiada Sachê 120G,6.35,6.35
1242,Seleta de Legumes Fugini 170G,4.45,4.45
1243,Pimenta Malagueta Pirata Vermelha em Conserva Pet 30G,5.79,5.79
1244,Azeitona La Violetera Fatiada 160G,9.79,9.79
1245,Azeitona Verde S/Caroco Violetera 160G,7.99,7.99
1246,Cogumelo Fatiado Vale Fértil Sachet 100G,6.35,6.35
1247,Azeitonas Verdes Tozzi Fatiada 80G,3.59,3.59
1248,Azeitona Verde Vale Fértil Sachê 100G,3.15,3.15
1249,Azeitona Verde La Violetera Fatiada Sachê 160G,7.29,7.29
1250,Azeitona Verde Vale Fértil sem Caroço Vidro 160G,9.45,9.45
1251,Azeitona Verde La Violetera Vidro 500G,14.75,12.99
1252,Palmito Braspalm Vidro 300G,18.65,18.65
1253,Dueto Fugini Ao Vapor Lata 170G,3.95,3.95
1254,Azeitona Verde Vale Fértil Sachê 150G,5.55,5.55
1255,Azeitona Preta Vale Fértil Fatiada Sachê 120G,6.3,6.3
1256,Azeitona Verde Vale Fértil Fatiada Vidro 160G,8.89,6.99
1257,Pimenta Malagueta Macerada Imperial 145Ml,5.29,5.29
1258,Cogumelos D Casa Pre Cozido 120G,9.1,9.1
1259,Pimenta Malagueta Alheiro 30G,6.55,6.55
1260,Cogumelo em Conserva Dcasa Embalagem 200G,14.49,14.49
1261,Palmito Pupunha Amo Picado Vidro 300G,11.09,11.09
1262,Pimenta Biquinho Pirata Embalagem 160G,9.39,9.39
1263,Azeitona Fontini Embalagem 500G,13.49,13.49
1264,Ketchup Hellmann's Tradicional 380G,9.45,9.45
1265,Catchup Colonial Tradicional Embalagem 400G,5.35,5.35
1266,Maionese Fugini Sachê 200G,1.85,1.85
1267,Ketchup Tradicional Arisco 370G,6.35,6.35
1268,Maionese Light Hellmann's 250G,6.59,6.59
1269,Molho de Madeira Predilecta 300G,3.75,3.75
1270,Molho de Três Queijos Predilecta 240G,6.05,6.05
1271,Catchup Anchieta Picante 400G,5.8,5.8
1272,Molho para Carne Pirata Embalagem 150Ml,3.79,3.79
1273,Molho Inglês Pirata Embalagem 150Ml,3.79,3.79
1274,Molho Alho Alheiro 200Ml,3.15,3.15
1275,Ketchup Heinz Bacon & Cebola Caramelizada 397G,14.59,14.59
1276,Molho de Alho com Pimenta Alheiro 200Ml,3.15,3.15
1277,Molho Carne Alheiro Pet 200Ml,3.15,3.15
1278,Molho de Pimenta Pirata Picante Pet 150Ml,5.55,5.55
1279,Molho para Carne Pirata 150Ml,3.79,3.79
1280,Molho Barbecue Sabor Embalagem 215G,5.49,5.49
1281,Molho de Pimenta Biquinho Sabor 150Ml,5.89,5.89
1282,Maionese Clássica Predilecta Bisnagada 915G,11.75,9.99
1283,Imperial Extrato de Pimenta 58Ml,5.29,5.29
1284,Molho Inglês Pirata Embalagem 150Ml,3.79,3.79
1285,Molho de Pimenta Biquinho Sabor com Pimenta Vermelha 150Ml,5.89,5.89
1286,Molho de Tomate Fugini Tradicional Sachê 300G,1.69,1.39
1287,Extrato Elefante Tomate 310G,6.15,6.15
1288,Molho de Tomate com Pedaços Tradicional Heinz 300G,2.79,2.79
1289,Molho de Tomate Tradicional Pomarola 300G,2.69,2.69
1290,Molho de Tomate Tradicional Pomarola 320G,2.55,2.55
1291,Molho de Tomate Tradicional Stella D'oro 300G,1.49,1.49
1292,Molho de Tomate Sacciali Passata Rústica 300G,2.3,2.3
1293,Molho de Tomate Mastroiani Passata Di Pomodori Garrafa 420G,15.15,13.99
1294,Extrato de Tomate Colonial Lata 350G,3.49,3.49
1295,Passata Pomodori Mastroiani Embalagem 680G,18.45,18.45
1296,Molho de Tomate Arrabiata Heinz Sachê 340G,3.89,3.89
1297,Molho de Tomate Pomarola Bolonhesa Sachê 300G,3.99,3.99
1298,Molho de Tomate Pomarola Pizza Sachê 300G,3.25,3.25
1299,Extrato Tomate Predilecta 300G,3.05,3.05
1300,Creme de Cebola Maggi 68G,4.8,4.8
1301,Sopa Maggi Cebola 63G,4.05,4.05
1302,Creme de Cebola com Bacon Maggi Sachê 61G,4.79,4.79
1303,Sopa Vono Peito de Frango com Queijo 17G,2.59,2.59
1304,Creme de Milho Pacha Embalagem 500G,3.05,3.05
1305,Tempero para Carnes Sazón Pacote 60G,5.09,5.09
1306,Caldo de Galinha Knorr 57G,1.89,1.89
1307,Bicarbonato de Sódio Pirata Embalagem 80G,2.29,2.29
1308,Tempero Meu Segredo Maggi 7 Vegetais 49G,3.59,3.59
1309,Temp Sazon 60G Legumes,5.09,5.09
1310,Tempero Pronto Pirata Alho Sal Pote 500G,6.15,6.15
1311,Tempero Sazón Nordeste 60G,5.09,5.09
1312,Caldo Maggi Picanha Tablete 57G,1.59,1.59
1313,Tempero para Feijão Sazón 60G,5.09,5.09
1314,Caldo de Carne Knorr 57G,1.89,1.89
1315,Tempero Sazón Massas 60G,5.09,5.09
1316,Caldo de Legumes Maggi Tablete 57G,1.59,1.59
1317,Alho Massa Alho Cheiroso 500G,8.05,8.05
1318,Tempero Sazón Frango 60G,5.09,5.09
1319,Tempero Pronto Pirata Alho Sal 300G,3.75,3.75
1320,Tempero Kitano Mais Sabor 60G. Aves,3.35,3.35
1321,Tempero Sazón Alho 60G,5.09,5.09
1322,Tempero Completo Pirata sem Pimenta Pote 500G,6.15,6.15
1323,Tempero Sazón Toque de Limão 60G,5.09,5.09
1324,Caldo de Picanha Maggi Tablete 57G,1.59,1.59
1325,Tempero Pronto Kitano Mais Sabor Feijão Sachê 60G,3.35,3.35
1326,Tempero Alho e Cebola Meu Assado Knorr 25G,6.25,4.69
1327,Caldo de Carne Maggi Tablete 57G,1.59,1.59
1328,Tempero Completo Pirata com Pimenta Embalagem 300G,3.75,3.75
1329,Tempero Sazón Arroz 60G,5.09,5.09
1330,"Cebola, Alho e Salsa Sabor 20G",3.35,3.35
1331,Tempero Arisco Carnes 50G,3.29,3.29
1332,Alho Flocos Desidratado Sabor 40G,4.89,4.89
1333,Tempero Pronto Pirata Alho Sal Pacote 500G,4.1,4.1
1334,Cebola Salsa e Alho Mirra 10G,1.8,1.8
1335,Ervas Finas Desidratada Sabor 10G,3.49,3.49
1336,Páprica Doce Mirra Pacote 20G,1.35,1.35
1337,Pimenta Calabresa Sabor 10G,2.0,2.0
1338,Curry Sabor 10G,2.95,2.95
1339,Condimento Sabor Cheiro Verde 5Gr,2.55,2.55
1340,Cebola Granulada Média Mirra Pote 20G,1.8,1.8
1341,Tempero Pronto para Carnes Pacha 50G,2.75,2.75
1342,Cominho Moído Pirata 10G,1.49,1.49
1343,Pimenta Caiena Sabor 10G,2.0,2.0
1344,Pimenta do Reino Preta Moída Pirata 30G,7.49,7.49
1345,Alecrim Sabor 5G,1.99,1.99
1346,Alho Casa do Alho Roxo Pote 180G,7.15,7.15
1347,Camomila Mirra 5G,1.89,1.89
1348,Açafrão Pirata 20G,1.55,1.55
1349,Canela em Casca Sabor 8G,2.69,2.69
1350,Canela em Pó Sabor 8G,2.99,2.99
1351,Canela em Pó Tubo Pirata 40G,6.25,6.25
1352,Manjericão Desidratado Sabor 5G,1.69,1.69
1353,Salsa Desidratada Sabor 5G,2.35,2.35
1354,Orégano Pirata 100G,14.45,14.45
1355,Papicra Picante Mirra 20G,1.35,1.35
1356,Tempero Misto Sabor 10G,2.09,2.09
1357,Tempero Baiano Mirra 20G,2.05,2.05
1358,Pimenta do Reino Preta em Grãos Pirata 10G,1.89,1.89
1359,Noz Moscada Bola Mirra 7G,2.05,2.05
1360,Orégano Tempero Mirra 5G,1.25,1.25
1361,"Cebola, Alho e Salsa Pirata 20G",3.79,3.79
1362,Páprica Defumada Pirata 30G,4.15,4.15
1363,Páprica Picante Sabor 10G,2.39,2.39
1364,Colorau Pirata 30G,1.29,1.29
1365,Pirata Canela Moída 10G,2.2,2.2
1366,Pirata Pimenta do Reino Preta Moída 10G,1.95,1.95
1367,Chimichurri com Pimenta Mirra 10G,1.89,1.89
1368,Pimenta Calabresa Mirra 10G,1.8,1.8
1369,Tempero Pronto Sabor para Peixe 40G,3.39,3.39
1370,Coentro Moído Pirata 10G,1.45,1.45
1371,Canela em Casca Pirata 10G,2.59,2.59
1372,Cravo da Índia Pirata 10G,3.95,3.95
1373,Tempero Pronto Alho Cheiroso Alho 900G,12.75,12.75
1374,Pirata Louro Folha 6G,2.9,2.9
1375,Orégano Pirata 5G,1.69,1.69
1376,Bebida Láctea Fermentada Pulsi Tri Sabores Bandeja 540G,3.65,3.65
1377,Iogurte Polpa Itambé Morango e Coco Bandeja 540G,5.59,4.69
1378,Leite Fermentado Bob Esponja Elegê Tradicional Caixa 480G 6 Unidades,6.15,6.15
1379,Bebida Láctea Pulsi Morango Bandeja 540G,3.65,3.65
1380,Iogurte Natural Integral Nestlé 170G,3.15,3.15
1381,Iogurte Polpa Morango Itambé Bandeja 540G 6Un,5.59,4.69
1382,Bebida Láctea Cotochés Frutas Vermelhas com Coco 540G,4.49,4.49
1383,Iogurte Porto Alegre Morango e Coco 540G,4.59,4.59
1384,Leite Fermentado Trevinho 480G 6Un,5.35,5.35
1385,Iogurte Itambé Natural Copo 170G,3.25,3.25
1386,Sobremesa Flan Caramelo Batavo 200G,4.65,4.65
1387,Bebida Láctea Goody Morango 540G,4.4,4.4
1388,Petit Suisse Trevinho Morango Bandeja 360G,6.15,6.15
1389,Petit Suisse Trevinho Morango Banana Bandeja 360G,6.15,6.15
1390,Iogurte Apreciare Triple Morango Zero Lactose e Açúcar Bandeja 540G,6.59,6.59
1391,Iogurte Natural Integral Itambé Milk Copo 170G,3.25,3.25
1392,Bebida Láctea Goody Frutas Vermelhas e Coco 540G,4.4,4.4
1393,Iogurte Integral Trevinho 170G,2.65,2.29
1394,Sobremesa Láctea Itambé Flan com Calda Sabor Caramelo 200G,4.75,4.75
1395,Bebida Láctea Uht Trevinho Morango 200Ml,1.2,1.2
1396,Iogurte Grego Apreciare Tradicional Morango 100G,2.15,2.15
1397,Bebida Láctea Pulsi Morango Garrafa 180G,1.65,1.65
1398,Iogurte Grego Porto Alegre Morango 90G,2.35,2.35
1399,Bebida Láctea Itambé Morango Goody 170G,1.79,1.79
1400,Sobremesa Láctea Chocolate Branco Batavo Creamy Bandeja 180G 2Un,4.45,4.45
1401,Bebida Láctea Uht Trevinho Frutas 200Ml,1.2,1.2
1402,Iogurte Morango Itambé Gf 170G,2.69,2.69
1403,Bebida Láctea Itambé Goody Coco Embalagem 170G,1.79,1.79
1404,Leite Fermentado Desnatado Itambé 850G,10.15,10.15
1405,Iogurte Itambé Coco Garrafa 170G,2.69,2.69
1406,Iogurte Itambé Mamão Laranja Garrafa 170G,2.69,2.69
1407,Bebida Láctea Cemil Caramelo Embalagem 200Ml,1.39,1.39
1408,Iogurte Líquido Itambé Maracujá Garrafa 170G,2.69,2.69
1409,Iogurte Itambé Frutas Vermelhas Garrafa 170G,2.69,2.69
1410,Iogurte Trevinho Ball Morango Confeitos 130G,4.75,4.75
1411,Bebida Láctea Pulsi Coco Garrafa 180G,1.65,1.65
1412,Iogurte Porto Alegre Morango 170G,2.35,2.35
1413,Iogurte Líquido Porto Alegre Coco 170G,2.35,2.35
1414,Iogurte Trevinho Ball Confeitos 130G,4.75,4.75
1415,Iogurte Kids Tradicional com Confete Itambé 125G,4.69,4.69
1416,Iogurte Trevinho Laranja Cenoura e Mel 170G,2.65,2.29
1417,Leite em Pó Integral Itambé 400G,20.38,20.38
