,Produto,Preço Base,Preço Final
1386,Polvilho Antisséptico Granado Tradicional Embalagem 100G,12.99,12.99
1387,Sabonete Antibacteriano em Barra Aveia Protex 85G,3.99,3.99
1388,Antitranspirante Aerossol Tom Natural 48H Nivea 150Ml,14.99,14.99
1389,Sabonete Antibacteriano em Barra Cream Protex 85G,3.99,3.99
1390,Desodorante Masculino Antitranspirante Nivea Men Sensitiv Protect Embalagem Aerosol 150Ml,14.99,14.99
1391,Desodorante Antitranspirante Rexona Invisible 50Ml,9.99,9.99
1392,Sabonete em Barra Naturals Toque Radiante Palmolive 150G,4.99,4.99
1393,Sabonete Antibacteriano em Barra Aloe Protex 85G,3.99,3.99
1394,Desodorante Monange sem Perfume Rollon 60Ml,7.99,7.99
1395,Hidratante Desodorante Paixão Irresistivel 200Ml,8.99,8.99
1396,Hidratante Pele Normal a Seca Extrato de Algodão Monange 200Ml,7.99,7.99
1397,Desodorante Feminino Alma de Flores Essência de Flores Brancas Spray 90Ml,7.99,7.99
1398,Sabonete em Barra Naturals Hidrata & Perfuma Palmolive 150G,4.99,4.99
1399,Desodorante Antitranspirante Rexona sem Perfume 50Ml,9.99,9.99
1400,Sabonete Naturals Esfoliação Delicada Palmolive 150G,4.99,4.99
1401,Sabonete Antibacteriano em Barra Nutri Protect Macadâmia Protex 85G,3.99,3.99
1402,Desodorante Masculino Antitranspirante Nivea Men Active Fresh Aerosol 150Ml,14.99,14.99
1403,Sabonete Antibacteriano em Barra Limpeza Profunda Protex 85G,3.99,3.99
1404,Hidratante Desodorante Monange Hidratação Nutritiva Iogurte com Aveia 200Ml,7.99,7.99
1405,Desodorante Antitranspirante Suave Jasmin e Coco 150Ml,11.99,11.99
1406,Creme de Barbear Bozzano Refrescante 65G,9.99,9.99
1407,Desodorante Monange Invisível Rollon 60Ml,7.99,7.99
1408,Desodorante Old Spice Matador Aerosol 150Ml,16.99,16.99
1409,Sabonete Barra Antibactericida Carvão Detox Envoltório Protex 85G,3.99,3.99
1410,Loção Hidratante Desodorante Inspiradora Paixão 400Ml,16.99,16.99
1411,Desodorante Spray Masculino Classic Très Marchand 100Ml,7.99,7.99
1412,Loção Hidratante Ultracremosa Tentadora Ameixa Rubi Paixão 200Ml,16.99,16.99
1413,Sabonete Asepxia Detox Embalagem 80G,14.99,14.99
1414,Sabonete em Barra Naturals Hidratação Saudável Palmolive 150G,4.99,4.99
1415,Sabonete em Barra Anti Acne Cremoso Asepxia 90G,14.99,14.99
1416,Sabonete Asepxia Esfoliante/Cremoso 80G,14.99,14.99
1417,Desodorante Antitranspirante Dove Men +Care Invisible Dry 50Ml,12.99,12.99
1418,Sabonete Asepxia Neutro Unidade 90G,14.99,14.99
1419,Desodorante Antiperspirante Tabu Tradicional Embalagem Creme 55G,5.99,5.99
1420,Hidratante Corporal Skala Erva Doce 500Ml,8.99,8.99
1421,Desodorante Leite de Rosas Embalagem 100Ml,4.99,4.99
1422,Óleo Corporal Ideal Semente de Uva Embalagem 100Ml,6.99,6.99
1423,Aparelho de Barbear Bozzano Confort Embalagem 1Un,4.69,4.69
1424,Óleo de Amêndoas Avante Embalagem 100Ml,6.99,6.99
1425,Sabonete Iara 4X90g Embalagem 360G,5.99,5.99
1426,Desodorante Leite de Rosas Tradicional Embalagem 60Ml,3.99,3.99
1427,Lâmina de Barbear Lord Platinum Class com 5 Laminas,2.8,2.8
1428,Sabonete em Barra Asepxia Forte Ação Adstringente 80G,14.99,14.99
1429,Loção Hidratante de Cereja e Avelã Origem 380Ml,7.99,7.99
1430,Óleo Corporal Ideal Aloe Vera Embalagem 100Ml,6.99,6.99
1431,Desodorante Feminino Monange Lavanda Embalagem Rollon 60Ml,7.99,7.99
1432,Sabonete Asepxia Enxofre Unidade 80G,14.99,14.99
1433,Loção Hidratante Skala Leite de Arroz e Rosas 400Ml,8.99,8.99
1434,Loção Hidratante Skala Frescor Natural Chá Verde e Pera 500Ml,8.99,8.99
1435,Desodorante Antitranspirante Suave Frutas Vermelhas e Lichia 150Ml,11.99,11.99
1436,Leite de Colônia Final Fantastic Embalagem 200Ml,9.99,9.99
1437,Leite Hidratante de Amêndoas Hidratação Intensa Monange 400Ml,14.99,14.99
1438,Vaselina Ideal 100Ml,5.99,5.99
1439,Leite de Colônia Original 100Ml,5.99,5.99
1440,Desodorante Spray Avanço Original 85Ml,7.99,7.99
1441,Leite de Colônia Toque Carinho 100Ml,5.99,5.99
1442,Desodorante Spray Rastro Feminino 90Ml,7.99,7.99
1443,Leite de Colônia Original 200Ml,9.99,9.99
1444,Espátula Cutícula Dupla Inox,6.99,6.99
1445,Touca de Banho Luiza Un,3.99,3.99
1446,Gel de Arnica Mix Fórmula 270G,9.99,9.99
1447,Hidratante Vita Seiva Luva de Silicone Pele Seca e Extra Seca Embalagem 55G,14.99,14.99
1448,Desodorante Spray sem Perfume Delikad 90Ml,6.99,6.99
1449,Cortador de Unha Global,7.99,7.99
1450,Aparelho de Barbear Sekich para Lâmina Embalagem 1 Un,9.99,9.99
1451,Creme Hidratante Cacau Bicho da Seda 230G,12.99,12.99
1452,Pincel de Barba Cerdas Naturais Global,7.99,7.99
1453,Sabonete Gh Hidratante Neutro 100G,11.99,11.99
1454,Desodorante Antitranspirante Musk Musk Delikad 90Ml,6.99,6.99
1455,Preservativo Prudence Cores e Sabores Morango 3Un,4.99,4.99
1456,Preservativos Prudence Cores e Sabores Uva Embalagem 3 Un,4.99,4.99
1457,Preservativo Prudence Embalagem 3 Un,4.99,4.99
1458,Água Boricada 3% Farmax 100Ml,2.29,2.29
1459,Preservativo Prudence Hortelã Embalagem 3 Un,4.99,4.99
1460,Máscara Tripla Descartável Belamask 50Un,29.99,29.99
1461,Curativos Use It Transparente 35 Unidades,5.99,5.99
1462,Papel Higiênico Mili Bianco 60M Neutro Leve 12 Pague 11,18.99,15.99
1463,Hastes Flexives Topz com 75Un,2.99,2.99
1464,Papel Higiênico Mili Bianco 60M Perfumado Leve 12 Pague 11,18.99,15.99
1465,Haste Flexível Cotonetes Johnson & Johnson 150Un,9.99,9.99
1466,Papel Higiênico Neve Folha Dupla Toque de Seda Pacote Leve 12 Unidades Pague 11,21.99,21.99
1467,Papel Higiênico Carinho Plus 60M Embalagem 12 Un Pague 11 Un,14.99,14.99
1468,Hastes Flexíveis Use Caixa 75 Un,2.99,2.99
1469,Papel Higiênico Folha Dupla Neutro 30Mx10cm Mili Leve 12 Pague 11,21.99,21.99
1470,Papel Higiênico Fofinho Folha Dupla Pacote 12 Rolos Leve 12 Pague 11,18.99,18.99
1471,Papel Higiênico Neutro 30M Delicate 4Un,3.49,3.49
1472,Papel Higiênico Mili Folha Dupla 30M Perfumado Leve 12 Pague 11,21.99,21.99
1473,Hastes Flexíveis Johnsons Caixa 75Un,4.99,4.99
1474,Absorvente com Abas Total Protect Suave Sym Leve 16 Pague 14 Unidades,5.99,5.99
1475,Algodão Bola Apolo 50G,5.99,5.99
1476,Absorvente Sym Noite e Dia Suave C/ Abas Lv 8 Pg 7,4.99,4.99
1477,Hastes Flexíveis Topz Bastonetes Caixa 150Un,4.99,4.99
1478,Protetor Diário Carefree com 40Un,12.99,12.99
1479,Papel Higiênico Sulleg Folha Dupla Neutro 30M Pacote Leve 12 Pague 11,18.99,18.99
1480,Absorvente Suave com Abas Total Protect Santher Sym Leve 8 Pague 7,2.99,2.99
1481,Papel Higiênico 60M Perfumado Mili Bianco 4Un,7.99,7.99
1482,Algodão Topz Hidrófilo Rolo 25G,3.99,3.99
1483,Absorvente Externo Intimus Noturno Suave com Abas 8 Unidades,7.99,7.99
1484,Absorvente Externo Intimus Tripla Proteção Suave com Abas Leve 16 Pague 14,7.99,7.99
1485,Protetor Diário Sym sem Perfume Pague 35 Leve 40Un,9.99,9.99
1486,Papel Higiênico Carinho Toilet Folha Dupla 12Un,16.99,16.99
1487,Absorvente Intimus Gel Suave com Abas com 8Un,3.99,3.99
1488,Absorvente Noturno Suave com Abas Always 8Un,9.99,9.99
1489,Algodão Bola Topz 50G,4.99,4.99
1490,Absorvente Sym 360 Ação Seca com Abas Oferta 16 Unidades,5.99,5.99
1491,Absorvente Externo Intimus Tripla Proteção Seca com Abas Leve 16 Pague 14,7.99,7.99
1492,Absorvente Sym com Abas Noite e Dia Odor Block Cobertura Suave Santher Leve 16 Pague 14,9.99,9.99
1493,Papel Higiênico Mili Folha Dupla 60M 4 Rolos,13.99,13.99
1494,Papel Higiênico Carinho Plus 30M Pacote 4 Rolos,3.5,3.5
1495,Absorvente Gel Seca com Abas Intimus com 8Un,3.99,3.99
1496,Absorvente Externo Intimus Noturno Suave com Abas 16 Unidades,14.99,14.99
1497,Papel Higiênico Folha Simples Neutro Pacote 30M Mili Bianco 4Un,4.99,4.99
1498,Absorvente Neutralize sem Abas Carefree 15Un,6.99,6.99
1499,Absorvente Sym Total Protect Seca C/ Abas Lv 8 Pg 7,2.99,2.99
1500,Absorvente Interno Intimus Médio 8 Unidades,8.99,8.99
1501,Fralda Geriátrica Bigfral Classica Xg 7Un,29.99,29.99
1502,Absorvente com Abas Adapt Plus Noite Dia Sempre Livre 8Un,8.99,8.99
1503,Absorvente Brisa sem Perfume Carefree 15Un,6.99,6.99
1504,Absorvente com Abas Adapt Plus Leve Mais Pague Menos Sempre Livre 16Un,9.99,9.99
1505,Papel Higiênico Folha Simples Neutro 60M Mili Bianco 4Un,7.99,7.99
1506,Absorvente Interno Intimus Super 8 Unidades,8.99,8.99
1507,Algodão Use It Caixa 50G,5.99,5.99
1508,Protetor Diário Sym com Perfume Embalagem 15Un,4.99,4.99
1509,Absorvente Adapt Cobertura Suave com Abas Sempre Livre com 8Un,3.99,3.99
1510,Protetor Diário Sym sem Fragrância Pacote 15 Unidades,4.99,4.99
1511,Hastes Flexíveis Topz com 150Un,6.99,6.99
1512,Absorvente Interno Médio Ob 10Un,9.99,9.99
1513,Papel Higiênico Delicate 30M Embalagem 8Un,6.49,6.49
1514,Absorvente Interno Super Ob 10Un,9.99,9.99
1515,Algodão Hidrófilo Apolo Caixa 50G,5.99,5.99
1516,Protetor Diário Always com Perfume 15 Unidades,6.99,6.99
1517,Absorvente Interno Intimus Mini 8 Unidades,8.99,8.99
1518,Absorvente Sym Girl Cobertura Suave com Abas 8 Unidades,2.99,2.99
1519,Papel Higiênico Fofinho Folha Simples 60M Neutro Embalagem 4 Rolos,6.99,6.99
1520,Absorvente Sempre Livre Noturno Cobertura Seca C/ Abas Pacote 8 Un,9.99,9.99
1521,Abs Externo Gel Tripla com Aba Suave Intimus com 8Un,3.99,3.99
1522,Haste Flexível Isababy 150Un,4.99,4.99
1523,Absorvente Super Proteção Suave sem Abas Always 8Un,4.99,4.99
1524,Absorvente Sym Total Protect Suave S/ Abas C/ 8Un,2.99,2.99
1525,Fralda Descartável Adulto Regular Plus M Bigfral 8 Unidades,29.99,29.99
1526,Lenço Demaquilante Isababy Embalagem 16Un,9.99,9.99
1527,Fralda Descartável Adulto Regular Plus Tamanho P Bigfral 09Un,29.99,29.99
1528,Álcool Gel Zap Clean 70 Graus 500Ml,7.99,7.99
1529,Fralda Descartável Adulto Bigfral Derma Plus Xg Pacote 7Unidades,29.99,29.99
1530,Fralda Descartável Adulto Derma Plus Tamanho G Bigfral 7 Un,29.99,29.99
1531,Algodão Farol Hidrófilo Caixa 50G,5.99,5.99
1532,Fralda Masterfral Confort G Unissex C/8,14.99,14.99
1533,Hastes Flexíveis Use It Antigerme Embalagem 120Un,3.99,3.99
1534,Algodão Use It Bolas Coloridas Embalagem 50G,5.99,5.99
1535,Creme Dental Menta Suave Oral-B 1-2-3 70G,2.99,2.99
1536,Creme Dental Colgate Mpa 50G,3.49,3.49
1537,Creme Dental Triple Menta Close Up 70G,2.99,2.99
1538,Creme Dental Close Up Triple Menta Americana 70G,2.99,2.99
1539,Creme Dental Colgate Máxima Proteção Anticáries 90G,5.99,5.99
1540,Creme Dental Colgate Tripla Ação Menta Original 90G,5.99,5.99
1541,Creme Dental Colgate Total 12 Clean Mint 90G,9.99,9.99
1542,Creme Dental Close Up Triple Hortelã 70G,2.99,2.99
1543,Creme Dental Colgate Clean Mint Total 12 50G,5.99,5.99
1544,Kit Escova Dental Oral B 123 3Un,16.99,16.99
1545,Antisséptico Bucal Cool Mint Refrescância Intensa Hortelã Listerine 500Ml,24.99,24.99
1546,Creme Dental Sorriso Tripla Limpeza Completa 70G,2.99,2.99
1547,Antisséptico Bucal Cool Mint Refrescância Intensa Hortelã Listerine 250Ml,14.99,14.99
1548,Creme Dental Tripla Ação Preço Especial Colgate 180G,9.99,9.99
1549,Creme Dental Sorriso Carvao 60G,5.99,5.99
1550,Escova Dental Macia Colgate Classic Clean Oferta 3Un,12.99,12.99
1551,Escova Dental Oral-B Pro Embalagem 1Un,5.99,5.99
1552,Creme Dental em Gel Close Up Proteção 360º Fresh Eucalyptus Freeze 90G.,4.99,4.99
1553,Creme Dental Oral-B 4 em 1 Embalagem 70G,4.99,4.99
1554,Creme Dental Extra Branco Oral-B 70G,3.99,3.99
1555,Gel Dental Close Up Fresh Action Red Hot 90G,4.99,4.99
1556,Creme Dental Colgate Tripla Ação Menta Original 180G,9.99,9.99
1557,Escova Dental Hillo Macia 34 Embalagem 1Un,3.99,3.99
1558,Fio Dental Hillo Woman Embalagem 100M,5.99,5.99
1559,Escova Dental Essencial Clean Colgate,5.99,5.99
1560,Gel Dental Close Up Proteção 360 Fresh Menthol Paradise 90G,4.99,4.99
1561,Creme Dental Sorriso Dentes Brancos 180G Unid,6.99,6.99
1562,Escova Dental Oral-B Classic Macia 40 Oferta Embalagem 3Un,29.99,29.99
1563,Creme Denta Máxima Proteção Anticáries L Colgate 180G,9.99,9.99
1564,Creme Dental Sensodyne Branq Extr Fresh 50G,11.99,11.99
1565,Antisséptico Bucal Hortelã Hillo 500Ml,16.99,16.99
1566,Creme Dental Sorriso Fresh Plus Xtra Mint 90G,4.99,4.99
1567,Creme Dental Sorriso Fresh Plus Menthol Impact 90G,4.99,4.99
1568,Creme Dental Sensodyne Original para Dentes Sensíveis Gsk 50G,11.99,11.99
1569,Escova Dental Macia Color Collection Clean Oral-B 2Un,26.99,26.99
1570,Creme Dental Colgate Tandy Morangostoso 50G,7.99,7.99
1571,Escova de Dente Original Sorriso 1Un,3.99,3.99
1572,Creme Dental Tripla Limpeza Completa Sorriso 180G,6.99,6.99
1573,Escova Dental Sorriso Original 1Un,3.99,3.99
1574,Corega Fixador de Prótese Pó Corega 22G,19.99,19.99
1575,Escova Dental Colgate Classic Clean 1Un,7.99,7.99
1576,Escova Dental Sorriso Original Média 1Un,3.99,3.99
1577,Creme Dental Sorriso Fresh Plus Hortelã Explosion 90G,4.99,4.99
1578,Creme Dental Sorriso Dentes Brancos Oferta 180G,6.99,6.99
1579,Escova Dental Tripla 123 Sorriso,6.99,6.99
1580,Escova Dental Hillo Kids Macia Suave Embalagem 1Unidade,3.99,3.99
1581,Antisséptico Bucal Hillo Tutti Frutti 500Ml,16.99,16.99
1582,Escova Dental Inova Fresh Média Embalagem 1 Un,3.99,3.99
1583,Spray Bucal Mel do Vale Roma e Menta 35Ml,12.99,12.99
1584,Tenys Pé Baruel Original Embalagem 100G,11.99,11.99
1585,Alicate de Cutícula Mundial 522 Classic 1 Un,22.99,22.99
1586,Esmalte Risqué Technology Linha de Tratamento Seda Base 8Ml,4.99,4.99
1587,Esmalte Metálico Risqué Maçã do Amor Embalagem 8Ml,4.99,4.99
1588,Desodorante em Pó para Os Pés Tenys Pé Baruel Canforado Embalagem 100G,11.99,11.99
1589,Esmalte Risqué Branco Natural Novo Renda 8Ml,4.99,4.99
1590,Amolecedor de Cuticulas Ideal 100 Ml,6.99,6.99
1591,Acetona Avante Blue Embalagem 100Ml,3.69,3.69
1592,Removedor Ideal com Silicone Embalagem 200Ml,7.99,7.99
1593,Esmalte Risqué Nude Cremoso Nude 8Ml,4.99,4.99
1594,Esmalte Cremoso Preto Sépia Risqué 8Ml,4.99,4.99
1595,Esmalte Cremoso Love Vermelho Risqué 8Ml,4.99,4.99
1596,Esmalte Colorama Verniz e Cor 2 em 1 Jabuticaba Embalagem 8Ml,6.99,6.99
1597,Esmalte Risqué Nudes Cremoso Cappuccino 8Ml,4.99,4.99
1598,Amolecedor de Cutículas Ideal Manteiga de Karité Embalagem 100Ml,5.99,5.99
1599,Esmalte Risqué Glitter Granulado Rosé Embalagem 8Ml,4.99,4.99
1600,Creme Lisa Pe Soft Hair 120G,11.99,11.99
1601,Esmalte Novo Toque Cremoso Nice Embalagem 8Ml,2.99,2.99
1602,Lixa para Pés Pvc Sempre,4.99,4.99
1603,Lixa Americana para Unhas Sbo Landh's 3Un,3.99,3.99
1604,Lixa para Manicure Mini Zalike 20Un,2.99,2.99
1605,Creme Lisa Mão Ácido Hialurônico Bio Soft 120G,11.99,11.99
1606,Protetor Labial Acqualips Fps12,2.99,2.99
1607,Amendoim Anchieta Torrado e Moído 500G,8.99,8.99
1608,Amendoim Pachá Embalagem 500G,14.99,14.99
1609,Amendoim Torrado Pachá 500G,8.99,8.99
1610,Amendoim Pacha Torrado e Moído 500G,8.99,8.99
1611,Amendoim Branco Pacha Embalagem 500G,7.99,7.99
1612,Amendoim Anchieta Vermelho 500G,14.99,14.99
1613,Amendoim Torrado Salgado sem Pele Pettiz Special Dori 50G,2.99,2.99
1614,Amendoim Frito e Salgado Elma Chips 40G,3.49,3.49
1615,Amendoim Japonês Special Dori Pettiz 50G,2.99,2.99
1616,Amendoim Japonês Pachazito Embalagem 150G,5.99,5.99
1617,Biscoito Maizena Marilan 350G,7.99,7.99
1618,Biscoito Maizena Renata 360G,5.49,5.49
1619,Biscoito Recheado de Chocolate Passatempo 130G,3.49,3.49
1620,Aymoré Biscoito Amanteigado Leite com Gotas 330G,5.99,5.99
1621,Biscoito Wafer Bauducco Chocolate Pacote 140G,4.49,4.49
1622,Biscoito Rosquinha Mabel Coco Pacote 500G,7.99,7.99
1623,Biscoito de Leite Renata 360G,5.49,5.49
1624,Biscoito Rosquinha Leite Vilma 700G,10.99,10.99
1625,Biscoito Wafer Parati Minueto Morango Embalagem 115G,2.69,2.69
1626,Aymoré Biscoito Recheado Chocolate 120G,2.89,2.89
1627,Biscoito Passatempo Leite Nestlé 150G,3.49,3.49
1628,Biscoito Wafer de Chocolate Visconti 120G,3.49,3.49
1629,Aymoré Biscoito Amanteigado Leite 330G,5.99,5.99
1630,Biscoito Amanteigado de Chocolate Marilan 280G,6.99,6.99
1631,Biscoito Wafer Visconti Morango Pacote 120G,3.49,3.49
1632,Wafer Bauducco 140G Choco C Avela,4.49,4.49
1633,Biscoito Doce Aymoré Maizena 200G,2.99,2.99
1634,Biscoito Doce Mabel Rosquinha de Coco Pacote 800G,9.99,9.99
1635,Biscoito Doce Vilma Maizena Embalagem 360G,5.69,4.49
1636,Biscoito Doce Recheado Fofinho Chocolate Pacote 110G,1.69,1.69
1637,Cookies Bauducco Maxi Chocolate 96G,5.49,5.49
1638,Aymoré Biscoito Recheado Brigadeiro 120G,2.89,2.89
1639,Biscoito Wafer Parati Minueto Chocolate Pacote 115G,2.69,2.69
1640,Biscoito Wafer Bauducco Morango 140G,4.49,4.49
1641,Aymoré Biscoito Amanteigado Chocolate 330G,5.99,5.99
1642,Biscoito Wafer Parati Minueto Brigadeiro Pacote 115G,2.69,2.69
1643,Biscoito Cookies Bauducco Original 100G,5.49,5.49
1644,Biscoito Bono Recheado de Chocolate Nestlé 126G,3.49,3.49
1645,Biscoito de Leite Marilan 350G,7.99,7.99
1646,Biscoito Recheado Cartoon Brigadeiro 110G,2.69,2.69
1647,Biscoito Wafer Stick Look Chocolate Pacote 55G,2.99,2.99
1648,Biscoito Doce Aymoré Maria 200G,3.49,3.49
1649,Aymoré Biscoito Recheado Morango 120G,2.89,2.89
1650,Biscoito Rosquinha Sabor Coco Marilan 600G,9.99,9.99
1651,Biscoito Choker Cobertura Chocolate 95G,4.49,4.49
1652,Cookie Gotas de Baunilha Negresco 60G,2.99,2.99
1653,Biscoito de Chocolate Recheio Baunilha Negresco Nestlé 100G,3.49,3.49
1654,Biscoito Recheado Danix Chocolate 130G,2.99,2.99
1655,Biscoito Zoo Cartoon Recheado com Chocolate 110G,2.69,2.69
1656,Cookies Visconti Original Embalagem 60G,1.99,1.99
1657,Biscoito Rosquinha Coco Aymoré 350G,6.99,6.99
1658,Biscoito Amanteigado Sabor Chocolate Vilma 300G,5.99,5.99
1659,Biscoito Waffer Chocolate com Avelã Aymoré 105G,3.49,3.49
1660,Biscoito Doce Aymoré Coco 200G,3.99,3.99
1661,Cookies de Chocolate Visconti Embalagem 60G,1.99,1.99
1662,Aymoré Biscoito Amanteigado Coco 330G,5.99,5.99
1663,Biscoito Parati Recheado Zoo Cartoon Morango 110G,2.69,2.69
1664,Biscoito de Maisena Vilma Embalagem 200G,2.99,2.99
1665,Biscoito Doce Recheado Morango Visconti Pacote 125G,2.49,2.49
1666,Rosquinha Vilma Coco Embalagem 800G,10.99,10.99
1667,Biscoito Amanteigado Sabor Leite Marilan 280G,6.99,6.99
1668,Recheadinho Bauducco Goiabinha 112G,3.99,3.99
1669,Biscoito Parati Recheado Zoo Cartoon Flocos 110G,2.69,2.69
1670,Biscoito Doce Bauducco Maizena Embalagem 170G,3.99,3.99
1671,Biscoito Maria Marilan 350G,7.99,7.99
1672,Biscoito Maizena Parati 370G,6.99,6.99
1673,Biscoito Recheado Original Oreo 90G,3.29,3.29
1674,Biscoito Renata Maizena Pacote 200G,2.99,2.99
1675,Biscoito Recheado Visconti Chocolate Pacote 125G,2.49,2.49
1676,Biscoito Recheado com Leite Passatempo 130G,3.49,3.49
1677,Vovo Delma Sequilhos Laranja 300G,7.99,7.99
1678,Biscoito Parati Leite 370G,6.99,6.99
1679,Danix Biscoito Recheado Choco Choco 130G,2.99,2.99
1680,Biscoito de Chocolate Wafer Aymoré 105G,3.49,3.49
1681,Biscoito Renata Coco Pacote 360G,5.49,5.49
1682,Biscoito Champmell Champagne Embalagem 300G,10.99,10.99
1683,Biscoito Doce Recheado Fofinho Doce de Leite Pacote 110G,1.69,1.69
1684,Biscoito Doce Recheado Chocker Chocolate Branco Pacote 95G,4.49,4.49
1685,Danix Biscoito Recheado Morango 130G,2.99,2.99
1686,Biscoito Wafer Marilan Chocolate 115G,3.99,3.99
1687,Biscoito de Coco Marilan 350G,7.99,7.99
1688,Biscoito Doce Vilma Amanteigado Coco Embalagem 300G,5.99,5.99
1689,Biscoito Maizena de Manteiga Marilan 350G,7.99,7.99
1690,Biscoito Cookie Chocolate com Gotas de Chocolate Bauducco 100G,5.49,5.49
1691,Biscoito Tortinha Sabor Chocolate Marilan 140G,4.99,4.99
1692,Biscoito Wafer de Limão Aymoré 105G,3.49,3.49
1693,Biscoito Maria Parati 370G,6.99,6.99
1694,Biscoito Integral Cereale Cacau e Castanhas Bauducco 170G,4.99,4.99
1695,Biscoito Recheado Prestígio 140G,4.49,4.49
1696,Sequilho Krokero Leite Embalagem 300G,5.99,5.99
1697,Biscoito Recheado de Morango Vilma 120G,2.49,2.49
1698,Sequilho Krokero Coco Embalagem 300G,5.99,5.99
1699,Biscoito Wafer Marilan Morango 115G,3.99,3.99
1700,Biscoito Wafer Vilma Morango Embalagem 125G,2.99,2.99
1701,Biscoito Doce Tortinha de Limão Marilan 140G,4.99,4.99
1702,Biscoito Doce Vilma Amanteigado Leite Embalagem 300G,5.99,5.99
1703,Bisc Nestle Nesfit 200G Cacau Cereais,3.69,3.69
1704,Biscoito Cereale Cacau Aveia & Mel Bauducco 170G,4.99,4.99
1705,Biscoito Wafer Vilma Limão Embalagem 125G,2.99,2.99
1706,Biscoito Maizena Marilan 170G,3.29,3.29
1707,Biscoito Maisena Lowçucar Zero Adição de Açúcares 140G,6.99,6.99
1708,Danix Biscoito Recheado Choco Shake 130G,2.99,2.99
1709,Biscoito Doce Recheado Vilma Limão Embalagem 120G,2.49,2.49
1710,Suspiro Vovô Delma Morango 150G,6.99,6.99
1711,Suspiro Delma Sabor Limão Pacote 150G,6.99,6.99
1712,Biscoito Recheado Nescau 140G,4.49,4.49
1713,Biscoito Waffer Sabor Morango Aymoré 105G,3.49,3.49
1714,Biscoito Wafer Vilma Chocolate Embalagem 125G,2.99,2.99
1715,Biscoito Recheado Classic Chocolate 140G,4.49,4.49
1716,Aymoré Biscoito Recheado Choco Creme 120G,2.89,2.89
1717,Biscoito Cream Cracker Marilan 170G,3.29,3.29
1718,Biscoito Seqiilhos Vovo Delma Leite 300Gr,7.99,7.99
1719,Biscoito Doce Renata Leite Pacote 200G,2.99,2.99
1720,Biscoito Doce Recheado Vilma Chocolate Embalagem 120G,2.49,2.49
1721,Biscoito Sequilhos Vovo Delma Coco 300G,7.99,7.99
1722,Suspiro Vovô Delma Leite Condensado Embalagem 150G,6.99,6.99
1723,Biscoito Rosquinha de Leite Aymoré 350G,6.99,6.99
1724,Biscoito Marilan Wafer Bauny 115G,3.99,3.99
1725,Biscoito Casadinho Tradicional Vovo Delma 300G,7.99,7.99
1726,Biscoito Rosa de Minas Embalagem 300G,6.99,6.99
1727,Biscoito Amanteigado de Coco Vovo Delma 300G,7.99,7.99
1728,Biscoito Doce Vovô Delma Amanteigado Nata 300G,7.99,7.99
1729,Rosquinha Chocolate Vilma 700 Gr,10.99,10.99
1730,Biscoito Escaldado Vovó Delma 300G,9.99,9.99
1731,Biscoito Doce Petisco Rosquinha Sabor Coco 800G,7.99,7.99
1732,Biscoito Recheado Juvis Doce de Leite 100G,1.49,1.49
1733,Biscoito Caseiro Papa Ovo Vovó Chica 250G,9.99,9.99
1734,Biscoito Aymoré Salpet Tradicional 200G,3.99,3.99
1735,"Biscoito Salgado Petisco Deliciosos 1,8Kg",16.99,16.99
1736,Biscoito Salgado Cream Cracker Renata 360G,5.49,5.49
1737,Biscoito Água e Sal Renata 360G,5.49,5.49
1738,Biscoito Cream Cracker Marilan 350G,7.99,7.99
1739,Biscoito Água e Sal Marilan 350G,7.99,7.99
1740,Biscoito Salgado Vilma Cream Cracker Embalagem 360G,5.69,4.49
1741,Biscoito Club Social Regular Original Multipack 144G,4.49,4.49
1742,Biscoito Salgado Levíssimo Água e Sal Bauducco 200G,3.99,3.99
1743,Biscoito de Água e Sal Aymoré 164G,2.99,2.99
1744,Biscoito Original Pit Stop 162G,4.99,4.99
1745,Biscoito Salgado Renata Cream Cracker Pacote 200G,2.99,2.99
1746,Biscoito Salgado Bauducco Levissimo Cracker Pacote 200G,3.99,3.99
1747,Biscoito Cream Cracker Parati Pacote 370G,6.99,6.99
1748,Biscoito Salgado Vilma Água Sal Embalagem 360G,5.69,4.49
1749,Biscoito Aymoré Cream Cracker 200G,2.99,2.99
1750,Biscoito Água Sal Vilma Embalagem 200G,2.99,2.99
1751,Biscoito Pit Stop Presunto 162G,4.99,4.99
1752,Biscoito Pit Stop Pizza 162G,4.99,4.99
1753,Biscoito Club Social Regular Presunto Multipack 141G,4.49,4.49
1754,Biscoito Salgado Vilma Cream Cracker Embalagem 200G,2.99,2.99
1755,Biscoito Polvilho Vovô Delma Sabor Queijo 150G,7.99,7.99
1756,Biscoito Cracker Sabor Manteiga Aymoré 164G,4.99,4.99
1757,Biscoito de Polvilho Vovó Delma Palito com Queijo 150G,7.99,7.99
1758,Biscoito de Polvilho Tradicional Vovó Delma 300G,9.99,9.99
1759,Biscoito de Povilho São Tiago 100G,3.99,3.99
1760,Biscoito Polvilho Palitão Escaldado Vovó Delma 90G,4.99,4.99
1761,Biscoito de Polvilho Sabor Queijo Vovó Delma 100G,6.99,6.99
1762,Biscoito de Polvilho Tradicional Tradição 100G,3.99,3.99
1763,Biscoito Polvilho Vovô Delma Palito Tradicional 100G,6.99,6.99
1764,Biscoito de Polvilho Sabor Queijo Vovó Delma 300G,9.99,9.99
1765,Biscoito Polvilho Vovo Delma Palitão 90G,4.99,4.99
1766,Biscoito de Polvilho Vovó Delma Embalagem 150G,7.99,7.99
1767,Biscoito Polvilho Vovô Delma Bolinha Sabor Queijo 100G,6.99,6.99
1768,Biscoito de Polvilho Vovó Delma 150G,7.99,7.99
1769,Biscoito Povilho Vovo Delma Escaldado 100G,6.99,6.99
1770,Salgadinho Onda Requeijão Elma Cheetos 45G,2.99,2.99
1771,Batata Palha Yoki Extra Fina 100G,7.99,7.99
1772,Batata Palha Yoki Trad 105G,7.99,7.99
1773,Batata Palha Anchieta 300G,11.99,11.99
1774,Salgadinho Fandangos Presunto 44G,2.49,2.49
1775,Salgadinho Kerus Queijo 50G,1.2,1.2
1776,Batata Palha Extra Fina Croques 120G,5.99,5.99
1777,Salgadinho Kerus Presunto 50G,1.2,1.2
1778,Salgadinho Churrasco Torcida 45G,1.99,1.99
1779,Palitinho de Trigo Salgado Stiksy Elma Chips 48G,2.49,2.49
1780,Salgadinho Cheetos Lua Embalagem 42G,2.99,2.99
1781,Salgadinho Fandangos Queijo 44G,3.99,3.99
1782,Salgadinhos Kerus Cheddar 50G,1.2,1.2
1783,Salgadinho Baconzitos 30G,2.99,2.99
1784,Batata Palha Croques Embalagem 300G,11.99,11.99
1785,Batata Lays Clássica Embalagem 86G,8.99,8.99
1786,Salgadinho de Milho Queijo Nacho Doritos 140G,13.99,13.99
1787,Salgadinho Batata Ruffles Churrasco Elma Chips 40G,3.99,3.99
1788,Salgadinho de Milho Doritos® Queijo Nacho 84G,8.99,8.99
1789,Salgadinho Doritos Queijo Nacho 48G,4.99,4.99
1790,Pururuca Pacha Listrada Embalagem 400G,6.99,6.99
1791,Salgadinho Gulão Sabor Churrasco Embalagem 120G,3.49,3.49
1792,Pururuca Pacha Queijo Embalagem 400G,6.99,6.99
1793,Fandangos Queijo 37G,2.49,2.49
1794,Salgadinhos Yokitos Presunto Yoki 39G,2.99,2.99
1795,Salgadinho Yokitos Conchinha Queijo Yoki 39G,2.99,2.99
1796,Salgadinho de Milho Onda Requeijão Elma Chips Cheetos 140G,11.99,11.99
1797,Batata Ruffles Cebola e Salsa Elma Chips 40G,3.99,3.99
1798,Salgadinho de Trigo Costelinha com Limão Torcida Jr 45G,1.99,1.99
1799,Salgadinho Cebolitos 31G,2.99,2.99
1800,Batata Croques Petisco Picanha Barbecue 45G,3.49,3.49
1801,Salgadinho Yokitos Redinha Requeijao 39G,2.99,2.99
1802,Salgadinho de Milho Onda Requeijão Elma Chips Cheetos 75G,5.99,5.99
1803,Salgadinho de Milho Presunto Elmachips Fandangos 140G,11.99,11.99
1804,Salgadinho de Milho Fandangos Sabor Presunto 80G,5.99,5.99
1805,Salgadinho Ruffles Original 41G,3.99,3.99
1806,Batata Kerus Deora Cebola e Sal 45G,2.99,2.99
1807,Snack Panetini Queijo Suave Eqlibri 40G,3.49,3.49
1808,Salgadinho Kerus Cebola e Salsa 50G,1.2,1.2
1809,Salgadinho Cheetos Tubo 37G,2.99,2.99
1810,Salgadinho Kerus Bacon 50G,1.2,1.2
