,Produto,Preço Base,Preço Final
0,Álcool Mega 70° 1Lt,8.98,8.98
1,Kit Multiuso Mais Perfume 500Ml Azulim 3Un,8.89,8.89
2,Álcool Etílico Hidratado 70º Inpm Uzu 1L,8.98,8.98
3,Álcool Líquido 70º Inpm Flop's 1L,7.98,7.98
4,Limpador Multiuso Veja 10% Desconto 500Ml,5.29,5.29
5,Água Sanitária Marina Embalagem 2L,5.25,5.25
6,Limpador Multiuso Cif +Antibac Oferta 500Ml,3.99,3.99
7,Água Sanitária Marina Embalagem 1L,3.25,3.25
8,Desinfetante Marina Lavanda 2L,5.29,5.29
9,"Agua Sanitaria Super Globo Pague 1,8Ltr Leve 2Ltr",6.29,6.29
10,Água Sanitária Santa Clara Embalagem 2 Litros,5.69,4.98
11,Água Sanitária Classic Embalagem 2 Litros,5.65,5.65
12,Álcool 70% Asseptgel Start Embalagem 500Ml,4.99,4.99
13,Álcool Líquido 70% Start 1L,8.98,8.98
14,Sapólio Radium Cremoso Original 250Ml,9.48,9.48
15,Água Sanitária Santa Clara Embalagem 1 Litro,3.29,3.29
16,Limpador Uau Multiuso com Cloro Ativo Embalagem 500Ml,8.29,8.29
17,"Álcool Start 46,2º Embalagem 1L",9.98,9.98
18,Tira Limo Veja X14 Cloro Ativo Squeeze Oferta 500Ml,14.49,14.49
19,Querosene Jacaré Lata 900Ml,26.98,26.98
20,Kit Limpador Multiuso Azulim 550Ml 3Un,8.89,8.89
21,Água Sanitária Classic 1Litro,3.29,3.29
22,Limpador Multiuso Cif Cremoso Original Oferta 450Ml,13.98,13.98
23,Tira Limo Azulim Embalagem 500Ml,4.29,3.99
24,Água Sanitária Ypê 2L,8.98,8.98
25,Limpa Alumínio Marina Verde Embalagem 500Ml,2.85,2.85
26,Água Sanitária Super Globo Embalagem 2 Litros,6.29,6.29
27,Limpador Uau Multiuso Desengordurante Limão Siciliano 500Ml,4.25,4.25
28,Limpador Desengordurante Cozinha Limão Veja 500Ml 20% de Desconto,10.85,10.85
29,Limpador Multiuso Uau Rosas Sedução 500Ml,4.25,4.25
30,Limpador Multiuso Super Globo Floral Embalagem 500Ml,3.65,3.65
31,Limpador Brilhalumínio Tradicional Embalagem 500Ml,2.98,2.98
32,Limpador Multiuso Gold Original Veja 500Ml,5.29,5.29
33,Kit Econômico Azulim Multiuso 4X1,14.89,14.89
34,Água Sanitária Marina 5 Litros,12.98,12.98
35,Cloro Super Cloro Classic Extra Forte 1 Litro,3.99,3.99
36,Limpador Uau Cloro Ativo 2 Unidades de 500Ml Cada + Grátis Multiuso Lavanda 500Ml,16.9,16.9
37,Limpa Box Uau Blindex 200Ml,11.28,11.28
38,Tira Limo Veja Banheiro X14 500Ml,14.49,14.49
39,"Água Sanitária Ypê Leve 2L Pague 1,8L Grátis 200Ml",8.98,8.98
40,Limpador Cif Cremoso Original Oferta Embalagem 500Ml,13.98,13.98
41,Super Cloro Classic Extra Forte 2L,7.29,7.29
42,Limpador Uau Perfumes Lavanda e Conforto Embalagem L1p800ml,6.98,5.99
43,Pedra Sanitária Harpic Pinho Campestre 25G,3.35,3.35
44,Limpador Uau Perfumes Flores Vermelhas Embalagem 1 Litro,6.98,5.99
45,Casa e Perfume Sensazine 500Ml,4.78,4.78
46,Cloro Gel Vim Lavanda 700Ml,12.79,12.79
47,Sapólio Radium Pó Clássico,5.29,4.99
48,Desengordurante Uau Squeeze 500Ml,7.85,7.85
49,Desinfetante Santa Clara Lavanda Embalagem 2 Litros,5.99,5.99
50,Pedra Sanitária Inspira Lavanda 1Un,2.99,2.99
51,Limpador Cremoso Cif Original 450Ml,13.98,13.98
52,Pastilhas Ades Inspira Lavanda 20%Desc 3Un,5.98,5.98
53,Limpador Sanitário Limpeza Profunda Gel Marine Pato 750Ml,15.95,15.95
54,Limpador Uau Multiuso Lavanda 500Ml,4.25,4.25
55,Limpador Uau Multiuso Flores e Folhas 500Ml,4.25,4.25
56,Desinfetante Marina Marine Embalagem 2 Litros,5.29,5.29
57,Limpador Uau Perfumes Flores Vermelhas e Sedução 500Ml,4.45,4.45
58,Limpa Piso Uau Laminado 750Ml,9.48,9.48
59,Limpador de Pisos Laminados Destac 750Ml,14.98,14.98
60,Limpador Limpeza Pesada Veja 500Ml,10.95,10.95
61,Soda Cáustica Yara 950G,18.9,18.9
62,Limpador de Pisos Destac Laminados 750Ml,14.98,14.98
63,Pedra Sanitária de Lavanda Harpic Oferta 25G,3.35,3.35
64,Desinfetante Original Bruto Lysoform 1L,12.79,12.79
65,Desengordurante Veja Limão Squeeze 500Ml,10.85,10.85
66,Limpador Multiuso Fresh Marina 500Ml,3.29,3.29
67,Cera Líquida Special Taco/Madeiras Ingleza Maxx 750Ml,13.49,13.49
68,Desentupidor de Piá Diabo Verde Embalagem 300G,19.98,19.98
69,Água Sanitária Ypê 1L,4.98,4.98
70,Desinfetante Santa Clara Herbal Embalagem 2 Litros,5.99,5.99
71,Limpador Multiuso Super Globo Original 500Ml,3.65,3.65
72,Limpador Multiuso Veja Lavanda e Álcool Oferta 500Ml,5.29,5.29
73,Cera Líquida Incolor Brilho Fácil 750Ml,12.49,12.49
74,Desengordurante Super Globo Squeeze 500Ml,5.49,5.49
75,Limpador Azulim Lavanda Embalagem 1L,6.89,5.99
76,Limpador Uau Cloro Ativo Limpeza Pesada 500Ml,6.49,6.49
77,Desinfetante Classic Floral 5 Litros,13.49,13.49
78,Limpador Uau Limpa Vidros Embalagem 500Ml,7.79,6.98
79,Cera Líquida Brilhowax Incolor 750Ml,9.85,9.85
80,Limpadores Veja Limpeza Pesada Original Leve 500Ml Pague 400Ml Embalagem 500Ml,10.95,10.95
81,Desinfetante Urca Floral Brisa 2L,5.98,5.98
82,Limpador Multiuso Uau Cloro Ativo 500Ml,8.29,8.29
83,Desinfetante Batuta Floral Embalagem 2L,7.98,7.98
84,Limpador Multiuso Veja Floral 500Ml,5.29,5.29
85,Lustra Móveis Uau Perfumado Rosas e Sedução 200Ml,6.29,6.29
86,Desinfetante Pinho Trop 1L,6.95,6.95
87,Desengordurante Azulim Limpeza Pesada Limão Embalagem 500Ml,4.99,4.99
88,Limpador Uau Flores e Sonhos 500Ml,4.45,4.45
89,Limpa Piso Uau Rosas e Sedução 750Ml,9.49,9.49
90,Limpador Multiuso Veja Campestre Oferta 10% de Desconto 500Ml,5.29,5.29
91,Limpador Multiuso Veja Floral Oferta 500Ml,5.29,5.29
92,Limpador Perfumado Uau Flores e Sonhos Embalagem Leve 1 Litro Pague 800Ml,6.98,5.99
93,Bry Lustra Móveis de Lavanda Ingleza 200Ml,6.25,6.25
94,Limpador Multiuso Azulim Citronela 500Ml,3.49,2.99
95,Água Sanitária Superglobo Embalagem 1L,3.59,3.59
96,Limpador Uau Perfumes Lavanda e Conforto Ingleza Embalagem 500Ml,4.45,4.45
97,Limpador Multiuso Ação Clareadora Uau 500Ml,4.25,4.25
98,Sapólio Radium Cremoso Clássico Multiuso Bombril 250Ml,9.48,9.48
99,Desinfetante Pinho Bril Campos de Lavanda 500Ml,4.28,4.28
100,Limpador Multiuso Veja Gold Campestre 500Ml,5.29,5.29
101,Cera Líquida para Piso de Pedra Ardósia Verde Ingleza Embalagem 750Ml,10.79,10.79
102,Limpador Perfumado Intuizione New Casa & Perfume 500Ml,4.78,4.78
103,Desinfetante Batuta Lavanda Embalagem 2L,7.98,7.98
104,Limpador Cif Banheiro Tira Limo com Cloro 450Ml,10.98,10.98
105,Limpador Multiuso Azulim Original Azul 500Ml,3.49,2.99
106,Limpador Uau Multiuso Cloro Ativo 5 em 1 Lavanda 500Ml,8.29,8.29
107,Limpador Uau Brisa Frescor 500Ml,4.45,4.45
108,Limpador Multiuso Super Globo Lavanda 500Ml,3.65,3.65
109,Limpa Pedra Start Pedrex Embalagem 2L,18.99,18.99
110,Desinfetante Pinho Sol Original 500Ml,7.28,7.28
111,Limpeza Pesada Uau Rosas e Sedução 500Ml,6.49,6.49
112,Pedra Sanitária Master Sortida 25G,2.25,2.25
113,Pedra Sanitária Marine Oferta Pato,3.79,3.79
114,Limpador Removedor de Gordura Cozinha Cif Sch 450Ml Refil,10.98,10.98
115,Cera Líquida Ingleza Maxx Incolor 750Ml,13.49,13.49
116,Soda Caustica Escorpião Embalagem 500G,18.98,18.98
117,Desinfetante Citrus Lysoform 1L,12.79,12.79
118,Limpador Multiuso com Álcool Brilho Instantâneo Uau Frasco 500Ml,4.25,4.25
119,Sapólio Radium Pó Lavanda 300G,5.29,4.99
120,Limpa Piso Uau Cerâmicas 750Ml,9.48,9.48
121,Desinfetante de Limão Pinho Bril 500Ml,4.28,4.28
122,Limpador Veja Multiuso Original Pague 500Ml Embalagem 650Ml,5.29,5.29
123,Desinfetante Líquido Original Lysoform 500Ml,6.49,6.49
124,Cera Líquida Ingleza Max Ardosia Verde Embalagem 750Ml,13.49,13.49
125,Desinfetante Multiuso Antibac Cif 500Ml,3.99,3.99
126,Desinfetante Santa Clara Floral Embalagem 2 Litros,5.99,5.99
127,Lustra Móveis Jasmim Poliflor 500Ml,19.98,19.98
128,Limpador Casa e Perfume Amable 500Ml,4.78,4.78
129,Limpador Multiuso Floral Uau Embalagem 500Ml,4.25,4.25
130,Desinfetante Pinho Bril Brisa do Mar 500Ml,4.28,4.28
131,Limpa Pisos Uau Eliminador de Odores Embalagem 750Ml,9.48,9.48
132,Desinfetante Pinho Bril Lavanda Oferta 500Ml,4.28,4.28
133,Desinfetante Pinho Bril Campos de Lavanda 1000Ml,7.49,7.49
134,Pastilha Adesiva Pato Citrus 3Un,8.95,8.95
135,Cera Super Tacolac 500Ml,12.49,12.49
136,Limpador Casa e Perfume Passione Embalagem 500Ml,4.78,4.78
137,Desinfetante Pinho Sol Lavanda 1000Ml,13.98,13.98
138,Desinfetante Pinho Bril Brisa Mar Embalagem 500Ml,4.28,4.28
139,Desinfetante Pinho Bril Silvestre Plus 1L,7.49,7.49
140,Limpador Multiuso Coco Veja Power Fusion Squeeze 500Ml,8.45,8.45
141,Limpa Casa e Perfume Mistero Di Amore Embalagem 500Ml,4.78,4.78
142,"Álcool Start 46,2º Garrafa 500Ml",5.29,5.29
143,Desinfetante Pinho Bril Silvestre Plus 500Ml,4.28,4.28
144,Cera Líquida Poliflor Pratic Incolor Oferta 750Ml,14.29,14.29
145,Limpa Vidros Cif Refil 450Ml,10.98,10.98
146,Limpador Multiuso Veja Lavanda e Álcool 500Ml,5.29,5.29
147,Limpador Multiuso Azulim Laranja 500Ml,3.49,2.99
148,Desinfetante Pinho Sol Original Oferta 1000Ml,13.98,13.98
149,Cera Líquida Ingleza Maxx Vermelha 750Ml,13.49,13.49
150,Desinfetante Pinho Sol Original 1000Ml,13.98,13.98
151,Limpador Casa e Perfume Speciale Embalagem 500Ml,4.78,4.78
152,Desinfetante Scarlim Eucalipto 2L,5.85,5.85
153,Limpa Piso Porcelanato e Cerâmica Super Globo 750Ml,8.99,8.99
154,Desinfetante Pinho Sol Leve 500Ml Pague 450Ml,7.28,7.28
155,Limpador Banheiro Cif sem Cloro Refil 450Ml,10.98,10.98
156,Limpador Multiuso Uau Flores e Folhas Embalagem Leve 600Ml Pague 500Ml,4.25,4.25
157,Limpador Multiuso Marina Tradicional 500Ml,3.29,3.29
158,Limpador Perfumado Concentrado Uau Citronela 130Ml,11.49,11.49
159,Cera Líquida Brilho Fácil Ardósia Embalagem 750Ml,12.49,12.49
160,Limpador Multiuso Veja Power Fusion Laranja 500Ml,8.45,8.45
161,Desinfetante Classic Jasmim Embalagem 2 Litros,5.99,5.99
162,Desinfetante Pinho Bril Brisa do Mar 1000Ml,7.49,7.49
163,Limpador Uau Perfumes Brisa e Frescor Ingleza Frasco 1L 20% de Desconto,6.98,5.99
164,Desinfetante Pinho Bril Silvestre Oferta 500Ml,4.28,4.28
165,Cera Líquida para Sapato Nugget Preto Embalagem 60Ml Grátis 33%,18.98,18.98
166,Óleo de Peroba King 100Ml,8.99,8.99
167,Limpador Multiuso Uau Flores e Frescor Ingleza 500Ml,4.25,4.25
168,Lustra Móveis Bry Jasmim Embalagem 200Ml,6.25,6.25
169,Sapólio Radium Pedra Clássico 200G,3.28,3.28
170,Pastilha Adesiva Limppano Inspira Lavanda Embalagem 3 Un,5.98,5.98
171,Limpador Multiuso Super Globo Original Embalagem 500Ml,3.65,3.65
172,Pedra Sanitária Eucalipto Azulim 25G,2.75,2.75
173,Limpa Pisos Uau Ação Clareadora Embalagem 750Ml,9.48,9.48
174,Limpador Uau Multiuso Folhas Verdes Embalagem 500Ml,4.25,4.25
175,Detergente Sanitário Pastilha Adesiva Marine Inspira Grátis 20% Desconto 3Un,5.98,5.98
176,Limpador Veja com Álcool Limpeza Pesada Original 500Ml,10.95,10.95
177,Pedra Sanitária Lavanda Azulim Start Embalagem 25G,2.75,2.75
178,Pedra Sanitária Azulim Jasmim Embalagem 25G,2.75,2.75
179,Desinfetante Eucalipto Santa Clara 2L,5.99,5.99
180,Desinfetante Ypê Bak Eucalipto 500Ml,3.75,3.75
181,Desinfetante Trop Pinho Lavanda Inglesa 500Ml,3.75,3.75
182,Desinfetante Pinho Bril Flores de Limão 1000Ml,7.49,7.49
183,Desinfetante Batuta Oceano Ação Limpa Pisos Elimina Germes e Bactérias Embalagem 2L,7.98,7.98
184,Limpa Pisos Cif Perfumes Relaxante Frasco 450Ml,5.49,5.49
185,Limpa Pisos Cif Perfumes Envolvente 450Ml,5.49,5.49
186,Desinfetante Pinho Trop Fresh Leve 1000Ml Pague 900Ml,6.95,6.95
187,Cera Líquida Ingleza Maxx Amarela Embalagem 750Ml,13.49,13.49
188,Cera Líquida Nugget Preto 33% de Desconto Embalagem 60Ml,18.98,18.98
189,Desinfetante Pinho Flores de Limão Leve 500Ml Pague 450Ml,4.28,4.28
190,Desinfetante Pinho Sol Limão 1L,13.98,13.98
191,Desinfetante Pinho Trop Pinho e Menta 500Ml,3.75,3.75
192,Cera Auto Brilho Líquida Poliflor Brilho Prático Incolor 750Ml,14.29,14.29
193,Cera Líquida Brilho Fácil Amarela Embalagem 750Ml,12.49,12.49
194,Desinfetante Omo Pinho 1L,9.99,7.98
195,Desinfetante Classic Lavanda Embalagem 2 Litros,5.99,5.99
196,Pedra Sanitária Pato Marine Limpa e Perfuma Embalagem 25G,3.79,3.79
197,Limpa Vidro Super Globo 500Ml,5.29,5.29
198,Cera Líquida para Sapato Nugget Super Branco 60Ml,18.98,18.98
199,Desinfetante Marina Pinho Embalagem 2L,5.29,5.29
200,Desinfetante Pinho Sol Lavanda Oferta 1000Ml,13.98,13.98
201,Desinfetante Líquido Pureza do Algodão Lysol 500Ml,5.49,5.49
202,Limpador Concentrado Uau Eucalipto 130Ml,11.49,11.49
203,Desengordurante Marina 500Ml,4.28,4.28
204,Limpa Forno Easy Off 250Ml,20.95,20.95
205,Limpador Cif Tira-Limo Banheiro Ultra Rápido com Cloro Refil 450Ml,10.98,10.98
206,Limp.Uau 500Ml Multi Uso Lavanda C/10%Gts,4.25,4.25
207,Limpador Uau Desengordurante 500Ml,11.49,11.49
208,Limpador Multiuso Lavanda Tradicional Uau 600Ml,4.25,4.25
209,Pastilha Adesiva Limppano Inspira Marine Embalagem 3 Un,5.98,5.98
210,Higienizador Cif +Álcool Original 2L,23.49,19.98
211,Limpador Perfumado Super Globo Vida Marinha Embalagem 500Ml,4.39,4.39
212,Desinfetante Santa Clara Eucalipto Embalagem 5 Litros,16.49,16.49
213,Cera Líquida para Sapatos Nugget Preto 60Ml,18.98,18.98
214,Limpador Limpeza Pesada 4 em 1 Alta Performance Uau 500Ml,6.49,6.49
215,Desinfetante Pinho Trop Citrus Leve 1000Ml Pague 900Ml,6.95,6.95
216,Limpador Multi Uso Clareadora Super Globo 500Ml,3.65,3.65
217,Pedra Sanitária Harpic Aroma Plus Lavanda 25G,3.35,3.35
218,Pedra Sanitária Bouquet de Lavanda Glade 25G,3.49,3.49
219,Desinfetante Pinho Trop Pínho Menta Embalagem Leve 1L Pague 900Ml,6.95,6.95
220,Desinfetante Pinho Trop Limão Embalagem 500Ml,3.75,3.75
221,Cera Líquida Ingleza Ardósia Verde Embalagem 850Ml,10.79,10.79
222,Limpa Vidros Uau Gatilho 500Ml,16.98,16.98
223,Desinfetante Super Globo Lavanda 2 Litros,6.99,6.99
224,Limpador Uau Limpeza Pesada Alta Performance Embalagem Leve 1 Litro Pague 900Ml,10.49,10.49
225,Graxa para Sapato em Pasta Preta Nugget Lata 36G,11.49,11.49
226,Limpador Multiuso Super Globo Embalagem 500Ml,4.98,4.29
227,Desinfetante Uso Geral Ufe 750Ml,11.98,11.98
228,Limpadores Concentrado Uau Lavanda 130Ml,11.49,11.49
229,Cera Líquida Ingleza Brilhowax Vermelha Embalagem 850Ml,9.85,9.85
230,Pedra Sanitária Azulim Floral Embalagem 25G,2.75,2.75
231,Limpador Brilhaluminio Fresh Lemon Embalagem 500Ml,2.98,2.98
232,Limpador Veja Limpeza Pesada Original Embalagem 500Ml,10.95,10.95
233,Desinfetante Marina Erva Doce Embalagem 2 Litros,5.29,5.29
234,Limpa Vidro Marina Embalagem 500Ml,5.25,5.25
235,Desinfetante Trop Pinho Lavanda Embalagem 1L,6.95,6.95
236,Cera Líquida Brilhowax Vermelha 750Ml,9.85,9.85
237,Limpador Uau Banheiro 7Em1 Gatilho sem Cloro 500Ml,18.9,18.9
238,Limpador Limpesa Pesada Uau Bambu Azaleia Leve 500Ml Pague 400Ml,4.45,4.45
239,Desinfetante Marina Citronela 2 Litros,7.49,7.49
240,Desinfetante Marina Lavanda Embalagem 5 Litros,12.49,12.49
241,Desinfetante Super Globo Pinho Lavanda 1L,5.49,5.49
242,Soda Cáustica Yara 480G,13.95,13.95
243,Água Sanitária Classic Embalagem 1 Litro,3.29,3.29
244,Desinfetante Classic Lavanda Embalagem 2 Litros,5.99,5.99
245,Desinfetante Classic Lavanda 5 Litros,13.49,13.49
246,Limpador Acido Muriatico Mais 1L,7.98,7.98
247,Limpador Acido Muriatico Clarix 1L,7.49,7.49
248,Desengripante Pratik 250Ml,9.9,9.9
249,Ácido Muriático Mais Embalagem 1 Litro,7.98,7.98
250,Limpador Multiuso Super Globo Floral 500Ml,3.65,3.65
251,Água Sanitária Classic Embalagem 2 Litros,5.65,5.65
252,Limpa Cerâmica Marina 1L,5.49,5.49
253,Limpador Perfumado Uau Lavanda e Camomila Embalagem 500Ml Pague 400Ml,4.45,4.45
254,Limpa Vidros Marina 500Ml,5.25,5.25
255,Limpador Multiuso Super Globo Citrus 500Ml,3.65,3.65
256,Limpador Multiuso Folhas e Flores Marina 500Ml,3.29,3.29
257,Cera Ingleza Brilhowax Incolor Embalagem 850Ml,9.85,9.85
258,Limpador Multiuso Cloro Ativo 5 em 1 Super Globo 500Ml,4.98,4.29
259,Desinfetante Marina Floral Embalagem 5 Litros,12.49,12.49
260,Pedra Sanitária Limppano Inspira Lavanda Embalagem 35G,2.99,2.99
261,Pedra Sanitária Bouquet Lavanda Embalagem com 25% de Desconto Glade 25G,3.49,3.49
262,Eliminador de Odores Multiuso Hortelã Uau 500Ml,4.25,4.25
263,Incenso Flute Alfazema,3.25,3.25
264,Pastilha Adesiva Pato Citrus 20% de Desconto 3Un,8.95,8.95
265,Bom Ar Air Wick Limão Siciliano e Baunilha Aerosol 360Ml,13.98,13.98
266,Neutralizador de Odores Cheirinho de Talco Bom Ar Frasco Embalagem Econômica 360Ml,13.98,13.98
267,Aromatizante Águas Florais Aerosol Glade 360Ml,13.49,13.49
268,Incenso Flute Canela,3.25,3.25
269,Essência Aromatec Floral 140Ml,9.98,9.98
270,Bom Ar Air Wick Cheirinho de Talco Aerosol 360Ml Grátis 20%,13.98,13.98
271,Desodorizador Aerossol Lavanda Oferta Especial Glade 360Ml,13.49,13.49
272,Detergente Sanitário em Pedra Bosque de Pinho Harpic 25G,3.35,3.35
273,Bloco Higiênico Limppano Inspira Campos de Lavanda Embalagem 1 Un,11.49,11.49
274,Pedra Sanitária Harpic Aroma Plus Citrus 25G,3.35,3.35
275,Desodorizador e Aromatizante de Lavanda Glade 360Ml,13.49,13.49
276,Bom Ar Air Wick Cheirinho de Talco Aerosol 360Ml,13.98,13.98
277,Aromatizador Air Wick Cheirinho de Talco 360Ml,13.98,13.98
278,Neutralizador de Odores Flor de Algodão Econômica Bom Ar Air Wick 360Ml,13.98,13.98
279,Incenso Flute Alecrim,3.25,3.25
280,Incenso Flute Citronella,3.25,3.25
281,Incenso Flute Chamando Dinheiro Caixa com 8Un,3.25,3.25
282,Desodorizador e Aromatizante Toque de Frescor Lembranças de Infância Glade Refil 12Ml,12.85,12.85
283,Pastilha Sanitária Adesiva Inspira Fresh Embalagem Leve 4Un Pague 3Un,7.49,7.49
284,Incenso Alfazema India Brasil,3.25,3.25
285,Incenso Flute Sandalo,3.25,3.25
286,Incenso Arruda Hortelã Flute,3.25,3.25
287,Incenso Flute Rosa Vermelha,3.25,3.25
288,Incenso Citronela Vinati Caixa com 25Un,3.25,3.25
289,Incenso Arruda Mahalakshimi 8Un,3.25,3.25
290,Incenso de Canela Mahalakshimi 8Un,3.25,3.25
291,Incenso Canela Bic Brand 8 Unidades,3.25,3.25
292,Seu Lar Incenso Arruda,3.25,3.25
293,Incenso Lavanda Bic Brand 8 Unidades,3.25,3.25
294,Aromatizador de Ambiente Citronel Classic 140Ml,12.98,12.98
295,Incenso Alecrim Flute 8 Unidades,3.25,3.25
296,Incenso Rosa Branca Bic Brand 8 Unidades,3.25,3.25
297,Incenso Guiné Avatar Geral Parimal 8 Unidades,3.25,3.25
298,Incenso Mirra Flute Tradicional 8Un,3.25,3.25
299,Incensos Arruda,3.25,3.25
300,Incenso Sândalo Shankar 8Un,3.25,3.25
301,Incenso de Citronela Shankar 16G,3.25,3.25
302,Incenso Citronela Bic 8 Unidades,3.25,3.25
303,Incenso Índia Brasil Citronela Unidade,3.25,3.25
304,Odorizante Ambiente Floral Rissilim 140Ml,12.98,12.98
305,Incenso Alfazenma Shankar 16G,3.25,3.25
306,Incenso Alfazema Bic Brand 8 Unidades,3.25,3.25
307,Incenso de Alfazema Mahalakshimi,3.25,3.25
308,Incenso Arruda Sac 8Un,3.25,3.25
309,Incenso Mamãe e Bebê Mahalakshimi 8Un,3.25,3.25
310,Incenso Shankar Rosas Vermelhas 16Gr,3.25,3.25
311,Incenso Lavanda Mahalakshimi 8Un,3.25,3.25
312,Incenso Flute Chama Fregues,3.25,3.25
313,Incenso Abre Caminho Parimal 8Un,3.25,3.25
314,Incensos Variados,3.25,3.25
315,Incensos Variados Unidade,3.25,3.25
316,Incenso Mamãe e Bebê Hem Caixa com 8 Varetas,3.25,3.25
317,Incenso Mamãe e Bebê Parimal 8 Unidades,3.25,3.25
318,Detergente Ypê Clear 500Ml,2.79,2.79
319,Detergente Ypê Neutro 500Ml,2.79,2.79
320,Detergente Coco Ypê 500Ml,2.79,2.79
321,Detergente Ypê Clear 500Ml Oferta 6Un Grátis Esponja,15.2,15.2
322,Lava Louças com 10% de Desconto Clear Ypê 500Ml com 6Un,15.2,15.2
323,Detergente Líquido Limpol Cristal Embalagem 500Ml,2.58,2.58
324,Detergente Líquido Neutro Limpol 500Ml,2.58,2.58
325,Detergente Azulim Coco 500Ml,1.98,1.98
326,Detergente Líquido Azulim Neutro 500Ml,1.98,1.98
327,Detergente Limpol Maçã 500Ml,2.58,2.58
328,Detergente Líquido Classic Neutro 500Ml,2.19,2.19
329,Detergente Limpol Limão 500Ml,2.58,2.58
330,Detergente Líquido Maçã Ypê 500Ml,2.79,2.79
331,Detergente Líquido Azulim Clear 500Ml,1.98,1.98
332,Detergente Classic Maçã 500Ml,2.19,2.19
333,"Lava Roupas em Pó 5 em 1 Rosas e Flor de Lis Surf 1,6Kg",16.98,16.98
334,Pasta Multiuso Cristal Rosa 500G,5.49,5.49
335,Detergente Líquido Classic Clear 500Ml,2.19,2.19
336,Sabão em Pasta Dipol 500G,8.98,8.98
337,Kit Limpador Super Globo 1 Desengordurante + 1 Pinho + 1 Cloro 3Un,9.98,9.98
338,Detergente Liquido Maçã Smart 500Ml,1.98,1.98
339,Inseticida Sbp Aerosol Eucalipto 450Ml,15.98,15.98
340,K-Othrine 30Ml,13.95,13.95
341,Inseticida Raid Multi Insetos Base Água 420Ml,16.98,12.98
342,Inseticida Raid Acqua Protec Aerosol 420Ml,16.98,12.98
343,K-Othrine Sc 25 Bayer 30Ml,13.95,13.95
344,Inseticida Raid Multi Insetos Eucalipto Oferta 420Ml,16.98,12.98
345,Sbp Multi Inseticida Aerossol Leve+ Pague- 450Ml,15.98,15.98
346,Inseticida Raid Mata Baratas Formigas Oferta 420Ml,16.98,12.98
347,Inseticida Boa Noite Original Espiral 96G,4.48,4.48
348,Inseticida Raid Multi Insetos Citronela Oferta 420Ml,16.98,12.98
349,Refil Pastilha Eletrica Raid com 12Un,7.99,7.99
350,Repelente Elétrico Raid Pastilha Oferta Refil 12Un,7.99,7.99
351,Inseticida Aerosol Ação Total Baygon 360Ml,13.98,13.98
352,Inseticida Mata Baratas Baygon 360Ml,13.98,13.98
353,Sbp Multi Inseticida Aerossol Óleo de Citronela Leve+ Pague- 450Ml,15.98,15.98
354,Naftalina Azulim Start 30G,3.85,3.85
355,Inseticida Aerossol Ação Total Mortein Pro Frasco Econômica 400Ml,13.98,13.98
356,Inseticida Sbp Anti Aedes Aegypti Spray 450Ml,15.98,15.98
357,Sbp Repelente Elétrico Líquido 45 Noites Refil 35Ml,16.98,16.98
358,Inseticida Raid Protector Pastilha Elétrica Refil 12 Un,7.99,7.99
359,Inseticida Sbp Óleo de Citronela Aerosol 300Ml,15.98,15.98
360,Inseticida Raid Multi Insetos Aerosol 285Ml,16.98,12.98
361,Inseticida Espiral Boa Noite Fort 10 Un,4.48,4.48
362,Inseticida Muiti Inseticida Aerosol Sbp 300Ml,15.98,15.98
363,Lava Roupas Sanitizante em Pó Brilhante Limpeza Total 2.2Kg,23.98,21.98
364,Sabão em Pó Omo Lavagem Perfeita Grátis 80G Caixa 800G,16.49,16.49
365,Sabão em Pó Surf Rosas e Flor de Lis Sachê 1Kg,10.98,10.98
366,"Lava Roupas Limpeza Total Brilhante 1,6Kg",18.99,18.99
367,1Un Lava Roupa Omo Lavagem Perfeita 1.6Kg Grátis 150G.,23.49,23.49
368,"Lava-Roupas Pó Lavagem Perfeita Omo 1,6Kg",23.49,23.49
369,Sabão em Pó Omo Lavagem Perfeita 400G,8.29,8.29
370,Lava-Roupas Pó Lavagem Perfeita Omo 800G,16.49,16.49
371,Sabão em Barra Neutro Ypê 1Kg,14.98,13.49
372,Lava Roupas em Pó Brilhante Limpeza Total 800G,11.98,11.98
373,"Lava Roupas em Pó para Roupas Brancas e Coloridas Limpeza Total Brilhante 1,6Kg Grátis 150G",19.9,19.9
374,Lava Roupa Pó Omo Lavagem Perfeita 1.6Kg,23.49,23.49
375,"Sabão em Pó Tixan Ypê Primavera Sachê 1,3Kg",15.98,15.98
376,Lava Roupas Sanitizante em Pó Brilhante Limpeza Total 2.2Kg,23.98,21.98
377,"Lava-Roupas Pó Omo Lavagem Perfeita Caixa 2,2Kg Tamanho Família",28.49,28.49
378,Sabao Glic Ype Neutro 900G,14.98,13.49
379,"Amaciante Ypê Intenso Leve 2L Pague 1,8L",10.98,10.98
380,Lava Roupas em Pó Tixan Ypê Primavera 500G,6.45,6.45
381,"Amaciante Ypê Intenso Leve 2L Pague 1,6L",10.98,10.98
382,"Amaciante de Roupa Aconchego Ypê Frasco Leve 2L Pague 1,8L",10.98,10.98
383,"Amaciante Azul Aconchego Ypê Leve 2L Pague 1,6L",10.98,10.98
384,Lava-Roupas Líquido Omo Lavagem Perfeita Galão 3L,47.9,47.9
385,Amaciante Concentrado Downy Sport 500Ml,10.98,10.98
386,Sabão em Pó Baby Soft Embalagem 1Kg,9.85,9.85
387,Lava Roupas em Pó para Roupas Brancas e Coloridas Limpeza Total Brilhante Sachê 800G,11.98,11.98
388,Lava Roupas em Pó Tixan Ypê Primavera 800G,11.98,11.98
389,"Lava-Roupas Pó Concentrado Maciez Tixan Ypê 1,6Kg",22.9,22.9
390,Lava Roupas em Pó Baby Soft 2Kg,16.98,16.98
391,Amaciante Comfort Tradicional Explosao Azul 1.8L,21.9,21.9
392,Amaciante Concentrado Puro Cuidado Comfort Pague 400Ml Leve 500Ml,8.99,8.99
393,Amaciante Ypê Aconchego 2L,10.98,10.98
394,"Lava Roupas em Pó Limpeza Total Brilhante 1,6Kg",19.9,19.9
395,"Lava Roupa em Pó Brancas e Coloridas +150G Grátis Brilhante 1,6Kg",19.9,19.9
396,Lava Roupas em Pó Concentrado Maciez Tixan Ypê 800G,11.98,11.98
397,"Lava-Roupas em Pó Concentrado Primavera Tixan Ypê 1,6Kg",22.9,22.9
398,Amaciante Ypê Intenso Embalagem 2L,10.98,10.98
399,Lava Roupas em Pó Rosas e Flor de Lis Surf 800G,10.98,10.98
400,Lava Roupas Pó Coquel Natureza Limpa Caixa Pg800g. e Lv.1Kg,10.79,10.79
401,"Lava-Roupas em Pó Concentrado Primavera Tixan Ypê 1,3Kg",15.98,15.98
402,Tira Manchas Gel Multiuso Vanish 500Ml,12.98,12.98
403,Sabão em Pó Surf Rosas e Flor de Lis Pacote 800G,10.98,10.98
404,Cloro Marina 1 Litro,3.85,3.85
405,"Lava Roupas em Pó Concentrado Primavera Tixan Ypê Leve 1,6Kg Pague 1,52Kg",22.9,22.9
406,Tira Manchas em Pó Vanish Oxi Action Crystal White Refil 400G,21.98,21.98
407,Tira Manchas Pó Vanish Roupas Coloridas Refil 400G,21.98,21.98
408,Amaciante Baby Soft Toque de Carinho Azul Embalagem 2L,8.29,8.29
409,Tira Manchas em Pó Roupas Brancas Oxi Action Crystal White Vanish 120G,6.79,6.79
410,Detergente Lava Roupas em Pó Surf 5Em1 Rosas e Flor de Lis 1.6Kg,16.98,16.98
411,Sabão em Barra Glicerinado Neutro Ypê 180G,3.65,3.65
412,Detergente em Pó Limão e Bicarbonato Surf 800G,10.98,10.98
413,Amaciante Concentrado Comfort Intense Puro Cuidado 500Ml,8.99,8.99
414,Sabão em Barra Minuano Glicerinado 1Kg,14.89,14.89
415,"Amaciante para Roupas Baby Soft Carinho 1,8L",6.98,6.98
416,Lava-Roupas em Pó Concentrado Maciez Tixan Ypê 400G,6.45,6.45
417,Detergente Líquido Lava Roupas Ariel Refil Cores Radiante 700Ml,13.98,13.98
418,Detergente Lava Roupas em Pó Surf 5Em1 Cuidado do Coco 800G,10.98,10.98
419,Amaciante Tuff Plus Azul Embalagem 500Ml,3.78,3.78
420,Amaciante Marina Conforto Embalagem 2 Litros,6.98,6.98
421,Amaciante de Roupa Concentrado Brisa Intenso Downy 500Ml,10.98,10.98
422,Sabão Líquido Uau Active Embalagem 3L,23.98,19.98
423,"Lava Roupas em Pó Cuidado do Coco 5 em 1 Surf 1,6Kg",16.98,16.98
424,Sabão Líquido Urca 3L,17.9,14.98
425,Amaciante Concentrado Fofo Tradicional Oferta 500Ml,7.89,7.89
426,Sabão Líquidobrilho Ativo Brilhante 3L,29.49,29.49
427,Sabão em Barra Glicerinado Minuano 180G,3.75,3.75
428,Amaciante Amacitel Luxo Momento de Carinho 2L,7.98,6.98
429,Sabão Líquido Uau Rosas e Sedução 3 Litros,23.98,19.98
430,Amaciante para Roupas Amacitel Momentos de Carinho Branco Embalagem 2L,7.98,6.98
431,Detergente Lava Roupas em Pó Surf 5Em1 Limão e Bicarbonato 800G,10.98,10.98
432,Detergente Lava Roupas em Pó Surf 5Em1 Rosas e Flor de Lis 800G,10.98,10.98
